Improving instruction cache performance in OLTP,Stavros Harizopoulos; Anastassia Ailamaki,Instruction-cache misses account for up to 40% of execution time in Online TransactionProcessing (OLTP) database workloads. In contrast to data cache misses; instruction missescannot be overlapped with out-of-order execution. Chip design limitations do not allowincreases in the size or associativity of instruction caches that would help reduce misses. Onthe contrary; the effective instruction cache size is expected to further decrease with theadoption of Multicore and Multithreading chip designs (multiple onchip processor cores andmultiple simultaneous threads per core). Different concurrent database threads; however;execute similar instruction sequences over their lifetime; too long to be captured andexploited in hardware. The challenge; from a software designer's point of view; is to identifyand exploit common code paths across threads executing arbitrary operations; thereby …,ACM transactions on database systems,2006,33,11
Enabling efficient OS paging for main-memory OLTP databases,Radu Stoica; Anastasia Ailamaki,Abstract Even though main memory is becoming large enough to fit most OLTP databases; itmay not always be the best option. OLTP workloads typically exhibit skewed access patternswhere some records are hot (frequently accessed) but many records are cold (infrequentlyor never accessed). Therefore; it is more economical to store the coldest records on a fastsecondary storage device such as a solid-state disk. However; main-memory DBMS have noknowledge of secondary storage; while traditional disk-based databases; designed forworkloads where data resides on HDD; introduce too much overhead for the common casewhere the working set is memory resident. In this paper; we propose a simple and low-overhead technique that enables main-memory databases to efficiently migrate cold data tosecondary storage by relying on the OS's virtual memory paging mechanism. We propose …,Proceedings of the Ninth International Workshop on Data Management on New Hardware,2013,32,10
A new look at the roles of spinning and blocking,Ryan Johnson; Manos Athanassoulis; Radu Stoica; Anastasia Ailamaki,Abstract Database engines face growing scalability challenges as core counts exponentiallyincrease each processor generation; and the efficiency of synchronization primitives used toprotect internal data structures is a crucial factor in overall database performance. The trade-offs between different implementation approaches for these primitives shift significantly withincreasing degrees of available hardware parallelism. Blocking synchronization; which haslong been the favored approach in database systems; becomes increasingly unattractive asgrowing core counts expose its bottlenecks. Spinning implementations improve peak systemthroughput by a factor of 2x or more for 64 hardware contexts; but suffer from poorperformance under load. In this paper we analyze the shifting trade-off between spinningand blocking synchronization; and observe that the trade-off can be simplified by isolating …,Proceedings of the Fifth International Workshop on Data Management on New Hardware,2009,32,10
Query co-processing on commodity processors,Anastassia Ailamaki; Naga K Govindaraju; Stavros Harizopoulos; Dinesh Manocha,Page 1. The UNIVERSITY of NORTH CAROLINA at CHAPEL HILL @Carnegie Mellon DatabasesQuery co-Processing on Commodity Processors Anastassia Ailamaki Carnegie Mellon UniversityNaga K. Govindaraju Dinesh Manocha University of North Carolina at Chapel Hill StavrosHarizopoulos MIT Page 2. The UNIVERSITY of NORTH CAROLINA at CHAPEL HILL @CarnegieMellon Databases © A. Ailamaki 2004-06 Technology shift towards multi-cores [Multipleprocessors on the same chip] Specint2000 1.00 10.00 100.00 1000.00 10000.00 85 86 87 8889 90 91 92 93 94 95 96 97 98 99 00 01 02 03 04 05 Intel Alpha Sparc Mips HP PA Pow er PCAMD Processor Performance over Time* Year of introduction Scalar Superscalar Out-of-orderSMT Performance *graph courtesy of Rakesh Kumar Page 3. The UNIVERSITY of NORTHCAROLINA at CHAPEL HILL @Carnegie Mellon Databases …,VLDB,2006,32,0
Clotho: Decoupling memory page layout from storage organization,Minglong Shao; Jiri Schindler; Steven W Schlosser; Anastassia Ailamaki; Gregory R Ganger,Abstract As database application performance depends on the utilization of the memoryhierarchy; smart data placement plays a central role in increasing locality and in improvingmemory utilization. Existing techniques; however; do not optimize accesses to all levels ofthe memory hierarchy and for all the different workloads; because each storage level usesdifferent technology (cache; memory; disks) and each application accesses data usingdifferent patterns. Clotho is a new buffer pool and storage management architecture thatdecouples in-memory page layout from data organization on non-volatile storage devices toenable independent data layout design at each level of the storage hierarchy. Clotho canmaximize cache and memory utilization by (a) transparently using appropriate data layoutsin memory and non-volatile storage; and (b) dynamically synthesizing data pages to …,Proceedings of the Thirtieth international conference on Very large data bases-Volume 30,2004,32,17
Improving flash write performance by using update frequency,Radu Stoica; Anastasia Ailamaki,Abstract Solid-state drives (SSDs) are quickly becoming the default storage medium as thecost of NAND flash memory continues to drop. However; flash memory introduces newchallenges; as data cannot be eciently updated in-place. To overcome the technology'slimitations; SSDs incorporate a software Flash Translation Layer (FTL) that implements out-of-place updates; typically by storing data in a log-structured fashion. Despite a largenumber of existing FTL algorithms; SSD performance; predictability; and lifetime remain anissue; especially for the write-intensive workloads specific to database applications. In thispaper; we show how to design FTLs that are more efficient by using the I/O write skew toguide data placement on flash memory. We model the relationship between data placementand write performance for basic I/O write patterns and detail the most important concepts …,Proceedings of the VLDB Endowment,2013,30,20
Same queries; different data: Can we predict runtime performance?,Adrian Daniel Popescu; Vuk Ercegovac; Andrey Balmin; Miguel Branco; Anastasia Ailamaki,We consider MapReduce workloads that are produced by analytics applications. In contrastto ad hoc query workloads; analytics applications are comprised of fixed data flows that arerun over newly arriving data sets or on different portions of an existing data set. Examples ofsuch workloads include document analysis/indexing; social media analytics; and ETL(Extract Transform Load). Motivated by these workloads; we propose a technique thatpredicts the runtime performance for a fixed set of queries running over varying input datasets. Our prediction technique splits each query into several segments where eachsegment's performance is estimated using machine learning models. These per-segmentestimates are plugged into a global analytical model to predict the overall query runtime. Ourapproach uses minimal statistics about the input data sets (eg; tuple size; cardinality) …,Data Engineering Workshops (ICDEW); 2012 IEEE 28th International Conference on,2012,30,10
Practical off-chip meta-data for temporal memory streaming,Thomas F Wenisch; Michael Ferdman; Anastasia Ailamaki; Babak Falsafi; Andreas Moshovos,Prior research demonstrates that temporal memory streaming and related address-correlating prefetchers improve performance of commercial server workloads thoughincreased memory level parallelism. Unfortunately; these prefetchers require large on-chipmeta-data storage; making previously-proposed designs impractical. Hence; to improvepracticality; researchers have sought ways to enable timely prefetch while locating meta-data entirely off-chip. Unfortunately; current solutions for off-chip meta-data increase memorytraffic by over a factor of three. We observe three requirements to store meta-data off chip:minimal off-chip lookup latency; bandwidth-efficient meta-data updates; and off-chip lookupamortized over many prefetches. In this work; we show:(1) minimal off-chip meta-data lookuplatency can be achieved through a hardware-managed main memory hash table;(2) …,High Performance Computer Architecture; 2009. HPCA 2009. IEEE 15th International Symposium on,2009,30,15
Improving preemptive prioritization via statistical characterization of OLTP locking,David T McWherter; Bianca Schroeder; Anastassia Ailamaki; Mor Harchol-Balter,OLTP and transactional workloads are increasingly common in computer systems; rangingfrom e-commerce to warehousing to inventory management. It is valuable to provide priorityscheduling in these systems; to reduce the response time for the most important clients; egthe" big spenders". Two-phase locking; commonly used in DBMS; makes prioritizationdifficult; as transactions wait for locks held by others regardless of priority. Common lockscheduling solutions; including non-preemptive priority inheritance and preemptive abort;have performance drawbacks for TPC-C type workloads. The contributions of this paper aretwo-fold:(i) We provide a detailed statistical analysis of locking in TPC-C workloads withpriorities under several common preemptive and non-preemptive lock prioritization policies.We determine why non-preemptive policies fail to sufficiently help high-priority …,Data Engineering; 2005. ICDE 2005. Proceedings. 21st International Conference on,2005,30,15
Exposing and exploiting internal parallelism in MEMS-based storage,Steven W Schlosser; Jiri Schindler; Anastassia Ailamaki; Gregory R Ganger,Abstract: MEMS-based storage has interesting access parallelism features. Specifically;subsets of a MEMStore's thousands of tips can be used in parallel; and the particular subsetcan be dynamically chosen. This paper describes how such access parallelism can beexposed to system software--with minimal changes to system interfaces--and utilized cleanlyfor two classes of applications. First; background tasks can utilize unused parallelism toaccess media locations with no impact on foreground activity. Second; two-dimensional datastructures; such as dense matrices and relational database tables; can be accessed in bothrow order and column order with maximum efficiency. With proper table layout; unwantedportions of a table can be skipped while scanning at full speed. Using simulation; theauthors explore performance features of using this device parallelism for an example …,*,2003,29,10
Flash in a DBMS: Where and How?,Manos Athanassoulis; Anastasia Ailamaki; Shimin Chen; Phillip Gibbons; Radu Stoica,Abstract Over the past decade; new solid state storage technologies; with flash being themost mature one; have become increasingly popular. Such technologies store data durably;and can alleviate many handicaps of hard disk drives (HDDs). Nonetheless; they have verydifferent characteristics compared to HDDs; making it challenging to integrate suchtechnologies into data intensive systems; such as database management systems (DBMS);that rely heavily on underlying storage behaviors. In this paper; we ask the question: Whereand how will flash be exploited in a DBMS? We describe techniques for making effective useof flash in three contexts:(i) as a log device for transaction processing on memory-residentdata;(ii) as the main data store for transaction processing; and (iii) as an update cache forHDD-resident data warehouses.,IEEE Data Eng. Bull.,2010,28,1
Just-in-time data virtualization: Lightweight data management with ViDa,Manos Karpathiotakis; Ioannis Alagiannis; Thomas Heinis; Miguel Branco; Anastasia Ailamaki,ABSTRACT As the size of data and its heterogeneity increase; traditional database systemarchitecture becomes an obstacle to data analysis. Integrating and ingesting (loading) datainto databases is quickly becoming a bottleneck in face of massive data as well asincreasingly heterogeneous data formats. Still; state-of-the-art approaches typically rely oncopying and transforming data into one (or few) repositories. Queries; on the other hand; areoften ad-hoc and supported by pre-cooked operators which are not adaptive enough tooptimize access to data. As data formats and queries increasingly vary; there is a need todepart from the current status quo of static query processing primitives and build dynamic;fully adaptive architectures. We build ViDa; a system which reads data in its raw format andprocesses queries using adaptive; just-in-time operators. Our key insight is use of …,Proceedings of the 7th Biennial Conference on Innovative Data Systems Research (CIDR),2015,27,15
Predicting cost amortization for query services,Debabrata Dash; Georgios Gratsias; Anastasia Ailamaki,Abstract Emerging providers of online services offer access to data collections. Such dataservice providers need to build data structures; eg materialized views and indexes; in orderto offer better performance for user query execution. The cost of such structures is charged tothe user as part of the overall query service cost. In order to ensure the economic viability ofthe provider; the building and maintenance cost of new structures has to be amortized to aset of prospective query services that will use them. This work proposes a novel stochasticmodel that predicts the extent of cost amortization in time and number of services. The modelis completed with a novel method that regresses query traffic statistics and provides input tothe prediction model. In order to demonstrate the effectiveness of the prediction model; westudy its application on an extension of an existing economy model for the management …,Proceedings of the 2011 ACM SIGMOD International Conference on Management of data,2011,27,10
MaSM: efficient online updates in data warehouses,Manos Athanassoulis; Shimin Chen; Anastasia Ailamaki; Phillip B Gibbons; Radu Stoica,Abstract Data warehouses have been traditionally optimized for read-only queryperformance; allowing only offline updates at night; essentially trading off data freshness forperformance. The need for 24x7 operations in global markets and the rise of online andother quickly-reacting businesses make concurrent online updates increasingly desirable.Unfortunately; state-of-the-art approaches fall short of supporting fast analysis queries overfresh data. The conventional approach of performing updates in place can dramatically slowdown query performance; while prior proposals using differential updates either requirelarge in-memory buffers or may incur significant update migration cost. This paper presentsa novel approach for supporting online updates in data warehouses that overcomes thelimitations of prior approaches; by making judicious use of available SSDs to cache …,Proceedings of the 2011 ACM SIGMOD International Conference on Management of data,2011,27,3
Temporal streams in commercial server applications,Thomas F Wenisch; Michael Ferdman; Anastasia Ailamaki; Babak Falsafi; Andreas Moshovos,Commercial server applications remain memory bound on modern multiprocessor systemsbecause of their large data footprints; frequent sharing; complex non-strided accesspatterns; and long chains of dependant misses. To improve memory system performancedespite these challenging access patterns; researchers have proposed prefetchers thatexploit temporal streams—recurring sequences of memory accesses. Although prior studiesshow substantial performance improvement from such schemes; they fail to explain whytemporal streams arise; that is; they treat commercial applications as a black box and do notidentify the specific behaviors that lead to recurring miss sequences. In this paper; weperform an information-theoretic analysis of miss traces from single-chip and multi-chipmultiprocessors to identify recurring temporal streams in web serving; online transaction …,Workload Characterization; 2008. IISWC 2008. IEEE International Symposium on,2008,27,1
Critical sections: re-emerging scalability concerns for database storage engines,Ryan Johnson; Ippokratis Pandis; Anastasia Ailamaki,Abstract Critical sections in database storage engines impact performance and scalabilitymore as the number of hardware contexts per chip continues to grow exponentially. Withenough threads in the system; some critical section will eventually become a bottleneck.While algorithmic changes are the only long-term solution; they tend to be complex andcostly to develop. Meanwhile; changes in enforcement of critical sections require much lesseffort. We observe that; in practice; many critical sections are so short that enforcing themcontributes a significant or even dominating fraction of their total cost and tuning themdirectly improves database system performance. The contribution of this paper is two-fold:we (a) make a thorough performance comparison of the various synchronization primitivesin the database system developer's toolbox and highlight the best ones for practical use …,Proceedings of the 4th international workshop on Data management on new hardware,2008,26,20
Inspector joins,Shimin Chen; Anastassia Ailamaki; Phillip B Gibbons; Todd C Mowry,Abstract The key idea behind Inspector Joins is that during the I/O partitioning phase of ahash-based join; we have the opportunity to look at the actual data itself and then use thisknowledge in two ways:(1) to create specialized indexes; specific to the given query on thegiven data; for optimizing the CPU cache performance of the subsequent join phase of thealgorithm; and (2) to decide which join phase algorithm best suits this specific query. Weshow how inspector joins; employing novel statistics and specialized indexes; match orexceed the performance of state-of-the-art cache-friendly hash join algorithms. For example;when run on eight or more processors; our experiments show that inspector joins offer 1.1-1.4 X speedups over these previous algorithms; with the speedup increasing as the numberof processors increases.,Proceedings of the 31st international conference on Very large data bases,2005,26,0
Accelerating range queries for brain simulations,Farhan Tauheed; Laurynas Biveinis; Thomas Heinis; Felix Schurmann; Henry Markram; Anastasia Ailamaki,Neuroscientists increasingly use computational tools in building and simulating models ofthe brain. The amounts of data involved in these simulations are immense and efficientlymanaging this data is key. One particular problem in analyzing this data is the scalableexecution of range queries on spatial models of the brain. Known indexing approaches donot perform well even on today's small models which represent a small fraction of the brain;containing only few millions of densely packed spatial elements. The problem of currentapproaches is that with the increasing level of detail in the models; also the overlap in thetree structure increases; ultimately slowing down query execution. The neuroscientists' needto work with bigger and more detailed (denser) models thus motivates us to develop a newindexing approach. To this end we develop FLAT; a scalable indexing approach for …,Data Engineering (ICDE); 2012 IEEE 28th International Conference on,2012,25,20
CoPhy: a scalable; portable; and interactive index advisor for large workloads,Debabrata Dash; Neoklis Polyzotis; Anastasia Ailamaki,Abstract Index tuning; ie; selecting the indexes appropriate for a workload; is a crucialproblem in database system tuning. In this paper; we solve index tuning for large probleminstances that are common in practice; eg; thousands of queries in the workload; thousandsof candidate indexes and several hard and soft constraints. Our work is the first to reveal thatthe index tuning problem has a well structured space of solutions; and this space can beexplored efficiently with well known techniques from linear optimization. Experimentalresults demonstrate that our approach outperforms state-of-the-art commercial and researchtechniques by a significant margin (up to an order of magnitude).,Proceedings of the VLDB Endowment,2011,25,10
Automated physical design in database caches,Tanu Malik; Xiaodan Wang; Randal Burns; Debabrata Dash; Anastasia Ailamaki,Performance of proxy caches for database federations that serve a large number of users iscrucially dependent on its physical design. Current techniques; automated or otherwise; forphysical design depend on the identification of a representative workload. In proxy caches;however; such techniques are inadequate since workload characteristics change rapidly.This is remarkably shown at the proxy cache of SkyQuery; an Astronomy federation; whichreceives a continuously evolving workload. We present novel techniques for automatedphysical design that adapt with the workload and balance the performance benefits ofphysical design decisions with the cost of implementing these decisions. These include bothcompetitive and incremental algorithms that optimize the combined cost of query evaluationand making physical design changes. Our techniques are general in that they do not …,Data Engineering Workshop; 2008. ICDEW 2008. IEEE 24th International Conference on,2008,25,20
A workload-driven unit of cache replacement for mid-tier database caching,Xiaodan Wang; Tanu Malik; Randal Burns; Stratos Papadomanolakis; Anastassia Ailamaki,Abstract Making multi-terabyte scientific databases publicly accessible over the Internet isincreasingly important in disciplines such as Biology and Astronomy. However; contention ata centralized; backend database is a major performance bottleneck; limiting the scalability ofInternet-based; database applications. Mid-tier caching reduces contention at the backenddatabase by distributing database operations to the cache. To improve the performance ofmid-tier caches; we propose the caching of query prototypes; a workload-driven unit ofcache replacement in which the cache object is chosen from various classes of queries inthe workload. In existing mid-tier caching systems; the storage organization in the cache isstatically defined. Our approach adapts cache storage to workload changes; requires noprior knowledge about the workload; and is transparent to the application. Experiments …,International Conference on Database Systems for Advanced Applications,2007,25,22
Optimistic intra-transaction parallelism on chip multiprocessors,Christopher B Colohan; Anastassia Ailamaki; J Gregory Steffan; Todd C Mowry,Abstract With the advent of chip multiprocessors; exploiting intra-transaction parallelism isan attractive way of improving transaction performance. However; exploiting intra-transaction parallelism in existing database systems is difficult; for two reasons: first;significant changes are required to avoid races or conflicts within the DBMS; and second;adding threads to transactions requires a high level of sophistication from transactionprogrammers. In this paper we show how dividing a transaction into speculative threadssolves both problems---it minimizes the changes required to the DBMS; and the details ofparallelization are hidden from the transaction programmer. Our technique requires a limitednumber of small; localized changes to a subset of the low-level data structures in the DBMS.Through this method of parallelizing transactions we can dramatically improve …,Proceedings of the 31st international conference on Very large data bases,2005,25,20
Parinda: an interactive physical designer for postgresql,Cristina Maier; Debabrata Dash; Ioannis Alagiannis; Anastasia Ailamaki; Thomas Heinis,Abstract One of the most challenging tasks for the database administrator is to physicallydesign the database to attain optimal performance for a given workload. Physical design ishard because it requires the selection of an optimal set of design features from a vast searchspace. There have been many commercial tools available to automatically suggest thephysical design; for a given a set of queries. These tools are; however; based on greedyheuristic pruning; which reduces their usefulness. Furthermore; they are not interactive; asthe APIs to simulate the indexes and tables are product specific and hidden from thedatabase administrators. Finally; all these tools are built specifically for commercial systemsand there is lack of automated physical designers for open source DBMSs. In thisdemonstration we introduce-PARINDA-an interactive physical designer for an open …,Proceedings of the 13th International Conference on Extending Database Technology,2010,24,23
Affinity scheduling in staged server architectures,Stavros Harizopoulos; Anastassia Ailamaki,Abstract Modern servers typically process request streams by assigning a worker thread to arequest; and rely on a round robin policy for context-switching. Although this programmingparadigm is intuitive; it is oblivious to the execution state and ignores each softwaremodule's affinity to the processor caches. As a result; resumed threads of execution sufferadditional delays due to conflict and compulsory misses while populating the caches withtheir evicted working sets. Alternatively; the staged programming paradigm dividescomputation into stages and allows for stage-based (rather than request thread-based)cohort scheduling that improves module affinity. This technical report introduces (a) fournovel cohort scheduling techniques for staged software servers that follow a “production-line” model of operation; and (b) a mathematical framework to methodically quantify the …,*,2002,24,10
