Clearing the clouds: a study of emerging scale-out workloads on modern hardware,Michael Ferdman; Almutaz Adileh; Onur Kocberber; Stavros Volos; Mohammad Alisafaee; Djordje Jevdjic; Cansu Kaynak; Adrian Daniel Popescu; Anastasia Ailamaki; Babak Falsafi,Abstract Emerging scale-out workloads require extensive amounts of computationalresources. However; data centers using modern server hardware face physical constraintsin space and power; limiting further expansion and calling for improvements in thecomputational density per server and in the per-operation energy. Continuing to improve thecomputational resources of the cloud while staying within physical constraints mandatesoptimizing server efficiency to ensure that server hardware closely matches the needs ofscale-out workloads. In this work; we introduce CloudSuite; a benchmark suite of emergingscale-out workloads. We use performance counters on modern servers to study scale-outworkloads; finding that today's predominant processor micro-architecture is inefficient forrunning these workloads. We find that inefficiency comes from the mismatch between the …,ACM SIGPLAN Notices,2012,600,10
DBMSs on a modern processor: Where does time go?,Anastassia Ailamaki; David J DeWitt; Mark D Hill; David A Wood,Abstract Recent high-performance processors employ sophisticated techniques to overlapand simultaneously execute multiple computation and memory operations. Intuitively; thesetechniques should help database applications; which are becoming increasingly computeand memory bound. Unfortunately; recent studies report that faster processors do notimprove database system performance to the same extent as scientific workloads. Recentwork on database systems focusing on minimizing memory latencies; such as cache-conscious algorithms for sorting and data placement; is one step toward addressing thisproblem. However; to best design high performance DBMSs we must carefully evaluate andunderstand the processor and memory behavior of commercial DBMSs on today's hardwareplatforms. In this paper we answer the question “Where does time go when a database …,*,1999,600,0
Weaving Relations for Cache Performance.,Anastassia Ailamaki; David J DeWitt; Mark D Hill; Marios Skounakis,Abstract Relational database systems have traditionally optimzed for I/O performance andorganized records sequentially on disk pages using the N-ary Storage Model (NSM)(aka;slotted pages). Recent research; however; indicates that cache utilization and performanceis becoming increasingly important on modern platforms. In this paper; we first demonstratethat in-page data placement is the key to high cache performance and that NSM exhibits lowcache utilization on modern platforms. Next; we propose a new data organization modelcalled PAX (Partition Attributes Across); that significantly improves cache performance bygrouping together all values of each attribute within each page. Because PAX only affectslayout inside the pages; it incurs no storage penalty and does not affect I/O behavior.According to our experimental results; when compared to NSM (a) PAX exhibits superior …,VLDB,2001,501,0
Reactive NUCA: near-optimal block placement and replication in distributed caches,Nikos Hardavellas; Michael Ferdman; Babak Falsafi; Anastasia Ailamaki,Abstract Increases in on-chip communication delay and the large working sets of server andscientific workloads complicate the design of the on-chip last-level cache for multicoreprocessors. The large working sets favor a shared cache design that maximizes theaggregate cache capacity and minimizes off-chip memory requests. At the same time; thegrowing on-chip communication delay favors core-private caches that replicate data tominimize delays on global wires. Recent hybrid proposals offer lower average latency thanconventional designs; but they address the placement requirements of only a subset of thedata accessed by the application; require complex lookup and coherence mechanisms thatincrease latency; or fail to scale to high core counts. In this work; we observe that the cacheaccess patterns of a range of server and scientific workloads can be classified into distinct …,ACM SIGARCH Computer Architecture News,2009,421,15
SimFlex: statistical sampling of computer system simulation,Thomas F Wenisch; Roland E Wunderlich; Michael Ferdman; Anastassia Ailamaki; Babak Falsafi; James C Hoe,Timing-accurate full-system multiprocessor simulations can take years because ofarchitecture and application complexity. Statistical sampling makes simulation-basedstudies feasible by providing ten-thousand-fold reductions in simulation runtime andenabling thousand-way simulation parallelism,IEEE Micro,2006,340,10
Reconstruction and simulation of neocortical microcircuitry,Henry Markram; Eilif Muller; Srikanth Ramaswamy; Michael W Reimann; Marwan Abdellah; Carlos Aguado Sanchez; Anastasia Ailamaki; Lidia Alonso-Nanclares; Nicolas Antille; Selim Arsever; Guy Antoine Atenekeng Kahou; Thomas K Berger; Ahmet Bilgili; Nenad Buncic; Athanassia Chalimourda; Giuseppe Chindemi; Jean-Denis Courcol; Fabien Delalondre; Vincent Delattre; Shaul Druckmann; Raphael Dumusc; James Dynes; Stefan Eilemann; Eyal Gal; Michael Emiel Gevaert; Jean-Pierre Ghobril; Albert Gidon; Joe W Graham; Anirudh Gupta; Valentin Haenel; Etay Hay; Thomas Heinis; Juan B Hernando; Michael Hines; Lida Kanari; Daniel Keller; John Kenyon; Georges Khazen; Yihwa Kim; James G King; Zoltan Kisvarday; Pramod Kumbhar; Sébastien Lasserre; Jean-Vincent Le Bé; Bruno RC Magalhães; Angel Merchán-Pérez; Julie Meystre; Benjamin Roy Morrice; Jeffrey Muller; Alberto Muñoz-Céspedes; Shruti Muralidhar; Keerthan Muthurasa; Daniel Nachbaur; Taylor H Newton; Max Nolte; Aleksandr Ovcharenko; Juan Palacios; Luis Pastor; Rodrigo Perin; Rajnish Ranjan; Imad Riachi; José-Rodrigo Rodríguez; Juan Luis Riquelme; Christian Rössert; Konstantinos Sfyrakis; Ying Shi; Julian C Shillcock; Gilad Silberberg; Ricardo Silva; Farhan Tauheed; Martin Telefont; Maria Toledo-Rodriguez; Thomas Tränkler; Werner Van Geit; Jafet Villafranca Díaz; Richard Walker; Yun Wang; Stefano M Zaninetta; Javier DeFelipe; Sean L Hill; Idan Segev; Felix Schürmann,Summary We present a first-draft digital reconstruction of the microcircuitry of somatosensorycortex of juvenile rat. The reconstruction uses cellular and synaptic organizing principles toalgorithmically reconstruct detailed anatomy and physiology from sparse experimental data.An objective anatomical method defines a neocortical volume of 0.29±0.01 mm 3containing∼ 31;000 neurons; and patch-clamp studies identify 55 layer-specificmorphological and 207 morpho-electrical neuron subtypes. When digitally reconstructedneurons are positioned in the volume and synapse formation is restricted to biologicalbouton densities and numbers of synapses per connection; their overlapping arbors form∼8 million connections with∼ 37 million synapses. Simulations reproduce an array of in vitroand in vivo experiments without parameter tuning. Additionally; we find a spectrum of …,Cell,2015,291,15
Toward dark silicon in servers,Nikos Hardavellas; Michael Ferdman; Babak Falsafi; Anastasia Ailamaki,Server chips will not scale beyond a few tens to low hundreds of cores; and an increasingfraction of the chip in future technologies will be dark silicon that we cannot afford to power.Specialized multicore processors; however; can leverage the underutilized die area toovercome the initial power barrier; delivering significantly higher performance for the samebandwidth and power envelopes.,IEEE Micro,2011,250,0
Shore-MT: a scalable storage manager for the multicore era,Ryan Johnson; Ippokratis Pandis; Nikos Hardavellas; Anastasia Ailamaki; Babak Falsafi,Abstract Database storage managers have long been able to efficiently handle multipleconcurrent requests. Until recently; however; a computer contained only a few single-coreCPUs; and therefore only a few transactions could simultaneously access the storagemanager's internal structures. This allowed storage managers to use non-scalableapproaches without any penalty. With the arrival of multicore chips; however; this situation israpidly changing. More and more threads can run in parallel; stressing the internalscalability of the storage manager. Systems optimized for high performance at a limitednumber of cores are not assured similarly high performance at a higher core count; becauseunanticipated scalability obstacles arise. We benchmark four popular open-source storagemanagers (Shore; BerkeleyDB; MySQL; and PostgreSQL) on a modern multicore …,Proceedings of the 12th International Conference on Extending Database Technology: Advances in Database Technology,2009,196,15
Scheduling threads for constructive cache sharing on CMPs,Shimin Chen; Phillip B Gibbons; Michael Kozuch; Vasileios Liaskovitis; Anastassia Ailamaki; Guy E Blelloch; Babak Falsafi; Limor Fix; Nikos Hardavellas; Todd C Mowry; Chris Wilkerson,Abstract In chip multiprocessors (CMPs); limiting the number of offchip cache misses iscrucial for good performance. Many multithreaded programs provide opportunities forconstructive cache sharing; in which concurrently scheduled threads share a largelyoverlapping working set. In this paper; we compare the performance of two state-of-the-artschedulers proposed for fine-grained multithreaded programs: Parallel Depth First (PDF);which is specifically designed for constructive cache sharing; and Work Stealing (WS); whichis a more traditional design. Our experimental results indicate that PDF scheduling yields a1.3--1.6 X performance improvement relative to WS for several fine-grain parallelbenchmarks on projected future CMP configurations; we also report several issues that maylimit the advantage of PDF in certain applications. These results also indicate that PDF …,Proceedings of the nineteenth annual ACM symposium on Parallel algorithms and architectures,2007,196,6
Spatial memory streaming,Stephen Somogyi; Thomas F Wenisch; Anastassia Ailamaki; Babak Falsafi; Andreas Moshovos,Abstract Prior research indicates that there is much spatial variation in applications' memoryaccess patterns. Modern memory systems; however; use small fixed-size cache blocks andas such cannot exploit the variation. Increasing the block size would not only prohibitivelyincrease pin and interconnect bandwidth demands; but also increase the likelihood of falsesharing in shared-memory multiprocessors. In this paper; we show that memory accesses incommercial workloads often exhibit repetitive layouts that span large memory regions (eg;several kB); and these accesses recur in patterns that are predictable through codebasedcorrelation. We propose Spatial Memory Streaming; a practical on-chip hardware techniquethat identifies codecorrelated spatial access patterns and streams predicted blocks to theprimary cache ahead of demand misses. Using cycle-accurate full-system multiprocessor …,ACM SIGARCH Computer Architecture News,2006,182,10
Data-oriented transaction execution,Ippokratis Pandis; Ryan Johnson; Nikos Hardavellas; Anastasia Ailamaki,Abstract While hardware technology has undergone major advancements over the pastdecade; transaction processing systems have remained largely unchanged. The number ofcores on a chip grows exponentially; following Moore's Law; allowing for an ever-increasingnumber of transactions to execute in parallel. As the number of concurrently-executingtransactions increases; contended critical sections become scalability burdens. In typicaltransaction processing systems the centralized lock manager is often the first contendedcomponent and scalability bottleneck. In this paper; we identify the conventional thread-to-transaction assignment policy as the primary cause of contention. Then; we design DORA; asystem that decomposes each transaction to smaller actions and assigns actions to threadsbased on which data each action is about to access. DORA's design allows each thread …,Proceedings of the VLDB Endowment,2010,180,0
Storage device performance prediction with CART models,Mengzhi Wang; Kinman Au; Anastassia Ailamaki; Anthony Brockwell; Christos Faloutsos; Gregory R Ganger,Storage device performance prediction is a key element of self-managed storage systems.The paper explores the application of a machine learning tool; CART (classification andregression trees) models; to storage device modeling. Our approach predicts a device'sperformance as a function of input workloads; requiring no knowledge of the deviceinternals. We propose two uses of CART models: one that predicts per-request responsetimes (and then derives aggregate values); one that predicts aggregate values directly fromworkload characteristics. After being trained on the device in question; both provide accurateblack-box models across a range of test traces from real environments. Experiments showthat these models predict the average and 90th percentile response time with a relative erroras low as 19%; when the training workloads are similar to the testing workloads; and …,Modeling; Analysis; and Simulation of Computer and Telecommunications Systems; 2004.(MASCOTS 2004). Proceedings. The IEEE Computer Society's 12th Annual International Symposium on,2004,178,0
Improving hash join performance through prefetching,Shimin Chen; Anastassia Ailamaki; Phillip B Gibbons; Todd C Mowry,Abstract Hash join algorithms suffer from extensive CPU cache stalls. This article shows thatthe standard hash join algorithm for disk-oriented databases (ie GRACE) spends over80&percnt; of its user time stalled on CPU cache misses; and explores the use of CPU cacheprefetching to improve its cache performance. Applying prefetching to hash joins iscomplicated by the data dependencies; multiple code paths; and inherent randomness ofhashing. We present two techniques; group prefetching and software-pipelined prefetching;that overcome these complications. These schemes achieve 1.29--4.04 X speedups for thejoin phase and 1.37--3.49 X speedups for the partition phase over GRACE and simpleprefetching approaches. Moreover; compared with previous cache-aware approaches (iecache partitioning); the schemes are at least 36&percnt; faster on large relations and do …,ACM Transactions on Database Systems (TODS),2007,177,10
QPipe: a simultaneously pipelined relational query engine,Stavros Harizopoulos; Vladislav Shkapenyuk; Anastassia Ailamaki,Abstract Relational DBMS typically execute concurrent queries independently by invoking aset of operator instances for each query. To exploit common data retrievals and computationin concurrent queries; researchers have proposed a wealth of techniques; ranging frombuffering disk pages to constructing materialized views and optimizing multiple queries. Theideas proposed; however; are inherently limited by the query-centric philosophy of modernengine designs. Ideally; the query engine should proactively coordinate same-operatorexecution among concurrent queries; thereby exploiting common accesses to memory anddisks as well as common intermediate result computation. This paper introduces on-demandsimultaneous pipelining (OSP); a novel query evaluation paradigm for maximizing data andwork sharing across concurrent queries at execution time. OSP enables proactive …,Proceedings of the 2005 ACM SIGMOD international conference on Management of data,2005,174,20
Database servers on chip multiprocessors: Limitations and opportunities,Nikos Hardavellas; Ippokratis Pandis; Ryan Johnson; Naju Mancheril; Anastassia Ailamaki; Babak Falsafi,ABSTRACT Prior research shows that database system performance is dominated by off-chip data stalls; resulting in a concerted effort to bring data into on-chip caches. At the sametime; high levels of integration have enabled the advent of chip multiprocessors andincreasingly large (and slow) on-chip caches. These two trends pose the imminent technicaland research challenge of adapting high-performance data management software to ashifting hardware landscape. In this paper we characterize the performance of a commercialdatabase server running on emerging chip multiprocessor technologies. We find that themajor bottleneck of current software is data cache stalls; with L2 hit stalls rising from oblivionto become the dominant execution time component in some cases. We analyze the sourceof this shift and derive a list of features for future database designs to attain maximum …,*,2007,171,10
The Claremont report on database research,Rakesh Agrawal; Anastasia Ailamaki; Philip A Bernstein; Eric A Brewer; Michael J Carey; Surajit Chaudhuri; AnHai Doan; Daniela Florescu; Michael J Franklin; Hector Garcia-Molina; Johannes Gehrke; Le Gruenwald; Laura M Haas; Alon Y Halevy; Joseph M Hellerstein; Yannis E Ioannidis; Hank F Korth; Donald Kossmann; Samuel Madden; Roger Magoulas; Beng Chin Ooi; Tim O'Reilly; Raghu Ramakrishnan; Sunita Sarawagi; Michael Stonebraker; Alexander S Szalay; Gerhard Weikum,Abstract In late May; 2008; a group of database researchers; architects; users and punditsmet at the Claremont Resort in Berkeley; California to discuss the state of the research fieldand its impacts on practice. This was the seventh meeting of this sort in twenty years; andwas distinguished by a broad consensus that we are at a turning point in the history of thefield; due both to an explosion of data and usage scenarios; and to major shifts in computinghardware and platforms. Given these forces; we are at a time of opportunity for researchimpact; with an unusually large potential for influential results across computing; thesciences and society. This report details that discussion; and highlights the group'sconsensus view of new focus areas; including new database engine architectures;declarative programming languages; the interplay of structured and unstructured data …,ACM Sigmod Record,2008,161,19
Autopart: Automating schema design for large scientific databases using data partitioning,Stratos Papadomanolakis; Anastassia Ailamaki,Database applications that use multi-terabyte datasets are becoming increasingly importantfor scientific fields such as astronomy and biology. Scientific databases are particularlysuited for the application of automated physical design techniques; because of their datavolume and the complexity of the scientific workloads. Current automated physical designtools focus on the selection of indexes and materialized views. In large-scale scientificdatabases; however the data volume and the continuous insertion of new data allows foronly limited indexes and materialized views. By contrast; data partitioning does not replicatedata; thereby reducing space requirements and minimizing update overhead. In this paperwe present AutoPart; an algorithm that automatically partitions database tables to optimizesequential access assuming prior knowledge of a representative workload. The resulting …,Scientific and Statistical Database Management; 2004. Proceedings. 16th International Conference on,2004,151,14
Diamond: A Storage Architecture for Early Discard in Interactive Search.,Larry Huston; Rahul Sukthankar; Rajiv Wickremesinghe; Mahadev Satyanarayanan; Gregory R Ganger; Erik Riedel; Anastassia Ailamaki,Abstract This paper explores the concept of early discard for interactive search of unindexeddata. Processing data inside storage devices using downloaded searchlet code enablesDiamond to perform efficient; application-specific filtering of large data collections. Earlydiscard helps users who are looking for``needles in a haystack''by eliminating the bulk of theirrelevant items as early as possible. A searchlet consists of a set of application-generatedfilters that Diamond uses to determine whether an object may be of interest to the user. Thesystem optimizes the evaluation order of the filters based on run-time measurements of eachfilter's selectivity and computational cost. Diamond can also dynamically partitioncomputation between the storage devices and the host computer to adjust for changes inhardware and network conditions. Performance numbers show that Diamond dynamically …,FAST,2004,133,19
ZOO: A desktop experiment management environment,Yannis E Ioannidis; Miron Livny; Anastassia Ailamaki; Anand Narayanan; Andrew Therber,Despite much interestin the areaof Scientific Database Systems [2; 11]; a major problem thatmany experimental scientists are still facing today is that there are no adequate experimentmanagement tools that are powerful enough to capture the complexity of the experimentsand at the same time are natural and intuitive to the nonexpert. Over the past three years; incollaboration with several domain scientists; we have studied the needs of a wide range ofexperimental disciplines; developed solutions to some of the basic problems in experimentmanagement; and have made significant progress towards implementing a simple DesktopExperiment Management Erwir-onmen~(DEME) called Zoo. Our work has proceeded in atight Ioop between developing generic experiment management technology that isimplemented in a generic tool; Zoo; installing customized enhancementsof the tool …,ACM SIGMOD Record,1997,128,20
Temporal streaming of shared memory,Thomas F Wenisch; Stephen Somogyi; Nikolaos Hardavellas; Jangwoo Kim; Anastassia Ailamaki; Babak Falsafi,Abstract Coherent read misses in shared-memory multiprocessors account for a substantialfraction of execution time in many important scientific and commercial workloads. Wepropose Temporal Streaming; to eliminate coherent read misses by streaming data to aprocessor in advance of the corresponding memory accesses. Temporal streamingdynamically identifies address sequences to be streamed by exploiting two commonphenomena in shared-memory access patterns:(1) temporal address correlation¿ groups ofshared addresses tend to be accessed together and in the same order; and (2) temporalstream locality¿ recently-accessed address streams are likely to recur. We present apractical design for temporal streaming. We evaluate our design using a combination oftrace-driven and cycle-accurate full-system simulation of a cache-coherent distributed …,ACM SIGARCH Computer Architecture News,2005,126,3
NoDB: efficient query execution on raw data files,Ioannis Alagiannis; Renata Borovica; Miguel Branco; Stratos Idreos; Anastasia Ailamaki,Abstract As data collections become larger and larger; data loading evolves to a majorbottleneck. Many applications already avoid using database systems; eg; scientific dataanalysis and social networks; due to the complexity and the increased data-to-query time.For such applications data collections keep growing fast; even on a daily basis; and we arealready in the era of data deluge where we have much more data than what we can move;store; let alone analyze. Our contribution in this paper is the design and roadmap of a newparadigm in database systems; called NoDB; which do not require data loading while stillmaintaining the whole feature set of a modern database system. In particular; we show howto make raw data files a first-class citizen; fully integrated with the query engine. Through ourdesign and lessons learned by implementing the NoDB philosophy over a modern DBMS …,Proceedings of the 2012 ACM SIGMOD International Conference on Management of Data,2012,121,20
Middleware-based database replication: the gaps between theory and practice,Emmanuel Cecchet; George Candea; Anastasia Ailamaki,Abstract The need for high availability and performance in data management systems hasbeen fueling a long running interest in database replication from both academia andindustry. However; academic groups often attack replication problems in isolation;overlooking the need for completeness in their solutions; while commercial teams take aholistic approach that often misses opportunities for fundamental innovation. This hascreated over time a gap between academic research and industrial practice. This paperaims to characterize the gap along three axes: performance; availability; and administration.We build on our own experience developing and deploying replication systems incommercial and academic settings; as well as on a large body of prior related work. We siftthrough representative examples from the last decade of open-source; academic; and …,Proceedings of the 2008 ACM SIGMOD international conference on Management of data,2008,120,10
Priority mechanisms for OLTP and transactional web applications,David T McWherter; Bianca Schroeder; Anastassia Ailamaki; Mor Harchol-Balter,Transactional workloads are a hallmark of modern OLTP and Web applications; rangingfrom electronic commerce and banking to online shopping. Often; the database at the core ofthese applications is the performance bottleneck. Given the limited resources available tothe database; transaction execution times can vary wildly as they compete and wait forcritical resources. As the competitor is" only a click away"; valuable (high-priority) users mustbe ensured consistently good performance via QoS and transaction prioritization. This paperanalyzes and proposes prioritization for transactional workloads in traditional databasesystems (DBMS). This work first performs a detailed bottleneck analysis of resource usageby transactional workloads on commercial and noncommercial DBMS (IBM DB2; Post-greSQL; Shore) under a range of configurations. Second; this work implements and …,Data Engineering; 2004. Proceedings. 20th International Conference on,2004,117,10
