Vectorizing an In Situ Query Engine,Panagiotis Sioulas; Anastasia Ailamaki,Abstract Database systems serve a wide range of use cases efficiently; but require data tobe loaded and adapted to the system's execution engine. This pre-processing step is abottleneck to the analysis of the increasingly large and heterogeneous datasets. Therefore;numerous research efforts advocate for querying each dataset in situ; ie; without pre-loadingit in a DBMS. On the other hand; performing analysis over raw data entails numerousoverheads because of the potentially inefficient data representations. In this paper; weinvestigate the effect of vector processing on raw data querying. We enhance the operatorsof a query engine to use SIMD operations. Specifically; we examine the effect of SIMD ontwo different cases: the scan operators that perform the CPU-intensive task of input parsing;and the part of the query pipeline that performs a selection and computes an aggregate …,Proceedings of the 2016 International Conference on Management of Data,2016,*,0
Letter from the SIGMOD executive committee,Donald Kossmann; Anastasia Ailamaki; Magda Balazinska; K Selcuk Candan; Yanlei Diao; Curtis Dyreson; Yannis Loannidis; Christian Jensen; Tova Milo; Fran Spinola,Powered by Pure; Scopus & Elsevier Fingerprint Engine™ © 2017 Elsevier BV.,Sigmod Record,2015,*,0
RUBIK: efficient threshold queries on massive time series,Eleni Tzirita Zacharatou; Farhan Tauheedz; Thomas Heinis; Anastasia Ailamaki,Abstract An increasing number of applications from finance; meteorology; science andothers are producing time series as output. The analysis of the vast amount of time series iskey to understand the phenomena studied; particularly in the simulation sciences; where theanalysis of time series resulting from simulation allows scientists to refine the modelsimulated. Existing approaches to query time series typically keep a compact representationin main memory; use it to answer queries approximately and then access the exact timeseries data on disk to validate the result. The more precise the in-memory representation;the fewer disk accesses are needed to validate the result. With the massive sizes of today'sdatasets; however; current in-memory representations oftentimes no longer fit into mainmemory. To make them fit; their precision has to be reduced considerably resulting in …,Proceedings of the 27th International Conference on Scientific and Statistical Database Management,2015,*,14
Running with scissors: Fast queries on just-in-time databases,Anastasia Ailamaki,The amount of data collected in the last two years is higher than the amount of data collectedsince the dawn of time. Businesses are drowning in data; and need several months of ETLprocessing to barely prepare them for querying. Domain scientists collect data much fasterthan they can be transformed into valuable information and are often forced into hastydecisions on which parts to discard; potentially throwing away valuable data before it hasbeen exploited fully. The reason is that query processing; which is the mechanism tosqueeze information out of data; becomes slower as datasets grow larger. At the same time;the continuously increased number of hardware contexts ends up slowing processing downfurther; as keeping all cores busy with doing useful computation is difficult. Today's queryengines cannot harness but a fraction of the potential of new hardware platforms.,Data Engineering (ICDE); 2014 IEEE 30th International Conference on,2014,*,19
EDBT Vision Papers: EDBT Vision Track,Thomas Heinis; Farhan Tauheed; Anastasia Ailamaki; Michael Johnson; Jorge Perez; James Terwillinger; David Bronseke; Sebastian Bress; Max Heimel; Gunter Saake,T. Heinis; F. Tauheed; A. Ailamaki; M. Johnson; J. Perez; J. Terwillinger; D. Bronseke; S.Bress; M. Heimel; and G. Saake; “EDBT Vision Papers: EDBT Vision Track;” presented at the17th International Conference on Extending Database Technology; Εθνικό Κέντρο Τεκμηρίωσης(ΕΚΤ); 26-Mar-2014.,10442/13867,2014,*,15
Ippokratis Pandis,O Hassanzadeh; A Ailamaki; R Johnson,Research Staff Member of the Advanced Database Solutions (K55G) group. Activelyinvolved on the BLU project. BLU is the column store (in) DB2 and was released as part ofDB2 for Linux; Unix; Windows (LUW) v10. 5. DB2 BLU accelerates read-mostly BusinessIntelligence queries against column-organized tables by 10 to 100 times and improvescompression by one to two orders of magnitude; compared to traditional roworganizedtables and execution.,The VLDB Journal (VLDBJ),2014,*,1
Letter from the new SIGMOD Officers,Donald Kossmann Anastasia Ailamaki Magda Balazinska,Secondly; we would like to ask you for your input; help; and continuous support. SIGMOD isrun primarily by volunteers; some in formal roles; such as the executive committee and theorganizers of the various conferences which are sponsored by SIGMOD. Ultimately;however; all your actions every day make a difference and make this community such agreat place to be in.,SIGMOD Record,2013,*,0
Accelerating spatial range queries,Alexandros Stougiannis; Farhan Tauheed; Thomas Heinis; Anastasia Ailamaki,Abstract It is increasingly common for domain scientists to use computational tools to buildand simulate spatial models of the phenomena they are studying. The spatial models theybuild are more and more detailed as well as dense and are consequently difficult to managewith today's tools. A crucial problem when analyzing spatial models of increasing detail isthe scalable execution of range queries. State-of-the-art approaches like the R-Tree performsuboptimally on today's models and do not scale for more dense; future models. Theproblem is that the amount of overlap in the tree structure increases as a function of the levelof detail/density in the model. In this demonstration we showcase ZOOM; a new tool toefficiently execute spatial range queries on increasingly detailed (denser) models. ZOOM isbased on FLAT; a novel range query execution approach that effectively decouples the …,Proceedings of the 16th International Conference on Extending Database Technology,2013,*,11
Enabling Scientific Discovery Via Innovative Spatial Data Management,Thomas Heinis; Farhan Tauheed; Mirjana Pavlovic; Anastasia Ailamaki,Abstract Researchers in several scientific disciplines are struggling to cope with the massesof data resulting from either increasingly precise instruments or from simulation runs on evermore powerful supercomputers. Efficiently managing this deluge of data has become key tounderstand the phenomena they are studying. Scientists in the simulation sciences; forexample; build increasingly big and detailed models; as detailed as the hardware allows;but they lack the efficient technology to update and analyze them. In this paper we discusshow innovative data management techniques we have developed; enable scientists to buildand analyze bigger and more detailed spatial models and how these techniques ultimatelyaccelerate discovery in the simulation sciences. These include spatial join methods (inmemory and on disk); techniques for the efficient navigation in detailed meshes; an index …,Data Engineering Bulletin,2013,*,20
Approximate Probabilistic Tree Indexing for Partitionable Data,Manos Athanassoulis; Anastasia Ailamaki,Today we experience a shift both in storage technologies and in workloads characteristics.Firstly; solid state disks (SSD)(using flash; PCM or other low-level technologies) emerge asviable competitors of hard disk drives (HDD). Secondly; the increasing number of time-based generated workloads change the characteristics of the stored and analyzed data.Capacity and access times of storage devices create a storage tradeoff where SSD arepositioned diametrically opposite to HDD: slow random accesses in HDD have beenreplaced by efficient random accesses-particularly reads-in SSD; but the capacity per dollaroffered by HDD is still one or more orders of magnitude higher than the one offered by SSD.As the aggregated SSD capacity increases exponentially; an increasing part of our dataresides on SSD. Traditionally; indexing is designed assuming HDD as secondary storage …,*,2013,*,1
Scientific and Statistical Database Management: 24th International Conference; SSDBM 2012; Chania; Crete; Greece; June 25-27; 2012; Proceedings,Anastasia Ailamaki; Shawn Bowers,This book constitutes the refereed proceedings of the 24th International Conference onScientific and Statistical Database Management; SSDBM 2012; held in Chania; Grete;Greece; in June 2012. The 25 long and 10 short papers presented together with 2 keynotes;1 panel; and 13 demonstration and poster papers were carefully reviewed and selected fromnumerous submissions. The topics covered are uncertain and probabilistic data; paralleland distributed data management; graph processing; mining multidimensional data;provenance and workflows; processing scientific queries; and support for demandingapplications.,*,2012,*,19
Metadata Front-end for Shore-MT Storage Manager,Bao Duy Tran,Abstract Shore-MT is a scalable storage manager offering high performance on multi-corearchitectures [1]. This report documents the design and implementation of Shore-MT front-end; a dynamic relational application layer for Shore-MT with metadata managementcapability. The work was conducted as an EPFL semester project.,*,2012,*,19
Dagstuhl Reports; Vol. 1; Issue 8 ISSN 2192-5283,Anastassia Ailamaki; Michael J Carey; Donald Kossmann; Steve Loughran; Volker Markl; Tim Clark; Anita De Waard; Ivan Herman; Eduard Hovy; Hubert Comon-Lundh; Ralf Küsters; Catherine Meadows; Michael Biehl; Barbara Hammer; Erzsébet Merényi; Alessandro Sperduti; Thomas Villmann; Iris van Rooij; Yll Haxhimusa; Zygmunt Pizlo; Georg Gottlo,Abstract Cloud computing is emerging as a new paradigm for highly scalable; fault-tolerant;and adaptable computing on large clusters of off-the-shelf computers. Cloud architecturesstrive to massively parallelize complex processing tasks through a computational modelmotivated by functional programming. They provide highly available storage and computecapacity through distribution and redundancy. Most importantly; Cloud architectures adapt tochanging requirements by dynamically provisioning new (virtualized) compute or storagenodes. Economies of scale enable cloud providers to provide compute and storage powersto a multitude of users. On the infrastructure side; such a model has been pioneered byAmazon with EC2; whereas software as a service on cloud infrastructures with multi-tenancyhas been pioneered by Salesforce. com. The Dagstuhl Seminar 11321 “Information …,*,2011,*,10
2011 Index IEEE Transactions on Knowledge and Data Engineering Vol. 23,Ahmed Abbasi; Hanady Abdulsalam; Foto N Afrati; Jesus S Aguilar Ruiz; Anastasia Ailamaki; Reda Alhajj; Gustavo Alonso; Mohammed Alshalalfa; Marcelo Arenas; Nikolaus Augsten; Hujun Bao; Zhifeng Bao; Denilson Barbosa; Ilaria Bartolini; Gustavo EAPA Batista; Elisa Bertino; Henry H Bi; Paolo Biondi; M Brian Blake; Michael M Bohlen; Danushka Bollegala; Ljiljana Brankovic; Keith E Brown; Deng Cai; Ruichu Cai; David Camacho; Manuel Cebrian; Surajit Chaudhuri; Muhammad Aamir Cheema; Degang Chen; Gang Chen; Haifeng Chen; Harr Chen; Hsinchun Chen; Jianxia Chen; Ke Chen; Kuang Chen; Lei Chen; Lijiang Chen,This index covers all technical items-papers; correspondence; reviews; etc.-that appeared inthis periodical during the year; and items from previous years that were commented upon orcorrected in this year. Departments and other items may also be covered if they have beenjudged to have archival value. The Author Index contains the primary entry for each item;listed under the first author's name. The primary entry includes the coauthors' names; the titleof the paper or other item; and its location; specified by the publication abbreviation; year;month; and inclusive pagination. The Subject Index contains entries describing the itemunder all appropriate subject headings; plus the first author's name; the publicationabbreviation; month; and year; and inclusive pages. Note that the item title is found onlyunder the primary entry in the Author Index.,IEEE Transactions on Knowledge and Data Engineering,2011,*,22
What CS Academics Think They Teach Response,Anastasia Ailamaki; Verena Kantere; Debabrata Dash,*,COMMUNICATIONS OF THE ACM,2010,*
more than one Way to annotate metadata,CACM Staff,Communications welcomes your opinion. to submit a letter to the editor; please limit your commentsto 500 words or less and send to letters@cacm.acm.org. © 2010 AcM 0001-0782/10/0900 $10.00,Communications of the ACM,2010,*,6
Non-intrusive quality analysis of monitoring data,Mark Brightwell; Anastasia Ailamaki; Anna Suwalska,Abstract Any large-scale operational system running over a variety of devices requires amonitoring mechanism to assess the health of the overall system. The TechnicalInfrastructure Monitoring System (TIM) at CERN is one such system; and monitors a widevariety of devices and their properties; such as electricity supplies; device temperatures;liquid flows etc. Without adequate quality assurance; the data collected from such devicesleads to false-positives and false-negatives; reducing the effectiveness of the monitoringsystem. The quality must; however; be measured in a non-intrusive way; so that the criticalpath of the data flow is not affected by the quality computation. The quality computationshould also scale to large volumes of incoming data. To address these challenges; wedevelop a new statistical module; which monitors the data collected by TIM and reports its …,International Conference on Scientific and Statistical Database Management,2010,*,10
Database systems in the multicore era,Anastasia Ailamaki,Abstract Database systems have long optimized for parallel execution; the researchcommunity has pursued parallel database machines since the early80s; and several the keyideas from that era underlie the design and success of commercial database engines today.Computer architectures have shifted drastically during the intervening decades; however;and today the constraints of semiconductor technology combine with Moore's Law to doublethe number of processors per chip every 18 months. Converting this available rawparallelism into scalable performance is increasingly difficult with conventional servers; forboth business intelligence and transaction processing workloads. This talk analyzesdatabase performance scaling results on future chip multiprocessors and demonstrates thatcurrent parallelism methods are insufficient and of bounded utility as the number of …,Proceedings of the twenty-second annual ACM symposium on Parallelism in algorithms and architectures,2010,*,15
NWU-EECS-10-05 March 4; 2010 Power Scaling: the Ultimate Obstacle to 1K-Core Chips,Nikos Hardavellas; Michael Ferdman; Anastasia Ailamaki; Babak Falsafi,ABSTRACT As Moore's Law continues for at least another decade; the number of cores onchip and the on-chip cache size will continue to grow at an exponential rate. Whileworkloads with limited parallelism pose performance challenges with multicore processors;server workloads with abundant parallelism are believed to be immune; capable of scalingto the parallelism available in the hardware. However; despite the inherent scalability inthreaded server workloads; increasing core counts cannot directly translate intoperformance improvements because chips are physically constrained in power and off-chipbandwidth. In this work; we explore the design space of physically-constrained multicorechips across technologies and show that; even with conservative estimates; chips will notscale beyond a few tens of cores due to physical power and off-chip bandwidth …,*,2010,*,19
The Path Forward: Specialized Computing in the Datacenter,Nikos Hardavellas; Michael Ferdman; Anastasia Ailamaki; Babak Falsafi,ABSTRACT Popular belief holds that the cores on chip will grow at an exponential rate;following Moore's Law; with a commensurate increase in performance. However; byexploring the design space of multicore chips across technologies under a large array ofdesign parameters; we observe that physical constraints in power and off-chip bandwidthprohibit such performance increase. This leads us to conclude that server chips will notscale beyond a few tens of cores; potentially leaving the die real-estate underutilized infuture technology generations. We observe that heterogeneous multicores can leverage thedie area to overcome the initial power barrier; delivering significantly higher performance forthe same offchip bandwidth and power envelopes. Thus; specialized computing; especiallywhen coupled with emerging memory technologies; promises significant increases in …,2nd Workshop on Architectural Considerations for Large Datacenters (ACLD),2010,*,15
Guest Editor's Introduction: Top Picks from the Computer Architecture Conferences of 2009,Trevor Mudge,This special issue is the seventh in an important tradition in the computer architecturecommunity: IEEE Micro's Top Picks from the Computer Architecture Conferences. Thistradition; started by IEEE Micro's then editor in chief; Pradip Bose; provides a means forsharing a sample of the best papers published in computer architecture during the past yearwith the IEEE Micro readership and researchers in the computer architecture community.,IEEE micro,2010,*,17
SIGMOD Officers; Committees; and Awardees,Advisory Board; Tamer Özsu,ABSTRACT As applications within and outside the enterprise encounter increasing volumesof unstructured data; there has been renewed interest in the area of information extraction(IE)–the discipline concerned with extracting structured information from unstructured text.Classical IE techniques developed by the NLP community were based on cascadinggrammars and regular expressions. However; due to the inherent limitations ofgrammarbased extraction; these techniques are unable to:(i) scale to large data sets; and (ii)support the expressivity requirements of complex information tasks. At the IBM AlmadenResearch Center; we are developing SystemT; an IE system that addresses these limitationsby adopting an algebraic approach. By leveraging well-understood database concepts suchas declarative queries and costbased optimization; SystemT enables scalable execution …,SIGMOD Record,2009,*,8
CANDIDATE FOR ACM SIGMOD VICE CHAIRPERSON,ANASTASIA AILAMAKI; SWITZERLAND LAUSANNE,• Associate Editor; ACM SIGMOD Digital Symposium Collection (DiSC); 2002-2003. • ElectronicProceedings Chair; ACM SIGMOD Int'l Conf. on Management of Data; 2002. • Program CommitteeChair; Demo track; ACM SIGMOD Int'l Conf. on Management of Data; 2006. • Program CommitteeChair; General Chair; and Organizer; ACM SIGMOD Workshop on Data Management on ModernHardware (DaMoN). 2005-now • Program Committee Member; SIGMOD;SIGPLAN/SIGARCH/SIGOPS ASPLOS; SIGPLAN TRANSACT; etc. 2000-present … • PublicationsChair (2006-07) and Chair (2008-present); IEEE Workgroup on Self-Managing DatabaseSystems. • Associate Editor; IEEE Data Engineering Bulletin; 2006-2008. • Vice PC Chair; IEEEInternational Conference on Data Engineering; 2004 and 2007 • Program CommitteeMember; ICDE; VLDB; SBBD; etc. 2001-present … • OTHER: European Science …,SIGMOD Record,2009,*,20
Efficient Model-Driven Query Processing Based on Data Regeneration,Petre Alexandru Arion; Saket Sathe,Nowadays; sensor data is generated in large amounts. Storing or transmitting all thesensor's measurements might not be the ideal choice because of the volume (and rate) atwhich it is generated. But we also cannot easily discard it; since every data might containrelevant information and be required while processing queries. One approach to avoidstoring and transmitting large amounts of data is to create a sufficiently accurate model overthe data and then store or transmit that model. Later; at the time of query processing; thestraight forward approach is to regenerate the required data from the model (s) and proceedwith query processing; or answer the queries directly on the model (s). We ask the questionof how computationally expensive are various query processing techniques; given theavailability of the models only.,*,2009,*,20
Improving OLTP concurrency through Early Lock Release,Manos Athanassoulis; Ryan Johnson; Anastasia Ailamaki; Radu Stoica,ABSTRACT Since the beginning of the multi-core era; database systems research hasrestarted focusing on increasing concurrency. Even though database systems have beenable to accommodate concurrent requests; the exploding number of available cores per chiphas surfaced new difficulties. More and more transactions can be served in parallel (sincemore threads can run simultaneously) and; thus; concurrency in a database system is moreimportant than ever in order to exploit the available resources. In this paper; we evaluateEarly Lock Release (ELR); a technique that allows early release of locks to improveconcurrency level and overall throughput in OLTP. This technique has been proven to leadto a database system that can produce correct and recoverable histories but it has neverbeen implemented in a full scale DBMS. A new action is introduced which decouples the …,*,2009,*,21
An Integer Linear Programming Approach to Database Design,Anastasia Ailamaki; Stratos Papadomanolakis,Accessibility; Homepage; Navigation within EPFL sites; Navigation within this site; Jump to searchfield; Jump to page content; Technical contact. You are: Prospective students portal. Bachelor;Master; PhD; Exchange student. Students portal. Student services; Academic calendar. Researchersportal. Research funding; Prizes and Awards. Staff portal. Human resources; Polylex: laws; directives.Business portal. Innovation & Tech Transfer; EPFL Innovation Park. Mediacorner. Press releases;EPFL Magazine; Image library. Teaching portal. Courses management; Students management.EPFL Alumni Portal. Join the community; Alumni events. Science and Society. Science Outreach;Culture/Art/Science - ArtLab. By school: Architecture; Civil and Environmental Engineering ENAC.Architecture; Civil Engineering; Environmental Engineering. Basic Sciences SB. Chemistry andChemical Engineering; Mathematics; Physics …,Proceedings of the 2nd International Workshop on Self-Managing Database Systems (SMDB 2007),2007,*,10
Letter from the Special Issue Editor,Anastassia Ailamaki,Accessibility; Homepage; Navigation within EPFL sites; Navigation within this site; Jump to searchfield; Jump to page content; Technical contact. You are: Prospective students portal. Bachelor;Master; PhD; Exchange student. Students portal. Student services; Academic calendar. Researchersportal. Research funding; Prizes and Awards. Staff portal. Human resources; Polylex: laws; directives.Business portal. Innovation & Tech Transfer; EPFL Innovation Park. Mediacorner. Press releases;EPFL Magazine; Image library. Teaching portal. Courses management; Students management.EPFL Alumni Portal. Join the community; Alumni events. Science and Society. Science Outreach;Culture/Art/Science - ArtLab. By school: Architecture; Civil and Environmental Engineering ENAC.Architecture; Civil Engineering; Environmental Engineering. Basic Sciences SB. Chemistry andChemical Engineering; Mathematics; Physics …,IEEE Data Eng. Bull.,2007,*,10
Service-based Data Management for High Parallelism and Agressive Sharing on Chip Multiprocessors,Anastassia Ailamaki,Accessibility; Homepage; Navigation within EPFL sites; Navigation within this site; Jump to searchfield; Jump to page content; Technical contact. You are: Prospective students portal. Bachelor;Master; PhD; Exchange student. Students portal. Student services; Academic calendar. Researchersportal. Research funding; Prizes and Awards. Staff portal. Human resources; Polylex: laws; directives.Business portal. Innovation & Tech Transfer; EPFL Innovation Park. Mediacorner. Press releases;EPFL Magazine; Image library. Teaching portal. Courses management; Students management.EPFL Alumni Portal. Join the community; Alumni events. Science and Society. Science Outreach;Culture/Art/Science - ArtLab. By school: Architecture; Civil and Environmental Engineering ENAC.Architecture; Civil Engineering; Environmental Engineering. Basic Sciences SB. Chemistry andChemical Engineering; Mathematics; Physics …,*,2007,*,0
Observer: Keeping System Models from Becoming Obsolete (CMU-PDL-07-101),Eno Thereska; Dushyanth Narayanan; Anastassia Ailamaki; Gregory R Ganger,Abstract To be effective for automation; in practice; system models used for performanceprediction and behavior checking must be robust. They must be able to cope withcomponent upgrades; misconfigurations; and workload-system interactions that were notanticipated. This paper promotes making models self-evolving; such that they continuouslyevaluate their accuracy and adjust their predictions accordingly. Such self-evaluation alsoenables confidence values to be provided with predictions; including identification ofsituations where no trustworthy prediction can be produced. With a combination ofexpectation-based and observationbased techniques; we believe that such self-evolvingmodels can be achieved and used as a robust foundation for tuning; problem diagnosis;capacity planning; and administration tasks.,*,2007,*,1
