Adaptive NUMA-aware data placement and task scheduling for analytical workloads in main-memory column-stores,Iraklis Psaroudakis; Tobias Scheuer; Norman May; Abdelkader Sellami; Anastasia Ailamaki,Abstract Non-uniform memory access (NUMA) architectures pose numerous performancechallenges for main-memory column-stores in scaling up analytics on modern multi-socketmulti-core servers. A NUMA-aware execution engine needs a strategy for data placementand task scheduling that prefers fast local memory accesses over remote memory accesses;and avoids an imbalance of resource utilization; both CPU and memory bandwidth; acrosssockets. State-of-the-art systems typically use a static strategy that always partitions dataacross sockets; and always allows inter-socket task stealing. In this paper; we show thatadapting data placement and task stealing to the workload can improve throughput by up toa factor of 4 compared to a static approach. We focus on highly concurrent workloadsdominated by operators working on a single table or table group (copartitioned tables) …,Proceedings of the VLDB Endowment,2016,6,10
How to stop under-utilization and love multicores,Anastasia Ailamaki; Erietta Liarou; Pınar Tözün; Danica Porobic; Iraklis Psaroudakis,Hardware trends oblige software to overcome three major challenges against systemsscalability:(1) taking advantage of the implicit/vertical parallelism within a core that isenabled through the aggressive micro-architectural features;(2) exploiting theexplicit/horizontal parallelism provided by multicores; and (3) achieving predictively efficientexecution despite the variability in communication latencies among cores on multisocketmulticores. In this three hour tutorial; we shed light on the above three challenges andsurvey recent proposals to alleviate them. The first part of the tutorial describes theinstruction-and data-level parallelism opportunities in a core coming from the hardware andsoftware side. In addition; it examines the sources of under-utilization in a modern processorand presents insights and hardware/software techniques to better exploit the micro …,Data Engineering (ICDE); 2015 IEEE 31st International Conference on,2015,6,20
Processor performance of selection Queries,Anastassia Ailamaki; Donald Slutz,Abstract We conducted an in-depth analysis of the processor and memory behavior of threecommercial database management systems; running simple selection queries. The goalwas to find and understand bottlenecks across. In addition; we evaluated vertical partitioningas a technique to reduce data-related memory stall time.,*,1999,6,20
Scaling the memory power wall with dram-aware data management,Raja Appuswamy; Matthaios Olma; Anastasia Ailamaki,Abstract Improving the energy efficiency of database systems has emerged as an importanttopic of research over the past few years. While significant attention has been paid tooptimizing the power consumption of tradition disk-based databases; little attention hasbeen paid to the growing cost of DRAM power consumption in main-memory databases(MMDB). In this paper; we bridge this divide by examining power--performance tradeoffsinvolved in designing MMDBs. In doing so; we first show how DRAM will soon emerge asthe dominating source of power consumption in emerging MMDB servers unlike traditionaldatabase servers; where CPU power consumption overshadows that of DRAM. Second; weshow that using DRAM frequency scaling and power-down modes can provide substantialimprovement in performance/Watt under both transactional and analytical workloads. This …,Proceedings of the 11th International Workshop on Data Management on New Hardware,2015,5,20
OCTOPUS: Efficient query execution on dynamic mesh datasets,Farhan Tauheed; Thomas Heinis; Felix Schurmann; Henry Markram; Anastasia Ailamaki,Scientists in many disciplines use spatial mesh models to study physical phenomena.Simulating natural phenomena by changing meshes over time helps to better understandthe phenomena. The higher the precision of the mesh models; the more insight do thescientists gain and they thus continuously increase the detail of the meshes and build themas detailed as their instruments and the simulation hardware allow. In the process; the datavolume also increases; slowing down the execution of spatial range queries needed tomonitor the simulation considerably. Indexing speeds up range query execution; but theoverhead to maintain the indexes is considerable because almost the entire mesh changesunpredictably at every simulation step. Using a simple linear scan; on the other hand;requires accessing the entire mesh and the performance deteriorates as the size of the …,Data Engineering (ICDE); 2014 IEEE 30th International Conference on,2014,5,20
Scaling up analytical queries with column-stores,Ioannis Alagiannis; Manos Athanassoulis; Anastasia Ailamaki,Abstract As data analytics is used by an increasing number of applications; data analyticsengines are required to execute workloads with increased concurrency; ie; an increasingnumber of clients submitting queries. Data management systems designed for data analytics-a market dominated by column-stores-however; were initially optimized for single queryexecution; minimizing its response time. Hence; they do not treat concurrency as a first classcitizen. In this paper; we experiment with one open-source and two commercial column-stores using the TPC-H and SSB benchmarks in a setup with an increasing number ofconcurrent clients submitting queries; focusing on whether the tested systems can scale upin a single node instance. The tested systems for in-memory workloads scale up; to somedegree; however; when the server is saturated they fail to fully exploit the available …,Proceedings of the Sixth International Workshop on Testing Database Systems,2013,5,19
Automated physical designers: what you see is (not) what you get,Renata Borovica; Ioannis Alagiannis; Anastasia Ailamaki,Abstract The explosion of available data in the last few years has increased the importanceof physical database design; since the selection of proper physical structures (eg indices;partitions and materialized views) may improve query execution performance by severalorders of magnitude. Commercial DBMS vendors have recognized this need and offeredautomated physical design tools as part of their products. These tools use what-if interfacesto simulate the presence of different physical structures and recommend physical designsthat minimize the estimated execution time of a given workload. Along with therecommended design; they deliver an estimation of the expected improvement the newdesign brings. In this paper; we examine the output of physical designers; ie; whether whatwe see as a result of the tuning (the estimation of the improvement) is indeed what we …,Proceedings of the Fifth International Workshop on Testing Database Systems,2012,5,10
Information management in the cloud (dagstuhl seminar 11321),Anastasia Ailamaki; Michael J Carey; Donald Kossman; Steve Loughran; Volker Markl,Abstract Cloud computing is emerging as a new paradigm for highly scalable; fault-tolerant;and adaptable computing on large clusters of off-the-shelf computers. Cloud architecturesstrive to massively parallelize complex processing tasks through a computational modelmotivated by functional programming. They provide highly available storage and computecapacity through distribution and redundancy. Most importantly; Cloud architectures adapt tochanging requirements by dynamically provisioning new (virtualized) compute or storagenodes. Economies of scale enable cloud providers to provide compute and storage powersto a multitude of users. On the infrastructure side; such a model has been pioneered byAmazon with EC2; whereas software as a service on cloud infrastructures with multi-tenancyhas been pioneered by Salesforce. com. The Dagstuhl Seminar 11321``Information …,Dagstuhl Reports,2011,5,20
Time for our field to grow up,Anastassia Ailamaki; Laura Haas; HV Jagadish; David Maier; Tamer Özsu; Marianne Winslett,Abstract Compared to centuries of physics and millennia of mathematics; the 50-year-historyof computer science and information management research makes us the toddlers of thescientific community. Yet during our brief existence; we've revolutionized the world and; notcontent with that; gone on to build and study virtual worlds. We have justly taken pride in ouraccomplishments; and developed our own unique way of conducting research; unlike otherscientific and engineering fields. But cracks have appeared in this edifice we have built. Theconference system that served us so well for our first 50 years is falling apart. Our ever-increasing population competes ever more energetically for a finite set of resources. Otherscientific and engineering disciplines still think that our field equates to programming; andlook down on us. While we may also look down on them; it is undeniably true that high …,Proceedings of the VLDB Endowment,2010,5,7
Parallel depth first vs. work stealing schedulers on CMP architectures,Vasileios Liaskovitis; Shimin Chen; Phillip B Gibbons; Anastassia Ailamaki; Guy E Blelloch; Babak Falsafi; Limor Fix; Nikos Hardavellas; Michael Kozuch; Todd C Mowry; Chris Wilkerson,Abstract In chip multiprocessors (CMPs); limiting the number of off-chip cache misses iscrucial for good performance. Many multithreaded programs provide opportunities forconstructive cache sharing; in which concurrently scheduled threads share a largelyoverlapping working set. In this brief announcement; we highlight our ongoing study [4]comparing the performance of two schedulers designed for fine-grained multithreadedprograms: Parallel Depth First (PDF)[2]; which is designed for constructive sharing; andWork Stealing (WS)[3]; which takes a more traditional approach. Overview of schedulers. InPDF; processing cores are allocated ready-to-execute program tasks such that higherscheduling priority is given to those tasks the sequential program would have executedearlier. As a result; PDF tends to co-schedule threads in a way that tracks the sequential …,Proceedings of the eighteenth annual ACM symposium on Parallelism in algorithms and architectures,2006,5,17
Logs and lifeguards: Accelerating dynamic program monitoring,Shimin Chen; Babak Falsafi; PB Gibbons; M Kozuch; TC Mowry; R Teodorescu; A Ailamaki; L Fix; GR Ganger; SW Schlosser,Abstract Runtime monitoring tools are invaluable for detecting various types of bugs; in bothsequential and multi-threaded programs. However; running one of these tools slows downthe monitored program by an order of magnitude or more; thereby limiting the tool'susefulness. Fortunately; the emergence of chip multiprocessors as a dominant computingplatform means that resources are available on-chip to assist in monitoring tasks. This paperpresents an architecture for exploiting such resources in order to dramatically reduce theoverheads for runtime program monitoring. Specifically; we propose adding hardwaresupport for logging a main program's trace and delivering it to another (otherwise idle)processor for inspection. A lifeguard program running on this other processor executes thedesired monitoring task. Simulation results using three diverse lifeguards (for address …,*,2006,5,20
The Case For Heterogeneous HTAP,Raja Appuswamy; Manos Karpathiotakis; Danica Porobic; Anastasia Ailamaki,ABSTRACT Modern database engines balance the demanding requirements of mixed;hybrid transactional and analytical processing (HTAP) workloads by relying on i) globalshared memory; ii) system-wide cache coherence; and iii) massive parallelism. Thus;database engines are typically deployed on multi-socket multi-cores; which have been theonly platform to support all three aspects. Two recent trends; however; indicate that thesehardware assumptions will be invalidated in the near future. First; hardware vendors havestarted exploring alternate non-cache-coherent shared-memory multi-core designs due toescalating complexity in maintaining coherence across hundreds of cores. Second; asGPGPUs overcome programmability; performance; and interfacing limitations; they arebeing increasingly adopted by emerging servers to expose heterogeneous parallelism. It …,8th Biennial Conference on Innovative Data Systems Research,2017,4,22
BLOCK: Efficient Execution of Spatial Range Queries in Main-Memory,Matthaios Alexandros Olma; Farhan Tauheed; Thomas Heinis; Anastasia Ailamaki,ABSTRACT The execution of spatial range queries is at the core of many applications;particularly in the simulation sciences but also in many other domains. Although mainmemory in desktop and supercomputers alike has grown considerably in recent years; mostspatial indexes supporting the efficient execution of range queries are still only optimized fordisk access (minimizing disk page reads). Recent research has primarily focused on theoptimization of known disk-based approaches for memory (through cache alignment etc.)but has not fundamentally revisited index structures for memory. In this paper we developBLOCK; a novel approach to execute range queries on spatial data featuring volumetricobjects in main memory. Our approach is built on the key insight that in-memory approachesneed to be optimized to reduce the number of intersection tests (between objects and …,*,2017,4,19
Databases and hardware: The beginning and sequel of a beautiful friendship,Anastasia Ailamaki,Abstract Fast query and transaction processing is the goal of 40 years of database researchand the reason of existence for many new database system architectures. In datamanagement; system performance means acceptable response time and throughput oncritical-path operations; ideally with scalability guarantees. Performance is improved with top-of-the line research on data processing algorithms; efficiency; however; is contingent onseamless collaboration between the database software and hardware and storage devices.In 1980; the goal was to minimize disk accesses; in 2000; memory replaced disks in terms ofaccess costs. Nowadays performance is synonymous to scalability; scalability; in turn;translates into sustainable and predictable use of hardware resources in the face ofembarrassing parallelism and deep storage hierarchies while minimizing energy needs-a …,Proceedings of the VLDB Endowment,2015,4,17
Toward scalable transaction processing: evolution of shore-MT,Anastasia Ailamaki; Ryan Johnson; Ippokratis Pandis; Pínar Tözün,Abstract Designing scalable transaction processing systems on modern multicore hardwarehas been a challenge for almost a decade. The typical characteristics of transactionprocessing workloads lead to a high degree of unbounded communication on multicores forconventional system designs. In this tutorial; we initially present a systematic way ofeliminating scalability bottlenecks of a transaction processing system; which is based onminimizing the unbounded communication. Then; we show several techniques that applythe presented methodology to minimize logging; locking; latching etc. related bottlenecks oftransaction processing systems. In parallel; we demonstrate the internals of the Shore-MTstorage manager and how they have evolved over the years in terms of scalability onmulticore hardware through such techniques. We also teach how to use Shore-MT with …,Proceedings of the VLDB Endowment,2013,4,0
GIPSY: joining spatial datasets with contrasting density,Mirjana Pavlovic; Farhan Tauheed; Thomas Heinis; Anastasia Ailamakit,Abstract Many scientific and geographical applications rely on the efficient execution ofspatial joins. Past research has produced several efficient spatial join approaches and whileeach of them can join two datasets; the problem of efficiently joining two datasets withcontrasting density; ie; with the same spatial extent but with a wildly different number ofspatial elements; has so far been overlooked. State-of-the-art data-oriented spatial joinapproaches (eg; based on the R-Tree) suffer from degraded performance due to overlap;whereas space-oriented approaches excessively read data from disk. In this paper wedevelop GIPSY; a novel approach for the spatial join of two datasets with contrasting density.GIPSY uses fine-grained data-oriented partitioning and thus only retrieves the data neededfor the join. At the same time it avoids the overlap related problems associated with data …,Proceedings of the 25th International Conference on Scientific and Statistical Database Management,2013,4,15
Data-driven neuroscience: enabling breakthroughs via innovative data management,Alexandros Stougiannis; Mirjana Pavlovic; Farhan Tauheed; Thomas Heinis; Anastasia Ailamaki,Abstract Scientists in all disciplines increasingly rely on simulations to develop a betterunderstanding of the subject they are studying. For example the neuroscientists wecollaborate with in the Blue Brain project have started to simulate the brain on asupercomputer. The level of detail of their models is unprecedented as they model details onthe subcellular level (eg; the neurotransmitter). This level of detail; however; also leads to atrue data deluge and the neuroscientists have only few tools to efficiently analyze the data.This demonstration showcases three innovative spatial management techniques that havesubstantial impact on computational neuroscience and other disciplines in that they allow tobuild; analyze and simulate bigger and more detailed models. More particularly; wedemonstrate a tool that integrates three spatial data management techniques that have …,Proceedings of the 2013 ACM SIGMOD International Conference on Management of Data,2013,4,20
Towards predicting the runtime of iterative analytics with predict,Adrian Daniel Popescu; Andrey Balmin; Vuk Ercegovac; Anastasia Ailamaki,ABSTRACT Machine learning algorithms are widely used today for analytical tasks such asdata cleaning; data categorization; or data filtering. At the same time; the rise of social mediamotivates recent uptake in large scale graph processing. Both categories of algorithms aredominated by iterative subtasks; ie; processing steps which are executed repetitively until aconvergence condition is met. Optimizing cluster resource allocations among multipleworkloads of iterative algorithms motivates the need for estimating their runtime; which inturn requires: i) predicting the number of iterations; and ii) predicting the processing time ofeach iteration. As both parameters depend on the characteristics of the dataset and on theconvergence function; estimating their values before execution is difficult. This paperproposes PREDIcT; an experimental methodology for predicting the runtime of iterative …,*,2013,4,0
Reducing OLTP instruction misses with thread migration,Islam Atta; Pinar Tözün; Anastasia Ailamaki; Andreas Moshovos,Abstract During an instruction miss a processor is unable to fetch instructions. The morefrequent instruction misses are the less able a modern processor is to find useful work to doand thus performance suffers. Online transaction processing (OLTP) suffers from highinstruction miss rates since the instruction footprint of OLTP transactions does not fit intoday's L1-I caches. However; modern many-core chips have ample aggregate L1 cachecapacity across multiple cores. Looking at the code paths concurrently executingtransactions follow; we observe a high degree of repetition both within and acrosstransactions. This work presents TMi a technique that uses thread migration to reduceinstruction misses by spreading the footprint of a transaction over multiple L1 caches. TMi isa software-transparent; hardware technique; TMi requires no code instrumentation; and …,Proceedings of the Eighth International Workshop on Data Management on New Hardware,2012,4,0
Rethinking the conference reviewing process,Michael J Franklin; Jennifer Widom; Anastassia Ailamaki; Philip A Bernstein; David DeWitt; Alon Halevy; Zachary Ives; Gerhard Weikum,In recent years the database research community has endeavored to expand the scope ofthe field and attract a larger and more varied base of participants. We have also long workedat “educating” academic tenure committees and research management about theimportance of our major conferences. We may now be seeing some unintended effects ofour success. There is a growing dissatisfaction with conference reviewing from all sides ofthe process. Many now perceive the process to be" broken". A number of factors can beidentified as precipitating the discontent:• The number of submitted papers has spikeddramatically in recent years (see Figure 1).,Proceedings of the 2004 ACM SIGMOD international conference on Management of data,2004,4,15
Workload-Driven Schema Design for Large Scientific Databases.,Stratos Papadomanolakis; Anastassia Ailamaki,Abstract Database applications that use multi-terabyte datasets are becoming increasinglyimportant for scientific fields such as astronomy and biology. Scientific databases areparticularly suited for the application of automated physical design techniques; because oftheir data volume and the complexity of their workloads. Current automated physical designtools focus on the selection of indexes and materialized views. In large-scale scientificdatabases; however; the data volume and the continuous insertion of new data allows foronly limited use of such redundant structures. In this paper we propose schema designtechniques to improve query performance without redundancy. We present AutoPart; analgorithm that automatically partitions database tables utilizing knowledge of arepresentative workload. To evaluate AutoPart we built an automated schema design tool …,IEEE Data Eng. Bull.,2004,4,10
DBMS Data Loading: An Analysis on Modern Hardware,Adam Dziedzic; Manos Karpathiotakis; Ioannis Alagiannis; Raja Appuswamy; Anastasia Ailamaki,Abstract Data loading has traditionally been considered a “one-time deal”–an offline processout of the critical path of query execution. The architecture of DBMS is aligned with thisassumption. Nevertheless; the rate in which data is produced and gathered nowadays hasnullified the “one-off” assumption; and has turned data loading into a major bottleneck of thedata analysis pipeline. This paper analyzes the behavior of modern DBMS in order toquantify their ability to fully exploit multicore processors and modern storage hardwareduring data loading. We examine multiple state-of-the-art DBMS; a variety of hardwareconfigurations; and a combination of synthetic and real-world datasets to identify bottlenecksin the data loading process and to provide guidelines on how to accelerate data loading.Our findings show that modern DBMS are unable to saturate the available hardware …,*,2016,3,10
Towards the identification of disease signatures,Tassos Venetis; Anastasia Ailamaki; Thomas Heinis; Manos Karpathiotakis; Ferath Kherif; Alexis Mitelpunkt; Vasilis Vassalos,Abstract The identification of biological signatures of diseases will enable the developmentof new biologically grounded classifications of brain diseases; leading to a new systematicunderstanding of their causes; and new diagnostic tools. In this paper we present thechallenges and steps taken towards the identification of disease signatures; through theMedical Informatics Platform of the Human Brain Project; that will expedite diagnosis andlead to more accurate prognosis and objective diagnosis.,International Conference on Brain Informatics and Health,2015,3,0
RITA: An index-tuning advisor for replicated databases,Quoc Trung Tran; Ivo Jimenez; Rui Wang; Neoklis Polyzotis; Anastasia Ailamaki,Abstract Given a replicated database; a divergent design tunes the indexes in each replicadifferently in order to specialize it for a specific subset of the workload. Empirical studieshave shown that this specialization brings significant performance gains compared to thecommon practice of having the same indexes in all replicas. However; reaping the benefitsof divergent designs requires the development of new tuning tools for databaseadministrators; and the existing tools unfortunately suffer from severe shortcomings: theyassume a fixed number of replicas and a known workload distribution; and ignore thepossibility of replica failures and the subsequent effect on load imbalance. To address theseshortcomings; we analyze the theory and practice of tuning the divergent design of areplicated database. We design and implement RITA; a novel divergent-tuning advisor …,Proceedings of the 27th International Conference on Scientific and Statistical Database Management,2015,3,14
Online Updates on Data Warehouses via Judicious Use of Solid-State Storage,Manos Athanassoulis; Shimin Chen; Anastasia Ailamaki; Philip B Gibbons; Radu Stoica,Abstract Data warehouses have been traditionally optimized for read-only queryperformance; allowing only offline updates at night; essentially trading off data freshness forperformance. The need for 24x7 operations in global markets and the rise of online andother quickly reacting businesses make concurrent online updates increasingly desirable.Unfortunately; state-of-the-art approaches fall short of supporting fast analysis queries overfresh data. The conventional approach of performing updates in place can dramatically slowdown query performance; while prior proposals using differential updates either requirelarge in-memory buffers or may incur significant update migration cost. This article presentsa novel approach for supporting online updates in data warehouses that overcomes thelimitations of prior approaches by making judicious use of available SSDs to cache …,ACM Transactions on Database Systems (TODS),2015,3,1
