Clinical manifestations of IgE hypogammaglobulinemia,John K Smith; Guha H Krishnaswamy; Rhesa Dykes; Scott Reynolds; Steven L Berk,Background Athough IgE has been shown to play a role in the expulsion of intestinalparasites in experimental animals; its overall contribution to host defense in humansremains a subject of controversy. In order to clarify the potential role of IgE in host defense;we have studied the clinical characteristics of patients with serum IgE levels of< 2.5 IU/mL;using patients with normal or elevated IgE levels as controls. Objective To determine theclinical characteristics of IgE deficiency. Methods Serum IgE levels were measured in 420adult patients seen in our Allergy-Immunology Clinic over a period extending from January1990 to March 1996. All subjects were examined by one of the authors (JKS or GHK) using astandardized history and physical examination form. Patients with IgE levels of< 2.5 IU/mLalso had measurements of serum IgG; IgG subclasses; IgA and IgM. All IgE-deficient …,Annals of Allergy; Asthma & Immunology,1997,31
The clinical implications of adult-onset henoch-schonelin purpura,Warit Jithpratuck; Yasmin Elshenawy; Hana Saleh; George Youngberg; David S Chi; Guha Krishnaswamy,Henoch-Schonlein Purpura (HSP) is a small vessel vasculitis mediated by IgA-immunecomplex deposition. It is characterized by the clinical tetrad of non-thrombocytopenicpalpable purpura; abdominal pain; arthritis and renal involvement. Pathologically; it can beconsidered a form of immune complex-mediated leukocytoclastic vasculitis (LCV) involvingthe skin and other organs. Though it primarily affects children (over 90% of cases); theoccurrence in adults has been rarely reported. Management often involves the use ofimmunomodulatory or immune-suppressive regimens.,*,2011,30
Induction of p38-and gC1qR-dependent IL-8 expression in pulmonary fibroblasts by soluble hepatitis C core protein,Jonathan P Moorman; S Matthew Fitzgerald; Deborah C Prayther; Steven A Lee; David S Chi; Guha Krishnaswamy,Recent studies suggest that HCV infection is associated with progressive declines inpulmonary function in patients with underlying pulmonary diseases such as asthma andchronic obstructive pulmonary disease. Few molecular studies have addressed theinflammatory aspects of HCV-associated pulmonary disease. Because IL-8 plays afundamental role in reactive airway diseases; we examined IL-8 signaling in normal humanlung fibroblasts (NHLF) in response to the HCV nucleocapsid core protein; a viral antigenshown to modulate intracellular signaling pathways involved in cell proliferation; apoptosisand inflammation. NHLF were treated with HCV core protein and assayed for IL-8expression; phosphorylation of the p38 MAPK pathway; and for the effect of p38 inhibition.Our studies demonstrate that soluble HCV core protein induces significant increases in …,Respiratory research,2005,29
Reactive and clonal thrombocytosis: proinflammatory and hematopoietic cytokines and acute phase proteins.,Marco Araneda; Vinodini Krishnan; Kenton Hall; John Kalbfleisch; Guha Krishnaswamy; Koyamangalath Krishnan,BACKGROUND: We quantitated proinflammatory and thrombopoietic cytokines in reactivethrombocytosis (RT) and clonal thrombocytosis (CT) to identify a cytokine profile that mightaid in the distinction of these two disorders. METHODS: Serum levels of cytokines relevant toplatelet biology--interleukins 3; 6; 11; and 1beta; thrombopoietin; tumor necrosis factoralpha; and C-reactive protein (CRP)--were measured by enzyme-linked immunosorbentassay in healthy subjects and in patients with CT and RT. RESULTS: Interleukin-6 and CRPlevels were higher in RT patients than in controls or CT patients. Interleukin 1beta levelswere higher in the RT group than in the CT and control groups. CONCLUSIONS: In RT; IL-6;IL-1beta; and CRP levels are elevated. In both RT and CT; IL-11 is elevated; butthrombopoietin levels are not.,Southern medical journal,2001,29
X-linked agammaglobulinemia diagnosed late in life: case report and review of the literature,Justin R Sigmon; Ehab Kasasbeh; Guha Krishnaswamy,Common variable immune deficiency (CVID); one of the most common primaryimmunodeficiency diseases presents in adults; whereas X-linked agammaglobulinemia(XLA); an inherited humoral immunodeficiency; is usually diagnosed early in life aftermaternal Igs have waned. However; there have been several reports in the world literaturein which individuals have either had a delay in onset of symptoms or have beenmisdiagnosed with CVID and then later found to have mutations in Bruton's tyrosine kinase(BTK) yielding a reclassification as adult-onset variants of XLA. The typical finding of absentB cells should suggest XLA rather than CVID and may be a sensitive test to detect thiscondition; leading to the more specific test (Btk mutational analysis). Further confirmationmay be by mutational analyses. The records of 2 patients were reviewed and appropriate …,*,2008,27
The diagnosis and management of hypothyroidism.(Featured CME Topic: Thyroid Dysfunction/Disease),Bhuvana Guha; Guha Krishnaswamy; Alan Peiris,HYPOTHYROIDISM REFERS TO a metabolic state resulting from a deficiency in thyroidhormone function. It usually arises from primary thyroid disease; but in rare cases it is due tohypothalamic-pituitary disease or generalized tissue resistance to thyroid hormone.'Themanifestations of hypothyroidism are well described and can affect virtually any organ. Theearly recognition of hypothyroidism remains a challenge; especially when the decline inthyroid function is gradual. In some instances; the manifestations of hypothyroidism may beerroneously attributed to the effects of aging in the elderly. Clinical suspicion ofhypothyroidism justifies laboratory testing. Screening for abnormalities in thyroid function isrecommended by several medical professional organizations; however; the criteria forscreening remains controversial. In the presence of conditions which increase the risk of …,Southern medical journal,2002,27
Acinetobacter baumannii pneumonia: a case report and review of the literature.,Said B Iskandar; Bhuvana Guha; Guha Krishnaswamy; Thomas M Roy,Abstract Bacteria that constitute the genus Acinetobacter were originally identified in the firstdecade of the 20th century. However; it was not until the last decade that its role as anopportunistic pathogen was fully appreciated. It is now clear that Acinetobacter is animportant cause of nosocomial infection and contributes significantly to the patient'smorbidity and mortality. The prevalence of infection with A. baumannii has increasedsignificantly during the last decade. At the same time; A. baumannii has developed one ofthe most impressive patterns of antibiotic resistance ever observed; establishing it as animportant nosocomial pathogen. It has been nicknamed the" Gram-negative MRSA"because of its frequent resistance to commonly used antibiotics. Infection with A. baumanniishould be suspected in hospitalized patients who are not responding to initial empiric …,Tennessee medicine: journal of the Tennessee Medical Association,2003,26
Quinolone-associated rupture of the achilles' tendon,Harsha Vyas; Guha Krishnaswamy,An 81-year-old woman with rheumatoid arthritis; Sjögren's syndrome; and hypertensionpresented with swelling and pain in the area of the left heel; which had developed suddenlya week after a short course of levofloxacin for acute bronchitis. She reported neither traumato the area nor any excessive physical activity before the pain began. Examination revealedan ecchymotic area around the left posterior heel and a moderately swollen calf. A defectwas palpable in the lateral side of the Achilles' tendon; the medial side was still intact.Movement of the ankle was limited by severe pain. Magnetic resonance imaging (MRI) of...,New England Journal of Medicine,2007,23
Oral use of interferon-alpha stimulates ISG-15 transcription and production by human buccal epithelial cells,J Kelly Smith; Afzal A Siddiqui; Guha A Krishnaswamy; Rhesa Dykes; Steven L Berk; Mike Magee; William Joyner; Joseph Cummins,ISG-15 is a 15-kDa protein encoded by an interferon (IFN)-stimulated gene (ISG); which istranscriptionally regulated by IFN-alpha and IFN-beta. Considered as part of the cytokinenetwork; ISG-15 has the potential to amplify the immunomodulatory effects of these IFNs byenhancing IFN-gamma production; natural killer cell proliferation; and lymphokine-activatedkiller cell cytotoxicity. To understand better the mechanism (s) of action of orallyadministered IFN-alpha; we have studied the effect of IFN-alpha on ISG-15 gene expressionby human buccal epithelial cells (BEC). For in vitro studies; ISG-15 mRNA and protein levelswere measured in BEC incubated for 0.5; 2; and 9 h with 100 or 1;000 IU/ml of humanlymphoblastoid IFN-alpha. For in vivo studies; ISG-15 mRNA was measured in BEC samplescollected at baseline; and 0.5; 2; and 9 h after 5-20 min of oral rinsing with 10 ml of IFN …,Journal of interferon & cytokine research,1999,22
Eosinophilia in a patient with cyclical vomiting: a case report,Billy H Copeland; Omolola O Aramide; Salim A Wehbe; S Matthew Fitzgerald; Guha Krishnaswamy,Eosinophilic gastritis is related to eosinophilic gastroenteritis; varying only in regards to theextent of disease and small bowel involvement. Common symptoms reported are similar toour patient's including: abdominal pain; epigastric pain; anorexia; bloating; weight loss;diarrhea; ankle edema; dysphagia; melaena and postprandial nausea and vomiting.Microscopic features of eosinophilic infiltration usually occur in the lamina propria orsubmucosa with perivascular aggregates. The disease is likely mediated by eosinophilsactivated by various cytokines and chemokines. Therapy centers around the use ofimmunosuppressive agents and dietary therapy if food allergy is a factor. The patient is a 31year old Caucasian female with a past medical history significant for ulcerative colitis. Shepresented with recurrent bouts of vomiting; abdominal pain and chest discomfort of 11 …,Clinical and Molecular Allergy,2004,21
Moraxella catarrhalis induces mast cell activation and nuclear factor kappa B-dependent cytokine synthesis,G Krishnaswamy; R Martin; E Walker; C Li; F Hossler; K Hall; DS Chi,1. ABSTRACT Human mast cells are often found perivascularly and at mucosal sites andmay play crucial roles in the inflammatory response. Recent studies have suggested aprominent role for mast cells in host defense. In this study; we analyzed the effects of acommon airway pathogen; Moraxella catarrhalis and a commensal bacterium; Neiserriacinerea; on activation of human mast cells. Human mast cell leukemia cells (HMC-1) wereactivated with either phorbol myristate acetate (PMA) and calcium ionophore or with varyingconcentrations of heat-killed suspensions of bacteria. Supernatants were assayed for thecytokines interleukin-4 (IL-4); granulocyte macrophage colony stimulating factor (GM-CSF);IL-6; IL-8; IL-13 and monocyte chemotactic protein-1 (MCP-1). Nuclear proteins wereisolated and assayed by electrophoretic mobility shift assay (EMSA) for nuclear factor …,Front Biosci,2003,20
Mast cells: methods and protocols,Guha Krishnaswamy; David S Chi,The mast cell; long implicated in causing allergic reactions; may also be involved in manyother disease processes; including cancer; heart disease; parasitic disease; atherosclerosis;asthma; and arthritis. In Mast Cells: Methods and Protocols; hands-on experts describe indetail their best techniques for the isolation; culture; and study of both activation andsignaling in human mast cells. These readily reproducible methods take advantage of thelatest advances in molecular biology; technology; and information science. The techniquesprovide a sound base of methodology for mast cell research and include methods for theidentification of mast cells; the development of mast cells in vitro; the study of mast cellsignaling and gene expression; and the measurement of mast cell expression ofinflammatory mediators. Additional chapters cover methods for studying mast cell …,*,2006,19
Chronic granulomatous disease; the McLeod phenotype and the contiguous gene deletion syndrome-a review,Casey E Watkins; John Litchfield; Eunkyung Song; Gayatri B Jaishankar; Niva Misra; Nikhil Holla; Michelle Duffourc; Guha Krishnaswamy,Chronic Granulomatous Disease (CGD); a disorder of the NADPH oxidase system; results inphagocyte functional defects and subsequent infections with bacterial and fungal pathogens(such as Aspergillus species and Candida albicans). Deletions and missense; frameshift; ornonsense mutations in the gp91phox gene (also termed CYBB); located in the Xp21. 1region of the X chromosome; are associated with the most common form of CGD. Whenlarger X-chromosomal deletions occur; including the XK gene deletion; a so-called,*,2011,18
Angiopoietin-1 inhibits doxorubicin-induced human umbilical vein endothelial cell death by modulating fas expression and via the PI3K/Akt pathway,Deling Yin; Chuanfu Li; Race L Kao; Tuanzhu Ha; Guha Krishnaswamy; Matthew Fitzgerald; Charles A Stuart,Angiopoietin-1 (Ang-1) is essential for the maturation of blood vessels duringvasculogenesis. Besides angiogenesis; recent publications indicate that Ang-1 is also apotent survival factor for endothelial cells; however; the mechanisms by which pathwaysremain elusive. Doxorubicin (DOX) is a powerful anticancer drug; but its use is severelyrestricted by its cardiotoxicity. The authors report here that Ang-1 inhibits DOX-induced celldeath in human umbilical vein endothelial cells (HUVECs). Interestingly; the DOX-inducedup-regulation in Fas (CD95/APO-1) and Fas ligand expression could be blocked by Ang-1;indicating a pivotal role of Ang-1 in DOX-induced Fas and Fas ligand expression. Inaddition; the prevention of cell death in this model system seems to be dependent on theactivation of phosphatidylinositol 3-kinase (PI3K)/Akt; as Ang-1 fails to inhibit DOX …,*,2004,18
Molecular defects in the mannose binding lectin pathway in dermatological disease: Case report and literature review,Christopher Miller; Sara Wilgenbusch; Mini Michael; David S Chi; George Youngberg; Guha Krishnaswamy,Mannose-binding lectin (MBL) and the Mannose-binding lectin-associated serine proteases(MASPs) are an essential aspect of innate immune responses that probably play animportant but understudied role in cutaneous function. The MBL-MASP pathway appears toexert its primary role by assisting in the clearance of apoptotic skin cells (thus preventingaccumulation and a subsequent autoimmune response) and promotingopsonophagocytosis of invading pathogens; limiting their dissemination. Deficiencies of thepathway have been described and are associated with infectious; autoimmune and vascularcomplications. However; the role of this pathway in dermatological disease is essentiallyunexplored. We describe 6 patients presenting with recurrent inflammatory and/or infectiousskin conditions who also demonstrated severely low MBL levels. One patient also had a …,*,2010,17
Differential regulation of antigen-induced IL-4 and IL-13 generation from T lymphocytes by IFN-α,David M Essayan; Guha Krishnaswamy; Lawrence M Lichtenstein; Shau-Ku Huang,Abstract Background: IL-4 and IL-13 are related cytokines with similar functional properties.Differential regulation of IL-4 and IL-13 has not been described. Objective: We haveexamined the effects of IFN-α on antigen-driven proliferation; IL-4 generation; and IL-13generation from human PBMCs and T-cell clones. Methods: Proliferation was assessed by 3H-thymidine incorporation. Cytokine generation was assessed by reverse transcription PCRand ELISA. Messenger RNA stability was assessed in the presence of actinomycin D.Results: IFN-α induced a concentration-dependent inhibition of antigen-driven proliferationof T H1 and T H2 clones (median effective concentration; 150 to 200 U/mL); the sensitivity ofT H1 and T H2 clones to IFN-α was not significantly different (P=. 6). IFN-α induced ananalogous concentration-dependent inhibition of antigen-driven IL-13 generation from T …,Journal of allergy and clinical immunology,1999,16
A patient with persistent wheezing; sinusitis; elevated IgE; and eosinophilia,Jeff Robinson; Zulfiqar Ahmed; Afzal Siddiqui; Thomas Roy; Steven Berk; John Kelly Smith; Guha Krishnaswamy,HISTORY OF PRESENTING ILLNESS A 76-year-old Caucasian male; with a past medical historyof severe steroid- dependent asthma; presented with a 4-day history of worsening shortnessof breath and a productive cough. His medical records documented four ad- missions to the hospitalin the last few months for similar complaints. In spite of aggressive therapy for his asthma; includingtriamcinalone; albuterol; and ipratropium inhalers plus oral pred- nisone (20 mg daily); his dyspneaworsened progressively. He was now using nebulized albuterol every few hours; with minimalrelief. The patient also had symptoms compatible with persistent rhinosinusitis but denied fe-ver; chills; sweats; or recent infectious contacts. He had no symptoms of or- thopnea; posturalnocturnal dyspnea; or hemoptysis. The patient also denied epistaxis; arthritis; unusual skinerup- tions; hematuria; or abdominal pain. There was no history of recent travel. His other …,Annals of Allergy; Asthma & Immunology,1999,16
Exercise-induced anaphylaxis: a serious but preventable disorder,Christopher WT Miller; Bhuvana Guha; Guha Krishnaswamy,Abstract Described for the first time approximately 30 years ago; exercise-inducedanaphylaxis is a rare disorder characterized by development of a severe allergic responseoccurring after mild-to-strenuous physical activity. This disorder is especially important torecognize with the recent increase in physical activity and health fitness fads. A number ofpredisposing factors (eg; prior ingestion of particular food groups) linked to exercise-inducedanaphylaxis has been outlined over the years. Mechanisms governing the condition are stillbeing unveiled; and it is likely that one mechanism involves mast cell degranulation andinflammatory mediator generation resulting from the biochemical effects of exercise;sometimes in the presence of an ingested allergen such that wheat or shell fish. Clinicalmanifestations usually occur after around 10 minutes of exercise; and follow a specific …,The Physician and sportsmedicine,2008,15
Resolution of the neutropenia of Felty's syndrome by longterm administration of recombinant granulocyte colony stimulating factor.,G Krishnaswamy; C Odem; DS Chi; J Kalbfleisch; N Baker; JK Smith,Abstract Felty's syndrome is characterized by neutropenia; splenomegaly; and recurrentinfection in patients with rheumatoid arthritis. We used recombinant granulocyte colonystimulating factor (rGCSF) in a patient with Felty's syndrome and recurrent sepsis. rGCSFinduced a statistically significant increase in the patient's absolute neutrophil and total whiteblood cell counts. During 14 months of followup taking rGCSF; disseminated varicella zosterwas the only infectious complication. Except mild thrombocytopenia and a transient flare ofarthritis; no serious adverse effects occurred. rGCSF may be a safe and effective therapy forFelty's syndrome in selected patients.,*,1996,15
Enhanced effects of cigarette smoke extract on inflammatory cytokine expression in IL-1β-activated human mast cells were inhibited by Baicalein via regulation of th...,David S Chi; Ta-Chang Lin; Kenton Hall; Tuanzhu Ha; Chuanfu Li; Zong Doa Wu; Thomas Soike; Guha Krishnaswamy,Human mast cells are capable of a wide variety of inflammatory responses and play a vitalrole in the pathogenesis of inflammatory diseases such as allergy; asthma; andatherosclerosis. We have reported that cigarette smoke extract (CSE) significantly increasedIL-6 and IL-8 production in IL-1β-activated human mast cell line (HMC-1). Baicalein (BAI)has anti-inflammatory properties and inhibits IL-1β-and TNF-α-induced inflammatorycytokine production from HMC-1. The goal of the present study was to examine the effect ofBAI on IL-6 and IL-8 production from CSE-treated and IL-1β-activated HMC-1. Main-stream(Ms) and Side-stream (Ss) cigarette smoke were collected onto fiber filters and extracted inRPMI-1640 medium. Two ml of HMC-1 at 1× 106 cells/mL were cultured with CSE in thepresence or absence of IL-1β (10 ng/mL) for 24 hrs. A group of HMC-1 cells stimulated …,Clinical and Molecular Allergy,2012,14
Treatment strategies for bronchial asthma: an update,Guha Krishnaswamy,Advances in understanding the biomolecular basis of the disease's inflammatory andremodeling responses are offering new therapeutic choices—and sometimes newdrugdelivery system∼ n categories such as B-agonists; glucocorticoids; and leukotrieneblockers. Meanwhile; researchers are exploring novel targets; including intercellular signalsand cell-adhesion and gene-activating molecules.,Hospital Practice,2001,14
Effect of interferon alpha on HLA-DR expression by human buccal epithelial cells.,J Kelly Smith; David S Chi; Guha Krishnaswamy; Sujata Srikanth; Scott Reynolds; Steven L Berk,Abstract/We have studied the effect of interferon alpha (IFN-alpha) on MHC class IIexpression by human buccal epithelial cells (BEC); and mRNA expression by BEC andmucosal-associated mononuclear cells (MAMC). In 6 experiments; freshly collected BECwere suspended at a concentration of 1.0 x 10 (5)/ml in RPMI 1640 and incubated in thepresence of 0-10;000 IU/ml of human lymphoblastoid IFN-alpha (HuIFN-alpha). Zero and sixhour samples were analyzed by single color flow cytometry using FITC-labeled murine IgG1monoclonal antibody to HLA-DR. Preparations were also analyzed for expression ofcytokine transcripts (IL-2; IL-4; IL-5; IL-6; IL-8; IFN-gamma; GM-CSF) by reverse transcriptasepolymerase chain reaction (RT-PCR). Increasing concentrations of IFN-alpha resulted inproportionate increases in the percentage of HLA-DR+ BEC (r= 0.7897; p= 0.0627) and in …,Archivum immunologiae et therapiae experimentalis,1996,14
Qualitative and quantitative analysis of cytokine transcripts in the bronchoalveolar lavage cells of patients with asthma,SHAU‐KU HUANG; Guha Krishnaswamy; SONG‐NAN SU; HUI‐QING XIAO; Mark C Liu,Bronchial asthma is typically associated with bronchial hyperreactivity to a variety of stimuli.such as inhaled allergens.'Studies of the inflamed asthmatic airways have demonstrated thepresence of eosinophils and activated T-lymphocytes infiltrating the bronchial mucosa.'.? Ithas been suggested that this inflammatory state is a consequence of the elaboration ofvarious proinflammatory cytokines and mediators in the asthmatic airways.'-3 It has alsobecome evident that a network of cytokines control the chronic inflammatory state.? Furtherunderstanding of the molecular pathogenesis of asthma is thus intimately linked toidentifying the types and sources of these cytokines coupled with functional studies of theirrespective roles in inducing asthma. Using the technique of in sitir hybridization; mRNAs forgranulocyte-macrophage colony stimulating factor (GM-CSF); interleukin-2 (IL-2). IL-3; IL …,Annals of the New York Academy of Sciences,1994,14
Inhaled corticosteroid use is associated with increased circulating T regulatory cells in children with asthma,Anne Marie Singh; Paul Dahlberg; Kristjan Burmeister; Michael D Evans; Ronald Gangnon; Kathy A Roberg; Christopher Tisler; Douglas DaSilva; Tressa Pappas; Lisa Salazar; Robert F Lemanske; James E Gern; Christine M Seroogy,T regulatory (Treg) cells are important in balancing immune responses and dysregulation ofTreg cells has been implicated in the pathogenesis of multiple disease states includingasthma. In this study; our primary aim was to determine Treg cell frequency in the peripheralblood of children with and without asthma. The secondary aim was to explore theassociation between Treg cell frequency with allergen sensitization; disease severity andmedication use. Peripheral blood mononuclear cells from healthy control subjects (N= 93)and asthmatic children of varying disease severity (N= 66) were characterized by multi-parameter flow cytometry. Our findings demonstrate that children with asthma had asignificantly increased frequency of Treg cells compared to children without asthma. Using amultivariate model; increased Treg cell frequency in children with asthma was most …,Clinical and Molecular Allergy,2013,13
Persistent urticarial eruption in an asthmatic patient.,Raghu Mukkamala; Nawras Baban; Guha Krishnaswamy; John Kelly Smith,Abstract This case demonstrates the importance of recognizing urticarial vasculitis inpatients with chronic urticarial eruptions. The salient points in history that point towards thediagnosis of urticarial vasculitis include the presence of painful urticarial lesions that lastlonger than 24 hours and that heal leaving residual pigmentation. In some cases theurticaria may evolve into palpable purpura. An associated systemic illness that mayresemble systemic lupus erythematosus should also suggest the diagnosis; which isestablished by skin biopsy. Histopathology reveals a leukocytoclastic vasculitis involvingpostcapillary venules. When associated with systemic vasculitis; the urticaria is likely to be ofthe hypocomplementemic variety; with immunoglobulin and complement deposition onbiopsies; and with serum complement studies demonstrating classical pathway activation …,Annals of allergy; asthma & immunology: official publication of the American College of Allergy; Asthma; & Immunology,1996,13
