Enabling Efficient Agile Software Development of NoSQL-backed Applications.,Uta Störl; Daniel Müller; Meike Klettke; Stefanie Scherzinger,NoSQL databases are popular in agile software development; where a frequently changingdatabase schema imposes challenges for the production database. In this demo; we presentDarwin; a middleware for systematic; tool-based support specifically designed for NoSQLdatabase systems. Darwin carries out schema evolution and data migration tasks. To thebest of our knowledge; Darwin is the first tool of its kind that supports both eager and lazyNoSQL data migration.,BTW,2017,2
NoSQL schema evolution and big data migration at scale,Meike Klettke; Uta Störl; Manuel Shenavai; Stefanie Scherzinger,This paper explores scalable implementation strategies for carrying out lazy schemaevolution in NoSQL data stores. For decades; schema evolution has been an evergreen indatabase research. Yet new challenges arise in the context of cloud-hosted data backends:With all database reads and writes charged by the provider; migrating the entire datainstance eagerly into a new schema can be prohibitively expensive. Thus; lazy migrationmay be more cost-efficient; as legacy entities are only migrated in case they are actuallyaccessed by the application. Related work has shown that the overhead of migrating datalazily is affordable when a single evolutionary change is carried out; such as adding a newproperty. In this paper; we focus on long-term schema evolution; where chains of pendingschema evolution operations may have to be applied. Chains occur when legacy entities …,Big Data (Big Data); 2016 IEEE International Conference on,2016,2
Datalution: a tool for continuous schema evolution in NoSQL-backed web applications,Stefanie Scherzinger; Stephanie Sombach; Katharina Wiech; Meike Klettke; Uta Störl,Abstract When an incremental release of a web application is deployed; the structure of dataalready persisted in the production database may no longer match what the applicationcode expects. Traditionally; eager schema migration is called for; where all legacy data ismigrated in one go. With the growing popularity of schema-flexible NoSQL data stores; lazyforms of data migration have emerged: Legacy entities are migrated on-the-fly; one at-a-time; when they are loaded by the application. In this demo; we present Datalution; a tooldemonstrating the merits of lazy data migration. Datalution can apply chains of pendingschema changes; due to its Datalog-based internal representation. The Datalution approachthus ensures that schema evolution; as part of continous deployment; is carried out correctly.,Proceedings of the 2nd International Workshop on Quality-Aware DevOps,2016,2
Kontrolliertes Schema-Evolutionsmanagement für NoSQL-Datenbanksysteme,Uta Störl; Meike Klettke; Stefanie Scherzinger,Zusammenfassung. In der agilen Entwicklung von Anwendungen werden neue Software-Versionen häufig und regelmäßig veröffentlicht. Relationale Datenbanksysteme mit ihremrigiden Schema-Management werden dabei oft als unflexibel empfunden. SchemaloseNoSQL-Datenbanksysteme bieten zwar die nötige Flexibilität; unterstützen aber keinsystematisches Release-und Schema-Evolutionsmanagement. Dieser Artikel stelltentsprechende Konzepte vor: Schema-Evolutionsschritte werden deklarativ spezifiziert; ihreUmsetzung erfolgt für die Anwendung transparent eager oder lazy. Während eine eagerMigration sämtliche Datensätze erfasst; werden lazy persistierte Objekte nur bei Zugriffdurch die Anwendung aktualisiert. Wir diskutieren eine effiziente lazy Migration selbst fürden Fall; dass eine Migration über mehrere Evolutionsschritte und mehrere persistierte …,LWA,2015,2
ControVol Flex: Flexible Schema Evolution for NoSQL Application Development,Florian Haubold; Johannes Schildgen; Stefanie Scherzinger; Stefan Deßloch,We demonstrate ControVol Flex; an Eclipse plugin for controlled schema evolution in Javaapplications backed by NoSQL document stores. The sweet spot of our tool are applicationsthat are deployed continuously against the same production data store: Each new releasemay bring about schema changes that conflict with legacy data already stored in production.The type system internal to the predecessor tool ControVol is able to detect commonschema conflicts; and enables developers to resolve them with the help of object-mapperannotations. Our new tool ControVol Flex lets developers choose their schema-migrationstrategy; whether all legacy data is to be migrated eagerly by means of NotaQLtransformation scripts; or lazily; as declared by object-mapper annotations. Our tool is evencapable of carrying out both strategies in combination; eagerly migrating data in the …,Datenbanksysteme für Business; Technologie und Web (BTW 2017),2017,1
Kurz erklärt: Objekt-NoSQL-Mapping,Uta Störl; Meike Klettke; Stefanie Scherzinger,S. Scherzinger OTH Regensburg; Regensburg; Deutschland E-Mail: stefanie. scherzinger@oth-regensburg. de die systemunabhängige Anwendungsentwicklung unterstützen bzw.überhaupt erst ermöglichen. Im Folgenden werden die Grundlagen der Datenmodellierungbei der Verwendung gängiger Objekt-NoSQLMapper für Java dargestellt. Anschließend wirdein Überblick über den aktuellen Stand dieser Produkte gegeben. Dabei wird auch daraufeingegangen; wie sie der Herausforderung der derzeit noch sehr heterogenenAnfrageschnittstellen von NoSQL-Datenbanken begegnen. Die meisten NoSQL-DBMS sindschema-flexibel; dh sie verwalten keine expliziten Schemainformationen. Damit erlaubensie das Persistieren von Objekten mit variablen und sich dynamisch veränderndenSchemata. Aus diesem Grund kommt dem Schema-Management und der Schema …,Datenbank-Spektrum,2016,1
Methods; apparatuses; and computer-readable media for computing checksums for effective caching in continuous distributed builds,*,Methods; systems; and computer-readable media for determining whether dependencies ofconfiguration files have changed such that the compilation strategy should be recomputed.Local build checksums are computed for individual configuration files. The local buildchecksums are computed by sorting input paths to the configuration files plus data indicatingwhether the path refers to a file or a directory and a checksum computed on theconfiguration file itself. The transitive closure of local build checksums are then used tocompute a global build checksum: the local build checksums are sorted in order to computethe global build checksum. If the global build checksum is different from a previouslycomputed global build checksum; then the compilation strategy should be recomputed;since this is a signal that the compilation strategy may not be valid anymore; eg because …,*,2014,1
Cloud-Technologien in der Hochschullehre–Pflicht oder Kür?,Stefanie Scherzinger; Andreas Thor,Zusammenfassung Ein eigenes Themenheft zum Datenmanagement in der Cloud dient unsals Anlass; die Präsenz von Cloud-Themen in der akademischen Datenbanklehre zuerfassen. In diesem Artikel geben wir die Ergebnisse einer Umfrage innerhalb derFachgruppe Datenbanksysteme durch den Arbeitskreis Datenmanagement in der Cloudwieder. Dozentinnen und Dozenten von über zwanzig Hochschulen nahmen an derUmfrage teil. Es zeigt sich deutlich; dass sich das Thema „Cloud “in der Hochschullehrezunehmend etabliert; jedoch überwiegend als ergänzendes Angebot; und seltener in dergrundständigen Lehre verankert. Wir fassen die Ergebnisse unserer Umfrage zusammenund wagen Deutungsversuche.,Datenbank-Spektrum,2014,1
Agil und spielerisch: Neue Methoden der Software-Entwicklung in der Praxis und ihr Potential für den Schulunterricht.,Stefanie Scherzinger,„Agile Software-Entwicklung “bezeichnet eine iterative Vorgehensweise; die sowohl inSilicon Valley Startups als auch großen Software-Häusern erfolgreich eingesetzt wird.Musste nach dem Wasserfall-Modell jede Eventualität im Voraus akribisch bedacht werden;sind agile Ansätze deutlich flexibler: In kurzen Zyklen wird eine einfache; prototypischeLösung zum vollwertigen Produkt ausgebaut. Am Ende jedes Zyklus steht das fertiggetestete Produkt; auch wenn es möglicherweise noch nicht über sämtliche gewünschtenFunktionalitäten verfügen sollte; ist es für die wichtigsten Zwecke bereits einsatzbereit. Somitkönnen Auftraggeber zeitnah Änderungswünsche einbringen und das Produkt noch in derEntstehungsphase auf das Nutzungsziel ausrichten. Das Entwicklungsteam wiederum kannauf Unvorhergesehenes flexibel reagieren und Zwischenerfolge entsprechend …,INFOS,2011,1
End-to-End Performance Monitoring of Databases in Distributed Environments.,Stefanie Scherzinger; Holger Karn; Torsten Steinbach,Abstract: This demonstration features the IBM DB2 Performance Expert for Linux; Unix andWindows; a high-end database monitoring tool that is capable of end-to-end monitoring indistributed environments. Performance Expert closely tracks the execution of databaseworkload; from the point when the workload is issued in a database application; to its actualexecution by the database server. This enables us to break down the response time asexperienced by the user into time spent waiting for connections; within database drivers; thenetwork; and finally; within the database server. From a data management point-of-view; themain challenge here is the handling of large amounts of performance data. We show howthis challenge is met by continuous aggregation; and the definition of so-called workloadcluster groups; which organize and narrow down the data of interest.,BTW,2009,1
Uncovering the evolution history of data lakes,Meike Klettke; Hannes Awolin; Uta Störl; Daniel Müller; Stefanie Scherzinger,Data accumulating in data lakes can become inaccessible in the long run when itssemantics are not available. The heterogeneity of data formats and the sheer volumes ofdata collections prohibit cleaning and unifying the data manually. Thus; tools for automateddata lake analysis are of great interest. In this paper; we target the particular problem ofreconstructing the schema evolution history from data lakes. Knowing how the data isstructured; and how this structure has evolved over time; enables programmatic access tothe lake. By deriving a sequence of schema versions; rather than a single schema; we takeinto account structural changes over time. Moreover; we address the challenge of detectinginclusion dependencies. This is a prerequisite for mapping between succeeding schemaversions; and in particular; detecting nontrivial changes such as a property having been …,Big Data (Big Data); 2017 IEEE International Conference on,2017,*
Herausforderungen bei der Anwendungsentwicklung mit schema-flexiblen NoSQL-Datenbanken,Meike Klettke; Uta Störl; Stefanie Scherzinger,Zusammenfassung NoSQL-Datenbanksysteme sind in den letzten Jahren sehr populärgeworden; gute Gründe sprechen für ihren Einsatz: Eine attraktive Eigenschaft vielerSysteme ist ihre Schema-Flexibilität; die insbesondere in der agilenAnwendungsentwicklung Vorteile bietet. Durch horizontale Skalierbarkeit ermöglichenNoSQL-Datenbanksysteme eine effiziente Verarbeitung großer Datenmengen. EinigeSysteme; die für die Datenhaltung interaktiver Anwendungen konzipiert sind; können zudemhochfrequente Nutzeranfragen bedienen. Diesen Vorteilen stehen eine Reihe vonNachteilen gegenüber; aus denen sich neue Herausforderungen für dieAnwendungsentwicklung ergeben: Fehlende Standards bei den Anfragesprachenerschweren die Entwicklung datenbanksystemunabhängiger Anwendungen. Schema …,HMD Praxis der Wirtschaftsinformatik,2016,*
Challenges with Continuous Deployment of NoSQL-backed Database Applications,Meike Klettke; Stefanie Scherzinger; Uta Störl; Stephanie Sombach; Katharina Wiech,*,Herbsttreffen der Fachgruppe Datenbanken,2016,*
PERFORMING A BACKGROUND COPY PROCESS DURING A BACKUP OPERATION,*,A method according to one embodiment includes receiving information from a performancemonitoring facility of a database at a data protection manager implemented at least in part inhardware; wherein the performance monitoring facility is configured to measureperformance of the database; wherein the data protection manager is configured to control abackup operation of the database on a storage subsystem. The backup operation is started;and the performance monitoring facility is informed about the starting of the backupoperation. In response to receiving an indication that a predefined performance criterion hasbeen violated; information from the performance monitoring facility is received at the dataprotection manager; the data protection manager causing compliance with the predefinedperformance criterion in response to the information.,*,2015,*
Identifying reroutable data columns in an ETL process,*,Reroutable data columns are identified in an ETL process by receiving an ETL processdefinition describing a set of processing stages and how each processing stage output datacolumn is a result of a function that operates on a set of input data columns; representing theETL process definition as a directed graph with nodes representing processing stages andlinks representing data flow between processing stages; traversing at least part of thedirected graph and identifying a set of subsequent nodes of the directed graph where atleast one data column is involved only as input data in identity functions; the at least onedata column being reroutable between outmost nodes of the set of subsequent nodes; andin connection with traversing the at least part of the directed graph; maintaining informationabout reroutable data columns and the respective outmost nodes.,*,2015,*
AutoShard–A Java Object Mapper (not only) for Hot Spot Data Objects in NoSQL Data Stores,Stefanie Scherzinger; Andreas Thor,We demonstrate AutoShard; a ready-to-use object mapper for Java applications runningagainst NoSQL data stores. AutoShard's unique feature is its capability to gracefully shardhot spot data objects that are suffering under concurrent writes. By sharding data on thelevel of the logical schema; scalability bottlenecks due to write contention can be effectivelyavoided. Using AutoShard; developers can easily employ sharding in their web applicationby adding minimally intrusive annotations to their code. Our live experiments show thesignificant impact of sharding on both the write throughput and the execution time.,BTW,2015,*
AutoShard–Declaratively Managing Hot Spot Data Objects in NoSQL Document Stores,Stefanie Scherzinger; Andreas Thor,*,WebDB,2014,*
System and method for merging monitoring data streams from a server and a client of the server,*,A method; system; and computer program product for merging monitoring data streamsincludes: receiving a first monitoring data stream relating to a server containing first records;each first record has a first transaction identifier relating to a first transaction and firstmonitoring data; relating to a performance of executing the first transaction; receiving asecond monitoring data stream relating to a client containing second records; each secondrecord has a list of second transaction identifiers relating to one or more second transactionsand second monitoring data; relating to a performance of executing the second transactions;buffering at least parts of the first and the second monitoring data streams; and merging thebuffered first and second monitoring data streams by computing an outer-join with a join-condition that the first records have the first transaction identifier that occurs in the list of …,*,2013,*
METHODS AND APPARATUSES FOR COMPUTING CHECKSUMS FOR EFFECTIVE CACHING IN CONTINUOUS DISTRIBUTED BUILDS,*,*,*,2013,*
Ein Cloud-basiertes räumliches Decision Support System für die Herausforderungen der Energiewende,Golo Klossek; Stefanie Scherzinger; Michael Sterner,KURZFASSUNG Die Energiewende in Deutschland wirft sehr konkrete Fragestellungen auf:Welche Standorte eignen sich für Windkraftwerke; wo können Solaranlagen wirtschaftlichbetrieben werden? Dahinter verbergen sich rechenintensive Datenverarbeitungsschritte;auszuführen auf Big Data aus mehreren Datenquellen; in entsprechend heterogenenFormaten. Diese Arbeit stellt exemplarisch eine konkrete Fragestellung und ihreBeantwortung als MapReduce Algorithmus vor. Wir konzipieren eine geeignete; Cluster-basierte Infrastruktur für ein neues Spatial Decision Support System und legen dieNotwendigkeit einer deklarativen; domänenspezifischen Anfragesprache dar.,Grundlagen von Datenbanken,2013,*
Efficient main memory-based XML stream processing,Stefanie Scherzinger,Anwendungen; die XML-Dokumente als Dateien oder Ströme verarbeiten; sindnatürlicherweise hauptspeicherbasiert. Für die Skalierbarkeit wird der Hauptspeicher damitzu einem Engpass. Diese Doktorarbeit widmet sich diesem Problem; zu dessen Lösung sieWerkzeuge für eine effektive Pufferverwaltung in hauptspeicherbasierten Prozessoren fürXML-Datenströme vorstellt. Die Projektion von XML-Dokumenten ist eine etablierteMethode; um den Pufferverbrauch von hauptspeicherbasierten XML-Prozessoren zureduzieren. Dabei werden nur jene Daten in den Hauptspeicherpuffer geladen; die für dieAnfrageauswertung auch relevant sind. Wir präsentieren eine neue Implementierung dieserAufgabe; wobei wir Algorithmen zur effizienten Suche in flachen Zeichenketten einsetzen;um in baumartig strukturierten Daten zu navigieren. Danach stellen wir eine Erweiterung …,*,2008,*
User Manual GCX-Garbage Collected XQuery,Christoph Koch; Stefanie Scherzinger; Michael Schmidt,*,*,2007,*
Building a Native XML-DBMS as a Term Project in a Database Systems Course,Christoph Koch; Dan Olteanu; Stefanie Scherzinger,This is to report on a database systems course the first author held in the summer semesterof 2005 at Saarland University; Saarbrücken; Germany. This course was an experiment inseveral respects. For one; we wanted to teach a systems course with a practical part inwhich students apply the material taught to build the core of a database managementsystem. Such a systems building effort seems to be quite common in top-tier US universities;but it is rare in Europe. One main reason for this is that European curricula often requirestudents to take many small courses per term. Students then cannot be required to invest thetime necessary for such a systems-building effort into an individual course. In Saarbrücken;this fortunately does not apply and students are expected to take only about two maincourses per term.(The database systems course in Saarbrücken is worth 9 points in the …,*,2006,*
