Learning-based entity resolution with MapReduce,Lars Kolb; Hanna Köpcke; Andreas Thor; Erhard Rahm,Abstract Entity resolution is a crucial step for data quality and data integration. Learning-based approaches show high effectiveness at the expense of poor efficiency. To reduce thetypically high execution times; we investigate how learning-based entity resolution can berealized in a cloud infrastructure using MapReduce. We propose and evaluate two efficientMapReduce-based strategies for pair-wise similarity computation and classifier applicationon the Cartesian product of two input sources. Our evaluation is based on real-worlddatasets and shows the high efficiency and effectiveness of the proposed approaches.,Proceedings of the third international workshop on Cloud data management,2011,16
Entity search strategies for mashup applications,Stefan Endrullis; Andreas Thor; Erhard Rahm,Programmatic data integration approaches such as mashups have become a viableapproach to dynamically integrate web data at runtime. Key data sources for mashupsinclude entity search engines and hidden databases that need to be queried via source-specific search interfaces or web forms. Current mashups are typically restricted to simplequery approaches such as using keyword search. Such approaches may need a highnumber of queries if many objects have to be found. Furthermore; the effectiveness of thequeries may be limited; ie; they may miss relevant results. We therefore propose moreadvanced search strategies that aim at finding a set of entities with high efficiency and higheffectiveness. Our strategies use different kinds of queries that are determined by source-specific query generators. Furthermore; the queries are selected based on the …,Data Engineering (ICDE); 2012 IEEE 28th International Conference on,2012,14
An Evolutionbased Approach for Assessing Ontology Mappings-A Case Study in the Life Sciences.,Andreas Thor; Michael Hartung; Anika Gross; Toralf Kirsten; Erhard Rahm,Abstract: Ontology matching has been widely studied. However; the resulting ontologymappings can be rather unstable when the participating ontologies or utilized secondarysources (eg; instance sources; thesauri) evolve. We propose an evolution-based approachfor assessing ontology mappings by annotating their correspondences by information aboutsimilarity values for past ontology versions. These annotations allow us to assess thestability of correspondences over time and they can thus be used to determine better andmore robust ontology mappings. The approach is generic in that it can be appliedindependently from the utilized match technique. We define different stability measures andshow results of a first evaluation for the life science domain.,BTW,2009,14
Adaptive website recommendations with awesome,Andreas Thor; Nick Golovin; Erhard Rahm,Abstract Recommendations are crucial for the success of large websites. While there aremany ways to determine recommendations; the relative quality of these recommendersdepends on many factors and is largely unknown. We present the architecture andimplementation of AWESOME (Adaptive website recommendations); a data warehouse-based recommendation system. It allows the coordinated use of a large number ofrecommenders to automatically generate website recommendations. Recommendations aredynamically selected by efficient rule-based approaches utilizing continuously measureduser feedback on presented recommendations. AWESOME supports a completely automaticgeneration and optimization of selection rules to minimize website administration overheadand quickly adapt to changing situations. We propose a classification of recommenders …,The VLDB journal,2005,12
Evaluation of query generators for entity search engines,Stefan Endrullis; Andreas Thor; Erhard Rahm,Abstract: Dynamic web applications such as mashups need efficient access to web data thatis only accessible via entity search engines (eg product or publication search engines).However; most current mashup systems and applications only support simple keywordsearches for retrieving data from search engines. We propose the use of more powerfulsearch strategies building on so-called query generators. For a given set of entities querygenerators are able to automatically determine a set of search queries to retrieve theseentities from an entity search engine. We demonstrate the usefulness of query generators foron-demand web data integration and evaluate the effectiveness and efficiency of querygenerators for a challenging real-world integration scenario. Subjects: Databases (cs. DB);Information Retrieval (cs. IR) ACM classes: H. 3.3; H. 3.4 Cite as: arXiv: 1003.4418 [cs. DB …,arXiv preprint arXiv:1003.4418,2010,11
Toward an adaptive String Similarity Measure for Matching Product Offers.,Andreas Thor,Abstract: Product matching aims at identifying different product offers referring to the samereal-world product. Product offers are provided by different merchants and describe productsusing textual attributes such as offer title and description. String similarity measurestherefore play an important role for matching corresponding product offers. In this paper; wepropose an adaptive string similarity measure that automatically adjusts the relevance ofterms for the product matching. This adaptation is done step-by-step during the matchprocess and does not require training data. We demonstrate that this approach improves thematch quality in comparison to the generic TFIDF string similarity measure.,GI Jahrestagung (1),2010,9
Automatische mapping-verarbeitung auf webdaten,Andreas Thor,Innerhalb einer Website können Korrespondenzen zB als Webseitenempfehlungen;sogenannte Recommendations; verwendet werden. Ausgehend von den vielen in derLiteratur vorgeschlagenen Algorithmen zur Berechnung von Recommendations;sogenannte Recommender; stellt sich das Problem; welcher Recommender für welchenNutzer unter welchen Umständen am nützlichsten ist. Durch eine gezielte und optimierteAuswahl sollen dabei die besten Recommendations bestimmt werden. Mit AWESOME [4; 5]wird dazu ein Ansatz vorgestellt; der eine solche adaptive Bestimmung vonRecommendations zulässt. Durch die Aufzeichnung und Auswertung von Nutzer-Feedbackkönnen die Empfehlungen den Nutzerinteressen angepasst werden; so dass eineSteigerung der Recommendation-Qualität ermöglicht wird. Innerhalb der Arbeit werden …,*,2008,9
Mashup-Werkzeuge zur Ad-hoc-Datenintegration im Web.,David Aumüller; Andreas Thor,Mashup-Werkzeuge ermöglichen eine einfache Erstellung von Mashups; dh vonWebapplikationen; die Informationen aus verschiedenen Quellen kombinieren und inintegrierter Form wieder selbst als Datenquelle oder Dienst anbieten. Dieser Artikel gibteinen Überblick über den aktuellen Stand der Technik von Mashups und einschlägigenWerkzeugen und geht dabei speziell auf die Möglichkeiten zur Datenintegration ein.Eingangs werden Mashups und typische Anwendungsszenarien vorgestellt um sodann diewesentlichen funktionalen Komponenten einer Mashup-Anwendung zu charakterisieren.Dabei wird der Einsatz von Mashups zur Datenintegration betrachtet und mit bestehendenklassischen Datenintegrationsansätzen verglichen. Anschließend wird eine Reihe vonMashup-Werkzeugen vorgestellt und kategorisiert; wobei Tools zur Modellierung von …,Datenbank-Spektrum,2008,8
Which early works are cited most frequently in climate change research literature? A bibliometric approach based on Reference Publication Year Spectroscopy,Werner Marx; Robin Haunschild; Andreas Thor; Lutz Bornmann,Abstract This bibliometric analysis focuses on the general history of climate change researchand; more specifically; on the discovery of the greenhouse effect. First; the ReferencePublication Year Spectroscopy (RPYS) is applied to a large publication set on climatechange of 222;060 papers published between 1980 and 2014. The references cited thereinwere extracted and analyzed with regard to publications; which are cited most frequently.Second; a new method for establishing a more subject-specific publication set for applyingRPYS (based on the co-citations of a marker reference) is proposed (RPYS-CO). The RPYSof the climate change literature focuses on the history of climate change research in total.We identified 35 highly-cited publications across all disciplines; which include fundamentalearly scientific works of the nineteenth century (with a weak connection to climate change …,Scientometrics,2017,7
Wetsuit: an efficient mashup tool for searching and fusing web entities,Stefan Endrullis; Andreas Thor; Erhard Rahm,Abstract We demonstrate a new powerful mashup tool called WETSUIT (Web EnTity Searchand fUsIon Tool) to search and integrate web data from diverse sources and domain-specificentity search engines. WETSUIT supports adaptive search strategies to query sets ofrelevant entities with a minimum of communication overhead. Mashups can be composedusing a set of high-level operators based on the Java-compatible language Scala. Theoperator implementation supports a high degree of parallel processing; in particular astreaming of entities between all data transformation operations facilitating a fastpresentation of intermediate results. WETSUIT has already been applied to solvechallenging integration tasks from different domains.,Proceedings of the VLDB Endowment,2012,7
PAnG: finding patterns in annotation graphs,Philip Anderson; Andreas Thor; Joseph Benik; Louiqa Raschid; Maria Esther Vidal,Abstract Annotation graph datasets are a natural representation of scientific knowledge.They are common in the life sciences and health sciences; where concepts such as genes;proteins or clinical trials are annotated with controlled vocabulary terms from ontologies. Wepresent a tool; PAnG (Patterns in Annotation Graphs); that is based on a complementarymethodology of graph summarization and dense subgraphs. The elements of a graphsummary correspond to a pattern and its visualization can provide an explanation of theunderlying knowledge. Scientists can use PAnG to develop hypotheses and for exploration.,Proceedings of the 2012 ACM SIGMOD International Conference on Management of Data,2012,7
New features of CitedReferencesExplorer (CRExplorer),Andreas Thor; Werner Marx; Loet Leydesdorff; Lutz Bornmann,Abstract Recently; we introduced the CitedReferencesExplorer (CRExplorer at http://www.crexplorer. net). The program was primarily developed to identify those publications in afield; a topic or by a researcher which have been frequently cited. This Letter to the Editordescribes the features of the new release of the CRExplorer.,Scientometrics,2016,6
Cloudfuice: A flexible cloud-based data integration system,Andreas Thor; Erhard Rahm,Abstract The advent of cloud computing technologies shows great promise for webengineering and facilitates the development of flexible; distributed; and scalable webapplications. Data integration can notably benefit from cloud computing because integratingweb data is usually an expensive task. This paper introduces CloudFuice; a data integrationsystem that follows a mashup-like specification of advanced dataflows for data integration.CloudFuice's task-based execution approach allows for an efficient; asynchronous; andparallel execution of dataflows in the cloud and utilizes recent cloud-based web engineeringinstruments. We demonstrate and evaluate CloudFuice's applicability for mashup-baseddata integration in the cloud with the help of a first prototype implementation.,International Conference on Web Engineering,2011,6
Parallel Sorted Neighborhood Blocking with MapReduce,Lars Kolb; Andreas Thor; Erhard Rahm,Abstract: Cloud infrastructures enable the efficient parallel execution of data-intensive taskssuch as entity resolution on large datasets. We investigate challenges and possiblesolutions of using the MapReduce programming model for parallel entity resolution. Inparticular; we propose and evaluate two MapReduce-based implementations for SortedNeighborhood blocking that either use multiple MapReduce jobs or apply a tailored datareplication. Subjects: Distributed; Parallel; and Cluster Computing (cs. DC) Cite as: arXiv:1010.3053 [cs. DC](or arXiv: 1010.3053 v1 [cs. DC] for this version) Submission historyFrom: Lars Kolb [view email][v1] Fri; 15 Oct 2010 00: 28: 44 GMT (268kb; D),arXiv preprint arXiv:1010.3053,2010,6
Referenced Publication Year Spectroscopy (RPYS) and Algorithmic Historiography: The Bibliometric Reconstruction of Andr\'as Schubert's {\OE} uvre,Loet Leydesdorff; Lutz Bornmann; Jordan Comins; Werner Marx; Andreas Thor,Abstract: Referenced Publication Year Spectroscopy (RPYS) was recently introduced as amethod to analyze the historical roots of research fields and groups or institutions. RPYSmaps the distribution of the publication years of the cited references in a document set. Inthis study; we apply this methodology to the {\oe} uvre of an individual researcher on theoccasion of a Festschrift for Andr\'as Schubert's 70th birthday. We discuss the differentoptions of RPYS in relation to one another (eg Multi-RPYS); and in relation to the longer-term research program of algorithmic historiography (eg; HistCite) based on Schubert'spublications (n= 172) and cited references therein as a bibliographic domain inscientometrics. Main path analysis and Multi-RPYS of the citation network are used to showthe changes and continuities in Schubert's intellectual career. Diachronic and static …,arXiv preprint arXiv:1604.04705,2016,3
Determining similarity of scientific entities in annotation datasets,Guillermo Palma; Maria-Esther Vidal; Eric Haag; Louiqa Raschid; Andreas Thor,Abstract Linked Open Data initiatives have made available a diversity of scientific collectionswhere scientists have annotated entities in the datasets with controlled vocabulary termsfrom ontologies. Annotations encode scientific knowledge; which is captured in annotationdatasets. Determining relatedness between annotated entities becomes a building block forpattern mining; eg identifying drug–drug relationships may depend on the similarity of thetargets that interact with each drug. A diversity of similarity measures has been proposed inthe literature to compute relatedness between a pair of entities. Each measure exploits someknowledge including the name; function; relationships with other entities; taxonomicneighborhood and semantic knowledge. We propose a novel general-purpose annotationsimilarity measure called 'AnnSim'that measures the relatedness between two entities …,Database,2015,2
Exploiting Semantics from Ontologies and Shared Annotations to Find Patterns in Annotated Linked Open Data.,Guillermo Palma; Maria-Esther Vidal; Louiqa Raschid; Andreas Thor,Abstract. Linked Open Data initiatives have made available a diversity of collections thatdomain experts have annotated with controlled vocabulary terms from ontologies. Thechallenge is to explore these rich and complex annotated datasets; together with the domainsemantics captured within ontologies; to discover patterns of annotations across multipleconcepts that may lead to potential discoveries. We identify an annotation signaturebetween a pair of concepts based on shared annotations and ontological relatedness.Formally; an annotation signature is a partitioning of the edges that represent therelationships between shared annotations. A clustering algorithm named AnnSigClusteringis proposed to generate annotation signatures. Evaluation results over drug and genedatasets demonstrate the effectiveness of using annotation signatures to find patterns.,LISC@ ISWC,2013,2
How do Ontology Mappings Change in the Life Sciences?,Anika Gross; Michael Hartung; Andreas Thor; Erhard Rahm,Abstract: Mappings between related ontologies are increasingly used to support dataintegration and analysis tasks. Changes in the ontologies also require the adaptation ofontology mappings. So far the evolution of ontology mappings has received little attentionalbeit ontologies change continuously especially in the life sciences. We therefore analyzehow mappings between popular life science ontologies evolve for different matchalgorithms. We also evaluate which semantic ontology changes primarily affect themappings. We further investigate alternatives to predict or estimate the degree of futuremapping changes based on previous ontology and mapping transitions.,arXiv preprint arXiv:1204.2731,2012,2
Identifying seminal works most important for research fields: Software for the Reference Publication Year Spectroscopy (RPYS),Lutz Bornmann; Andreas Thor; Werner Marx; Loet Leydesdorff,Reference Publication Year Spectroscopy (RPYS) was proposed by Marx; Bornmann; Barth;and Leydesdorff (2014;[18]) to identify seminal publications in a research field which aremost important in a historical context. We refined our RPYS toolbox by adding some featuresto the existing programs and we developed two new routines. First; a direct comparison ofthe results of different RPYSs is now possible; because the software transforms the results ofthe RPYS into percentiles for standardization. Second; we added routines that facilitate theuser with retrieving the most-cited publications in specific years indicated by peaks in thespectrograms. Cited references can be aggregated across misspellings and variants. Forthis paper; two examples from the humanities and natural sciences are provided todemonstrate the functionalities and results of the programs. A more technical description …,Collnet Journal of Scientometrics and Information Management,2016,1
Exploiting Semantics from Ontologies and Shared Annotations to Partition Linked Data,Guillermo Palma; Maria-Esther Vidal; Louiqa Raschid; Andreas Thor,Abstract Linked Open Data initiatives have made available a diversity of collections thatdomain experts have annotated with controlled vocabulary terms from ontologies. Weidentify annotation signatures of linked data that associate semantically similar concepts;where similarity is measured in terms of shared annotations and ontological relatedness.Formally; an annotation signature is a partition or clustering of the links that represent therelationships between shared annotations. A clustering algorithm named AnnSigClusteringis proposed to generate annotation signatures. Evaluation results over drug and diseasedatasets demonstrate the effectiveness of using annotation signatures to identify patternsamong entities in the same cluster of a signature.,International Conference on Data Integration in the Life Sciences,2014,1
Cloud-Technologien in der Hochschullehre–Pflicht oder Kür?,Stefanie Scherzinger; Andreas Thor,Zusammenfassung Ein eigenes Themenheft zum Datenmanagement in der Cloud dient unsals Anlass; die Präsenz von Cloud-Themen in der akademischen Datenbanklehre zuerfassen. In diesem Artikel geben wir die Ergebnisse einer Umfrage innerhalb derFachgruppe Datenbanksysteme durch den Arbeitskreis Datenmanagement in der Cloudwieder. Dozentinnen und Dozenten von über zwanzig Hochschulen nahmen an derUmfrage teil. Es zeigt sich deutlich; dass sich das Thema „Cloud “in der Hochschullehrezunehmend etabliert; jedoch überwiegend als ergänzendes Angebot; und seltener in dergrundständigen Lehre verankert. Wir fassen die Ergebnisse unserer Umfrage zusammenund wagen Deutungsversuche.,Datenbank-Spektrum,2014,1
Exploration using signatures in annotation graph datasets,Louiqa Raschid; Guillermo Palma; Maria-Esther Vidal; Andreas Thor,Abstract The widespread development and adoption of ontologies to capture semanticdomain knowledge and the growth of annotation graph datasets has created manyopportunities for large scale Linked Data analytics. Ontologies are developed by domainexperts to capture knowledge specific to some domain. The biomedical community hastaken the lead in these activities. Every model organism database has genes and proteinsthat are widely annotated; eg; with controlled vocabulary (CV) terms from the Gene Ontology(GO). The NCI Thesaurus (NCIt) version 12.05 d has 93;788 terms and the LinkedCT datasetof clinical trial results circa September 2011 includes 142;207 drugs or interventions;167;012 conditions or diseases; and 166;890 links to DBPedia; DrugBank and Diseasome.At the opposite end of the domain spectrum; the Financial Industry Business Ontology …,*,2013,1
Data-warehouse-basierte architektur für adaptive online-recommendations,Andreas Thor; Erhard Rahm,Kurzfassung Aufgezeichnetes Nutzungsverhalten von Websites stellt Wissen bereit; wieNutzer innerhalb der Website navigieren. Mittels effizientem Wissensmanagement könnendie Nutzer bei der Navigation zB durch den Einsatz von Online-Recommendation-Systemenunterstützt werden. Die vorgestellte Arbeit zeigt eine Architektur; wie ein solchesRecommendation-System flexibel und adaptiv gestaltet werden kann.,Content-und Wissensmanagement,2003,1
Identifying single influential publications in a research field: New analysis opportunities of the CRExplorer,Andreas Thor; Lutz Bornmann; Werner Marx; Rüdiger Mutz,Abstract: Reference Publication Year Spectroscopy (RPYS) has been developed foridentifying the cited references (CRs) with the greatest influence in a given paper set (mostlysets of papers on certain topics or fields). The program CRExplorer (see www. crexplorer.net) was specifically developed by Thor; Marx; Leydesdorff; and Bornmann (2016a; 2016b)for applying RPYS to publication sets downloaded from Scopus or Web of Science. In thisstudy; we present some advanced methods which have been newly developed forCRExplorer. These methods are able to identify and characterize the CRs which have beeninfluential across a longer period (many citing years). The new methods are demonstrated inthis study using all the papers published in Scientometrics between 1978 and 2016. Theindicators N_TOP50; N_TOP25; and N_TOP10 can be used to identify those CRswhich …,arXiv preprint arXiv:1801.08720,2018,*
Datenbanksysteme II SS 2017–Übungsblatt 3,Erhard Rahm; M Junghanns; V Christen,Page 1. Universität Leipzig; Institut für Informatik Abteilung Datenbanken Prof. Dr. E. Rahm;V. Christen; M. Franke Ausgabe: Besprechungen: 12.06.2017 19.06.2017 21.06.201726.06.2017 28.06.2017 Datenbanksysteme II SS 2017 – Übungsblatt 5 1. Aufgabe(SQL:2003: Tabellendefinitionen; Anfragen) Für eine Universitätsanwendung seien uafolgende SQL:2003-Typen definiert: CREATE TYPE PersonT (Name VARCHAR (40); FakREF (FakultaetT)); CREATE TYPE StudentT UNDER PersonT (MatNr INT; HauptfachVARCHAR (40); Nebenfach VARCHAR (40); Bachelor BOOLEAN); CREATE TYPE ProfTUNDER PersonT (Buero BueroT; Besoldung CHAR(2); DRTitel VARCHAR(20);ForschGebiete VARCHAR(20) ARRAY[5]); CREATE TYPE BueroT (GebaeudeVARCHAR(40); Stockwerk INTEGER; Nummer INTEGER; Telefon INTEGER); …,*,2017,*
Datenbanksysteme für Business; Technologie und Web (BTW 2017); 17. Fachtagung des GI-Fachbereichs" Datenbanken und Informationssysteme"(DBIS); 6.-10. M...,Bernhard Mitschang; Norbert Ritter; Holger Schwarz; Meike Klettke; Andreas Thor; Oliver Kopp; Matthias Wieland,Mitschang; Bernhard and Ritter; Norbert and Schwarz; Holger and Klettke; Meike and Thor; Andreasand Kopp; Oliver and Wieland; Matthias (2017) Datenbanksysteme für Business; Technologieund Web (BTW 2017); 17. Fachtagung des GI-Fachbereichs "Datenbanken undInformationssysteme" (DBIS); 6.-10. März 2017; Stuttgart; Germany; Workshopband. LNI; P-266. GI … Full text not available from this repository … Official URL: https://www.gi.de/service/publikationen/lni/gi-edi … Dbis Repository is powered by EPrints 3 which is developed by the School ofElectronics and Computer Science at the University of Southampton. More information and softwarecredits.,*,2017,*
DIAL–Ein BigBlueButton-basiertes System für interaktive Live-Übertragungen von Vorlesungen,Luise Kaufmann; Tobias Welz; Andreas Thor,Dieser Beitrag präsentiert DIAL (Distributed InterActive Lecture); ein BigBlueButtonbasiertesSystem für interaktive Live-Übertragungen von Vorlesungen. DIAL erweitert dasKonferenzsystem BigBlueButton derart; dass Studierenden Zugang zum Chat-undUmfragesystem aus dem Stand-By ihres Endgerätes heraus ermöglicht wird; dh ohne dieNotwendigkeit einer permanenten Verbindung. Damit ermöglicht DIAL Teilnehmern einerLive-Übertragung die einfache und direkte Interaktion analog zum virtuellen Klassenzimmer.Der Beitrag beschreibt die Architektur und die prototypische Implementation von DIAL undpräsentiert Evaluationsergebnisse aus der praktischen Anwendung an der Hochschule fürTelekommunikation Leipzig.,Bildungsräume 2017,2017,*
Further steps in integrating the platforms of WoS and Scopus: Historiography with HistCite™ and main-path analysis,Loet Leydesdorff; Andreas Thor; Lutz Bornmann,The program HistCite™ enables an analyst to identify significant works on a given topicusing the citation links between them diachronically. However; using Scopus data fordrawing historiograms with HistCite™ has hitherto been a problem. In the new version of theprogram CRExplorer; one can translate citation data from Scopus to WoS formats (or viceversa) and then import the data into HistCite™. In this brief communication; we demonstratethese options using the papers of Eugene Garfield (1925-2017) in Scopus for main-pathanalysis. The two historiograms are considerably different: unlike the WoS set; thenetworked connections between the time lines are sparse in the representation of theScopus data; the secondary documents (eg; editorials in Current Contents) not processed inScopus; but included in WoS enrich the representation. Furthermore; HistCite™ has an …,El profesional de la información (EPI),2017,*
