Evaluation of entity resolution approaches on real-world match problems,Hanna Köpcke; Andreas Thor; Erhard Rahm,Abstract Despite the huge amount of recent research efforts on entity resolution (matching)there has not yet been a comparative evaluation on the relative effectiveness and efficiencyof alternate approaches. We therefore present such an evaluation of existingimplementations on challenging real-world match tasks. We consider approaches both withand without using machine learning to find suitable parameterization and combination ofsimilarity functions. In addition to approaches from the research community we also considera state-of-the-art commercial entity resolution implementation. Our results indicate significantquality and efficiency differences between different approaches. We also find that somechallenging resolution tasks such as matching product entities from online shops are notsufficiently solved with conventional approaches based on the similarity of attribute …,Proceedings of the VLDB Endowment,2010,226
Load balancing for mapreduce-based entity resolution,Lars Kolb; Andreas Thor; Erhard Rahm,The effectiveness and scalability of MapReduce-based implementations of complex data-intensive tasks depend on an even redistribution of data between map and reduce tasks. Inthe presence of skewed data; sophisticated redistribution approaches thus becomenecessary to achieve load balancing among all reduce tasks to be executed in parallel. Forthe complex problem of entity resolution; we propose and evaluate two approaches for suchskew handling and load balancing. The approaches support blocking techniques to reducethe search space of entity resolution; utilize a preprocessing MapReduce job to analyze thedata distribution; and distribute the entities of large blocks among multiple reduce tasks. Theevaluation on a real cloud infrastructure shows the value and effectiveness of the proposedload balancing approaches.,Data Engineering (ICDE); 2012 IEEE 28th International Conference on,2012,145
Dedoop: efficient deduplication with Hadoop,Lars Kolb; Andreas Thor; Erhard Rahm,Abstract We demonstrate a powerful and easy-to-use tool called Dedoop (< u> De</u>duplication with Ha< u> doop</u>) for MapReduce-based entity resolution (ER) of largedatasets. Dedoop supports a browser-based specification of complex ER workflowsincluding blocking and matching steps as well as the optional use of machine learning forthe automatic generation of match classifiers. Specified workflows are automaticallytranslated into MapReduce jobs for parallel execution on different Hadoop clusters. Toachieve high performance Dedoop supports several advanced load balancing strategies.,Proceedings of the VLDB Endowment,2012,111
Diving behaviour of whale sharks in relation to a predictable food pulse,Rachel T Graham; Callum M Roberts; James CR Smart,We present diving data for four whale sharks in relation to a predictable food pulse (reef fishspawn) and an analysis of the longest continuous fine-resolution diving record for aplanktivorous shark. Fine-resolution pressure data from a recovered pop-up archival satellitetag deployed for 206 days on a whale shark were analysed using the fast Fourier Transformmethod for frequency domain analysis of time-series. The results demonstrated that a free-ranging whale shark displays ultradian; diel and circa-lunar rhythmicity of diving behaviour.Whale sharks dive to over 979.5 m and can tolerate a temperature range of 26.4° C. Thewhale sharks made primarily diurnal deep dives and remained in relatively shallow watersat night. Whale shark diving patterns are influenced by a seasonally predictable food source;with shallower dives made during fish spawning periods.,Journal of the Royal Society Interface,2006,108
Multi-pass sorted neighborhood blocking with MapReduce,Lars Kolb; Andreas Thor; Erhard Rahm,Abstract Cloud infrastructures enable the efficient parallel execution of data-intensive taskssuch as entity resolution on large datasets. We investigate challenges and possiblesolutions of using the MapReduce programming model for parallel entity resolution usingSorting Neighborhood blocking (SN). We propose and evaluate two efficient MapReduce-based implementations for single-and multi-pass SN that either use multiple MapReducejobs or apply a tailored data replication. We also propose an automatic data partitioningapproach for multi-pass SN to achieve load balancing. Our evaluation based on real-worlddatasets shows the high efficiency and effectiveness of the proposed approaches.,Computer Science-Research and Development,2012,105
Citation analysis of database publications,Erhard Rahm; Andreas Thor,Abstract We analyze citation frequencies for two main database conferences (SIGMOD;VLDB) and three database journals (TODS; VLDB Journal; Sigmod Record) over 10 years.The citation data is obtained by integrating and cleaning data from DBLP and GoogleScholar. Our analysis considers different comparative metrics per publication venue; inparticular the total and average number of citations as well as the impact factor which has sofar only been considered for journals. We also determine the most cited papers; authors;author institutions and their countries.,ACM Sigmod Record,2005,99
Convergent validity of bibliometric Google Scholar data in the field of chemistry—Citation counts for papers that were accepted by Angewandte Chemie International...,Lutz Bornmann; Werner Marx; Hermann Schier; Erhard Rahm; Andreas Thor; Hans-Dieter Daniel,Abstract Examining a comprehensive set of papers (n= 1837) that were accepted forpublication by the journal Angewandte Chemie International Edition (one of the primechemistry journals in the world) or rejected by the journal but then published elsewhere; thisstudy tested the extent to which the use of the freely available database Google Scholar(GS) can be expected to yield valid citation counts in the field of chemistry. Analyses ofcitations for the set of papers returned by three fee-based databases–Science CitationIndex; Scopus; and Chemical Abstracts–were compared to the analysis of citations foundusing GS data. Whereas the analyses using citations returned by the three fee-baseddatabases show very similar results; the results of the analysis using GS citation datadiffered greatly from the findings using citations from the fee-based databases. Our study …,Journal of informetrics,2009,93
MOMA-A Mapping-based Object Matching System.,Andreas Thor; Erhard Rahm,Object matching or object consolidation is a crucial task for data integration and datacleaning. It addresses the problem of identifying object instances in data sources referring tothe same real world entity. We propose a flexible framework called MOMA for mapping-based object matching. It allows the construction of match workflows combining the results ofseveral matcher algorithms on both attribute values and contextual information. The outputof a match task is an instance-level mapping that supports information fusion in P2P dataintegration systems and can be re-used for other match tasks. MOMA utilizes furthersemantic mappings of different cardinalities and provides merge and compose operators formapping combination. We propose and evaluate several strategies for both object matchingbetween different sources as well as for duplicate identification within a single data …,CIDR,2007,74
Instance-based matching of large life science ontologies,Toralf Kirsten; Andreas Thor; Erhard Rahm,Abstract Ontologies are heavily used in life sciences so that there is increasing value tomatch different ontologies in order to determine related conceptual categories. We proposea simple yet powerful methodology for instance-based ontology matching which utilizes theassociations between molecular-biological objects and ontologies. The approach can buildon many existing ontology associations for instance objects like sequences and proteinsand thus makes heavy use of available domain knowledge. Furthermore; the approach isflexible and extensible since each instance source with associations to the ontologies ofinterest can contribute to the ontology mapping. We study several approaches to determinethe instance-based similarity of ontology categories. We perform an extensive experimentalevaluation to use protein associations for different species to match between …,International Conference on Data Integration in the Life Sciences,2007,55
Data integration support for mashups,Andreas Thor David Aumueller Erhard Rahm; D Thor; E Aumueller,*,Workshops at the Twenty-Second AAAI Conference on Artificial Intelligence,2007,45
Link prediction for annotation graphs using graph summarization,Andreas Thor; Philip Anderson; Louiqa Raschid; Saket Navlakha; Barna Saha; Samir Khuller; Xiao-Ning Zhang,Abstract Annotation graph datasets are a natural representation of scientific knowledge.They are common in the life sciences where genes or proteins are annotated with controlledvocabulary terms (CV terms) from ontologies. The W3C Linking Open Data (LOD) initiativeand semantic Web technologies are playing a leading role in making such datasets widelyavailable. Scientists can mine these datasets to discover patterns of annotation. Whileontology alignment and integration across datasets has been explored in the context of thesemantic Web; there is no current approach to mine such patterns in annotation graphdatasets. In this paper; we propose a novel approach for link prediction; it is a preliminarytask when discovering more complex patterns. Our prediction is based on a complementarymethodology of graph summarization (GS) and dense subgraphs (DSG). GS can exploit …,International Semantic Web Conference,2011,44
Tailoring entity resolution for matching product offers,Hanna Köpcke; Andreas Thor; Stefan Thomas; Erhard Rahm,Abstract Product matching is a challenging variation of entity resolution to identifyrepresentations and offers referring to the same product. Product matching is highly difficultdue to the broad spectrum of products; many similar but different products; frequentlymissing or wrong values; and the textual nature of product titles and descriptions. Wepropose the use of tailored approaches for product matching based on a preprocessing ofproduct offers to extract and clean new attributes usable for matching. In particular; wepropose a new approach to extract and use so-called product codes to identify products anddistinguish them from similar product variations. We evaluate the effectiveness of theproposed approaches with challenging real-life datasets with product offers from onlineshops. We also show that the UPC information in product offers is often error-prone and …,Proceedings of the 15th International Conference on Extending Database Technology,2012,35
Instance-based matching of hierarchical ontologies.,Andreas Thor; Toralf Kirsten; Erhard Rahm,Abstract: We study an instance-based approach for matching hierarchical ontologies; suchas product catalogs. The motivation for utilizing instances is that metadata-based matchapproaches often suffer from semantic heterogeneity; eg ambiguous concept names;different concept granularities or incomparable categorizations. Our instance-based matchapproach matches categories based on the instances (eg products) assigned to them. Thisway we partly translate the ontology match problem into an instance match problem which isoften easier to solve; especially when instances carry globally unique object ids. Sinceconcepts of different ontologies rarely match 1: 1 we propose to determine correspondencesbetween sets of concepts. We experimentally evaluate the match approaches for realproduct catalogs.,BTW,2007,34
Learning-based approaches for matching web data entities,Hanna Kopcke; Andreas Thor; Erhard Rahm,Entity matching is a key task for data integration and especially challenging for Web data.Effective entity matching typically requires combining several match techniques and findingsuitable configuration parameters; such as similarity thresholds. The authors investigate towhat degree machine learning helps semi-automatically determine suitable match strategieswith a limited amount of manual training effort. They use a new framework; Fever; toevaluate several learning-based approaches for matching different sets of Web data entities.In particular; they study different approaches for training-data selection and how muchtraining is needed to find effective combined match strategies and configurations.,IEEE Internet Computing,2010,29
iFuice-Information Fusion utilizing Instance Correspondences and Peer Mappings.,Erhard Rahm; Andreas Thor; David Aumueller; Hong Hai Do; Nick Golovin; Toralf Kirsten,ABSTRACT We present a new approach to information fusion of web data sources. It isbased on peer-to-peer mappings between sources and utilizes correspondences betweentheir instances. Such correspondences are already available between many sources; eg inthe form of web links; and help combine the information about specific objects and support ahigh quality data fusion. Sources and mappings relate to a domain model to support asemantically focused information fusion. The iFuice architecture incorporates a mappingmediator offering both an interactive and a script-driven; workflow-like access to the sourcesand their mappings. The script programmer can use powerful generic operators to executeand manipulate mappings and their results. The paper motivates the new approach andoutlines the architecture and its main components; in particular the domain model; source …,WebDB,2005,29
Comparative evaluation of entity resolution approaches with fever,Hanna Köpcke; Andreas Thor; Erhard Rahm,Abstract We present FEVER; a new evaluation platform for entity resolution approaches. Themodular structure of the FEVER framework supports the incorporation or reconstruction ofmany previously proposed approaches for entity resolution. A distinctive feature of FEVER isthat it not only evaluates traditional measures such as precision and recall but also the effortfor configuring (eg; parameter tuning; training) a good entity resolution approach. FEVERthus strives for a fair comparative evaluation of different approaches by considering both theeffectiveness and configuration effort.,Proceedings of the VLDB Endowment,2009,28
The calculation of the single publication h index and related performance measures: A web application based on Google Scholar data,Andreas Thor; Lutz Bornmann,Purpose–The single publication h index has been introduced by Schubert as the h indexcalculated from the list of citing publications of one single publication. This paper aims tolook at the calculation of the single publication h index and related performance measures.Design/methodology/approach–In this paper a web application is presented where thesingle publication h index and related performance measures (the single publication mindex; h 2 lower; h 2 centre; and h 2 upper) can be automatically calculated for anypublication indexed by Google Scholar. Findings–The use of the application isdemonstrated by means of the citation performance of two publications. Originality/value–Tothe authors' knowledge this web application is the first instrument to automatically calculatethe single publication h index and related performance measures based on Google …,Online Information Review,2011,26
Introducing CitedReferencesExplorer (CRExplorer): A program for reference publication year spectroscopy with cited references standardization,Andreas Thor; Werner Marx; Loet Leydesdorff; Lutz Bornmann,Abstract We introduce a new tool–the CitedReferencesExplorer (CRExplorer; www.crexplorer. net)–which can be used to disambiguate and analyze the cited references (CRs)of a publication set downloaded from the Web of Science (WoS). The tool is especiallysuitable to identify those publications which have been frequently cited by the researchers ina field and thereby to study for example the historical roots of a research field or topic.CRExplorer simplifies the identification of key publications by enabling the user to work withboth a graph for identifying most frequently cited reference publication years (RPYs) and thelist of references for the RPYs which have been most frequently cited. A further focus of theprogram is on the standardization of CRs. It is a serious problem in bibliometrics that thereare several variants of the same CR in the WoS. In this study; CRExplorer is used to study …,Journal of Informetrics,2016,25
Don't match twice: redundancy-free similarity computation with MapReduce,Lars Kolb; Andreas Thor; Erhard Rahm,Abstract To improve the effectiveness of pair-wise similarity computation; state-of-the-artapproaches assign objects to multiple overlapping clusters. This introduces redundant paircomparisons when similar objects share more than one cluster. We propose an approachthat eliminates such redundant comparisons and that can be easily integrated into existingMapReduce implementations. We evaluate the approach on a real cloud infrastructure andshow its effectiveness for all degrees of redundancy.,Proceedings of the Second Workshop on Data Analytics in the Cloud,2013,25
AWESOME: a data warehouse-based system for adaptive website recommendations,Andreas Thor; Erhard Rahm,Abstract Recommendations are crucial for the success of large websites. While there aremany ways to determine recommendations; the relative quality of these recommendersdepends on many factors and is largely unknown. We propose a new classification ofrecommenders and comparatively evaluate their relative quality for a sample web-site. Theevaluation is performed with AWESOME (Adaptive website recommendations); a new datawarehouse-based recommendation system capturing and evaluating user feedback onpresented recommendations. Moreover; we show how AWESOME performs an automaticand adaptive closed-loop website optimization by dynamically selecting the most promisingrecommenders based on continuously measured recommendation feedback. We proposeand evaluate several alternatives for dynamic recommender selection including a …,Proceedings of the Thirtieth international conference on Very large data bases-Volume 30,2004,24
How do computed ontology mappings evolve?-A case study for life science ontologies,Anika Gross; Michael Hartung; Andreas Thor; Erhard Rahm,Abstract. Mappings between related ontologies are increasingly used to support dataintegration and analysis tasks. Changes in the ontologies also require the adaptation ofontology mappings. So far the evolution of ontology mappings has received little attentionalbeit ontologies change continuously especially in the life sciences. We therefore analyzehow mappings between popular life science ontologies evolve for different matchalgorithms. We also evaluate which semantic ontology changes primarily affect themappings. Our results can be valuable for users working with ontology mappings; eg; onecan learn from past ontology/mapping changes and their correlation to estimate possiblemapping changes if new ontology versions become available.,Joint Workshop on Knowledge Evolution and Ontology Dynamics,2012,22
Dynamic Fusion of Web Data: Beyond Mashups,Erhard Rahm; Andreas Thor; David Aumüller,Page 1. Dynamic Fusion of Web Data: Beyond Mashups Erhard Rahm Andreas Thor; DavidAumüller http://dbs.uni-leipzig.de 24th September; 2007 Top VLDB '97 Pubs: Google Scholar'sTop-5 Page 2. Google Scholar's Top-5 (2) ... more GS quality problems Duplicates due to •Extraction errors (title; authors) • Different titles • Typos (author name) • Heterogeneous venuenames • Missing / additional authors (!) Heterogeneous venue names • How to query for "VLDB'97"? Page 3. Top VLDB'97 Pubs: MS Libra's Result ... similar problems Jennifer Widom receivedher Bachelors degree in 1982 and her Computer Science Ph.D. in 1987. searching for a specificpublication P (get full text) searching for all publications of an author A searching for allpublications of a venue V ☺ Page 4. Top VLDB '97 Publications: Desired Result Top VLDB '97Publications: Desired Result (2) Page 5. Agenda • Motivation …,Proc. of XSym07,2007,21
The application of bibliometrics to research evaluation in the humanities and social sciences: An exploratory study using normalized Google Scholar data for the pub...,Lutz Bornmann; Andreas Thor; Werner Marx; Hermann Schier,Abstract In the humanities and social sciences; bibliometric methods for the assessment ofresearch performance are (so far) less common. This study uses a concrete example in anattempt to evaluate a research institute from the area of social sciences and humanities withthe help of data from Google Scholar (GS). In order to use GS for a bibliometric study; wedeveloped procedures for the normalization of citation impact; building on the procedures ofclassical bibliometrics. In order to test the convergent validity of the normalized citationimpact scores; we calculated normalized scores for a subset of the publications based ondata from the Web of Science (WoS) and Scopus. Even if scores calculated with the help ofGS and the WoS/Scopus are not identical for the different publication types (consideredhere); they are so similar that they result in the same assessment of the institute …,Journal of the Association for Information Science and Technology,2016,20
Finding cross genome patterns in annotation graphs,Joseph Benik; Caren Chang; Louiqa Raschid; Maria-Esther Vidal; Guillermo Palma; Andreas Thor,Abstract Annotation graph datasets are a natural representation of scientific knowledge.They are common in the life sciences where concepts such as genes and proteins areannotated with controlled vocabulary terms from ontologies. Scientists are interested inanalyzing or mining these annotations; in synergy with the literature; to discover patterns.Further; annotated datasets provide an avenue for scientists to explore shared annotationsacross genomes to support cross genome discovery. We present a tool; PAnG (P atterns inAn notation G raphs); that is based on a complementary methodology of graphsummarization and dense subgraphs. The elements of a graph summary correspond to apattern and its visualization can provide an explanation of the underlying knowledge. Wepresent and analyze two distance metrics to identify related concepts in ontologies. We …,International Conference on Data Integration in the Life Sciences,2012,18
Block-based load balancing for entity resolution with MapReduce,Lars Kolb; Andreas Thor; Erhard Rahm,Abstract The effectiveness and scalability of MapReduce-based implementations of complexdata-intensive tasks depend on an even redistribution of data between map and reducetasks. In the presence of skewed data; sophisticated redistribution approaches thus becomenecessary to achieve load balancing among all reduce tasks to be executed in parallel. Forthe complex problem of entity resolution with blocking; we propose BlockSplit; a loadbalancing approach that supports blocking techniques to reduce the search space of entityresolution. The evaluation on a real cloud infrastructure shows the value and effectivenessof the proposed approach.,Proceedings of the 20th ACM international conference on Information and knowledge management,2011,18
From black box to white box at open access journals: predictive validity of manuscript reviewing and editorial decisions at Atmospheric Chemistry and Physics,Lutz Bornmann; Werner Marx; Hermann Schier; Andreas Thor; Hans-Dieter Daniel,Abstract More than 4;500 open access (OA) journals have now become established inscience. But doubts exist about the quality of the manuscript selection process forpublication in these journals. In this study we investigate the quality of the selection processof an OA journal; taking as an example the journal Atmospheric Chemistry and Physics(ACP). ACP is working with a new system of public peer review. We examine the predictivevalidity of the ACP peer review system; namely; whether the process selects the best of themanuscripts submitted. We have data for 1;111 manuscripts that went through the completeACP selection process in the years 2001 to 2006. The predictive validity was investigated onthe basis of citation counts for the later published manuscripts. The results of the citationanalysis confirm the predictive validity of the reviewers' ratings and the editorial decisions …,Research Evaluation,2010,18
Measuring relatedness between scientific entities in annotation datasets,Guillermo Palma; Maria-Esther Vidal; Eric Haag; Louiqa Raschid; Andreas Thor,Abstract Linked Open Data has made available a diversity of scientific collections wherescientists have annotated entities in the datasets with controlled vocabulary terms (CVterms) from ontologies. These semantic annotations encode scientific knowledge which iscaptured in annotation datasets. One can mine these datasets to discover relationships andpatterns between entities. Determining the relatedness (or similarity) between entitiesbecomes a building block for graph pattern mining; eg; identifying drug-drug relationshipscould depend on the similarity of the diseases (conditions) that are associated with eachdrug. Diverse similarity metrics have been proposed in the literature; eg; i) string-similaritymetrics; ii) path-similarity metrics; iii) topological-similarity metrics; all measure relatednessin a given taxonomy or ontology. In this paper; we consider a novel annotation similarity …,Proceedings of the International Conference on Bioinformatics; Computational Biology and Biomedical Informatics,2013,17
