Data Integration: A New Teenage,CA Curino; G Orsi; L Tanca,The Present: 2000-2008 • Mediated Schema - DIS [2] • Reverse Engineering • Semantic Annotationand publishing • P2P - Data Exchange [1] • Full P2P • Publish & Subscribe • Data Rings andData Spaces [3; 4] … Limitations • Data sources known in advance • Static; hand-mademappings … DATA SOURCE 1 (RDBMS) DATA SOURCE 2 (XML) DATA SOURCE 3(WWW) … Challenges • Internet of Things • Autonomic data-sources • Data and Users Mobility• Embedded systems Databases • Uncertainty and Lineage Management • Multimodality • Ambientand body intelligence • Information noise … Problems • Past problems are not completelysolved. • Missing or expensive infrastructures. • Sound and complete data integration in openworld is unpractical. • 85% of interesting data is unstructured … Context-ADDICT (joint workwith C. Bolchini; E. Quintarelli and FA Schreiber) … Features • Context-aware …,*,2008,*
Progettazione dei Dati con l'Uso del Contesto,Giorgio Orsi,Abstract Gli utenti dei sistemi informativi e di Internet si trovano oggi ad affrontare lanecessita'di contenere il “rumore informativo” in modo da non essere subissati e confusi dauna grande quantita'di dati; spesso poco legati al contesto di fruizione. L'attivita'di adattare idati alle necessita'delle applicazioni può essere assimilata al problema di confezionare unvestito su misura: da qui il nome Data Tailoring. In questo articolo si mostra come le “forbici”usate per questa operazione possano essere rappresentate dal contesto; inteso come uninsieme di variabili che caratterizzano l'ambiente specifico nel quale l'applicazione si trovaad operare.,Mondo Digitale,2008,*
Emergent semantics and cooperation in multi-knowledge environments: the ESTEEM architecture,Carola Aiello; R Baldoni; D Bianchini; C Bolchini; S Bonomi; S Castano; T Catarci; CA Curino; V De Antonellis; A Ferrara; M Melchiori; D Milano; S Montanelli; G Orsi; A Poggi; L Querzoni; E Quintarelli; R Rossato; D Salvi; M Scannapieco; FA Schreiber; L Tanca; S Tucci Pergiovanni,In the present global society; information has to be exchangeable in open and dynamicenvironments; where interacting peers do not necessarily share a common understanding ofthe world at hand; and do not have a complete picture of the context where the interactionoccurs. In this paper; we present the Esteem approach and the related peer architecture foremergent semantics in dynamic and multi-knowledge environments. In Esteem; semanticcommunities are built around declared interests in the form of manifesto ontologies; andtheir autonomous nature is preserved by allowing a shared semantics to naturally emergefrom peer interactions. Copyright 2007 VLDB Endowment.,International Workshop on Semantic Data and Service Integration,2007,*
X− SOM Results for OAEI 2007,Giorgio Orsi,Abstract This paper summarizes the results of the X-SOM tool in the OAEI 2007 campaign. X-SOM is an extensible ontology mapper that combines various matching algorithms bymeans of a feed-forward neural network. X-SOM exploits logical reasoning and localheuristics to improve the quality of mappings while guaranteeing their consistency.,*,2007,*
Context− aware views for mobile users,Giorgio Orsi,Abstract Independent; heterogeneous; distributed; sometimes transient and mobile datasources produce an enormous amount of information that should be semantically integratedand ﬁltered; or; as we say; tailored; based on the users' interests and context. We propose toexploit knowledge about the user; the adopted device; and the environment-altogethercalled context-to the end of information tailoring. This paper presents the Context DimensionTree; a context model which is the basis for solving the information tailoring problem; alongwith its role in the framework of the Context-ADDICT architecture.,*,2007,*
X− SOM: Ontology Mapping and Inconsistency Resolution,Giorgio Orsi,Abstract Data integration is an old but still open issue in the database research area; whereSemantic Web technologies; such as ontologies; may be of great help. Aim of the Context-ADDICT project is to provide support for the integration and context-aware reshaping of datacoming from heterogeneous data sources. Within this framework; we use ontologyextraction; alignment and tailoring to ﬁnd and solve conﬂicts due to data sourceheterogeneity. In this paper we present X-SOM: an ontology mapping tool developed withinthe Context-ADDICT project. The contribution of this high precision mapping tool istwofold:(i) a modular and extensible architecture that automatically combines severalmatching techniques by means of a neural network; and (ii) a subsystem for the (semi)-automatic resolution of semantic inconsistencies. Besides describing the tool components …,*,2007,*
Improving Search and Navigation by Combining Ontologies and Social Tags,Carlo A Curino; Davide Eynard; Giorgio Orsi,Abstract. The Semantic Web has the ambitious goal of enabling complex autonomousapplications to reason on a machine-processable version of the World Wide Web. This;however; would require a coordinated effort not easily achievable in practice. On the otherhand; spontaneous communities; based on social tagging; recently achieved noticeableconsensus and diffusion. The goal of the TagOnto system is to bridge between these tworealities by automatically mapping (social) tags to more structured domain ontologies; thus;providing assistive; navigational features typical of the Semantic Web. These novelsearching and navigational capabilities are complementary to more traditional searchengine functionalities. The system; and its intuitive AJAX interface; are released anddemonstrated on-line.,*,*,*
Semantic Data Markets: Store; Reason and Query,Roberto De Virgilio; Giorgio Orsi; Letizia Tanca; Riccardo Torlone,Abstract—This paper presents NYAYA; a flexible system for the management of Semantic-Web data which couples an efficient storage mechanism with advanced and up-to-dateontology reasoning capabilities. NYAYA is capable of processing large Semantic-Webdatasets; expressed in a variety of formalisms; by transforming them into a collection ofSemantic Data Kiosks that expose the native meta-data in a uniform fashion using Datalog±;a very general rule-based language. The kiosks form a Semantic Data Market where thedata in each kiosk can be uniformly accessed using conjunctive queries and where userscan specify user-defined constraints over the data.,*,*,*
