Ontological queries: Rewriting and optimization,Georg Gottlob; Giorgio Orsi; Andreas Pieris,Ontological queries are evaluated against an enterprise ontology rather than directly on adatabase. The evaluation and optimization of such queries is an intriguing new problem fordatabase research. In this paper we discuss two important aspects of this problem: queryrewriting and query optimization. Query rewriting consists of the compilation of anontological query into an equivalent query against the underlying relational database. Thefocus here is on soundness and completeness. We review previous results and present anew rewriting algorithm for rather general types of ontological constraints (descriptionlogics). In particular; we show how a conjunctive query (CQ) against an enterprise ontologycan be compiled into a union of conjunctive queries (UCQ) against the underlying database.Ontological query optimization; in this context; attempts to improve this process so to …,Data Engineering (ICDE); 2011 IEEE 27th International Conference on,2011,146
And what can context do for data?,Cristiana Bolchini; CA Curino; Giorgio Orsi; Elisa Quintarelli; Rosalba Rossato; Fabio A Schreiber; Letizia Tanca,a Enterprise Resource Planning. november 2009| vol. 52| no. 11| communications of theacm 137 contributed articles posed methodological approach. In the context design phase;all the possible scenarios (contexts) of the considered application are identified; then; thedesigner must determine context-aware views; as the portions of the entire dataset whichare relevant for each particular actor in each particular context. We propose the definition ofa context-guided methodology to support the designer in identifying; for a given applicationscenario; the contexts and the correspondingly interesting subsets of data. Our methodologyis composed of three basic elements: a context model; capturing all the aspects–the so-called dimensions–that allows the implicit representation of the possible applicationcontexts; a strategy for identifying; for each dimension; independently of the others; a …,Communications of the ACM,2009,67
The relational model is dead; SQL is dead; and I don't feel so good myself,Paolo Atzeni; Christian S Jensen; Giorgio Orsi; Sudha Ram; Letizia Tanca; Riccardo Torlone,Abstract We report the opinions expressed by well-known database researchers on thefuture of the relational model and SQL during a panel at the International Workshop on Non-Conventional Data Access (NoCoDa 2012); held in Florence; Italy in October 2012 inconjunction with the 31st International Conference on Conceptual Modeling. The panelistsinclude: Paolo Atzeni (Università Roma Tre; Italy); Umeshwar Dayal (HP Labs; USA);Christian S. Jensen (Aarhus University; Denmark); and Sudha Ram (University of Arizona;USA). Quotations from movies are used as a playful though effective way to convey thedramatic changes that database technology and research are currently undergoing.,ACM SIGMOD Record,2013,57
Query rewriting and optimization for ontological databases,Georg Gottlob; Giorgio Orsi; Andreas Pieris,Abstract Ontological queries are evaluated against a knowledge base consisting of anextensional database and an ontology (ie; a set of logical assertions and constraints thatderive new intensional knowledge from the extensional database); rather than directly onthe extensional database. The evaluation and optimization of such queries is an intriguingnew problem for database research. In this article; we discuss two important aspects of thisproblem: query rewriting and query optimization. Query rewriting consists of the compilationof an ontological query into an equivalent first-order query against the underlyingextensional database. We present a novel query rewriting algorithm for rather general typesof ontological constraints that is well suited for practical implementations. In particular; weshow how a conjunctive query against a knowledge base; expressed using linear and …,ACM Transactions on Database Systems (TODS),2014,54
DIADEM: domain-centric; intelligent; automated data extraction methodology,Tim Furche; Georg Gottlob; Giovanni Grasso; Omer Gunes; Xiaoanan Guo; Andrey Kravchenko; Giorgio Orsi; Christian Schallhart; Andrew Sellers; Cheng Wang,Abstract Search engines are the sinews of the web. These sinews have become strained;however: Where the web's function once was a mix of library and yellow pages; it hasbecome the central marketplace for information of almost any kind. We search more andmore for objects with specific characteristics; a car with a certain mileage; an affordableapartment close to a good school; or the latest accessory for our phones. Search engines alltoo often fail to provide reasonable answers; making us sift through dozens of websites withthousands of offers--never to be sure a better offer isn't just around the corner. What searchengines are missing is understanding of the objects and their attributes published onwebsites. Automatically identifying and extracting these objects is akin to alchemy:transforming unstructured web information into highly structured data with near perfect …,Proceedings of the 21st International Conference on World Wide Web,2012,43
Context Modeling and Context Awareness: steps forward in the Context− ADDICT project,Cristiana Bolchini; Giorgio Orsi; Elisa Quintarelli; Fabio A Schreiber; Letizia Tanca,Abstract: We give an account of the researches on context-aware information tailoring whichare going on within the PEDiGREE group at Politecnico di Milano; starting from afoundational framework for the lifecycle of context-aware information systems; in which thesystem design and management activities consider context as an orthogonal; ﬁrst-classcitizen. The design-time and run-time activities involved in this life-cycle provide material forstimulating research; summarized in this paper.,IEEE Data Engineering Bulletin,2011,37
Context modelling and context-aware querying,Giorgio Orsi; Letizia Tanca,Abstract Many interpretations of the notion of context have emerged in various fields andcontext-aware systems are pervading everyday life; becoming an expanding research field.Context has often a significant impact on the way humans (or machines) act; and on howthey interpret things; furthermore; a change in context causes a transformation in theexperience that is going to be lived. Accordingly; while the computer science community hasinitially perceived the context simply as a matter of user time and location; in the last fewyears this notion has been considered not simply as a state; but as part of a process in whichusers are involved; thus; sophisticated and general context models and systems have beenproposed to support context-aware applications. In this paper we propose a foundationalframework for the life-cycle of context-aware system; in which the system design and …,*,2011,35
Context modelling and context-aware querying,Giorgio Orsi; Letizia Tanca,Abstract Many interpretations of the notion of context have emerged in various fields andcontext-aware systems are pervading everyday life; becoming an expanding research field.Context has often a significant impact on the way humans (or machines) act; and on howthey interpret things; furthermore; a change in context causes a transformation in theexperience that is going to be lived. Accordingly; while the computer science community hasinitially perceived the context simply as a matter of user time and location; in the last fewyears this notion has been considered not simply as a state; but as part of a process in whichusers are involved; thus; sophisticated and general context models and systems have beenproposed to support context-aware applications. In this paper we propose a foundationalframework for the life-cycle of context-aware system; in which the system design and …,*,2011,35
DIADEM: thousands of websites to a single database,Tim Furche; Georg Gottlob; Giovanni Grasso; Xiaonan Guo; Giorgio Orsi; Christian Schallhart; Cheng Wang,Abstract The web is overflowing with implicitly structured data; spread over hundreds ofthousands of sites; hidden deep behind search forms; or siloed in marketplaces; onlyaccessible as HTML. Automatic extraction of structured data at the scale of thousands ofwebsites has long proven elusive; despite its central role in the" web of data". Through anextensive evaluation spanning over 10000 web sites from multiple application domains; weshow that automatic; yet accurate full-site extraction is no longer a distant dream. diadem isthe first automatic full-site extraction system that is able to extract structured data fromdifferent domains at very high accuracy. It combines automated exploration of websites;identification of relevant data; and induction of exhaustive wrappers. Automating thesecomponents is the first challenge. diadem overcomes this challenge by combining …,Proceedings of the VLDB Endowment,2014,33
Optimizing query answering under ontological constraints,Giorgio Orsi; Andreas Pieris,Abstract: Ontological queries are evaluated against a database combined with ontologicalconstraints. Answering such queries is a challenging new problem for database research.For many ontological modelling languages; query answering can be solved via queryrewriting: given a conjunctive query and an ontology; the query can be transformed into aﬁrst-order query; called the perfect rewriting; that takes into account the semanticconsequences of the ontology. Then; for every extensional database D; the answer to thequery is obtained by evaluating the rewritten query against D. In this paper we present anew algorithm that computes the perfect rewriting of a conjunctive query wrt a linearDatalog+/-ontology. Also; we provide an experimental comparison of our algorithm withexisting rewriting techniques.,Proceedings of the VLDB Endowment (PVLDB),2011,31
X-som: A flexible ontology mapper,Carlo Curino; Giorgio Orsi; Letizia Tanca,System interoperability is a well known issue; especially for heterogeneous informationsystems; where ontology-based representations may support automatic and user-transparent integration. In this paper we present X-SOM: an ontology mapping andintegration tool. The contribution of our tool is a modular and extensible architecture thatautomatically combines several matching techniques by means of a neural network;performing also ontology debugging to avoid inconsistencies. Besides describing the toolcomponents; we discuss the prototype implementation; which has been tested against theOAEI 2006 benchmark with promising results.,Database and Expert Systems Applications; 2007. DEXA'07. 18th International Workshop on,2007,29
Opal: automated form understanding for the deep web,Tim Furche; Georg Gottlob; Giovanni Grasso; Xiaonan Guo; Giorgio Orsi; Christian Schallhart,Abstract Forms are our gates to the web. They enable us to access the deep content of websites. Automatic form understanding unlocks this content for applications ranging fromcrawlers to meta-search engines and is essential for improving usability and accessibility ofthe web. Form understanding has received surprisingly little attention other than ascomponent in specific applications such as crawlers. No comprehensive approach to formunderstanding exists and previous works disagree even in the definition of the problem. Inthis paper; we present OPAL; the first comprehensive approach to form understanding. Weidentify form labeling and form interpretation as the two main tasks involved in formunderstanding. On both problems OPAL pushes the state of the art: For form labeling; itcombines signals from the text; structure; and visual rendering of a web page; yielding …,Proceedings of the 21st international conference on World Wide Web,2012,25
Improving search and navigation by combining ontologies and social tags,Silvia Bindelli; Claudio Criscione; Carlo A Curino; Mauro L Drago; Davide Eynard; Giorgio Orsi,Abstract The Semantic Web has the ambitious goal of enabling complex autonomousapplications to reason on a machine-processable version of the World Wide Web. This;however; would require a coordinated effort not easily achievable in practice. On the otherhand; spontaneous communities; based on social tagging; recently achieved noticeableconsensus and diffusion. The goal of the TagOnto system is to bridge between these tworealities by automatically mapping (social) tags to more structured domain ontologies; thus;providing assistive; navigational features typical of the Semantic Web. These novelsearching and navigational capabilities are complementary to more traditional searchengine functionalities. The system; and its intuitive AJAX interface; are released anddemonstrated on-line.,OTM Confederated International Conferences" On the Move to Meaningful Internet Systems",2008,25
Icdar 2013 table competition,Max Göbel; Tamir Hassan; Ermelinda Oro; Giorgio Orsi,Table understanding is a well studied problem in document analysis; and many academicand commercial approaches have been developed to recognize tables in several documentformats; including plain text; scanned page images and born-digital; object-based formatssuch as PDF. Despite the abundance of these techniques; an objective comparison of theirperformance is still missing. The Table Competition held in the context of ICDAR 2013 is ourfirst attempt at objectively evaluating these techniques against each other in a standardizedway; across several input formats. The competition independently addresses threeproblems:(i) table location;(ii) table structure recognition; and (iii) these two tasks combined.We received results from seven academic systems; which we have also compared againstfour commercial products. This paper presents our findings.,Document Analysis and Recognition (ICDAR); 2013 12th International Conference on,2013,20
NYAYA: A system supporting the uniform management of large sets of semantic data,Roberto De Virgilio; Giorgio Orsi; Letizia Tanca; Riccardo Torlone,We present NYAYA; a flexible system for the management of large-scale semantic datawhich couples a general-purpose storage mechanism with efficient ontological queryanswering. NYAYA rapidly imports semantic data expressed in different formalisms intosemantic data kiosks. Each kiosk exposes the native ontological constraints in a uniformfashion using data log±; a very general rule-based language for the representation ofontological constraints. A group of kiosks forms a semantic data market where the data ineach kiosk can be uniformly accessed using conjunctive queries and where users canspecify user-defined constraints over the data. NYAYA is easily extensible and robust toupdates of both data and meta-data in the kiosk and can readily adapt to different logicalorganizations of the persistent storage. In the demonstration; we will show the capabilities …,Data Engineering (ICDE); 2012 IEEE 28th International Conference on,2012,20
Accessing and documenting relational databases through OWL ontologies,Carlo Curino; Giorgio Orsi; Emanuele Panigati; Letizia Tanca,Abstract Relational databases have been designed to store high volumes of data and toprovide an efficient query interface. Ontologies are geared towards capturing domainknowledge; annotations; and to offer high-level; machine-processable views of data andmetadata. The complementary strengths and weaknesses of these data models motivate theresearch effort we present in this paper. The goal of this work is to bridge the relational andontological worlds; in order to leverage the efficiency and scalability of relationaltechnologies and the high level view of data and metadata proper of ontologies. The systemwe designed and developed achieves:(i) automatic ontology extraction from relational datasources and (ii) automatic query translation from SPARQL to SQL. Among the others; wefocus on two main applications of this novel technology:(i) ontological publishing of …,International Conference on Flexible Query Answering Systems,2009,20
Heuristic ranking in tightly coupled probabilistic description logics,Thomas Lukasiewicz; Maria Vanina Martinez; Giorgio Orsi; Gerardo I Simari,Abstract: The Semantic Web effort has steadily been gaining traction in the recent years. Inparticular; Web search companies are recently realizing that their products need to evolvetowards having richer semantic search capabilities. Description logics (DLs) have beenadopted as the formal underpinnings for Semantic Web languages used in describingontologies. Reasoning under uncertainty has recently taken a leading role in this arena;given the nature of data found on theWeb. In this paper; we present a probabilistic extensionof the DL EL++(which underlies the OWL2 EL profile) using Markov logic networks (MLNs)as probabilistic semantics. This extension is tightly coupled; meaning that probabilisticannotations in formulas can refer to objects in the ontology. We show that; even though thetightly coupled nature of our language means that many basic operations are data …,arXiv preprint arXiv:1210.4894,2012,18
A methodology for evaluating algorithms for table understanding in PDF documents,Max Göbel; Tamir Hassan; Ermelinda Oro; Giorgio Orsi,Abstract This paper presents a methodology for the evaluation of table understandingalgorithms for PDF documents. The evaluation takes into account three major tasks: tabledetection; table structure recognition and functional analysis. We provide a general andflexible output model for each task along with corresponding evaluation metrics andmethods. We also present a methodology for collecting and ground-truthing PDF documentsbased on consensus-reaching principles and provide a publicly available ground-trutheddataset.,Proceedings of the 2012 ACM symposium on Document engineering,2012,18
Semantic data markets: a flexible environment for knowledge management,Roberto De Virgilio; Giorgio Orsi; Letizia Tanca; Riccardo Torlone,Abstract We present Nyaya; a system for the management of Semantic-Web data whichcouples a general-purpose and extensible storage mechanism with efficient ontologyreasoning and querying capabilities. Nyaya processes large Semantic-Web datasets;expressed in multiple formalisms; by transforming them into a collection of Semantic DataKiosks. Nyaya uniformly exposes the native meta-data of each kiosk using the datalog+-language; a powerful rule-based modelling language for ontological databases. The kiosksform a Semantic Data Market where the data in each kiosk can be uniformly accessed usingconjunctive queries and where users can specify user-defined constraints over the data.Nyaya is easily extensible and robust to updates of both data and meta-data in the kiosk andcan readily adapt to different logical organization of the persistent storage. The approach …,Proceedings of the 20th ACM international conference on Information and knowledge management,2011,18
Ontological query answering via rewriting,Georg Gottlob; Giorgio Orsi; Andreas Pieris,Abstract Ontological databases extend traditional databases with ontological constraints.This technology is crucial for many applications such as semantic data publishing andintegration as well as model-driven database design. For many classes of ontologicalconstraints; query answering can be solved via query rewriting. In particular; given aconjunctive query and a set of ontological constraints; the query is compiled into a first-orderquery; called the perfect rewriting; that encodes the intensional knowledge implied by theconstraints. Then; for every database D; the answer is obtained by directly evaluating theperfect rewriting over D. Since first-order queries can be easily translated into SQL;ontological query answering can be delegated to traditional DBMSs. This allows us to utilizeall the query optimization techniques available in the underlying DBMS. This paper …,East European Conference on Advances in Databases and Information Systems,2011,18
Little knowledge rules the web: Domain-centric result page extraction,Tim Furche; Georg Gottlob; Giovanni Grasso; Giorgio Orsi; Christian Schallhart; Cheng Wang,Abstract Web extraction is the task of turning unstructured HTML into structured data.Previous approaches rely exclusively on detecting repeated structures in result pages.These approaches trade intensive user interaction for precision. In this paper; we introducethe Amber (“Adaptable Model-based Extraction of Result Pages”) system that replaces thehuman interaction with a domain ontology applicable to all sites of a domain. It modelsdomain knowledge about (1) records and attributes of the domain;(2) low-level (textual)representations of these concepts; and (3) constraints linking representations to records andattributes. Parametrized with these constraints; otherwise domain-independent heuristicsexploit the repeated structure of result pages to derive attributes and records. Amber isimplemented in logical rules to allow an explicit formulation of the heuristics and easy …,International Conference on Web Reasoning and Rule Systems,2011,18
Real understanding of real estate forms,Tim Furche; Georg Gottlob; Giovanni Grasso; Xiaonan Guo; Giorgio Orsi; Christian Schallhart,Abstract Finding an apartment is a lengthy and tedious process. Once decided; one cannever be sure not to have missed an even better offer which would have been just one clickaway. Form understanding is key to automatically access and process all the relevant---andnowadays readily available---data. We introduce opal (ontology-based web pattern analysiswith logic); a novel; purely logical approach to web form understanding: opal labels;structures; and groups form fields according to a domain-specific ontology linked throughphenomenological rules to a logical representation of a DOM. The phenomenological rulesdescribe how ontological concepts appear on the web; the ontology formalizes andstructures common patterns of web pages observed in a domain. A unique feature of opal isthat all domain-independent assumptions about web forms are represented in rules …,Proceedings of the International Conference on Web Intelligence; Mining and Semantics,2011,18
X− SOM Results for OAEI 2007,Carlo Curino; Giorgio Orsi; Letizia Tanca,Abstract: This paper summarizes the results of the X-SOM tool in the OAEI 2007 campaign. X-SOM is an extensible ontology mapper that combines various matching algorithms bymeans of a feed-forward neural network. X-SOM exploits logical reasoning and localheuristics to improve the quality of mappings while guaranteeing their consistency.,Proc. of the 2nd Intl Workshop on Ontology Matching (OAEI− ISWC/ASWC Workshops),2007,16
Aggregating semantic annotators,Luying Chen; Stefano Ortona; Giorgio Orsi; Michael Benedikt,Abstract A growing number of resources are available for enriching documents withsemantic annotations. While originally focused on a few standard classes of annotations; theecosystem of annotators is now becoming increasingly diverse. Although annotators oftenhave very different vocabularies; with both high-level and specialist concepts; they also havemany semantic interconnections. We will show that both the overlap and the diversity inannotator vocabularies motivate the need for semantic annotation integration: middlewarethat produces a unified annotation on top of diverse semantic annotators. On the one hand;the diversity of vocabulary allows applications to benefit from the much richer vocabularyavailable in an integrated vocabulary. On the other hand; we present evidence that the mostwidely-used annotators on the web suffer from serious accuracy deficiencies: the overlap …,Proceedings of the VLDB Endowment,2013,15
Problems and opportunities in context-based personalization,Letizia Tanca; Cristiana Bolchini; Elisa Quintarelli; Fabio A Schreiber; Giorgio Orsi,ABSTRACT In a world of global networking; the increasing amount of heterogeneousinformation; available through a variety of channels; has made it difficult for users to find theinformation they need in the current situation; at the right level of detail. This is true not onlywhen accessing information from mobile devices; characterized by limited–althoughgrowing–resources and by high connection costs; but also when using powerful systems;since the amount of “out-of-context” answers to a given user request may be overwhelming.The knowledge of the context in which the data are going to be used can support theprocess of focussing on currently useful; personalized information. The activity needed forcontextaware information personalization provides material for stimulating research; brieflyillustrated in this paper.,Proceedings of the VLDB Endowment,2011,15
CADD: a tool for context modeling and data tailoring,Cristiana Bolchini; CA Curino; Giorgio Orsi; Elisa Quintarelli; Fabio A Schreiber; Letizia Tanca,Nowadays user mobility requires that both content and services be appropriatelypersonalized; in order for the (mobile) user to be always-and anywhere-equipped with theadequate share of data. Thus; the knowledge about the user; the adopted device and theenvironment; altogether called context; has to be taken into account in order to minimize theamount of information imported on mobile devices. The Context-ADDICT (Context-AwareData Design; Integration; Customization and Tailoring) project aims at the definition of acomplete framework which; starting from a methodology for the early design phases;supports mobile users through the dynamic hooking and integration of new; availableinformation sources; so that an appropriate context-based portion of data; called data chunk;is delivered to their mobile devices. Data tailoring is needed because of two main …,Mobile Data Management; 2007 International Conference on,2007,15
