The ontological key: automatically understanding and integrating forms to access the deep Web,Tim Furche; Georg Gottlob; Giovanni Grasso; Xiaonan Guo; Giorgio Orsi; Christian Schallhart,Abstract Forms are our gates to the Web. They enable us to access the deep content of Websites. Automatic form understanding provides applications; ranging from crawlers over meta-search engines to service integrators; with a key to this content. Yet; it has received littleattention other than as component in specific applications such as crawlers or meta-searchengines. No comprehensive approach to form understanding exists; let alone one thatproduces rich models for semantic services or integration with linked open data. In thispaper; we present opal; the first comprehensive approach to form understanding andintegration. We identify form labeling and form interpretation as the two main tasks involvedin form understanding. On both problems; opal advances the state of the art: For formlabeling; it combines features from the text; structure; and visual rendering of a Web page …,The VLDB Journal,2013,14
Datalog and its extensions for semantic web databases,Georg Gottlob; Giorgio Orsi; Andreas Pieris; Mantas Šimkus,Abstract Since the early 70s; data management played a central role in organizations andrepresented a challenging area of research. A number of languages have been proposed tomodel; query; and manipulate data; as well as for expressing very general classes ofintegrity constraints; inference procedures; and ontological knowledge. Such languages arenowadays crucial for many applications such as semantic data publishing and integration;decision support; and knowledge management. In this tutorial we first introduce Datalog; apowerful rule-based language originally intended for expressing complex queries overrelational data; and that today is at the basis of languages for the specification ofoptimization and constraint satisfaction problems as well as of ontological constraints in dataand knowledge bases. We then discuss the limitations of Datalog for the semantic web; in …,Reasoning Web International Summer School,2012,14
Querying UML class diagrams,Andrea Calì; Georg Gottlob; Giorgio Orsi; Andreas Pieris,Abstract UML Class Diagrams (UCDs) are the best known class-based formalism forconceptual modeling. They are used by software engineers to model the intensionalstructure of a system in terms of classes; attributes and operations; and to expressconstraints that must hold for every instance of the system. Reasoning over UCDs is ofparamount importance in design; validation; maintenance and system analysis; however; formedium and large software projects; reasoning over UCDs may be impractical. Queryanswering; in particular; can be used to verify whether a (possibly incomplete) instance ofthe system modeled by the UCD; ie; a snapshot; enjoys a certain property. In this work; westudy the problem of querying UCD instances; and we relate it to query answering underguarded Datalog±; that is; a powerful Datalog-based language for ontological modeling …,International Conference on Foundations of Software Science and Computational Structures,2012,12
Ontological queries: Rewriting and optimization (extended version),Georg Gottlob; Giorgio Orsi; Andreas Pieris,Abstract: Ontological queries are evaluated against an ontology rather than directly on adatabase. The evaluation and optimization of such queries is an intriguing new problem fordatabase research. In this paper we discuss two important aspects of this problem: queryrewriting and query optimization. Query rewriting consists of the compilation of anontological query into an equivalent query against the underlying relational database. Thefocus here is on soundness and completeness. We review previous results and present anew rewriting algorithm for rather general types of ontological constraints.,arXiv preprint arXiv:1112.0343,2011,12
Data Wrangling for Big Data: Challenges and Opportunities.,Tim Furche; Georg Gottlob; Leonid Libkin; Giorgio Orsi; Norman W Paton,ABSTRACT Data wrangling is the process by which the data required by an application isidentified; extracted; cleaned and integrated; to yield a data set that is suitable forexploration and analysis. Although there are widely used Extract; Transform and Load (ETL)techniques and platforms; they often require manual work from technical and domainexperts at different stages of the process. When confronted with the 4 V's of big data(volume; velocity; variety and veracity); manual intervention may make ETL prohibitivelyexpensive. This paper argues that providing cost-effective; highly-automated approaches todata wrangling involves significant research challenges; requiring fundamental changes toestablished areas such as data extraction; integration and cleaning; and to the ways inwhich these areas are brought together. Specifically; the paper discusses the importance …,EDBT,2016,11
Automatically learning gazetteers from the deep web,Tim Furche; Giovanni Grasso; Giorgio Orsi; Christian Schallhart; Cheng Wang,Abstract Wrapper induction faces a dilemma: To reach web scale; it requires automaticallygenerated examples; but to produce accurate results; these examples must have the qualityof human annotations. We resolve this conflict with AMBER; a system for fully automateddata extraction from result pages. In contrast to previous approaches; AMBER employsdomain specific gazetteers to discern basic domain attributes on a page; and leveragesrepeated occurrences of similar attributes to group related attributes into records rather thanrelying on the noisy structure of the DOM. With this approach AMBER is able to identifyrecords and their attributes with almost perfect accuracy (> 98%) on a large sample ofwebsites. To make such an approach feasible at scale; AMBER automatically learns domaingazetteers from a small seed set. In this demonstration; we show how AMBER uses the …,Proceedings of the 21st International Conference on World Wide Web,2012,11
X− SOM: Ontology Mapping and Inconsistency Resolution,Carlo Curino; Giorgio Orsi; Letizia Tanca,Abstract: Data integration is an old but still open issue in the database research area; whereSemantic Web technologies; such as ontologies; may be of great help. Aim of the Context-ADDICT project is to provide support for the integration and context-aware reshaping of datacoming from heterogeneous data sources. Within this framework; we use ontologyextraction; alignment and tailoring to ﬁnd and solve conﬂicts due to data sourceheterogeneity. In this paper we present X-SOM: an ontology mapping tool developed withinthe Context-ADDICT project. The contribution of this high precision mapping tool istwofold:(i) a modular and extensible architecture that automatically combines severalmatching techniques by means of a neural network; and (ii) a subsystem for the (semi)-automatic resolution of semantic inconsistencies. Besides describing the tool components …,Proc. of 4th European Semantic Web Conference (ESWC),2007,11
On the interaction of existential rules and equality constraints in ontology querying,Andrea Calì; Georg Gottlob; Giorgio Orsi; Andreas Pieris,Abstract Ontological query processing is an exciting research topic in database theory;knowledge representation; and logic programming. In many cases; ontological constraintsare expressed over an extensional database by extending traditional Datalog rules to allowexistential quantification and equality atoms in the head. The unrestricted use of thesefeatures causes undecidability of query answering and; therefore; their interaction must becontrolled. This work provides a tutorial-like introduction to the problem of query answeringunder existential and equality constraints. We survey the most notable (semantic andsyntactic) restrictions to such constraints ensuring decidability of query answering; and wediscuss their practical application to conceptual modelling.,*,2012,9
Towards user centric schema mapping platform,Guilian Wang; Rami Rifaieh; Joseph Goguen; Vitaliy Zavesov; Arcot Rajasekar; Mark Miller,Abstract Schema mapping is a fundamental problem in many important databaseapplications. The process of mapping discovery is complex and error prone; it cannot befully automated; so user input is necessary. This paper presents SCIA; a system that assistsusers in creating executable mappings between a source schema and a target schema byautomating simple matches and finding critical points where user input is both necessaryand maximally useful. SCIA finds critical points by using path contexts together with acombination of multiple matching algorithms. SCIA also helps users; when a critical pointoccurs; by asking them specific questions with sufficient context and making suggestions foradding semantic information to data transformation; such as join and grouping conditions.SCIA handles complex mappings involving n-to-m matches with semantic functions and …,International Workshop on Semantic Data and Service Integration; SDSI 2007,2007,9
A new perspective in pervasive advertising,Lorenzo Carrara; Giorgio Orsi,Abstract. In commerce; advertising a potential customer with relevant offers is beneficial forboth the advertiser; who increases the chances of acquiring a new customer; and thecustomer himself; who is stimulated to purchase without being overwhelmed by irrelevantads. To achieve this goal; the advertiser must know the situation; the interests and theactivities of his potential customers; in one word; their context. However; the exposure or thecollection of these personal data has a clear repercussion on their privacy and is oftenconstrained by law. PervADs is a usercentred pervasive advertisement-distribution platformwhich maximizes the relevance of the ads sent to potential customers while preserving theirprivacy. The relevance is determined by semantically matching the profile and the context ofthe customer against those carried by the ads; while privacy is guaranteed by a client …,Technical Report; Department of Computer Science,2011,8
Keyword-based; context-aware selection of natural language query patterns,Giorgio Orsi; Letizia Tanca; Eugenio Zimeo,Abstract Pervasive access to distributed data sources by means of mobile devices isbecoming a frequent realistic operational context in many application domains. In thesescenarios data access may be thwarted by the scarce knowledge that users have of theapplication and of the underlying data schemas and complicated by limited query interfaces;due to the small size of the devices.,Proceedings of the 14th International Conference on Extending Database Technology,2011,8
Context based querying of dynamic and heterogeneous information sources.,Giorgio Orsi,Abstract The proliferation of freely-accessible data-intensive websites; the growingavailability of pervasive and mobile applications; as well as initiatives for open-accessiblelinked data in the Web; provided the users with potential sources of valuable information.These data also represent new business opportunities for industries; while their processingand management is a rich research field for academics. In addition; pervasiveness andmobility make information available everywhere and at any time; therefore; user-centred;dynamic and on-the-fly integration of heterogeneous becomes extremely useful in practicalsituations such as mobile data management; in particular with devices as tablets; pads andsmartphones. We present a methodology and a set of technologies for ontologydriven;context-aware data-integration systems capable of seamlessly handling heterogeneous …,*,2011,8
Emergent Semantics and Cooperation in Multi-Knowledge Environments: the ESTEEM Architecture,C Bolchini; E Quintarelli; R Rossato; F Schreiber; L Tanca,Segnalazioni con codici 20501/20503/20504: Alcuni dati obbligatori per il sito CINECA nonsono presenti o invalidi; oppure il sito CINECA non è riuscito ad individuare una rivista con idati forniti; è necessario controllare la correttezza dell'ISSN e/o EISSN dove applicabili e iltitolo della rivista.Segnalazioni con codici 20201/20202: La pubblicazione non è statatrasferita SOLO per i docenti segnalati nel messaggio a causa di problemi nell'anagraficaCINECA e/o di Ateneo (pe i codici fiscali non sono gli stessi) oppure perché si tratta didocenti che; pur essendo abilitati all'inserimento nel sistema di Ateneo; non hanno facoltà disincronizzare le proprie pubblicazioni in CINECA. Tutti gli altri eventuali coautori senzasegnalazione troveranno la pubblicazione correttamente nel proprio spazio personaleCINECA.,VLDB Int. Workshop on Semantic data and Service Integration (SDSI'07),2007,8
Wadar: joint wrapper and data repair,Stefano Ortona; Giorgio Orsi; Marcello Buoncristiano; Tim Furche,Abstract Web scraping (or wrapping) is a popular means for acquiring data from the web.Recent advancements have made scalable wrapper-generation possible and enabled dataacquisition processes involving thousands of sources. This makes wrapper analysis andmaintenance both needed and challenging as no scalable tools exists that support thesetasks. We demonstrate WADaR; a scalable and highly automated tool for joint wrapper anddata repair. WADaR uses off-the-shelf entity recognisers to locate target entities in wrapper-generated data. Markov chains are used to determine structural repairs; that are thenencoded into suitable repairs for both the data and corresponding wrappers.,Proceedings of the VLDB Endowment,2015,6
Amber: Automatic supervision for multi-attribute extraction,Tim Furche; Georg Gottlob; Giovanni Grasso; Giorgio Orsi; Christian Schallhart; Cheng Wang,Abstract: The extraction of multi-attribute objects from the deep web is the bridge betweenthe unstructured web and structured data. Existing approaches either induce wrappers froma set of human-annotated pages or leverage repeated structures on the page withoutsupervision. What the former lack in automation; the latter lack in accuracy. Thus accurate;automatic multi-attribute object extraction has remained an open challenge. AMBERovercomes both limitations through mutual supervision between the repeated structure andautomatically produced annotations. Previous approaches based on automatic annotationshave suffered from low quality due to the inherent noise in the annotations and haveattempted to compensate by exploring multiple candidate wrappers. In contrast; AMBERcompensates for this noise by integrating repeated structure analysis with annotation …,arXiv preprint arXiv:1210.5984,2012,6
Forms form patterns: reusable form understanding,Tim Furche; Georg Gottlob; Xiaonan Guo; Giorgio Orsi; Christian Schallhart,ABSTRACT Forms are our gates to the web. They enable us to access the deep content ofweb sites. Automatic form understanding unlocks this content for applications ranging fromcrawlers to meta-search engines and is essential for improving usability and accessibility ofthe web. Form understanding has received surprisingly little attention other than ascomponent in specific applications such as crawlers. No comprehensive approach to formunderstanding exists and previous works disagree even in the definition of the problem. Inthis paper; we present OPAL; the first comprehensive approach to form understanding. Weidentify form labeling and form interpretation as the two main tasks involved in formunderstanding. On both problems OPAL pushes the state of the art: For form labeling; itcombines signals from the text; structure; and visual rendering of a web page; yielding …,Proc. WWW,2012,6
Reasoning over Large Semantic Datasets.,Roberto De Virgilio; Giorgio Orsi; Letizia Tanca; Riccardo Torlone,ABSTRACT This paper presents NYAYA; a flexible system for the management of Semantic-Web data which couples an efficient storage mechanism with advanced and up-to-dateontology reasoning capabilities. NYAYA is capable of processing large Semantic-Webdatasets; expressed in a variety of formalisms; by transforming them into a collection ofSemantic Data Kiosks that expose the native meta-data in a uniform fashion using Datalog±;a very general rule-based language. The kiosks form a Semantic Data Market where thedata in each kiosk can be uniformly accessed using conjunctive queries and where userscan specify user-defined constraints over the data. NYAYA is easily extensible and robust toupdates of both data and meta-data in the kiosk. In particular; a new kiosk of the semanticdata market can be easily built from a fresh Semantic-Web source expressed in …,SEBD,2009,6
Semantic pervasive advertising,Lorenzo Carrara; Giorgio Orsi; Letizia Tanca,Abstract Pervasive advertising targets consumers on-the-move with ads displayed on theirmobile devices. As for web advertising; ads are distributed by embedding them into websitesand apps; easily flooding consumers with a large number of uninteresting offers. As thepervasive setting amplifies traditional issues such as targeting; cost; and privacy; we arguethe need for a new perspective on the problem. We introduce PervADs; a privacy-preserving; user-centric; and pervasive ads-distribution platform which uses semantictechnologies to reason about the consumer's context and the intended target of the ads.,International Conference on Web Reasoning and Rule Systems,2013,5
OPAL: a passe-partout for web forms,Xiaonan Guo; Jochen Kranzdorf; Tim Furche; Giovanni Grasso; Giorgio Orsi; Christian Schallhart,Abstract Web forms are the interfaces of the deep web. Though modern web browsersprovide facilities to assist in form filling; this assistance is limited to prior form fillings orkeyword matching. Automatic form understanding enables a broad range of applications;including crawlers; meta-search engines; and usability and accessibility support forenhanced web browsing. In this demonstration; we use a novel form understandingapproach; OPAL; to assist in form filling even for complex; previously unknown forms. OPALassociates form labels to fields by analyzing structural properties in the HTML encoding andvisual features of the page rendering. OPAL interprets this labeling and classifies the fieldsaccording to a given domain ontology. The combination of these two properties; allowsOPAL to deal effectively with many forms outside of the grasp of existing form filling …,Proceedings of the 21st International Conference on World Wide Web,2012,5
Introduction to the TPLP special issue; logic programming in databases: From Datalog to semantic-web rules,Giorgio Orsi; Letizia Tanca,Abstract Much has happened in data and knowledge base research since the introduction ofthe relational model in Codd (1970) and its strong logical foundations influence its advancesever since. Logic has been a common ground where Database and Artificial Intelligenceresearch competed and collaborated with each other for a long time (Abiteboul et al. 1995).The product of this joint effort has been a set of logic-based formalisms; such as theRelational Calculus (Codd 1970); Datalog (Ceri et al. 1990); Description Logics (Baader etal. 2007); etc.; capturing not only the structure but also the semantics of data in an explicitway; thus enabling complex inference procedures.,Theory and Practice of Logic Programming,2010,4
Joint repairs for web wrappers,Stefano Ortona; Giorgio Orsi; Tim Furche; Marcello Buoncristiano,Automated web scraping is a popular means for acquiring data from the web. Scrapers (orwrappers) are derived from either manually or automatically annotated examples; oftenresulting in under/over segmented data; together with missing or spurious content.Automatic repair and maintenance of the extracted data is thus a necessary complement toautomatic wrapper generation. Moreover; the extracted data is often the result of a long-termdata acquisition effort and thus jointly repairing wrappers together with the generated datareduces future needs for data cleaning. We study the problem of computing joint repairs forXPath-based wrappers and their extracted data. We show that the problem is NP-completein general but becomes tractable under a few natural assumptions. Even tractable solutionsto the problem are still impractical on very large datasets; but we propose an optimal …,Data Engineering (ICDE); 2016 IEEE 32nd International Conference on,2016,2
Structured aspect extraction,Omer Gunes; Tim Furche; Giorgio Orsi,Abstract Aspect extraction identifies relevant features of an entity from a textual descriptionand is typically targeted to product reviews; and other types of short text; as an enabling taskfor; eg; opinion mining and information retrieval. Current aspect extraction methods mostlyfocus on aspect terms; often neglecting associated modifiers or embedding them in theaspect terms without proper distinction. Moreover; flat syntactic structures are oftenassumed; resulting in inaccurate extractions of complex aspects. This paper studies theproblem of structured aspect extraction; a variant of traditional aspect extraction aiming at afine-grained extraction of complex (ie; hierarchical) aspects. We propose an unsupervisedand scalable method for structured aspect extraction consisting of statistical noun phraseclustering; cPMI-based noun phrase segmentation; and hierarchical pattern induction …,Proceedings of COLING 2016; the 26th International Conference on Computational Linguistics: Technical Papers,2016,2
Consistency checking of re-engineered UML class diagrams via Datalog+/-,Georg Gottlob; Giorgio Orsi; Andreas Pieris,Abstract UML class diagrams (UCDs) are a widely adopted formalism for modeling theintensional structure of a software system. Although UCDs are typically guiding theimplementation of a system; it is common in practice that developers need to recover theclass diagram from an implemented system. This process is known as reverse engineering.A fundamental property of reverse engineered (or simply re-engineered) UCDs isconsistency; showing that the system is realizable in practice. In this work; we investigate theconsistency of re-engineered UCDs; and we show is pspace-complete. The upper bound isobtained by exploiting algorithmic techniques developed for conjunctive query answeringunder guarded Datalog+/-; that is; a key member of the Datalog+/-family of KR languages;while the lower bound is obtained by simulating the behavior of a polynomial space …,International Symposium on Rules and Rule Markup Languages for the Semantic Web,2015,2
Preserving semantics in automatically created ontology alignments,Giorgio Orsi; Letizia Tanca,Abstract In an open world such as the Internet; one of the most challenging tasks is ontologyalignment; which is the process of finding relationships among their elements. Performingthis work in an automated fashion is; however; subject to errors; because of the differentsemantics carried by the same concept in different application domains or because ofdifferent ontology design styles which often produce incompatible ontology structures. In thischapter; we relate the most important approaches to ontology mapping revision; proposing arevision technique which aims at preserving the semantics of the original ontologies.,*,2010,2
Progettazione dei dati con l’uso del contesto,Cristiana Bolchini; Giorgio Orsi; Elisa Quintarelli; Fabio A Schreiber; Letizia Tanca,Fin dall'inizio degli anni'80; i sistemi infor-mativi di molte organizzazioni si sono estesi edevoluti per rispondere alle esigenze di un mercato che richiede sempre più la presenza diun'impresa allargata comprendente diversi partner. Anche tecnologicamente; sono stateintrodotte funzionalità di Knowledge Managementper permettere una facile condivisionedell'informazione tra i diversi membri dell'organizzazione; l'enorme fonte di informazionicostituita da Internet ha richiesto l'introduzione di strumenti quali XML; ontologie e serviziweb; che devono essere utilizzati e gestiti insieme a quelli di altre fonti di dati piùtradizionali. Questo aumento di disponibilità; se non opportunamente controllato; porta adun sovraccarico di dati riducendo drammaticamente i benefici di un ricco sistemainformativo. Tuttavia; distinguere l'informazione utile dal rumore; cioè da tutta quella non …,Mondo Digitale,2008,2
Table Modelling; Extraction and Processing,Max Göbel; Tamir Hassan; Ermelinda Oro; Giorgio Orsi; Roya Rastan,Abstract This tutorial is targeted at academics and practitioners; both within and outside ofthe Document Engineering community; who are confronted with table processing tasks suchas information extraction and conversion; or have an interest in the topic; and wish todeepen their understanding of the state-of-the-art in this field.,Proceedings of the 2016 ACM Symposium on Document Engineering,2016,1
ROSeAnn: Reconciling opinions of semantic annotators,Luying Chen; Stefano Ortona; Giorgio Orsi; Michael Benedikt,Abstract Named entity extractors can be used to enrich both text and Web documents withsemantic annotations. While originally focused on a few standard entity types; the ecosystemof annotators is becoming increasingly diverse; with recognition capabilities ranging fromgeneric to specialised entity types. Both the overlap and the diversity in annotatorvocabularies motivate the need for managing and integrating semantic annotations:allowing users to see the results of multiple annotations and to merge them into a unifiedsolution. We demonstrate ROSEANN; a system for the management of semanticannotations. ROSEANN provides users with a unified view over the opinion of multipleindependent annotators both on text and Web documents. It allows users to understand andreconcile conflicts between annotations via ontology-aware aggregation. ROSEANN …,Proceedings of the VLDB Endowment,2013,1
