High weight fraction surfactant solubilization of single-wall carbon nanotubes in water,MF Islam; E Rojas; DM Bergey; AT Johnson; AG Yodh,We report a simple process to solubilize high weight fraction single-wall carbon nanotubesin water by the nonspecific physical adsorption of sodium dodecylbenzene sulfonate. Thediameter distribution of nanotubes in the dispersion; measured by atomic force microscopy;showed that even at 20 mg/mL∼ 63±5% of single-wall carbon nanotube bundles exfoliatedinto single tubes. A measure of the length distribution of the nanotubes showed that ourdispersion technique reduced nanotube fragmentation.,Nano letters,2003,1861
Carbon nanotube composites for thermal management,MJ Biercuk; Mark C Llaguno; M Radosavljevic; JK Hyun; Alan T Johnson; John E Fischer,Single-wall carbon nanotubes (SWNTs) were used to augment the thermal transportproperties of industrial epoxy. Samples loaded with 1 wt% unpurified SWNT materialshowed a 70% increase in thermal conductivity at 40 K; rising to 125% at room temperature;the enhancement due to 1 wt% loading of vapor grown carbon fibers was three timessmaller. Electrical conductivity data showed a percolation threshold between 0.1 and 0.2wt% SWNT loading. The Vickers hardness rose monotonically with SWNT loading up to afactor of 3.5 at 2 wt%. These results suggest that the thermal and mechanical properties ofSWNT-epoxy composites are improved; without the need to chemically functionalize thenanotubes.,Applied physics letters,2002,1849
Electrical and thermal transport properties of magnetically aligned single wall carbon nanotube films,J Hone; MC Llaguno; NM Nemes; AT Johnson; JE Fischer; DA Walters; MJ Casavant; J Schmidt; RE Smalley,Dense; thick films of aligned single wall carbon nanotubes and nanotube ropes have beenproduced by filtration/deposition from suspension in strong magnetic fields. Electricalresistivity exhibits moderate anisotropy with respect to the alignment axis; while thethermopower is the same when measured parallel or perpendicular to this axis. Bothparameters have identical temperature dependencies in the two orientations. Thermalconductivity in the parallel direction exceeds 200 W/mK; within a decade of graphite.,Applied physics letters,2000,894
Intrinsic response of graphene vapor sensors,Yaping Dan; Ye Lu; Nicholas J Kybert; Zhengtang Luo; AT Charlie Johnson,Graphene is a two-dimensional material with extremely favorable chemical sensorproperties. Conventional nanolithography typically leaves a resist residue on the graphenesurface; whose impact on the sensor characteristics has not yet been determined. Here weshow that the contamination layer chemically dopes the graphene; enhances carrierscattering; and acts as an absorbent layer that concentrates analyte molecules at thegraphene surface; thereby enhancing the sensor response. We demonstrate a cleaningprocess that verifiably removes the contamination on the device structure and allows theintrinsic chemical responses of the graphene monolayer to be measured. These intrinsicresponses are surprisingly small; even upon exposure to strong analytes such as ammoniavapor.,Nano letters,2009,785
DNA translocation through graphene nanopores,Christopher A Merchant; Ken Healy; Meni Wanunu; Vishva Ray; Neil Peterman; John Bartel; Michael D Fischbein; Kimberly Venta; Zhengtang Luo; AT Charlie Johnson; Marija Drndic,We report on DNA translocations through nanopores created in graphene membranes.Devices consist of 1− 5 nm thick graphene membranes with electron-beam sculptednanopores from 5 to 10 nm in diameter. Due to the thin nature of the graphene membranes;we observe larger blocked currents than for traditional solid-state nanopores. However; ioniccurrent noise levels are several orders of magnitude larger than those for silicon nitridenanopores. These fluctuations are reduced with the atomic-layer deposition of 5 nm oftitanium dioxide over the device. Unlike traditional solid-state nanopore materials that areinsulating; graphene is an excellent electrical conductor. Use of graphene as a membranematerial opens the door to a new class of nanopore devices in which electronic sensing andcontrol are performed directly at the pore.,Nano letters,2010,642
Electrostatically-generated nanofibers of electronic polymers,AG MacDiarmid; WE Jones; ID Norris; J Gao; AT Johnson; NJ Pinto; J Hone; B Han; FK Ko; H Okuzaki; M Llaguno,Abstract Long nanofibers of conducting electronic polymers and their blends and alsoconventional polymers are conveniently fabricated in air by a non-mechanical electrostaticdispersion method. All fibers in a given preparation of certain polymers have diameters<lOOnm. Fibers of 100% doped polyaniline as well as its blends in polymers such aspolystyrene and polyethylene oxide have been prepared. Current/voltage in addition toconductivity/temperature relationships of single fibers as small as 419 nm have beenobtained. Polyacrylonitrile and polystyrene fibers can be easily and uniformly coated fromaqueous solution with conducting polypyrrole or with gold by electroless deposition.Polyacrylonitrile fibers can be thermally converted to conducting carbon nanofibers.,Synthetic Metals,2001,590
Quantized current in a quantum-dot turnstile using oscillating tunnel barriers,LP Kouwenhoven; AT Johnson; NC Van der Vaart; CJPM Harmans; Cf T Foxon,Abstract We have observed a quantized current in a lateral quantum dot; defined by metalgates in the two-dimensional electron gas (2DEG) of a GaAs/AlGaAs heterostructure. Bymodulating the tunnel barriers in the 2DEG with two phase-shifted rf signals; and employingthe Coulomb blockade of electron tunneling; we produced quantized current plateaus in thecurrent-voltage characteristics at integer multiples of ef; where f is the rf frequency. Thisdemonstrates that an integer number of electrons pass through the quantum dot each rfcycle.,Physical Review Letters,1991,563
Quantized phonon spectrum of single-wall carbon nanotubes,J Hone; B Batlogg; Z Benes; AT Johnson; JE Fischer,The electronic spectra of carbon nanotubes and other nanoscale systems are quantizedbecause of their small radii. Similar quantization in the phonon spectra has been difficult toobserve because of the far smaller energy scale. We probed this regime by measuring thetemperature-dependent specific heat of purified single-wall nanotubes. The data show directevidence of one-dimensional quantized phonon subbands. Above 4 kelvin; they are inexcellent agreement with model calculations of individual nanotubes and differ markedlyfrom the specific heat of two-dimensional graphene or three-dimensional graphite. Detailedmodeling yields an energy of 4.3 millielectron volts for the lowest quantized phononsubband and a tube-tube (or “lattice”) Debye energy of 1.1 millielectron volts; implying asmall intertube coupling in bundles.,Science,2000,541
DNA-decorated carbon nanotubes for chemical sensing,Cristian Staii; Alan T Johnson; Michelle Chen; Alan Gelperin,We demonstrate a new; versatile class of nanoscale chemical sensors based on single-stranded DNA (ss-DNA) as the chemical recognition site and single-walled carbon nanotubefield effect transistors (swCN-FETs) as the electronic read-out component. swCN-FETs witha nanoscale coating of ss-DNA respond to gas odors that do not cause a detectableconductivity change in bare devices. Responses of ss-DNA/swCN-FETs differ in sign andmagnitude for different gases and can be tuned by choosing the base sequence of the ss-DNA. ss-DNA/swCN-FET sensors detect a variety of odors; with rapid response andrecovery times on the scale of seconds. The sensor surface is self-regenerating: samplesmaintain a constant response with no need for sensor refreshing through at least 50 gasexposure cycles. This remarkable set of attributes makes sensors based on ss-DNA …,Nano Letters,2005,535
High yield preparation of macroscopic graphene oxide membranes,Zhengtang Luo; Ye Lu; Luke A Somers; AT Charlie Johnson,Graphene oxide membranes up to 2000 μm2 in size can be synthesized with 90% yield inbulk quantities through a microwave-assisted chemical method. Membranes are readilyvisualized on an oxidized silicon substrate; which enables efficient fabrication of electronicdevices and sensors. Field effect transistors made of the membrane show ambipolarbehavior; and their conductivity is significantly higher than previously reported values.,Journal of the American Chemical Society,2009,471
Crystallographic etching of few-layer graphene,Sujit S Datta; Douglas R Strachan; Samuel M Khamis; AT Charlie Johnson,We demonstrate a method by which few-layer graphene samples can be etched alongcrystallographic axes by thermally activated metallic nanoparticles. The technique results inlong (> 1 μm) crystallographic edges etched through to the insulating substrate; making theprocess potentially useful for atomically precise graphene device fabrication. This advancecould enable atomically precise construction of integrated circuits from single graphenesheets with a wide range of technological applications.,Nano letters,2008,465
Thermal properties of carbon nanotubes and nanotube-based materials,J Hone; MC Llaguno; MJ Biercuk; AT Johnson; B Batlogg; Z Benes; JE Fischer,Abstract. The thermal properties of carbon nanotubes are directly related to their uniquestructure and small size. Because of these properties; nanotubes may prove to be an idealmaterial for the study of low-dimensional phonon physics; and for thermal management;both on the macro-and the micro-scale. We have begun to explore the thermal properties ofnanotubes by measuring the specific heat and thermal conductivity of bulk SWNT samples.In addition; we have synthesized nanotube-based composite materials and measured theirthermal conductivity. The measured specific heat of single-walled nanotubes differs from thatof both 2D graphene and 3D graphite; especially at low temperatures; where 1Dquantization of the phonon bandstructure is observed. The measured specific heat showsonly weak effects of intertube coupling in nanotube bundling; suggesting that this …,Applied physics A,2002,465
Photoluminescence and band gap modulation in graphene oxide,Zhengtang Luo; Patrick M Vora; Eugene J Mele; AT Charlie Johnson; James M Kikkawa,We report broadband visible photoluminescence from solid graphene oxide; andmodifications of the emission spectrum by progressive chemical reduction. The data suggesta gapping of the two-dimensional electronic system by removal of π-electrons. We discusspossible gapping mechanisms; and propose that a Kekule pattern of bond distortions mayaccount for the observed behavior.,Applied physics letters,2009,455
Nonvolatile molecular memory elements based on ambipolar nanotube field effect transistors,M Radosavljević; M Freitag; KV Thadani; AT Johnson,We have fabricated air-stable n-type; ambipolar carbon nanotube field effect transistors(CNFETs) and used them in nanoscale memory cells. n-Type transistors are achieved byannealing nanotubes in hydrogen gas and contacting them by cobalt electrodes. Scanninggate microscopy reveals that the bulk response of these devices is similar to gold-contactedp-CNFETs; confirming that Schottky barrier formation at the contact interface determinesaccessibility of electron and hole transport regimes. The transfer characteristics andCoulomb blockade (CB) spectroscopy in ambipolar devices show strongly enhanced gatecoupling; most likely due to reduction of defect density at the silicon/silicon-dioxide interfaceduring hydrogen anneal. The CB data in the “on”-state indicates that these CNFETs arenearly ballistic conductors at high electrostatic doping. Due to their nanoscale …,Nano Letters,2002,433
Mapping the one-dimensional electronic states of nanotube peapod structures,DJ Hornbaker; S-J Kahng; S Misra; BW Smith; AT Johnson; EJ Mele; DE Luzzi; A Yazdani,Arrays of C 60 molecules nested inside single-walled nanotubes represent a class ofnanoscale materials having tunable properties. We report electronic measurements of thissystem made with a scanning tunneling microscope and demonstrate that the encapsulatedC 60 molecules modify the local electronic structure of the nanotube. Our measurementsand calculations also show that a periodic array of C 60 molecules gives rise to a hybridelectronic band; which derives its character from both the nanotube states and the C 60molecular orbitals.,Science,2002,418
Zero-dimensional states and single electron charging in quantum dots,AT Johnson; LP Kouwenhoven; W De Jong; NC Van der Vaart; CJPM Harmans; CT Foxon,Abstract We observe new transport effects in lateral quantum dots where zero-dimensional(0D) states and single electron charging coexist. In linear transport we see coherentresonant tunneling; described by a Landauer formula despite the many-body charginginteraction. In the nonlinear regime; Coulomb oscillations of a quantum dot with about 25electrons show structure due to 0D excited states as the bias voltage increases; and thecurrent-voltage characteristic has a double-staircase shape.,Physical Review Letters,1992,371
Electrospun polyaniline/polyethylene oxide nanofiber field-effect transistor,NJ Pinto; AT Johnson Jr; AG MacDiarmid; CH Mueller; N Theofylaktos; DC Robinson; FA Miranda,We report on the observation of field-effect transistor (FET) behavior in electrospuncamphorsulfonic-acid-doped polyaniline/polyethylene oxide (PEO) nanofibers. Saturationchannel currents are observed at surprisingly low source–drain voltages. The hole mobilityin the depletion regime is 1.4× 10− 4 cm 2/V s; while the one-dimensional (1-D) chargedensity (at zero gate bias) is calculated to be approximately 1 hole per 50 two-ring repeatunits of polyaniline; consistent with the rather high channel conductivity (∼ 10− 3 S/cm).Reducing or eliminating the PEO content in the fiber is expected to enhance deviceparameters. Electrospinning is thus proposed as a simple method of fabricating one-dimensional polymer FETs.,Applied physics letters,2003,358
Probing the structure of DNA− carbon nanotube hybrids with molecular dynamics,Robert R Johnson; AT Charlie Johnson; Michael L Klein,DNA− carbon nanotube hybrids (DNA− CN) are novel nanoscale materials that consist ofsingle-wall carbon nanotubes (SWCN) coated with a self-assembled monolayer of single-stranded DNA (ssDNA). Recent experiments on DNA− CN have shown that this materialoffers a remarkable set of technologically useful properties such as facilitation of SWCNsorting; chemical sensing; and detection of DNA hybridization. Despite the importance ofDNA− CN; a detailed understanding of its microscopic structure and physical properties islacking. To address this; we have performed classical all-atom molecular dynamics (MD)simulations exploring the self-assembly mechanisms; structure; and energetic properties ofthis nanomaterial. MD reveals that SWCN induces ssDNA to undergo a spontaneousconformational change that enables the hybrid to self-assemble via the π− π stacking …,Nano Letters,2008,349
Controlled fabrication of nanogaps in ambient environment for molecular electronics,DR Strachan; DE Smith; DE Johnston; T-H Park; Michael J Therien; DA Bonnell; AT Johnson,We have developed a controlled and highly reproducible method of making nanometer-spaced electrodes using electromigration in ambient lab conditions. This advance will makefeasible single molecule measurements of macromolecules with tertiary and quaternarystructures that do not survive the liquid-helium temperatures at which electromigration istypically performed. A second advance is that it yields gaps of desired tunneling resistance;as opposed to the random formation at liquid-helium temperatures. Nanogap formationoccurs through three regimes: First it evolves through a bulk-neck regime whereelectromigration is triggered at constant temperature; then to a few-atom regimecharacterized by conductance quantum plateaus and jumps; and finally to a tunnelingregime across the nanogap once the conductance falls below the conductance quantum.,Applied Physics Letters,2005,301
Single electron charging effects in semiconductor quantum dots,LP Kouwenhoven; NC Van der Vaart; AT Johnson; W Kool; CJPM Harmans; JG Williamson; AAM Staring; CT Foxon,Abstract We have studied charging effects in a lateral split-gate quantum dot defined bymetal gates in the two dimensional electron gas (2 DEG) of a GaAs/AlGaAs heterostructure.The gate structure allows an independent control of the conductances of the two tunnelbarriers separating the quantum dot from the two 2 DEG leads; and enables us to vary thenumber of electrons that are localized in the dot. We have measured Coulomb oscillations inthe conductance and the Coulomb staircase in current-voltage characteristics and studiedtheir dependence on the conductances of the tunnel barriers. We show experimentally thatat zero magnetic field charging effects start to affect the transport properties when bothbarrier conductances are smaller than the first quantized conductance value of a pointcontact at 2 e 2/h. The experiments are described by a simple model in terms of …,Zeitschrift für Physik B Condensed Matter,1991,268
Photoconductivity of self-assembled porphyrin nanorods,Alexander D Schwab; Deirdre E Smith; Brooks Bond-Watts; Danvers E Johnston; James Hone; Alan T Johnson; Julio C de Paula; Walter F Smith,The photoconductivity of nanorods self-assembled from meso-tetrakis (4-sulfonatophenyl)porphine is described. The nanorods are insulating in the dark. Upon illumination with 488nm light; the nanorods become photoconductive; exhibiting a rapid turn on/off (< 100 ms) ofthe current when the light is turned on/off. This photoconductivity grows over hundreds ofseconds with light exposure and decays slowly when the light is off. The nanorods can betrained via an applied bias to exhibit a short-circuit photocurrent (with corresponding open-circuit photovoltage) that flows in the direction opposite that of the training bias. A qualitativemodel is proposed; in which conduction occurs through the tightly coupled LUMOs of close-packed porphyrin molecules.,Nano Letters,2004,241
Effect of substrate roughness and feedstock concentration on growth of wafer-scale graphene at atmospheric pressure,Zhengtang Luo; Ye Lu; Daniel W Singer; Matthew E Berck; Luke A Somers; Brett R Goldsmith; AT Charlie Johnson,The growth of large-area graphene on catalytic metal substrates is a topic of bothfundamental and technological interest. We have developed an atmospheric pressurechemical vapor deposition (CVD) method that is potentially more cost-effective andcompatible with industrial production than approaches based on synthesis under highvacuum. Surface morphology of the catalytic Cu substrate and the concentration of carbonfeedstock gas were found to be crucial factors in determining the homogeneity andelectronic transport properties of the final graphene film. The use of an electropolished metalsurface and low methane concentration enabled the growth of graphene samples withsingle layer content exceeding 95%. Field effect transistors fabricated from CVD graphenemade with the optimized process had room temperature hole mobilities that are a factor of …,Chemistry of Materials,2011,237
Fabrication and electrical characterization of polyaniline-based nanofibers with diameter below 30 nm,Yangxin Zhou; Marcus Freitag; James Hone; Cristian Staii; AT Johnson Jr; Nicholas J Pinto; AG MacDiarmid,We fabricate and electrically characterize electrospun nanofibers of doped polyaniline/polyethylene oxide (PAn/PEO) blend with sub-30 nm diameter. Fiber diameters near 5 nmare obtained for optimized process parameters. Scanning conductance microscopy (SCM)shows that fibers with diameter below 15 nm are electrically insulating; the small diametermay allow complete dedoping in air or be smaller than phase-separated grains of PAn andPEO. Electrical contacts to nanofibers are made by shadow mask evaporation with nochemical or thermal damage to the fibers. Single fiber I–V characteristics show that thinfibers conduct more poorly than thick ones; in agreement with SCM data. I–V s of asymmetricfibers are rectifying; consistent with formation of Schottky barriers at the nanofiber-metalcontacts.,Applied Physics Letters,2003,232
Surface potentials and layer charge distributions in few-layer graphene films,Sujit S Datta; Douglas R Strachan; EJ Mele; AT Charlie Johnson,Graphene-derived nanomaterials are emerging as ideal candidates for postsiliconelectronics. Elucidating the electronic interaction between an insulating substrate and few-layer graphene (FLG) films is crucial for device applications. Here; we report electrostaticforce microscopy (EFM) measurements revealing that the FLG surface potential increaseswith film thickness; approaching a “bulk” value for samples with five or more graphenelayers. This behavior is in sharp contrast with that expected for conventional conducting orsemiconducting films; and derives from unique aspects of charge screening by graphene'srelativistic low energy carriers. EFM measurements resolve previously unseen electronicperturbations extended along crystallographic directions of structurally disordered FLGs;likely resulting from long-range atomic defects. These results have important implications …,Nano letters,2008,205
DNA-decorated graphene chemical sensors,Ye Lu; Brett R Goldsmith; Nicholas J Kybert; AT Charlie Johnson,Graphene is a two-dimensional material with exceptional electronic properties andenormous potential for applications. Graphene's promise as a chemical sensor material hasbeen noted but there has been little work on practical chemical sensing using graphene;and in particular; how chemical functionalization may be used to sensitize graphene tochemical vapors. Here we show one route towards improving the ability of graphene to workas a chemical sensor by using single stranded DNA as a sensitizing agent. The resultingdevices show fast response times; complete and rapid recovery to baseline at roomtemperature; and discrimination between several similar vapor analytes.,Applied Physics Letters,2010,201
Controlled creation of a carbon nanotube diode by a scanned gate,Marcus Freitag; Marko Radosavljevic; Yangxin Zhou; AT Johnson; Walter F Smith,We use scanning gate microscopy to precisely locate the gating response in field-effecttransistors (FETs) made from semiconducting single-wall carbon nanotubes. A dramaticincrease in transport current occurs when the device is electrostatically doped with holesnear the positively biased electrode. We ascribe this behavior to the turn-on of a reversebiased Schottky barrier at the interface between the p-doped nanotube and the electrode. Bypositioning the gate near one of the contacts; we convert the nanotube FET into a rectifyingnanotube diode. These experiments both clarify a longstanding debate over the gatingmechanism for nanotube FETs and indicate a strategy for diode fabrication based oncontrolled placement of acceptor impurities near a contact.,Applied Physics Letters,2001,173
Subband population in a single-wall carbon nanotube diode,RD Antonov; AT Johnson,Abstract We observe current rectification in a molecular diode consisting of asemiconducting single-wall carbon nanotube and an impurity. One-half of the nanotube hasno impurity; and it has a current-voltage (I− V) characteristic of a typical semiconductingnanotube. The other half of the nanotube has the impurity on it; and its I− V characteristic isthat of a diode. Current in the nanotube diode is carried by holes transported through themolecule's one-dimensional subbands. At 77 K we observe a stepwise increase in thecurrent through the diode as a function of gate voltage; showing that we can control thenumber of occupied one-dimensional subbands through electrostatic doping.,Physical Review Letters,1999,171
Role of single defects in electronic transport through carbon nanotube field-effect transistors,Marcus Freitag; AT Johnson; Sergei V Kalinin; Dawn A Bonnell,Abstract The influence of defects on electron transport in single-wall carbon nanotube field-effect transistors (CNFETs) is probed by combined scanning gate microscopy (SGM) andscanning impedance microscopy (SIM). SGM images are used to quantify the depletionsurface potential; and from this the Fermi level; at individual defects along the CNFET length.SIM is used to measure the voltage distribution along the CNFET. When the CNFET is in theconducting state; SIM reveals a uniform potential drop along its length; consistent withdiffusive transport. In contrast; when the CNFET is “off;” potential steps develop at theposition of depleted defects. High-resolution imaging of a second set of weak defects isachieved in a new “tip-gated” SIM mode.,Physical review letters,2002,146
Free energy landscape of a DNA− carbon nanotube hybrid using replica exchange molecular dynamics,Robert R Johnson; Axel Kohlmeyer; AT Charlie Johnson; Michael L Klein,The DNA− carbon nanotube hybrid (DNA-CN) consists of a single-wall carbon nanotube(SWCN) coated with a self-assembled monolayer of single-stranded DNA (ssDNA). Recentexperiments have demonstrated that this nanomaterial is ideal for numerousnanotechnological applications. Despite this importance; the structure of this materialremains poorly understood. Molecular dynamics (MD) simulations have providedinformation about the self-assembly mechanisms and ssDNA conformations thatcharacterize DNA-CN. However; MD simulations of biopolymers at low temperatures (T∼300 K) result in kinetic trapping that limits conformational sampling. Here; we present resultsof a large-scale replica exchange molecular dynamics (REMD) simulation that providesextensive sampling of the entire ensemble of oligonucleotide conformations in a (GT) 7 …,Nano letters,2009,145
