The emergence of antibiotic resistance in the hospital environment,ALAN JOHNSON,The discovery of different classes of antibiotic from the late 1940s onwards and theirintroduction into clinical use was a major breakthrough in the fight against bacterialinfections. Their initial success was so dramatic that; in the 1960s; the US Surgeon GeneralWilliam H. Stewart is reputed to have declared that 'it is time to close the book on infectiousdiseases'. 1 Four decades later; and with the benefit of hindsight; it is evident that suchoptimism was entirely misplaced. The reality is that infectious disease remains the secondmost common cause of death worldwide; 2 and in terms of bacterial infections; our failure tocontrol these diseases is related in large part to the emergence of antibiotic resistance.Antibiotic resistance can arise in individual strains of bacteria through the mutation of genesthat encode target sites to which antibiotics bind; with the result that antibiotic-binding is …,Environmental Medicine,2010,*
Intramammary teat sealant,*,The present invention relates to veterinary or pharmaceutical formulations comprising one ormore plant oils and bismuth subnitrate and methods for their manufacture and uses. The formulationsare useful as a teat sealant to prevent or treat mastitis in an animal … This application claimsbenefit of US provisional application Ser. No. 61/119;763 filed Dec. 4; 2008 … This inventionrelates to teat sealant formulations and their use for treating and preventing mastitis in ananimal … Mastitis is the most common disease of dairy cattle. In commercial herds; the costdue to reduced milk quality can be extremely significant. This cost can be due to reduced productionand the need to withhold contaminated milk from the processing stream … Mastitis is an inflammatoryresponse of the udder tissue due to some form of injury; the most common being bacterialinfection. The inflammatory response consists of an increase in blood proteins and white …,*,2010,*
Graphene Nanoconstriction Field Effect Transistor,Ye Lu; Brett Goldsmith; Douglas Strachan; AT Johnson,Abstract We report an approach to fabricate monolayer graphene nanoconstriction fieldeffect transistors (NCFETs) with critical dimensions below 10 nm; a regime that is notaccessible by conventional nanolithography. We start by fabricating a gold nanowire on topof mechanically-exfoliated monolayer graphene. We use Feedback ControlledElectromigration to form a nanoconstriction in the gold wire; which is then used as an etchmask for the graphene during an oxygen plasma patterning step. We observe the opening ofa confinement-induced energy gap as the NCFET width is reduced; as evidenced by a sharpincrease in the NCEFT on/off ratio; which can be as large as 1100 at room temperature forthe thinnest devices. Such devices deliver up to 100microampere current at 50mV bias withan on state resistance of 50kilo ohm; which is at least an order of magnitude lower than …,APS Meeting Abstracts,2010,*
Memristance in single-component metallic nanowires,Stephen Johnson; Patrick Hunley; Abhishek Sundararajan; Douglas Strachan,Abstract In this talk; we will discuss a new type of memristor-one whose state variable is itsphysical geometry. Using a single metallic material; we employ electromigration to changethe resistance of metallic nanowires. The resistive switching is due to the creation/filling-in ofvoids in the nanowire as atoms are pushed back and forth by the electrical current.Exploiting electromigration in this manner; we repeatedly switch the resistance of single-component metallic nanowires between low and high states over many cycles. This workthus completes the array of fundamental passive circuit elements; now including thememristor; which can be fabricated from a single metallic material.,APS Meeting Abstracts,2010,*
Large sensor array based on functionalized graphene devices,Zhengtang Luo; Daniel W Singer; Matthew E Berck; Luke A Somers; Lolita Rotkina; Brett R Goldsmith; AT Charlie Johnson,Graphene has been shown to have an extraordinary set of electronic properties and itschemical affinity is readily tuned by functionalization with a broad range of molecules. It isknown that field effect transistors based on single-layer graphene demonstrate extremelyhigh sensitivity for chemical sensing. It is thus very important to achieve fabrication ofintegrated circuits on large-area graphene in order to realize practical applications; eg anadvanced “electronic nose” system. Utilizing recent advances in graphene and grapheneoxide preparation and functionalization techniques; we aim to achieve fabrication of sensorarrays using conventional photolithography; where signals from the array are coupled tosignal-conditioning electronics and sensor responses fed to odor recognition algorithms toperform detection and classification of vapors.,Nanoelectronics Conference (INEC); 2010 3rd International,2010,*
Wetland Mitigation in Abandoned Gravel Pits: Creating Fresh Meadow and Shrub Swamp,Kurt Johnson; Gary Walton; Andrew Johnson,It is becoming increasingly difficult to provide on-site mitigation for wetland impacts due toroad construction in northeastern Minnesota counties that retain greater than 80 percent oftheir pre-settlement wetlands. Abandoned gravel pits are one of the few remaining areasthat can serve as wetland mitigation sites within the impacted watersheds. The overall goalof the project is to develop cost effective methods for creating functional mitigation wetlandson abandoned gravel pit sites to compensate for wetland impacts due to road construction innortheastern Minnesota. More specifically; the aim is to achieve" in-kind" compensation bycreating wetlands of the same type and function as those being disturbed; such as freshmeadow and shrub swamp. A 1.3 hectare wetland demonstration site was established in anabandoned gravel/borrow pit within the US Trunk Highway 53 reconstruction corridor in …,2009 International Conference on Ecology and Transportation (ICOET 2009) Federal Highway AdministrationUSDA Forest ServiceU. S. Fish and Wildlife ServiceU. S. Environmental Protection AgencyDefenders of WildlifeCalifornia Department of TransportationWashington State Department of TransportationTransportation Research BoardUniversity of California; DavisNorth Carolina State University; Raleigh,2010,*
Catalytic chemical vapor deposition of boron nitride nanotubes and nanosheets from molecular precursors,Shahana Chatterjee; Myung Jong Kim; Zhengtang Luo; Muharrem Acerce; Douglas M Yates; Dmitri N Zakharov; Seung Min Kim; Eric A Stach; AT Johnson; Benji Maruyama,Catalytic chemical vapor deposition of boron nitride nanotubesand nanosheets from molecular precursors.,ABSTRACTS OF PAPERS OF THE AMERICAN CHEMICAL SOCIETY; 244th National Fall Meeting of the American-Chemical-Society (ACS); Philadelphia; PA; AUG 19-23; 2012,2010,*
Building Scotland: Celebrating Scotland's Traditional Building Materials,Alan Johnson,*,*,2010,*
The impact of the European earthworm invasion on Red Lake Reservation,J Jourdain; A Johnson; M Sumner; M Kingbird; WF Martin; M Sather; C Thayer; TR Filley; SM Top; S Zurn-Birkhimer; T Kroeger; P Welle,*,AGU Fall Meeting Abstracts,2009,*
EXIT procedure to manage giant congenital cervical teratomas,Alan W Johnson; James Sidman,*,Otolaryngology-Head and Neck Surgery,2009,*
Size Selection of Metal Nanoparticles on Few Layer Graphene,Luke A Somers; Zhengtang Luo; EJ Mele; AT Johnson,Abstract We find layer number dependence in the size of metal nanoparticles grown on 1 to10 layer graphene. Graphene is an attractive substrate for investigating and usingnanoparticles due to its loose interaction with them. To preserve this condition it is ideal togrow particles in place rather than deposit them from solution. We find that annealing ofevaporated metal nanoparticles on graphene and few layer graphene surfaces tightens theirsize distribution. The number of graphene layers changes the selected size. These resultsare in quantitative agreement with a model incorporating surface; bulk; and coulomb freeenergies.,APS Meeting Abstracts,2009,*
Optical and diamagnetic anisotropy of graphene oxide,AL Exarhos; PM Vora; Z Lou; AT Johnson; JM Kikkawa,Abstract We have recently shown that graphene oxide (GO) emits a broadphotoluminescence (PL) band in both solid and aqueous preparations. The origin of this PLis not yet well understood; but for absorptive and emissive optical processes originating inthe two dimensional GO plane; one expects an in-plane polarization. Studies of opticalanisotropy can therefore help to clarify the origin of the PL. Here we use a method of opticalnanomagnetometry (Torrens; et al; JACS 129; p. 252 (2007)) to extract these quantities; alsodetermining the magnetic anisotropy. We find that when aqueous preparations of GO areplaced in a magnetic field; diamagnetically induced alignment leads to marked linearpolarization anisotropy of absorbance and photoluminescence. By taking six opticalmeasurements at each magnetic field; we are able to extract the intrinsic polarization …,APS Meeting Abstracts,2009,*
Calculation of the free energy of binding of DNA bases on a single-wall carbon nanotube,Robert Johnson; AT Johnson; Michael Klein,Abstract Biological molecules can be combined with inorganic nanostructures to formmultifunctional hybrid materials with unique properties that will drives advances innanoelectronics; environmental safety; medicine and homeland security. One such materialof contemporary interest is the DNA-carbon nanotube hybrid (DNA-CN); which consists of asingle-wall carbon nanotube (SWCN) coated with a self-assembled monolayer of single-stranded DNA (ssDNA). Computation and experiment indicate that DNA-CN self-assembleswith DNA bases binding to SWCN sidewall. However; the nature; strength and solvationeffects of base-SWCN binding have not been studied in detail. To address these issues andexpand our understanding of DNA-CN; we have computed the binding free energy ofindividual DNA bases with SWCN using alchemical free energy methods. Such …,APS Meeting Abstracts,2009,*
Thermal Effects in Precision Nano-Electronics Construction,Stephen Johnson; Douglas Strachan,Abstract The development of high precision nano-electronics requires a detailedunderstanding of the non-equilibrium thermal effects during their construction and use. Tobetter understand the dynamics of these nano-scale thermal effects; we investigatenanowires and nano-scale junctions of various dimensions with applied electric currents.During the application of current; significant joule heating occurs which induces thestructures to evolve through thermo-and electromigration processes. A distinct change in thesymmetry of these processes indicates that different mechanisms occur at the various stagesof evolution. The results are compared to detailed thermal modeling of our structures andhave implications on the development of a wide range of novel nanoscale devices.Supported in part by NSF Award No. DMR-0805136; the Kentucky NSF EPSCoR program …,APS Meeting Abstracts,2009,*
Richard B. Baldauf and Robert B. Kaplan; editors; 2007: Language planning,David Barton; Ros Ivanič; Yvon Appleby; Rachel Hodge; Karin Tusting; Vijay K Bhatia; John Flowerdew; Rodney H Jones; Ronald Carter; Angela Goddard; Danuta Reah; Keith Sanger; Nikki Swift; Malcolm Coulthard; Alison Johnson; Christiane Dalton-Puffer; ZhaoHong Han; Elaine K Horwitz; Stacey L Katz; Carl S Blyth; Ilona Leki; Martin Montgomery; Gemma Moss; John M Norris; Lourdes Ortega; Heidi Byrnes,ZhaoHong Han; editor; 2008: Understanding second language process. Clevedon:Multilingual Matters. 256 pp. $49.95 (paperback). ISBN 978-1-8476-9013-5. Elaine K.Horwitz; 2008: Becoming a language teacher: a practical guide to second language learningand teaching. Boston; MA: Pearson. 260 pp. $58.60 (paperback). ISBN 978-0-2054-3082-6.,Language Teaching Research,2009,*
Determination to narrow the gaps. Forward.,A Johnson,1. Health Serv J. 2008 Jul 31;Suppl:1 p preceding front cover. Determination to narrowthe gaps. Forward. Johnson A. PMID: 18825827 [Indexed for MEDLINE]. MeSH terms.Community Networks*; Cooperative Behavior*; Healthcare Disparities*; Humans;Quality of Health Care*; State Medicine; United Kingdom.,The Health service journal,2008,*
Probing Vapor Phase Analytes with Single Walled Carbon Nanotube Biopolymer Hybrid Devices.,Samuel Khamis; Michelle Chen; AT Johnson,Abstract Covalent and non-covalent functionalization schemes have been investigated inorder to tune the chemical affinity of Single Walled Carbon Nanotube (SWNT) Field EffectTransistors (FET's). Non-covalent means are preferable since they have minimal impact onthe electronic structure of pristine nanotubes. We present work involving the non-covalentadsorption of both ss-DNA and ss-RNA strands to SWNT FET's in order to obtain a class ofdevices that respond electrically to the presence of gaseous odors. We present a databaserepresenting measurements of hundreds of such devices; involving ten different sequencesof ss-DNA; two different sequences of ss-RNA; and five different chemical vapors. We showthat these responses are determined by the sequence of the adsorbed species ofbiopolymer; and we explore the performance limits of these devices.,APS Meeting Abstracts,2008,*
Remarkable Effects of Gating on the Photoconductivity of Porphyrin Nanorods,CK Riley; X Huang; WF Smith; DE Johnston; AT Johnson,Abstract Tetrakis (4-sulfonatophenyl) porphine self assembles into well-defined nanorodswith intriguing photoelectronic properties.^ 1 For example; when light is applied; theconductivity immediately jumps up from zero; then grows further over several hours. Thismay be due to a light-induced structural change. In recent experiments; we imaged thenanorods with AFM while measuring the photoconductivity; we observed no change inmorphology. We also deposited nanorods onto oxidized silicon substrates. We find that thephotoconductivity is not sensitive to the value of the gate voltage applied to the underlyingsilicon; but only to changes in the gate voltage. The photoconductivity increases when thegate voltage is increased; but then relaxes back to its original level over about one hour.When the gate voltage is decreased; the photoconductivity decreases; and again slowly …,APS Meeting Abstracts,2008,*
Dielectrophoretic Trapping of Au Nanoparticles using High Quality Nanogap Electrodes,Ye Lu; Danvers E Johnston; Douglas R Strachan; Beth S Guiton; Peter K Davies; Tae-Hong Park; Michael J Therien; AT Johnson,Abstract In the past decade; single molecule-based electronic devices have drawnenormous attention. One of the great challenges to be overcome is the fabrication of well-defined; uncontaminated nanogap electrodes; and the subsequent assembly of individualmolecules or nanoparticles onto the contacts. A promising route to this goal is the feedbackcontrolled electromigration (FCE) process; which can be used to create stable; metal-particlefree nanogap contacts at temperatures ranging from 4--300 K.^ 1; 2 Here we describeexperiments where Au nanoparticles (NPs) are assembled inside FCE fabricated nanogapsby using positive AC dielectrophoresis (DEP). Specific challenges relating to circuit designfor efficient DEP and solutions to these challenges are discussed. Additionally; substrateinteractions are found to substantially influence dielectrophoretic assembly. Methods for …,APS Meeting Abstracts,2008,*
Atomic Precision in Nano-Electronics,Douglas Strachan; Danvers Johnston; Beth Guiton; Ye Lu; Sujit Datta; Peter Davies; Dawn Bonnell; Charlie Johnson,Abstract One of the greatest challenges in developing molecular-scale devices is to fabricateand monitor their formation with atomic precision. Recently; we have developed anelectromigration technique that employs feedback for controllably electromigrating a nano-scale electrode with atomic precision at room temperature [1]. We will discuss our recentprogress advancing this technique towards atomically precise nano-electronics. This willinclude in-situ transmission electron microscopy which shows evidence for highly crystallineelectrode formation and the parallel fabrication of nanogaps for scaling-up to very large-scale integrated-circuits. Our results have implications on the development of a wide rangeof novel molecular-scale devices. Funding provided by: NSF-NSEC/NBIC DMR-0425780;NSF-NIRT Grant No. 0304531; and MRSEC award No. DMR05-20020.[1] DR Strachan; et …,APS Meeting Abstracts,2008,*
Structure of a DNA-carbon nanotube hybrid using replica exchange molecular dynamics,Robert Johnson; AT Johnson; Michael Klein,Abstract DNA-carbon nanotube hybrids (DNA-CN) are novel nanoscale materials thatconsist of single-wall carbon nanotubes coated with a self-assembled monolayer of singlestranded DNA (ssDNA). Many recent experiments have demonstrated that this nanomaterialis an ideal candidate for a variety of nanotechnological applications. Despite the importanceof this material; a complete understanding of its structural and physical properties is lacking.Recent molecular dynamics (MD) simulations of this nanomaterial have providedinformation about the self-assembly mechanisms and possible ssDNA conformations thatcharacterize DNA-CN. However; MD simulations of biopolymers at low temperatures (T 300K) result in kinetic trapping and limits sampling of ssDNA configurational space. Here; wepresent the results of large scale replica exchange molecular dynamics simulations that …,APS Meeting Abstracts,2008,*
STM study of MOCVD-grown a-plane ZnO thin films: film thickness; growth temperature; and substrate miscut effects,O Dulub; U Diebold; G Saraf; Y Lu,Abstract ZnO films with a-plane orientation were grown on r-plane (011bar2) sapphiresubstrates using metal-organic chemical vapor deposition (MOCVD). The surfacemorphology of ZnO films with various thicknesses (20--2000 nm); growth temperatures (300-580^ oC); and substrate miscut orientations and angles (0.2-2^ o) was characterized by lowenergy electron diffraction (LEED) and scanning tunneling microscopy (STM). Our resultsshow strong dependence of surface morphology on growth parameters and the substratemiscut. STM images reveal uniform surfaces with small; rectangular terraces during theinitial growth stage (20 nm-thick film). Films with thicknesses between 100 and 450 nm havea characteristic wave-like surface morphology with needle-shaped domains runningpredominantly along the crystallographic c-direction. Films with a thickness of 2000 nm …,APS Meeting Abstracts,2008,*
Synthesis of Aranidipine,Ling Li; ZF Luo; Yi Ding,Aranidipine was synthesized by the addition of propynol and ethylene glycol followed byreaction with ketene dimer to give 2; 2-ethylenedioxypropyl acetoacetate; which wassubjected to amination; condensation with 2-(2-nitrobenzylidene)-3-oxobutyric acid methylester and then hydrolysis with an overall yield of about 34%.,Chinese Journal of Pharmaceuticals,2008,*
New Biferrocene P; P; O-Ligand,H-L Zhang; X-L Hou; L-X Dai; Z-B Luo,Significance: The primary focus of this work is the synthesis of the new P; P; O-ligand 4designed by Hou and Dai. To demonstrate its utility; it was applied to the asymmetrichydrogenation of ketones. Although the only substrates tested in this report were b-hydroxyketones 1; the enantioselectivity obtained is high. Previous hydrogenation methods usingRu (II)/MeO-BIPHEP are excellent for alkyl ketones; but gave 95% ee with aryl ketones like 1(P. Bertus et al. Tetrahedron Lett. 1999; 40; 3175-3178). Comment: The new ligand 4presents only planar chirality. Also; it can potentially act either as a bidentate P; O-or P; P-ligand; or as a tridentate P; P; O-ligand. Thus it would be interesting to study its reactivity invarious metal-catalyzed systems.(R; R)-4 can be prepared in four steps from thecommercially available chiral sulfoxide 3.,Synfacts,2007,*
High Quality Nanogap Electrodes for Electronic Transport Measurements of Single Molecules,Danvers E Johnston; Douglas R Strachan; Beth S Guiton; Peter K Davies; Dawn A Bonnell; AT Charlie Johnson,ABSTRACT Electromigrated nanogaps have frequently been used in molecular scaleelectronics. We use a computer controlled electromigration (CCE) process for creatingnanogaps at room temperature permitting characterization of bare gaps prior to applicationof molecules. This is very different from other approaches where nanogaps are formed by asimple voltage ramp performed at low temperature with molecules already attached to thenanowire. Using CCE; we formed nanogaps at room temperature on both thick substratesand thin SiNx membranes compatible with transmission electron microscopy. We showedthat the electromigration process evolves through an initial bulk behavior regime andcrosses over to a ballistic conduction regime. It was found that nanogaps formed on SiNxmembranes are clean of parasitic conduction pathways and contamination. This work has …,Bulletin of the American Physical Society,2007,*
Sequence Dependent Single Stranded DNA-Single Walled Carbon Nanotube Interactions and Their Applications in Detection of Gaseous Analytes,Samuel Khamis; Michelle Chen; Robert Johnson; AT Johnson,Abstract Recently there has been great interest in sensing strategies based on the use ofnon-covalent means to tune the chemical affinity of single walled carbon nanotube fieldeffect transistors (SWNT FET's). The combination of single-stranded DNA (ssDNA) andSWNT FET's is particularly intriguing because of their chemical compatibility and diversechemical recognition properties. We have demonstrated the utility of such devices for vaporsensing^ 1; and report here on results involving more than a dozen different ssDNAsequences. ssDNA/SWNT based sensors are sensitive to ppms of said gases; with responseand recovery times on the scale of seconds. In tests involving a gas panel that includesexplosives; neuro-toxins; and disease defining compounds; sensor response is specific toparticular sequences of ssDNA. Given the extremely large number of different ssDNA …,APS Meeting Abstracts,2007,*
Persistent Photoconductivity and Photo-induced Morphology Changes of Porphyrin Nanorods,BE Feldman; EA Muller; VH Joines; WF Smith; AD Schwab; JC de Paula; DE Johnston; AT Johnson,Abstract Tetrakis (4-sulfonatophenyl) porphine self assembles into well-defined nanorodswith intriguing photoelectronic properties.^ 1 Recently; we have found that; over long timescales; they undergo a transition from non-persistent photoconductivity (NPPC) to a newmode; in which part of the conductivity persists after the light is blocked; decaying overhundreds of seconds. NPPC initially dominates; but its growth asymptotes within 2-3 hoursof illumination; while the persistent current continues to grow; even after 8 hours of lightexposure. The decay of persistent current after the light is blocked can be roughly modeledby a single exponential; a double exponential fits much better. The morphology of somenanorods changes as a result of long-term illumination---they become shorter; thinner andless well-formed. Other rods; however; appear unchanged. This and other structural …,APS Meeting Abstracts,2007,*
Controlled Fabrication and High-Resolution Imaging of Molecular-Scale Three-Terminal Devices,Douglas R Strachan; Danvers E Johnston; Beth S Guiton; T-H Park; MJ Therien; Peter K Davies; Dawn A Bonnell; AT Johnson,Abstract One of the biggest challenges to developing molecular-scale three terminal devicesis to precisely fabricate and monitor the formation of the nanometer-scale electrodes(nanogaps). Recently; electromigrated nanogaps have been developed which providesufficient gate-coupling to produce such devices. We have developed a technique forforming electromigrated nanogaps in a transmission electron microscope (TEM) in order tomonitor their formation with high-resolution imaging in real time. The technique relies oncomputer-controlled electromigration using feedback to produce the nanogaps at roomtemperature. This TEM imaging allows us to monitor the dynamics of the device evolution;where the gaps remain ordered and clear of residue during the process. Using thistechnique; we find clear visual evidence for the importance of joule heating in the …,APS Meeting Abstracts,2007,*
Observation of unusual structure in the low-temperature conductance of carbon nanotubes,Jeffrey D Stephens; Jerome C Licini; AT Johnson; Douglas R Strachan; Sam Khamis; Danvers E Johnston,Abstract Carbon nanotubes grown by chemical vapor deposition on a oxidized siliconsubstrate were contacted to form a gated sample consisting of a pair of tubes in parallel. Thesample was tested at low temperature and high magnetic field using a dilution refrigeratorand superconducting magnet. The current versus bias voltage graph shows a general trendconsistent with the linear relationship except at low voltage. Further investigation is done bycomputing the differential conductance (dI/dV) and investigating how it varies with biasvoltage. Here we see some intriguing behavior including a substantial increase inconductivity near zero voltage and a pronounced asymmetry with bias voltage. Thetemperature dependence of the zero field peak and asymmetry show that they appear at lowtemperatures and receding quickly by 3.0 K. However; the magnetic field dependence is …,APS Meeting Abstracts,2007,*
