Plant names simplified.,Arthur Tysilio Johnson; Henry Augustus Smith,Abstract: This is the third edition of a useful little guide to the pronunciation; derivation andmeaning of plant names. Formerly limited to hardy plants; it has now been enlarged toinclude many indoor temperate and tropical subjects and the new sectional genera intowhich cacti; mesembryanthemums and sempervivums have in modern times been hustled.Both generic and specific names are explained; and though in certain cases the explanationmay give rise to bewildered surmise as to the sanity of those who christened them; in othersthe reasons are alluring. For instance; to learn that Chorizema celebrates a joyful danceexecuted by a thirsty Australian colonist at the sight of water irresistibly leads to fruitfulsearch for other gay improbabilities. Again; though the gardening type who; convertingCheiranthus to a more euphonious" Cherryanthus"; sticks to it through life may have our …,Plant names simplified.,1947,23
Scalable production of molybdenum disulfide based biosensors,Carl H Naylor; Nicholas J Kybert; Camilla Schneier; Jin Xi; Gabriela Romero; Jeffery G Saven; Renyu Liu; AT Charlie Johnson,We demonstrate arrays of opioid biosensors based on chemical vapor deposition grownmolybdenum disulfide (MoS2) field effect transistors (FETs) coupled to a computationallyredesigned; water-soluble variant of the μ-opioid receptor (MOR). By transferring dense filmsof monolayer MoS2 crystals onto prefabricated electrode arrays; we obtain high-quality FETswith clean surfaces that allow for reproducible protein attachment. The fabrication yield ofMoS2 FETs and biosensors exceeds 95%; with an average mobility of 2.0 cm2 V–1 s–1 (36cm2 V–1 s–1) at room temperature under ambient (in vacuo). An atomic length nickel-mediated linker chemistry enables target binding events that occur very close to the MoS2surface to maximize sensitivity. The biosensor response calibration curve for a syntheticopioid peptide known to bind to the wild-type MOR indicates binding affinity that matches …,ACS nano,2016,22
Observing oxygen vacancy driven electroforming in Pt–TiO2–Pt device via strong metal support interaction,Moon Hyung Jang; Rahul Agarwal; Pavan Nukala; Dooho Choi; AT Charlie Johnson; I-Wei Chen; Ritesh Agarwal,Oxygen vacancy formation; migration; and subsequent agglomeration into conductivefilaments in transition metal oxides under applied electric field is widely believed to beresponsible for electroforming in resistive memory devices; although direct evidence of sucha pathway is lacking. Here; by utilizing strong metal–support interaction (SMSI) between Ptand TiO2; we observe via transmission electron microscopy the electroforming event inlateral Pt/TiO2/Pt devices where the atomic Pt from the electrode itself acts as a tracer for thepropagating oxygen vacancy front. SMSI; which originates from the d-orbital overlapbetween Pt atom and the reduced cation of the insulating oxide in the vicinity of oxygenvacancies; was optimized by fabricating nanoscale devices causing Pt atom migrationtracking the moving oxygen vacancy front from the anode to cathode during …,Nano letters,2016,22
Large area molybdenum disulphide-epitaxial graphene vertical Van der Waals heterostructures,Debora Pierucci; Hugo Henck; Carl H Naylor; Haikel Sediri; Emmanuel Lhuillier; Adrian Balan; Julien E Rault; Yannick J Dappe; François Bertran; Patrick Le Fèvre; AT Charlie Johnson; Abdelkarim Ouerghi,Abstract Two-dimensional layered transition metal dichalcogenides (TMDCs) show greatpotential for optoelectronic devices due to their electronic and optical properties. A metal-semiconductor interface; as epitaxial graphene-molybdenum disulfide (MoS 2); is of greatinterest from the standpoint of fundamental science; as it constitutes an outstanding platformto investigate the interlayer interaction in van der Waals heterostructures. Here; we studylarge area MoS 2-graphene-heterostructures formed by direct transfer of chemical-vapordeposited MoS 2 layer onto epitaxial graphene/SiC. We show that via a direct transfer; whichminimizes interface contamination; we can obtain high quality and homogeneous van derWaals heterostructures. Angle-resolved photoemission spectroscopy (ARPES)measurements combined with Density Functional Theory (DFT) calculations show that the …,Scientific reports,2016,21
Optomechanical enhancement of doubly resonant 2D optical nonlinearity,Fei Yi; Mingliang Ren; Jason C Reed; Hai Zhu; Jiechang Hou; Carl H Naylor; AT Charlie Johnson; Ritesh Agarwal; Ertugrul Cubukcu,Emerging two-dimensional semiconductor materials possess a giant second order nonlinearresponse due to excitonic effects while the monolayer thickness of such active materialslimits their use in practical nonlinear devices. Here; we report 3300 times optomechanicalenhancement of second harmonic generation from a MoS2 monolayer in a doubly resonanton-chip optical cavity. We achieve this by engineering the nonlinear light-matter interactionin a microelectro-mechanical system enabled optical frequency doubling device based onan electrostatically tunable Fabry–Perot microresonator. Our versatile optomechanicalapproach will pave the way for next generation efficient on-chip tunable light sources;sensors; and systems based on molecularly thin materials.,Nano letters,2016,20
Friction; adhesion; and elasticity of graphene edges,D Patrick Hunley; Tyler J Flynn; Tom Dodson; Abhishek Sundararajan; Mathias J Boland; Douglas R Strachan,Abstract Frictional; adhesive; and elastic characteristics of graphene edges are determinedthrough lateral force microscopy. Measurements reveal a significant local frictional increaseat exposed graphene edges; whereas a single overlapping layer of graphene removes thislocal frictional increase. Comparison of lateral force and atomic force microscopymeasurements shows that local forces on the probe are successfully modeled with a verticaladhesion in the vicinity of the atomic-scale graphene steps which also provides a new low-load calibration method. Lateral force microscopy performed with carefully maintained low-adhesion probes shows evidence of elastic straining of graphene edges. Estimates of theenergy stored of this observed elastic response is consistent with out-of-plane bending ofthe graphene edge.,Physical Review B,2013,20
Synthesis and characterization of p–n homojunction-containing zinc oxide nanowires,Guohua Li; Abhishek Sundararajan; Anas Mouti; Yao-Jen Chang; Andrew R Lupini; Stephen J Pennycook; Douglas R Strachan; Beth S Guiton,We illustrate a simple method to synthesize highly ordered ZnO axial p–n homojunction-containing nanowires using a low temperature method; and on a variety of substrates. X-raydiffraction; scanning transmission electron microscopy; scanning electron microscopy; andRaman spectroscopy are used to reveal high quality single-crystalline wires with a [001]growth direction. The study of electrical transport through a single nanowire based deviceand cathodoluminescence via scanning transmission electron microscopy demonstrates thatan axial p–n junction exists within each ZnO nanowire. This represents the first lowtemperature synthesis of axial p–n homojunction-containing ZnO nanowires with uniformand controllable diameters.,Nanoscale,2013,19
A carbon nanotube immunosensor for Salmonella,Mitchell B Lerner; Brett R Goldsmith; Ronald McMillon; Jennifer Dailey; Shreekumar Pillai; Shree R Singh; AT Charlie Johnson,Antibody-functionalized carbon nanotube devices have been suggested for use as bacterialdetectors for monitoring of food purity in transit from the farm to the kitchen. Here we reportprogress towards that goal by demonstrating specific detection of Salmonella in complexnutrient broth solutions using nanotube transistors functionalized with covalently-bound anti-Salmonella antibodies. The small size of the active device region makes them compatiblewith integration in large-scale arrays. We find that the on-state current of the transistor issensitive specifically to the Salmonella concentration and saturates at low concentration (<1000 cfu/ml). In contrast; the carrier mobility is affected comparably by Salmonella and otherbacteria types; with no sign of saturation even at much larger concentrations (108 cfu/ml).,AIP Advances,2011,19
Conductance and addition spectrum of a 2× 2 quantum-dot arrayin the extended Hubbard model,Zhiming Yu; Thomas Heinzel; AT Johnson,Abstract We have studied the conductance and addition spectrum of a 2× 2 quantum-dotarray in the extended Hubbard model; ie; when the dots are coupled to each other by bothinterdot tunneling and an interdot Coulomb interaction. Under parameters appropriate forexperiment; both the addition spectrum and the conductance show a dramatic qualitativedifference between a situation dominated by interdot Coulomb interaction and the pureHubbard model. We calculate how; in the general case; these different contributionsinfluence the spectra. The effects of various types of disorder are discussed.,Physical Review B,1997,19
Scalable production of high-sensitivity; label-free DNA biosensors based on back-gated graphene field effect transistors,Jinglei Ping; Ramya Vishnubhotla; Amey Vrudhula; AT Charlie Johnson,Scalable production of all-electronic DNA biosensors with high sensitivity and selectivity is acritical enabling step for research and applications associated with detection of DNAhybridization. We have developed a scalable and very reproducible (> 90% yield)fabrication process for label-free DNA biosensors based upon graphene field effecttransistors (GFETs) functionalized with single-stranded probe DNA. The shift of the GFETsensor Dirac point voltage varied systematically with the concentration of target DNA. Thebiosensors demonstrated a broad analytical range and limit of detection of 1 fM for 60-merDNA oligonucleotide. In control experiments with mismatched DNA oligomers; the impact ofthe mismatch position on the DNA hybridization strength was confirmed. This class of highlysensitive DNA biosensors offers the prospect of detection of DNA hybridization and …,ACS nano,2016,18
Addition spectra of arrays of interacting quantum dots: Dependence on array geometry and magnetic field,Zhiming Yu; AT Johnson; Thomas Heinzel,Abstract We use the extended Hubbard model to calculate the addition spectra of linearchains and ring-shaped arrays of three; four; and five quantum dots. We find that for lineararrays; the addition spectra obtained with the pure Hubbard model and the pure chargingmodel show no qualitative differences. For rings of quantum dots; however; the Hubbardmodel always produces doubly degenerate states that are absent in the charging model. Weattribute the double degeneracy to the presence of a periodic boundary condition. Thedegeneracies are lifted by a perpendicular magnetic field B→. As B→ varies; the spectra areperiodic with a period of one magnetic flux quantum φ 0= h/e and symmetric about one-halfmagnetic flux quantum enclosed by the ring of quantum dots.,Physical Review B,1998,15
Electrolytic phototransistor based on graphene-MoS2 van der Waals pn heterojunction with tunable photoresponse,Hugo Henck; Debora Pierucci; Julien Chaste; Carl H Naylor; Jose Avila; Adrian Balan; Mathieu G Silly; Maria C Asensio; Fausto Sirotti; A T Charlie Johnson; Emmanuel Lhuillier; Abdelkarim Ouerghi,Van der Waals (vdW) heterostructures obtained by stacking 2D materials offer a promisingroute for next generation devices by combining different unique properties in completelynew artificial materials. In particular; the vdW heterostructures combine high mobility andoptical properties that can be exploited for optoelectronic devices. Since the pn junction isone of the most fundamental units of optoelectronics; we propose an approach for itsfabrication based on the intrinsic n doped MoS2 and the p doped bilayer graphene hybridinterfaces. We demonstrate the control of the photoconduction properties using electrolyticgating which ensures a low bias operation. We show that by finely choosing the dopingvalue of each layer; the photoconductive properties of the hybrid system can be engineeredto achieve magnitude and sign control of the photocurrent. Finally; we provide a simple …,Applied Physics Letters,2016,14
DNA-decorated carbon nanotube-based FETs as ultrasensitive chemical sensors: Discrimination of homologues; structural isomers; and optical isomers,SM Khamis; RA Jones; AT Charlie Johnson; G Preti; J Kwak; A Gelperin,We have explored the abilities of all-electronic DNA-carbon nanotube (DNA-NT) vaporsensors to discriminate very similar classes of molecules. We screened hundreds of DNA-NT devices against a panel of compounds chosen because of their similarities. Wedemonstrated that DNA-NT vapor sensors readily discriminate between series of chemicalhomologues that differ by single methyl groups. DNA-NT devices also discriminate amongstructural isomers and optical isomers; a trait common in biological olfactory systems; butonly recently demonstrated for electronic FET based chemical sensors.,Aip Advances,2012,14
Load-dependent friction hysteresis on graphene,Zhijiang Ye; Philip Egberts; Gang Hee Han; AT Charlie Johnson; Robert W Carpick; Ashlie Martini,Nanoscale friction often exhibits hysteresis when load is increased (loading) and thendecreased (unloading) and is manifested as larger friction measured during unloadingcompared to loading for a given load. In this work; the origins of load-dependent frictionhysteresis were explored through atomic force microscopy (AFM) experiments of a silicon tipsliding on chemical vapor deposited graphene in air; and molecular dynamics simulations ofa model AFM tip on graphene; mimicking both vacuum and humid air environmentalconditions. It was found that only simulations with water at the tip–graphene contactreproduced the experimentally observed hysteresis. The mechanisms underlying this frictionhysteresis were then investigated in the simulations by varying the graphene–waterinteraction strength. The size of the water–graphene interface exhibited hysteresis trends …,ACS nano,2016,13
In situ transmission electron microscopy modulation of transport in graphene nanoribbons,Julio A Rodríguez-Manzo; Zhengqing John Qi; Alexander Crook; Jae-Hyuk Ahn; AT Charlie Johnson; Marija Drndić,In situ transmission electron microscopy (TEM) electronic transport measurements innanoscale systems have been previously confined to two-electrode configurations. Here; weuse the focused electron beam of a TEM to fabricate a three-electrode geometry from acontinuous 2D material where the third electrode operates as side gate in a field-effecttransistor configuration. Specifically; we demonstrate TEM nanosculpting of freestandinggraphene sheets into graphene nanoribbons (GNRs) with proximal graphene side gates;together with in situ TEM transport measurements of the resulting GNRs; whoseconductance is modulated by the side-gate potential. The TEM electron beam displacescarbon atoms from the graphene sheet; and its position is controlled with nanometerprecision; allowing the fabrication of GNRs of desired width immediately prior to each …,ACS nano,2016,13
Coulomb-blockade oscillations in a quantum dot strongly coupled to leads,T Heinzel; AT Johnson; DA Wharam; JP Kotthaus; G Böhm; W Klein; G Tränkle; G Weimann,Abstract We report on the behavior of Coulomb-blockade oscillations in a semiconductorquantum dot; when its coupling to the leads is strong; ie; of the order of the dot's energy-levelseparation. Under magnetic fields 0.75≤ B≤ 4 T; we find a periodic amplitude modulationof both the peaks and the valleys of the conductance resonances. Assuming that only thelowest edge channel carries current; we apply a model; describing partly coherent and partlyincoherent electron transport; to explain these modulations. Within this model; the period ofthe amplitude modulation reflects the filling factor inside the dot. The amplitude of theenvelope function is determined by the fraction of electrons scattered inelastically in the dot;the electron temperature; and the transmission of the tunnel barriers that couple the dot tothe reservoirs. We show that it is only in the strong coupling regime where we can …,Physical Review B,1995,11
Quantifying the effect of ionic screening with protein-decorated graphene transistors,Jinglei Ping; Jin Xi; Jeffery G Saven; Renyu Liu; AT Charlie Johnson,Abstract Liquid-based applications of biomolecule-decorated field-effect transistors (FETs)range from biosensors to in vivo implants. A critical scientific challenge is to develop aquantitative understanding of the gating effect of charged biomolecules in ionic solution andhow this influences the readout of the FETs. To address this issue; we fabricated protein-decorated graphene FETs and measured their electrical properties; specifically the shift inDirac voltage; in solutions of varying ionic strength. We found excellent quantitativeagreement with a model that accounts for both the graphene polarization charge and ionicscreening of ions adsorbed on the graphene as well as charged amino acids associatedwith the immobilized protein. The technique and analysis presented here directly couple thecharging status of bound biomolecules to readout of liquid-phase FETs fabricated with …,Biosensors and Bioelectronics,2017,10
Measurement of sulfur L2; 3 and carbon K edge XANES in a polythiophene film using a high harmonic supercontinuum,AS Johnson; L Miseikis; DA Wood; DR Austin; C Brahms; S Jarosch; CS Strüber; P Ye; JP Marangos,We use a high harmonic generated supercontinuum in the soft X-ray region to measure X-ray absorption near edge structure (XANES) spectra in polythiophene (poly (3-hexylthiophene)) films at multiple absorption edges. A few-cycle carrier-envelope phase-stable laser pulse centered at 1800 nm was used to generate a stable soft X-raysupercontinuum; with amplitude gating limiting the generated pulse duration to a singleoptical half-cycle. We report a quantitative transmission measurement of the sulfur L 2; 3edge over the range 160–200 eV and the carbon K edge from 280 to 330 eV. These spectrashow all the features previously reported in the XANES spectra of polythiophene; but for thefirst time they are measured with a source that has an approximately 1 fs pulse duration. Thisstudy opens the door to measurements that can fully time-resolve the photoexcited …,Structural Dynamics,2016,10
Growth of graphene underlayers by chemical vapor deposition,Mopeli Fabiane; Saleh Khamlich; Abdulhakeem Bello; Julien Dangbegnon; Damilola Momodu; AT Charlie Johnson; Ncholu Manyala,We present a simple and very convincing approach to visualizing that subsequent layers ofgraphene grow between the existing monolayer graphene and the copper catalyst inchemical vapor deposition (CVD). Graphene samples were grown by CVD and thentransferred onto glass substrates by the bubbling method in two ways; either direct-transfer(DT) to yield poly (methyl methacrylate)(PMMA)/graphene/glass or (2) inverted transfer (IT)to yield graphene/PMMA/glass. Field emission scanning electron microscopy (FE-SEM) andatomic force microscopy (AFM) were used to reveal surface features for both the DT and ITsamples. The results from FE-SEM and AFM topographic analyses of the surfaces revealedthe underlayer growth of subsequent layers. The subsequent layers in the IT samples arevisualized as 3D structures; where the smaller graphene layers lie above the larger layers …,AIP Advances,2013,10
Formulations comprising ceftiofur and ketoprofen or ceftiofur and benzyl alcohol,*,The present invention relates to veterinary or pharmaceutical formulations which maycomprise ceftiofur; ketoprofen; benzyl alcohol; or effective combinations thereof. Theformulations of the present invention may include a wetting or dispersing agent; apreservative; a flocculating agent or resuspendability enhancer; and/or a biocompatible oilvehicle. This invention also provides for; inter alia; formulations for the treating; controllingand preventing of respiratory disorders; particularly bovine respiratory disease (BRD); inwarm-blooded animals; such as livestock;. This invention further provides for methods ofincreasing the resuspendability of an oily formulation which may comprise the addition.,*,2010,10
Quantized current in a quantum dot turnstile,LP Kouwenhoven,Abstract We have observed a quantized current in a lateral quantum dot defined by metalgates in the two dimensional electron gas (2DEG) of a GaAs/AlGaAs heterostructure. Bymodulating the tunnel barriers in the 2DEG with two phase shifted RF signals; andemploying the Coulomb blockade of electron tunneling; we produced quantized currentplateaus in the current-voltage characteristics at integer multiples of ef; where f is the RFfrequency. This demonstrates that an integer number of electrons pass through the quantumdot each RF cycle.,Physica Scripta,1992,10
Electrical tuning of exciton–plasmon polariton coupling in monolayer MoS2 integrated with plasmonic nanoantenna lattice,Bumsu Lee; Wenjing Liu; Carl H Naylor; Joohee Park; Stephanie C Malek; Jacob S Berger; AT Charlie Johnson; Ritesh Agarwal,Active control of light-matter interactions in semiconductors is critical for realizing nextgeneration optoelectronic devices with real-time control of the system's optical propertiesand hence functionalities via external fields. The ability to dynamically manipulate opticalinteractions by applied fields in active materials coupled to cavities with fixed geometricalparameters opens up possibilities of controlling the lifetimes; oscillator strengths; effectivemass; and relaxation properties of a coupled exciton–photon (or plasmon) system. Here; wedemonstrate electrical control of exciton–plasmon coupling strengths between strong andweak coupling limits in a two-dimensional semiconductor integrated with plasmonicnanoresonators assembled in a field-effect transistor device by electrostatic doping. As aresult; the energy-momentum dispersions of such an exciton–plasmon coupled system …,Nano letters,2017,9
Bandgap inhomogeneity of MoS2 monolayer on epitaxial graphene bilayer in van der Waals pn junction,Zeineb Ben Aziza; Hugo Henck; Daniela Di Felice; Debora Pierucci; Julien Chaste; Carl H Naylor; Adrian Balan; Yannick J Dappe; AT Charlie Johnson; Abdelkarim Ouerghi,Abstract Atomically thin MoS 2/graphene vertical heterostructures are promising candidatesfor nanoelectronic and optoelectronic technologies. In this work; we studied the optical andelectronic properties of n doped single layer MoS 2 on p doped bilayer graphene vdWheterostructures. We demonstrate a non-uniform strain between two different orientationangles of MoS 2 monolayer on top of epitaxial bilayer graphene. A significant downshift ofthe E 1 2g mode; a slight downshift of the A 1g mode; and photoluminescence shift andquenching are observed between two MoS 2 monolayers differently oriented with respect tographene; This could be mostly attributed to the strain-induced transition from direct toindirect bandgap in monolayer MoS 2. Moreover; our theoretical calculations aboutdifferently-strained MoS 2 monolayers are in a perfect accordance with the experimentally …,Carbon,2016,9
Atomically precise nanoribbons and related methods,*,Disclosed are atomically precise nanoribbons formed by gradient-driven catalytic etching ofcrystalline substrates to produce edges formed along specific crystallographic axes bythermally-activated particles. Also provided are related methods for fabrication of thesenanoribbon structures. Further provided are devices and related methods for powergeneration and for detection of specific targets using the disclosed structures.,*,2012,9
Charging effects in quantum dots,LP Kouwenhoven; NC van der Vaart; AT Johnson; CJPM Harmans; JG Williamson; AAM Staring; CT Foxon,Abstract We have studied single electron charging effects in lateral quantum dots; defined bymetal gates in the two dimensional electron gas of a GaAs/AlGaAs heterostructure. Thecharging effects cause periodic oscillations in the conductance versus gate voltage; whereeach period corresponds to a change of one electron in the dot. A study of the dependenceof these Coulomb oscillations on the barrier conductances shows that charging effectsbecome visible precisely when the barrier conductances become smaller than the quantizedconductance value 2e 2/h. The amplitude of the Coulomb oscillations increases graduallyupon reducing the barrier conductances to a value much smaller than 2e 2/h. We determineexperimentally the total capacitance involved; and thereby the corresponding chargingenergy.,*,1991,9
