Micrometre and nanometre scale patterning of binary polymer brushes; supported lipid bilayers and proteins,Alexander Johnson; Jeppe Madsen; Paul Chapman; Abdullah Alswieleh; Omed Al-Jaf; Peng Bao; Claire R Hurley; Michaël L Cartron; Stephen D Evans; Jamie K Hobbs; C Neil Hunter; Steven P Armes; Graham J Leggett,Binary polymer brush patterns were fabricated via photodeprotection of an aminosilane witha photo-cleavable nitrophenyl protecting group. UV exposure of the silane film through amask yields micrometre-scale amine-terminated regions that can be derivatised toincorporate a bromine initiator to facilitate polymer brush growth via atom transfer radicalpolymerisation (ATRP). Atomic force microscopy (AFM) and imaging secondary ion massspectrometry (SIMS) confirm that relatively thick brushes can be grown with high spatialconfinement. Nanometre-scale patterns were formed by using a Lloyd's mirror interferometerto expose the nitrophenyl-protected aminosilane film. In exposed regions; protein-resistantpoly (oligo (ethylene glycol) methyl ether methacrylate)(POEGMEMA) brushes were grownby ATRP and used to define channels as narrow as 141 nm into which proteins could be …,Chemical science,2017,1
Monolayer WS 2 crossed with an electro-spun PEDOT-PSS nano-ribbon: Fabricating a Schottky diode,Deliris N Ortiz; Josee Vedrine; Nicholas J Pinto; Carl H Naylor; AT Charlie Johnson,Abstract WS 2 and PEDOT-PSS were individually characterized with the goal of analyzingcharge transport across a hetero-junction formed by these two materials. In thermalequilibrium electron flow from the WS 2 conduction band into the polymer LUMO level leadsto band bending that creates a potential barrier preventing further current. The measuredcurrent-voltage (I DS-V DS) curve across the hetero-junction was non-linear and asymmetricsimilar to a diode; with a turn-on voltage of 1.4 V and a rectification ratio of 12. The device I–V data were analyzed using the standard thermionic emission model of a Schottky junctionand yielded an ideality parameter of 1.9 and a barrier height of 0.58 eV. This faciletechnique is the first report on a nano-diode fabricated using WS 2 and PEDOT-PSS;opening up the possibility of extending this work to include other layered transition metal …,Materials Science and Engineering: B,2016,1
MoS2 based dual input logic AND gate,Luis M Martinez; Nicholas J Pinto; Carl H Naylor; AT Charlie Johnson,Crystalline monolayers of CVD MoS2 are used as the active semiconducting channel in asplit-gate field effect transistor. The device demonstrates logic AND functionality that iscontrolled by independently addressing each gate terminal with±10V. When+ 10V wassimultaneously applied to both gates; the device was conductive (ON); while any othercombination of gate voltages rendered the device resistive (OFF). The ON/OFF ratio of thedevice was∼ 35 and the charge mobility using silicon nitride as the gate dielectric was 1.2cm2/Vs and 0.1 cm2/Vs in the ON and OFF states respectively. Clear discrimination betweenthe two states was observed when a simple circuit containing a load resistor was used to testthe device logic AND functionality at 10Hz. One advantage is that split gate technology canreduce the number of devices required in complex circuits; leading to compact electronics …,AIP Advances,2016,1
Crystallographically-oriented carbon nanotubes grown on few-layer graphene films,*,A thermal and electrical conducting apparatus includes a few-layer graphene film having a thicknessD where D≦1.5 nm and a plurality of carbon nanotubes crystallographically aligned with thefew-layer graphene film … This utility patent application claims the benefit of priority in US ProvisionalPatent Application Ser. No. 61/571;764 filed on 1 Jul. 2011; the entirety of the disclosure of whichis incorporated herein by reference … This invention was made with government support undergrant DMR-0805136 awarded by the National Science Foundation. The government has certainrights in the invention … This document relates to carbon nanotube production and; moreparticularly; crystallographically-oriented carbon nanotubes grown on few-layer graphenefilm … Carbon nanotubes (NTs) and graphene have tremendous potential for future nanoscaleapplications due to their remarkable physical properties; such as high carrier mobility …,*,2016,1
Nanogaps on atomically thin materials as non-volatile read/writable memory devices,*,The present invention relates to the presence of nanogaps across a metal dispersed over anatomically-thin material; such that the nanogap exposes the atomically-thin material. Theresulting device offers an ultra-short gap with ballistic transport and demonstrated switchingin the presence of a gate or dielectric material in close proximity to the channel.,*,2016,1
Electronic and non-adiabatic dynamics: general discussion,Andrew J Orr-Ewing; Jan RR Verlet; Tom J Penfold; Russell S Minns; Michael P Minitti; Theis I Sølling; Oliver Schalk; Markus Kowalewski; Jon P Marangos; Michael A Robb; Allan S Johnson; Hans Jakob Wörner; Dmitrii V Shalashilin; RJ Dwayne Miller; Wolfgang Domcke; Kiyoshi Ueda; Peter M Weber; Raluca Cireasa; Morgane Vacher; Gareth M Roberts; Piero Decleva; Filippo Bencivenga; Daniel M Neumark; Oliver Gessner; Albert Stolow; Pankaj Kumar Mishra; Iakov Polyak; Kyoung Koo Baeck; Adam Kirrander; Danielle Dowek; Álvaro Jiménez-Galán; Fernando Martín; Shaul Mukamel; Taro Sekikawa; Maxim F Gelin; Dave Townsend; Dmitry V Makhov; Simon P Neville,Jon Marangos opened a general discussion of the paper by Fernando Martín: The work wasin part motivated by IR XUV probes and strong IR field experiments. Couplings to cationresonances are clearly very important in the IR/vis region–what do you anticipate to be therole of these strong field couplings and how can you unpick this effect in theexperiment?Fernando Martín responded: In the experiment; the molecule is ionized by usinga single XUV attosecond pulse. This process is clean and it is not contaminated by thepresence of an IR pulse. This second pulse is used to probe the dynamics induced by theattosecond pulse. Therefore it is at this stage where the IR field can induce additionalcouplings between the cationic states that might complicate the analysis of the dynamicsinduced by the attosecond pulse or even blur it. Our calculations were able to describe …,Faraday discussions,2016,1
Complete characterization of short wavelength infrared few cycle pulses via third harmonic generation dispersion scan,AS Wyatt; AS Johnson; P Matía-Hernando; O Alexander; RT Chapman; C Cacho; DR Austin; JWG Tisch; JP Marangos; E Springate,Abstract We present preliminary experimental results of third harmonic generationdispersion scans for the complete temporal characterization of fewcycle (~ 10fs)shortwavelength infrared (1 2.5 ľm) intense (400ľJ) laser pulses. Some of the subtleties ofusing third harmonic generation in bulk; such as phase matching and selfphase modulation;are discussed.,Super Intense Laser-Atom Physics (SILAP) XI,2015,1
Eigenmode super-resolution imaging in arbitrary optical systems,Allan S Johnson; Kevin Piché; Jeff Z Salvail; Jonathan Leach; Robert W Boyd,We investigate optical super-resolution by means of eigenmode decomposition in arbitraryimaging systems. This technique is applicable for arbitrary objects but requires a knowledgeof the eigenmodes of the imaging system. We outline a reconstruction technique that can beapplied even to systems in which the eigenmodes are not orthogonal; and we presentnumerical simulations of eigenmode super-resolution in systems with resolution limited bothby diffraction and by aberrations. Our results indicate that optical super-resolution by directeigenmode decomposition provides a versatile method of sub-diffraction and distortion-freeimaging in arbitrary optical systems.,Journal of Modern Optics,2013,1
Análisis del grado de cumplimiento y estimación de costos para la implementación de la Norma para Sistemas Sostenibles de Producción Ganadera en Río Blanco...,Diana Karina Ochoa Gordillo,En Nicaragua; la ganadería se ha convertido en uno de los rubros de mayor crecimiento ycontribución a la economía nacional; sin embargo; en este país se han venido realizandopastoreos excesivos; cultivos en laderas; tumba y quema de vegetación; llevando a ladegradación de las tierras. Además; las malas prácticas ganaderas han causado la malacalidad en los productos derivados del ganado siendo afectada la salud de las personas yla economía de los productores; provocando a su vez pérdidas significativas en laproductividad de las fincas y daños ambientales a largo plazo. Para hacer frente a estosproblemas; se ha venido promoviendo la incorporación de buenas prácticas ganaderas;que permitan mejorar los sistemas de producción y contribuyan a la conservación de losrecursos naturales. Por lo que en el presente estudio se realizaron entrevistas a 63 …,*,2013,1
Gas-phase extraction of lead and iron from their oxides in a fluidized-bed reactor,LD Van Dyk; EMR Mariba; Y Chen; A Johnson; JH Potgieter,SYNOPSIS The extraction of iron and lead from their oxides with a volatile organic ligandsuch as acetylacetone in the gas phase offers potential advantages of lower energyconsumption; recycling of the extractant; recovery of pure metals; and a reducedenvironmental impact compared with conventional extraction processes. The influence ofreaction temperature; ligand flow rate; and metal oxide levels on the extraction and rates ofreaction of iron and lead from single metal oxide (synthetic haematite (Fe 2 O 3) andsynthetic massicot (PbO)) systems in a fluidized bed was studied. It was found that at theinvestigated acetylacetone flow rates; the influence of mass transfer was limited; but that thereaction suffered from reactant starvation. When the metal load increased the effect ofstarvation on the rate of reaction also increased. The reaction kinetics increased with an …,Journal of the Southern African Institute of Mining and Metallurgy,2012,1
Novel dicyclanil-based shelf stable aqueous suspension and non-aqueous solution pour-on and spray-on formulations useful for the prevention and treatment of ins...,*,This invention relates to topically active compositions; including pour-on and spray-onformulations; comprising insect growth regulator (IGR) insecticides prepared as aqueoussuspension formulations; or as non-aqueous solution formulations; and to the methods ofmaking these formulations; and to methods of using these formulations for the treatmentand/or prevention of insect infestation in animals.,*,2011,1
Structural and magnetic properties of bulk nanocrystalline erbium metal,Ming Yue; Jun Huang; Weiqiang Liu; Dongtao Zhang; Jiuxing Zhang,Bulk nanocrystalline Erbium metals were prepared via Spark Plasma Sintering (SPS) andsubsequent annealing process. The nanocrystalline Er metals have the same hexagonalclose packed structure as that of coarse-grained sample. Decrease in grain size results inremarkable changes in the three magnetic ordering temperatures of the nanocrystalline Ermetal. At 5 K; the magnetization drops by 10.9%; while the coercivity increases by 4 times fornanocrystalline Er compared with those of coarse-grained sample. These results indicatethe remarkable influence of the nanostructure on the magnetism of Er due to finite size effect.,AIP Advances,2011,1
Why can’t experimentalists agree on the superconducting critical exponents?,MC Sullivan; DR Strachan; Su Li; Hua Xu; K Segawa; Yoichi Ando; Steven M Anlage; CJ Lobb,Abstract The scaling analysis of voltage vs. current curves has been an invaluable tool in thestudy of the normal-superconducting phase transition; both in zero-field and in the vortex–glass transition in a field. However; we have recently shown that the conventional scalinganalysis is too flexible to uniquely determine the critical parameters. We have also shownthat extrinsic effects such as current noise; small magnetic fields (for the zero-field transition);and finite size effects can obscure and even destroy the three-dimensional phase transition.These factors have led to the wide range of values for the dynamic critical exponent z andthe static critical exponent ν reported in the literature; even for the zero-field transition. Wehave developed a criterion that removes the flexibility in the scaling analysis and haveconducted experiments to eliminate the extrinsic effects described above. Our results …,Physica C: Superconductivity,2008,1
Effect of thermal treatments on the transduction behaviors of conductometric hydrogen gas sensors integrated with HCl-doped polyaniline nanofibers,Pen-Cheng Wang; Yaping Dan; Luke A Somers; Alan G MacDiarmid; AT Charlie Johnson,Abstract We present the effect of thermal treatments on the transduction behaviors of HCl-doped polyaniline (PANI) nanofibers integrated in conductometric devices upon exposure to1% H 2 (carried by N 2). After drying in N 2 at 25ºC for 12 hours; devices showed a∼ 10%decrease in electrical resistance upon exposure to 1% H 2. However; devices subject to 12-hour drying in N 2 at 25ºC followed by further thermal treatments in N 2 at 100ºC; 164ºC or200ºC for 30 minutes showed different transduction behaviors. Specifically; devices subjectto thermal treatments at 100ºC and 164ºC showed a decrease in electrical resistance by∼7% and< 0.5%; respectively. More interestingly; the device subject to thermal treatment at200ºC showed a transduction behavior with opposite polarity; ie a∼ 5% increase inelectrical resistance upon exposure to 1% H 2. SEM; FTIR and TGA were employed to …,MRS Online Proceedings Library Archive,2007,1
Castability and biocompatibility of novel fluorcanasite glass-ceramics,S Bandyopadhyay-Ghosh; Ian M Reaney; A Johnson; IM Brook; K Hurrell-Gillingham; PV Hatton,Abstract: Article Preview Article Preview Article Preview Novel fluorcanasite based glass-ceramics were produced by controlled two stage heattreatment of as-cast glasses.Castability of parent glasses was determined using a graduated spiral cast piece.Fluorcanasite glasses were also cast to form complex shapes using the lost wax castingtechnique. Gypsum and phosphate bonded investments were used to investigate their effecton the casting process; cast surface crystallinity and biocompatibility. The stoichiometriccomposition had the greatest castability but the other two modified compositions also hadgood castability. X-ray diffraction showed similar bulk crystallisation for each glassirrespective of the investment material. However; some differences in surface crystallisationin the presence of different investment materials were detected. Discs cast using gypsum …,Key Engineering Materials,2006,1
Supporting information for,Jinyong Wang; Yan Li,All manipulations were performed either in an Ar-filled glovebox or under an Ar or N2atmosphere using standard Schlenk techniques. Et2O and THF were dried overNa/benzophenone and distilled before use under an Ar atomosphere. The dilithiatedmethylenebis (diphenylphosphoranimine) salt;([Li2L] 2); was prepared as previouslydescribed. All other reagents were used as received from commercial sources. All analyticaltechniques were performed within the Department of Chemistry at the University of Alberta.NMR spectra,Anal. Chem,2004,1
A Key Characteristic in Co-development Performance Measurement Systems: Transparency,AS Johnson; S Evans,The requirement for the UK first tier automotive component suppliers to become world classat developing products with their customers (Co-development) is now seen as an orderwinning criteria (Foresight; 1995). Co-development is defined as “the ability of vehiclemanufacturers and their suppliers to develop competitive products together”(EPSRC GrantNo GR/K78553). The automotive suppliers development capability will in part determinehow effective they are at competing in the global market (Davies; 1994). The automotiveindustry is now moving towards a structure based on partnership where profit is sharedamongst the different players in the value chain. This is in contrast to the traditional structurebased on confrontation (Lamming; 1986). Vehicle manufacturers (VM's) will focus theiractivities on the design of the car; the manufacturing of very few key components based …,Managing New Product Innovation,2003,1
Analysis of the property of dot-controllers in DMC,Z-l Luo; Chao Gao; Q-j Zhang,*,JOURNAL-LANZHOU UNIVERSITY NATURAL SCIENCES,2002,1
Is there a vortex-glass transition in high-temperature superconductors?,DR Strachan; MC Sullivan; P Fournier; SP Pai; T Venkatesan; CJ Lobb,Abstract: We show that DC voltage versus current measurements of a YBCO micro-bridge ina magnetic field can be collapsed onto scaling functions proposed by Fisher; Fisher; andHuse; as is widely reported in the literature. We find; however; that good data collapse isachieved for a wide range of critical exponents and temperatures. These results stronglysuggest that agreement with scaling alone does not prove the existence of a phasetransition. We propose a criterion to determine if the data collapse is valid; and thus if aphase transition occurs. To our knowledge; none of the data reported in the literature meetour criterion.,arXiv preprint cond-mat/0011014,2000,1
Further delineation of the chromosome segment associated with biliary atresia in cat eye syndrome (CES).,B Fernandez; I Teshima; A Johnson; H McDermid; D Chitayat,*,AMERICAN JOURNAL OF HUMAN GENETICS,1997,1
A numerical technique for interpreting the bioluminescence ATP assay,MJ Krones; AT Johnson; OJ Hao,Abstract A numerical technique coupled with automatic data acquisition was developed forthe rapid and accurate evaluation of the bioluminescence ATP assay using the luciferin‐luciferase reaction. An exponential decay equation is fitted to the light emission curve of asample containing ATP. The integral of the curve was found to be a reliable indicator of theamount of ATP in a sample regardless of the overall shape of the curve; peak height; or rateof initial rise. This method is useful for analyzing extracts from environmental samplescontaining contaminating colloids and molecular species which tend to alter the lightemission curve.,Environmental technology,1990,1
Acidogenic fermentation of dairy manure,MJ Krones; AT Johnson; OJ Hao,*,American Society of Agricultural Engineers (Microfiche collection)(USA),1988,1
Towards African authenticity: language and literary form,János Riesz; Richard L Taylor; Jack Drake Rollins; Alex D Johnson,*,*,1985,1
DISCUSSION. EXAMPLES OF SEWAGE SLUDGE INCINERATION IN THE UK.,IC Camp; AD MASKELL; FMW KING; GTJ FOX; RM BELLIS; LF PHILLIPS; D BAILEY; D PHILPOTT; JT CALVERT; MH BOX; M BICKNELL; LH THOMPSON; RS GALE; WJ FISHER,Several years ago; when I volunteered this Paper; I was resolved that it would be about ascheme taken to the construction stage. At that time 1 was mainly concerned with the WaterPollution Control Works at Esher but; while preparing the Paper; installations for MiltonKeynes; Caernarvon and Banbury came under consideration in the ofice. Whilst not directlyconcerned in those three schemes; my colleagues supplied details so as to broaden thescope and interest of the Paper. 69. The present situation is that civil work at Esher andMilton Keynes is well advanced and delivery of equipment has commenced. The machinerycontract for Caernarvon began in November 1973 but there are many design aspects whichhave yet to be finalized. The scheme for Banbury has not yet materialized as the broaderconcept of a regional scheme of disposal with other solid wastes is being considered. 70 …,Proceedings of the Institution of Civil Engineers,1974,1
Thermal Relaxation in Gases: A New Method of Analysing the Experimental Data,ACJ Johnson,Abstract It is shown that in the case of a single relaxation in a gas the relaxation time can befound in a simple manner if measurements are made of both the velocity dispersion and theabsorption per wavelength. The problem is reduced to one of fitting circles and straight linesto the data. In the case of a multiple relaxation it is shown how the individual relaxation timescan be found. The method is applied to some published results in a few gases to show theworking of the method in practice.,Proceedings of the Physical Society,1959,1
Abraham johnson and henry johnson,*,*,*,1849,1
Surface thiolation of silicon for antifouling application,Xiaoning Zhang; Pei Gao; Valerie Hollimon; DaShan Brodus; Arion Johnson; Hongmei Hu,Thiol groups grafted silicon surface was prepared as previously described. 1H; 1H; 2H; 2H-perfluorodecanethiol (PFDT) molecules were then immobilized on such a surface throughdisulfide bonds formation. To investigate the contribution of PFDT coating to antifouling; theadhesion behaviors of Botryococcus braunii (B. braunii) and Escherichia coli (E. coli) werestudied through biofouling assays in the laboratory. The representative microscope imagessuggest reduced B. braunii and E. coli accumulation densities on PFDT integrated siliconsubstrate. However; the antifouling performance of PFDT integrated silicon substratedecreased over time. By incubating the aged substrate in 10 mM TCEP· HCl solution for 1 h;the fouled PFDT coating could be removed as the disulfide bonds were cleaved; resulting inreduced absorption of algal cells and exposure of non-fouled silicon substrate surface …,Chemistry Central Journal,2018,*
One-Dimensional Conducting Channel along Mirror Twin Boundaries of Monolayer CVD WSe 2 Flakes,Qicheng Zhang; Mengqiang Zhao; Zhaoli Gao; Zhengtang Luo; Alan Johnson,Edge states protected by non-valley mixing have been predicted in bilayer graphene and discoveredalong mirror twin boundaries (MTBs). The robustness of these edge states is closely associatedwith whether valley is a good quantum number. In TMDCs; who have larger band gap; similarsedge states along MTBs are predicted by first-principle calculations; and identified by thestate-of-art angle resolved photoemission spectroscopy (ARPES). We have synthesized largesize monolayer WSe2; a type of 2H phase TMDC; with MTBs and other line defects from differentmerging angles by chemical vapor deposition (CVD). The predicted one-dimensional channelhas been characterized for different line defects by nano-ARPES to reflect the effects of the wayvalleys join together … The American Physical Society (APS) is a non-profit membership organizationworking to advance the knowledge of physics.,Bulletin of the American Physical Society,2018,*
„3D-augmented-reality “-Visualisierung für die navigierte Osteosynthese von Beckenfrakturen,N Befrui; M Fischer; B Fuerst; S-C Lee; J Fotouhi; S Weidert; A Johnson; E Euler; G Osgood; N Navab; W Böcker,Zusammenfassung Hintergrund Trotz großer Fortschritte in der Entwicklung der Hard-undSoftware von Navigationssystemen finden diese aufgrund ihrer vermeintlichen Komplexität;umständlichen Integration in klinische Arbeitsabläufe und fraglichen Vorteilen gegenüberkonventionellen bildgebenden Verfahren bisher wenig Einsatz in den heutigenOperationssälen. Ziel der Arbeit Entwicklung einer „Augmented-reality “(AR)-Darstellung zurchirurgischen Navigation ohne Infrarot („IR “)-Tracking-Marker und Vergleich zumkonventioneller Röntgen in einem simulierten Eingriff. Material und MethodenNavigationssystem bestehend aus „Cone-beam-CT “(CBCT)-fähigem C‑Bogen und „Red-green-blue-depth “(RGBD)-Kamera. Testung durch Kirschner (K)-Draht-Platzierung inModellen unter Berücksichtigung der benötigten Zeit; der Strahlendosis und der …,Der Unfallchirurg,2018,*
Percutaneous Pelvis Fixation Using the Camera-augmented C-arm,Mathias Unberath; Javad Fotouhi; Emerson Tucker; Alex Johnson; Greg Osgood; Nassir Navab,Zusammenfassung Today; percutaneous techniques are widely accepted for treatment ofbone fractures in spine and pelvis. These techniques are enabled by modern imagingtechnology; such as mobile C-arm X-ray machines; and allow for substantial reductions inblood loss; collateral tissue damage; and overall surgery duration [1]. While minimallyinvasive surgery is beneficial for the patient; it increases the task load for the surgeon.,*,2018,*
Coincidence timing of femtosecond optical pulses in an X-ray free electron laser,Alvaro Sanchez-Gonzalez; Allan S Johnson; Ann Fitzpatrick; Christopher DM Hutchison; Clyde Fare; Violeta Cordon-Preciado; Gabriel Dorlhiac; Josie L Ferreira; Rhodri M Morgan; Jon P Marangos; Shigeki Owada; Takanori Nakane; Rie Tanaka; Kensuke Tono; So Iwata; Jasper J van Thor,Femtosecond resolution pump-probe experiments are now routinely carried out at X-rayFree Electron Lasers; enabled by the development of cross-correlation “time-tools” whichcorrect the picosecond-level jitter between the optical and X-ray pulses. These tools providevery accurate;< 10 fs; measurement of the relative arrival time; but do not provide a measureof the absolute coincidence time in the interaction. Cross-correlation experiments usingtransient reflectivity in a crystal are commonly used for this purpose; and to date noquantitative analysis of the accuracy or stability of absolute coincidence time determinationhas been performed. We have performed a quantitative analysis of coincidence timing at theSACLA facility through a cross-correlation of 100±10 fs; 400 nm optical pulses with 7 fs; 10.5keV X-ray pulses via transient reflectivity in a cerium-doped yttrium aluminum garnet …,Journal of Applied Physics,2017,*
