Semantics; types and effects for XML updates,Michael Benedikt; James Cheney,Abstract The W3C recently released the XQuery Update Facility 1.0; a CandidateRecommendation for an XML update language. It appears likely that this proposal willbecome standard. XQuery has been equip-ped with a formal semantics and sound typesystem; but there has been little work on static analysis or typechecking of XML updates; andthe typing rules in the current W3C proposal appear unsound for “transform” queries thatperform embedded updates. In this paper; we investigate the problem of schema alteration;or synthesizing an output schema describing the result of an update applied to a given inputschema. We review regular expression type systems for XQuery; present a core languageand semantics for W3C-style XML updates; and develop an effect analysis and schemaalteration; which can be used as the basis for sound typechecking for queries involving “ …,International Symposium on Database Programming Languages,2009,36
A simple sequent calculus for nominal logic,James Cheney,Abstract Nominal logic is a variant of first-order logic that provides support for reasoningabout bound names in abstract syntax. A key feature of nominal logic is the new-quantifier;which quantifies over fresh names (names not appearing in any values considered so far).Previous attempts have been made to develop convenient rules for reasoning with the new-quantifier; but we argue that none of these attempts is completely satisfactory. In this articlewe develop a new sequent calculus for nominal logic in which the rules for the new-quantifier are much simpler than in previous attempts. We also prove several structural andmetatheoretic properties; including cut-elimination; consistency and equivalence to Pitts'axiomatization of nominal logic.,Journal of Logic and Computation,2014,33
Completeness and Herbrand theorems for nominal logic,James Cheney,Abstract Nominal logic is a variant of first-order logic in which abstract syntax with namesand binding is formalized in terms of two basic operations: name-swapping and freshness. Itrelies on two important principles: equivariance (validity is preserved by name-swapping);and fresh name generation (“new” or fresh names can always be chosen). It is inspired by aparticular class of models for abstract syntax trees involving names and binding; drawing onideas from Fraenkel-Mostowski set theory: finite-support models in which each value candepend on only finitely many names.,The Journal of Symbolic Logic,2006,33
Relating nominal and higher-order pattern unification,James Cheney,Abstract. Higher-order pattern unification and nominal unification are two approaches tounifying modulo some form of α-equivalence (consistent renaming of bound names). Thehigher-order and nominal approaches seem superficially dissimilar. However; we show thata natural concretion (or name-application) operation for nominal terms can be used tosimulate the behavior of higherorder patterns. We describe a form of nominal terms callednominal patterns that includes concretion and for which unification is equivalent to a specialcase of higher-order pattern unification; and then show that full higher-order patternunification can be reduced to nominal unification via nominal patterns.,Proceedings of the 19th international workshop on Unification (UNIF 2005),2005,33
Causality and the semantics of provenance,James Cheney,Abstract: Provenance; or information about the sources; derivation; custody or history ofdata; has been studied recently in a number of contexts; including databases; scientificworkflows and the Semantic Web. Many provenance mechanisms have been developed;motivated by informal notions such as influence; dependence; explanation and causality.However; there has been little study of whether these mechanisms formally satisfyappropriate policies or even how to formalize relevant motivating concepts such ascausality. We contend that mathematical models of these concepts are needed to justify andcompare provenance techniques. In this paper we review a theory of causality based onstructural models that has been developed in artificial intelligence; and describe work inprogress on a causal semantics for provenance graphs.,arXiv preprint arXiv:1004.3241,2010,32
Row-based effect types for database integration,Sam Lindley; James Cheney,Abstract We present CoreLinks; a call-by-value variant of System F with row polymorphism;row-based effect types; and implicit subkinding; which forms the basis for the Links webprogramming language. We focus on extensions to CoreLinks for database programming.The effect types support abstraction over database queries; while ensuring that queries aretranslated predictably to idiomatic and efficient SQL at run-time. Subkinding staticallyenforces the constraint that queries must return a list of records of base type. Polymorphismover the presence of record labels supports abstraction over database queries; inserts;deletes and updates.,Proceedings of the 8th ACM SIGPLAN workshop on Types in language design and implementation,2012,31
Destabilizers and independence of XML updates,Michael Benedikt; James Cheney,Abstract Independence analysis is the problem of determining whether an update affects theresult of a query; eg a constraint or materialized view. We develop a new; modularframework for static independence analysis that decomposes the problem into twoorthogonal subproblems: approximating the destabilizer; that is; a finite representation of theset of updates that can change the result of the query; and testing whether the update anddestabilizer overlap via an intersection analysis. Focusing on XML queries as the viewlanguage and the XQuery Update Facility as the update language; we present a syntacticquery rewriting algorithm for translating queries to destabilizers; and show that intersectionchecking can be reduced to satisfiability problems for which efficient checkers already exist.We present an implementation based on an expressive tree satisfiability checker and a …,Proceedings of the VLDB Endowment,2010,30
Schema-based independence analysis for XML updates,Michael Benedikt; James Cheney,Abstract Query-update independence analysis is the problem of determining whether anupdate affects the results of a query. Query-update independence is useful for avoidingrecomputation of materialized views and may have applications to access control andconcurrency control. This paper develops static analysis techniques for query-updateindependence problems involving core XQuery queries and updates with a snapshotsemantics (based on the W3C XQuery Update Facility proposal). Our approach takesadvantage of schema information; in contrast to previous work on this problem. We formalizeour approach; sketch a proof of correctness; and report on the performance and accuracy ofour implementation.,Proceedings of the VLDB Endowment,2009,29
Towards a theory of information preservation,James Cheney; Carl Lagoze; Peter Botticelli,Abstract Digital preservation is a pressing challenge to the library community. In this paper;we describe the initial results of our efforts towards understanding digital (as well astraditional) preservation problems from first principles. Our approach is to use the languageof mathematics to formalize the concepts that are relevant to preservation. Our theory ofpreservation spaces draws upon ideas from logic and programming language semantics todescribe the relationship between concrete objects and their information contents. We alsodraw on game theory to show how objects change over time as a result of uncontrollableenvironment effects and directed preservation actions. In the second half of this paper; weshow how to use the mathematics of universal algebra as a language for objects whoseinformation content depends on many components. We use this language to describe …,International Conference on Theory and Practice of Digital Libraries,2001,29
Prov-dm: The prov data model,Khalid Belhajjame; Reza B'Far; James Cheney; Sam Coppens; Stephen Cresswell; Yolanda Gil; Paul Groth; Graham Klyne; Timothy Lebo; Jim McCusker; Simon Miles; James Myers; Satya Sahoo; Curt Tilmes,Provenance is information about entities; activities; and people involved in producing apiece of data or thing; which can be used to form assessments about its quality; reliability ortrustworthiness. PROV-DM is the conceptual data model that forms a basis for the W3Cprovenance (PROV) family of specifications. PROV-DM distinguishes core structures;forming the essence of provenance information; from extended structures catering for morespecific uses of provenance. PROV-DM is organized in six components; respectively dealingwith:(1) entities and activities; and the time at which they were created; used; or ended;(2)derivations of entities from entities;(3) agents bearing responsibility for entities that weregenerated and activities that happened;(4) a notion of bundle; a mechanism to supportprovenance of provenance;(5) properties to link entities that refer to the same thing; and …,*,2013,28
Provenance as dependency analysis,James Cheney; Amal Ahmed; Umut A Acar,Abstract Provenance is information recording the source; derivation or history of someinformation. Provenance tracking has been studied in a variety of settings; particularlydatabase management systems. However; although many candidate definitions ofprovenance have been proposed; the mathematical or semantic foundations of dataprovenance have received comparatively little attention. In this paper; we argue thatdependency analysis techniques familiar from program analysis and program slicingprovide a formal foundation for forms of provenance that are intended to show how (part of)the output of a query depends on (parts of) its input. We introduce a semanticcharacterisation of such dependency provenance for a core database query language; showthat minimal dependency provenance is not computable; and provide dynamic and static …,Mathematical Structures in Computer Science,2011,28
Recording provenance for sql queries and updates,Stijn Vansummeren; James Cheney,Knowing the origin of data (ie; where the data was copied or created from)---its provenance---is vital for assessing the trustworthiness of contemporary scientific databases such asUniProt and SWISS-PROT. Unfortunately; provenance information must currently berecorded manually; by added effort of the database maintainer. Since such maintenance istedious and error-prone; it is desirable to provide support for recording provenance in thedatabase system itself. We review a recent proposal for incorporating such support; as wellas its theoretical properties.,*,2007,28
Dynamic provenance for SPARQL updates,Harry Halpin; James Cheney,Abstract While the Semantic Web currently can exhibit provenance information by using theW3C PROV standards; there is a “missing link” in connecting PROV to storing and queryingfor dynamic changes to RDF graphs using SPARQL. Solving this problem would be requiredfor such clear use-cases as the creation of version control systems for RDF. While someprovenance models and annotation techniques for storing and querying provenance dataoriginally developed with databases or workflows in mind transfer readily to RDF andSPARQL; these techniques do not readily adapt to describing changes in dynamic RDFdatasets over time. In this paper we explore how to adapt the dynamic copy-pasteprovenance model of Buneman et al.[2] to RDF datasets that change over time in responseto SPARQL updates; how to represent the resulting provenance records themselves as …,International Semantic Web Conference,2014,27
Tradeoffs in XML database compression,James Cheney,Large XML data files; or XML databases; are now a common way to distribute scientific andbibliographic data; and storing such data efficiently is an important concern. A number ofapproaches to XML compression have been proposed in the last five years. The mostcompetitive approaches employ one or more statistical text compressors based on PPM orarithmetic coding in which some of the context is provided by the XML document structure.The purpose of this paper is to investigate the relationship between the extant proposals inmore detail. We review the two main statistical modeling approaches proposed so far; andevaluate their performance on two representative XML databases. Our main finding is thatwhile a recently-proposed multiple-model approach can provide better overall compressionfor large databases; it uses much more memory and converges more slowly than an older …,Data Compression Conference; 2006. DCC 2006. Proceedings,2006,27
Constraints of the PROV data model,James Cheney; Paolo Missier; Luc Moreau; Tom DeNies,*,W3C Recommendation. Available online: http://www. w3. org/TR/2013/REC-prov-constraints-20130430/(accessed on 30 April 2013),2013,26
A core calculus for provenance,Umut A Acar; Amal Ahmed; James Cheney; Roly Perera,Abstract Provenance is an increasing concern due to the ongoing revolution in sharing andprocessing scientific data on the Web and in other computer systems. It is proposed thatmany computer systems will need to become provenance-aware in order to providesatisfactory accountability; reproducibility; and trust for scientific or other high-value data. Todate; there is not a consensus concerning appropriate formal models or security propertiesfor provenance. In previous work; we introduced a formal framework for provenance securityand proposed formal definitions of properties called disclosure and obfuscation.,Journal of Computer Security,2013,26
Equivariant unification,James Cheney,Abstract Nominal logic is a variant of first-order logic with special facilities for reasoningabout names and binding based on the underlying concepts of swapping and freshness. Itserves as the basis of logic programming; term rewriting; and automated theorem provingtechniques that support reasoning about languages with name-binding. These applicationsoften require nominal unification; or equational reasoning and constraint solving in nominallogic. Urban; Pitts and Gabbay developed an algorithm for a broadly applicable class ofnominal unification problems. However; because of nominal logic's equivariance property;these applications also require a different form of unification; which we call equivariantunification. In this article; we first study the complexity of the decision problem for equivariantunification and equivariant matching. We show that these problems are NP-hard in …,Journal of Automated Reasoning,2010,26
A simple nominal type theory,James Cheney,Abstract Nominal logic is an extension of first-order logic with features useful for reasoningabout abstract syntax with bound names. For computational applications such asprogramming and formal reasoning; it is desirable to develop constructive type theories fornominal logic that extend standard type theories for propositional; first-or higher-order logic.This has proven difficult; largely because of complex interactions between nominal logic'sname-abstraction operation and ordinary functional abstraction. This difficulty already arisesin the case of propositional logic and simple type theory. In this paper we show how thisdifficulty can be overcome; and present a simple nominal type theory that enjoys propertiessuch as type soundness and strong normalization; and that can be soundly interpreted usingexisting nominal set models of nominal logic. We also sketch how recursion combinators …,Electronic Notes in Theoretical Computer Science,2009,25
PROV-N: the provenance notation,Luc Moreau; Paolo Missier; James Cheney; Stian Soiland-Reyes,*,W3C Recommendation. Available online: http://www. w3. org/TR/2013/REC-prov-n-20130430/(accessed on 30 April 2013),2012,24
Provenance traces,James Cheney; Umut Acar; Amal Ahmed,Abstract: Provenance is information about the origin; derivation; ownership; or history of anobject. It has recently been studied extensively in scientific databases and other settings dueto its importance in helping scientists judge data validity; quality and integrity. However; mostmodels of provenance have been stated as ad hoc definitions motivated by informalconcepts such as" comes from";" influences";" produces"; or" depends on". These modelslack clear formalizations describing in what sense the definitions capture these intuitiveconcepts. This makes it difficult to compare approaches; evaluate their effectiveness; orargue about their validity. We introduce provenance traces; a general form of provenance forthe nested relational calculus (NRC); a core database query language. Provenance tracescan be thought of as concrete data structures representing the operational semantics …,arXiv preprint arXiv:0812.0564,2008,23
An Empirical Evaluation of Simple DTD-Conscious Compression Techniques.,James Cheney,The term “XML compression” has been used to describe techniques addressing severaldifferent (though related) problems; all relevant to Web data management: 1. minimum-length coding for efficient XML document storage and transmission [13; 5; 10; 1]; 2. compactbinary formats for efficient (streaming) XML message processing and transmission [8; 9]; and3. storage techniques for efficient XML database query processing [11; 17; 3; 2].,WebDB,2005,23
Avoiding equivariance in alpha-prolog,Christian Urban; James Cheney,Abstract α Prolog is a logic programming language which is well-suited for rapid prototypingof type systems and operational semantics of typed λ-calculi and many other languagesinvolving bound names. In α Prolog; the nominal unification algorithm of Urban; Pitts andGabbay is used instead of first-order unification. However; although α Prolog can be viewedas Horn-clause logic programming in Pitts' nominal logic; proof search using nominalunification is incomplete in nominal logic. Because of nominal logic's equivariance principle;complete proof search would require solving NP-hard equivariant unification problems.Nevertheless; the α Prolog programs we studied run correctly without equivariant unification.In this paper; we give several examples of α Prolog programs that do not require equivariantunification; develop a test for identifying such programs; and prove the correctness of this …,Typed Lambda Calculi and Applications,2005,23
The rationale of PROV,Luc Moreau; Paul Groth; James Cheney; Timothy Lebo; Simon Miles,Abstract The prov family of documents are the final output of the World Wide WebConsortium Provenance Working Group; chartered to specify a representation ofprovenance to facilitate its exchange over the Web. This article reflects upon the keyrequirements; guiding principles; and design decisions that influenced the prov family ofdocuments. A broad range of requirements were found; relating to the key conceptsnecessary for describing provenance; such as resources; activities; agents and events; andto balancing prov's ease of use with the facility to check its validity. By this retrospectiverequirement analysis; the article aims to provide some insights into how prov turned out as itdid and why. Benefits of this insight include better inter-operability; a roadmap for alternateinvestigations and improvements; and solid foundations for future standardization …,Web Semantics: Science; Services and Agents on the World Wide Web,2015,22
Towards a repository of bx examples,James Cheney; James McKinna; Perdita Stevens; Jeremy Gibbons,Abstract: We argue for the creation of a curated repository of examples of bidirectionaltransformations (BX). In particular; such a resource may support research on BX; especiallycross-fertilisation between the different communities involved. We have initiated a BXrepository; which is introduced in this paper. We discuss our design decisions and theirrationale; and illustrate them using the now classic\" Composers\" example. We discuss thedifficulties that this undertaking may face; and comment on how they may be overcome.,BX Workshop,2014,21
Mechanized metatheory model-checking,James Cheney; Alberto Momigliano,Abstract The problem of mechanically formalizing and proving metatheoretic properties ofprogramming language calculi; type systems; operational semantics; and related formalsystems has received considerable attention recently. However; the dual problem ofsearching for errors in such formalizations has received comparatively little attention. In thispaper; we consider the problem of bounded model-checking for metatheoretic properties offormal systems specified using nominal logic. In contrast to the current state of the art formetatheory verification; our approach is fully automatic; does not require expertise intheorem proving on the part of the user; and produces counterexamples in the case that aflaw is detected. We present two implementations of this technique; one based on negation-as-failure and one based on negation elimination; along with experimental results …,Proceedings of the 9th ACM SIGPLAN international conference on Principles and practice of declarative programming,2007,21
Equivariant unification,James Cheney,Abstract Nominal logic is a variant of first-order logic with special facilities for reasoningabout names and binding based on the underlying concepts of swapping and freshness. Itserves as the basis of logic programming and term rewriting techniques that provide similaradvantages to; but remain simpler than; higher-order logic programming or term rewritingsystems. Previous work on nominal rewriting and logic programming has relied on nominalunification; that is; unification up to equality in nominal logic. However; because of nominallogic's equivariance property; these applications require a stronger form of unification; whichwe call equivariant unification. Unfortunately; equivariant unification and matching are NP-hard decision problems. This paper presents an algorithm for equivariant unification thatproduces a complete set of finitely many solutions; as well as NP decision procedure and …,International Conference on Rewriting Techniques and Applications,2005,21
System description: Alpha-Prolog; a fresh approach to logic programming modulo alpha-equivalence,James Cheney; Christian Urban,Abstract. αProlog is a prototype logic programming language with a built-in notion of bindersand unification modulo α-equivalence. It is based on a mild extension of first-order Hornformulae: instead of the usual first-order terms and first-order unification; αProlog usesnominal terms and nominal unification introduced in [3]. In this paper; we give threeexamples that demonstrate the advantages of αProlog and describe our currentimplementation.,Proc. 17th Int. Workshop on Unification; UNIF,2003,21
A dependent nominal type theory,James Cheney,Abstract: Nominal abstract syntax is an approach to representing names and bindingpioneered by Gabbay and Pitts. So far nominal techniques have mostly been studied usingclassical logic or model theory; not type theory. Nominal extensions to simple; dependentand ML-like polymorphic languages have been studied; but decidability and normalizationresults have only been established for simple nominal type theories. We present a LF-styledependent type theory extended with name-abstraction types; prove soundness anddecidability of beta-eta-equivalence checking; discuss adequacy and canonical forms via anexample; and discuss extensions such as dependently-typed recursion and inductionprinciples. Subjects: Logic in Computer Science (cs. LO); Programming Languages (cs. PL)ACM classes: F. 4.1 Journal reference: Logical Methods in Computer Science; Volume 8 …,Logical Methods in Computer Science,2012,20
Toward a general theory of names: binding and scope,James Cheney,Abstract High-level formalisms for reasoning about names and binding such as de Bruijnindices; various flavors of higher-order abstract syntax; the Theory of Contexts; and nominalabstract syntax address only one relatively restrictive form of scoping: namely; unary lexicalscoping; in which the scope of a (single) bound name is a subtree of the abstract syntax tree(possibly with other subtrees removed due to shadowing). Many languages exhibit bindingor renaming structure that does not fit this mold. Examples include binding transitions in theπ-calculus; unique identifiers in contexts; memory heaps; and XML documents; declarationscoping in modules and namespaces; anonymous identifiers in automata; type schemes;and Horn clauses; and pattern matching and mutual recursion constructs in functionallanguages. In these cases; it appears necessary to either rearrange the abstract syntax so …,Proceedings of the 3rd ACM SIGPLAN workshop on Mechanized reasoning about languages with variable binding,2005,18
ACCOn: checking consistency of XML write-access control policies,Loreto Bravo; James Cheney; Irini Fundulaki,Abstract XML access control policies involving updates may contain security flaws; herecalled inconsistencies; in which a forbidden operation may be simulated by performing asequence of allowed operations. ACCOn implements i) consistency checking algorithms thatexamine whether a write-access control policy defined over a DTD is inconsistent and ii)repair algorithms that propose repairs to an inconsistent policy to obtain a consistent one.,Proceedings of the 11th international conference on Extending database technology: Advances in database technology,2008,17
