Static Enforceability of XPath-Based Access Control Policies,James Cheney,Abstract: We consider the problem of extending XML databases with fine-grained; high-levelaccess control policies specified using XPath expressions. Most prior work checks individualupdates dynamically; which is expensive (requiring worst-case execution time proportionalto the size of the database). On the other hand; static enforcement can be performed withoutaccessing the database but may be incomplete; in the sense that it may forbid accesses thatdynamic enforcement would allow. We introduce topological characterizations of XPathfragments in order to study the problem of determining when an access control policy can beenforced statically without loss of precision. We introduce the notion of fair policies that arestatically enforceable; and study the complexity of determining fairness and of staticenforcement itself.,arXiv preprint arXiv:1308.0502,2013,1
Prov-dictionary: Modeling provenance for dictionary data structures,Paolo Missier; Luc Moreau; James Cheney; Timothy Lebo; Stian Soiland-Reyes,Provenance is information about entities; activities; and people involved in producing apiece of data or thing; which can be used to form assessments about its quality; reliability ortrustworthiness. This document describes extensions to PROV to facilitate the modeling ofprovenance for dictionary data structures.[PROV-DM] specifies a Collection as an entity thatprovides a structure to some constituents; which are themselves entities. However; someapplications may need a mechanism to specify more structure to a Collection; in order toaccurately describe its provenance. Therefore; in this document; we introduce Dictionary; aspecific type of Collection with a logical structure consisting of key-entity pairs.,*,2013,1
Using Links to prototype a Database Wiki.,James Cheney; Sam Lindley; Heiko Müller,ABSTRACT Both relational databases and wikis have strengths that make them attractive foruse in collaborative applications. In the last decade; database-backed Web applicationshave been used extensively to develop valuable shared biological references called curateddatabases. Databases offer many advantages such as scalability; query optimization andconcurrency control; but are not easy to use and lack other features needed forcollaboration. Wikis have become very popular for early-stage biocuration projects becausethey are easy to use; encourage sharing and collaboration; and provide built-in support forarchiving; history-tracking and annotation. However; curation projects often outgrow thelimited capabilities of wikis for structuring and efficiently querying data at scale; necessitatinga painful phase transition to a database-backed Web application. We perceive a need for …,DBPL,2011,1
A metaprogramming approach to data provenance,James Cheney,Abstract Provenance is information about the history; origin; or derivation of a piece of datain a database. It is useful for debugging; error correction; and data integrity; especially inscientific databases. For automatic provenance tracking techniques to behave consistentlyand reliably; it is important to prove their correctness. While semantic correctness criteria forprovenance have been proposed for simple query languages; these criteria have beendifficult to adapt to realistic database query languages including features such as grouping;negation; and aggregation. We take the view that correct provenance must show how thedata depends on the input and how the output data was computed from the input. Moreover;since provenance should be userreadable; we believe that it is expedient to use theexpressions of the query language itself as provenance. Thus; in our view; provenance …,*,2000,1
Dr. Formlens; Or: How I Learned to Stop Worrying and Love Monoidal Functors,Raghu Rajkumar; Nate Foster; Sam Lindley; James Cheney,Abstract To make data available on the Web; one must typically implement two components:one to convert the data into HTML; and another to parse updates out of client responses. Incurrent systems; these components are usually implemented using separate functions—anapproach that replicates functionality across multiple pieces of code; making programsdifficult to write; reason about; and maintain. This paper presents formlenses; a newabstraction based on formlets that makes it easy to bridge the gap between data stored on aserver and values embedded into an HTML form. We present a new foundation for formletsbased on monoidal functors (replacing the classic definition based on applicative functors);and show how to endow the resulting structures with a bidirectional semantics. Weinvestigate the connection between linearity and bidirectional transformations and …,*,*,1
Proof-relevant π-calculus: a constructive account of concurrency and causality,Roly Perera; James Cheney,Abstract We present a formalisation in Agda of the theory of concurrent transitions;residuation and causal equivalence of traces for the π-calculus. Our formalisation employsde Bruijn indices and dependently typed syntax; and aligns the 'proved transitions' proposedby Boudol and Castellani in the context of CCS with the proof terms naturally present inAgda's representation of the labelled transition relation. Our main contributions are proofs ofthe 'diamond lemma'for the residuals of concurrent transitions and a formal definition ofequivalence of traces up to permutation of transitions.,Mathematical Structures in Computer Science,2017,*
Causally Consistent Dynamic Slicing,Deepak Garg; James Cheney; Roly Perera,*,*,2016,*
Programming Languages for Big Data (PlanBig)(Dagstuhl Seminar 14511),James Cheney; Torsten Grust; Dimitrios Vytiniotis,Abstract This report documents the program and the outcomes of Dagstuhl Seminar 14511"Programming Languages for Big Data (PlanBig)". The seminar was motivated by recentdevelopments in programming languages; databases; machine learning; and cloudcomputing; and particularly by the opportunities offered by research drawing on more thanone of these areas. Participants included researchers working in each of these areas andseveral who have previously been involved in research in the intersection of databases andprogramming languages. The seminar included talks; demos and free time for discussion orcollaboration. This report collects the abstracts of talks and other activities; a summary of thegroup discussions at the seminar; and a list of outcomes.,Dagstuhl Reports,2015,*
Revisiting “forward node-selecting queries over trees”,James Cheney,Abstract In “Forward Node-Selecting Queries over Trees;” Olteanu [2007] gives threerewriting systems for eliminating reverse XPath axis steps from node-selecting queries overtrees; together with arguments for their correctness and termination for a large class of inputgraphs; including cyclic ones. These proofs are valid for tree or acyclic formulas; but two ofthe rewrite systems (TRS 2 and TRS 3) do not terminate on cyclic graphs; that is; there areinfinite rewrite sequences that never yield a normal form. We investigate the reasons whythe termination arguments do not work for general cyclic formulas; and develop alternativealgorithms that can be used instead. We prove that TRS 2 is weakly normalizing; while TRS3 is not weakly normalizing; but it can be extended to a weakly normalizing system TRS 3&cir;. The algorithms and proof techniques illustrate unforeseen subtleties in the handling …,ACM Transactions on Database Systems (TODS),2013,*
Editorial: Special issue dedicated to icfp 2010,Umut Acar; James Cheney; Stephanie Weirich,*,Journal of Functional Programming,2012,*
Higher-Order Unification for the λαν calculus,Ben Kavanagh; James Cheney,Abstract. In this paper we propose an equational theory of a lambda calculus with names;name abstraction; and restriction; and a derived unification algorithm for this theory. Ourcalculus is very closely related to the calculus of Pitts 2011 [3]. We restrict the calculuspresented there to obtain soundness of additional equalities; allowing us to define aunification algorithm very similar to the one given for the lambda calculus. We discuss theproperties of this algorithm and give examples of its utility in meta-programming.,UNIF 2011,2011,*
Interactive Debugging with Traces and Trace Slices,Roly Perera; Umat A Acar; James Cheney,*,*,2011,*
Formalizing adequacy,James Cheney; Rene Vestergaard; Michael Norrish,Abstract Adequacy is an important criterion for judging the correctness of formal reasoning.The issue is particularly subtle in the expansive case of approaches to languages with name-binding. We posit that adequacy of a novel representation technique is best addressed byformalizing an isomorphism or; more generally; an interpretation explicating the newapproach in terms of a more conventional one. We present an example formalization of anisomorphism relating nominal and higher-order abstract syntax techniques. We also outlinesteps towards a systematic framework that could be used for proving adequacy resultsautomatically; which we believe would help make representation techniques moretransparent to end-users of mechanized metatheory verification systems; and provide insightinto the relative merits of different approaches.,TAASN,2009,*
TOIS reviewers January 2006 through May 2007,Gary Marchionini; Ahmed Abbasi; Eugene Agichtein; Khurshid Ahmad; Azzah Al-Maskari; Gianni Amati; Sihem Amer Yahia; Shlomo Argamon; Daniel Ashbrook; Paolo Atzeni; Michela Bacchin; Godmar Back; Antonio Badia; Andras Banczur; Bettina Berendt; Elisa Bertino; B Bhagyavati; Suresh Bhavnani; Devdutta Bhosale; David Bodoff; Paolo Boldi; Johan Bollen; Angela Bonifati; Pia Borlund; Jit Bose; Athman Bouguettaya; Michael Brinkmeier; Peter Brown; Peter Brusilovsky; Peter Bruza; Christopher Burges; Robin Burke; Ben Carterette; Arthur Cater; Kuiyu Chang; Hsin Hsi Chen; Zheng Chen; James Cheney; Pu Jen Cheng; Roger Chiang; Byron Choi; Tat Seng Chua; Charlie Clarke; Paul Clough; Mariano Consens; Gordon Cormack; Nick Craswell; Fabio Crestani; Carolyn Crouch; Silviu Petru Cucerzan; Hang Cui; Sally Jo Cunningham; Edward Cutrell; Pablo De La Fuente; Arjen De Vries; Anne Diekema; Sandor Dominich; Shyamala Doraisamy; Mark Dunlop; Georges Dupret; Miles Efron; Jeremy Ellman; Peter Enser; Gunes Erkan; Laura Fochtmann; Anders Fongen; Nigel Ford; Martin Franz; Xin Fu; Paolo Garza; Susan Gauch; Pierre Geneves; Henry Gladney; Melanie Gnasa; Andrew Goldberg; Marcos Goncalves; Cyril Goutte; David Grossman; Dennis Groth; Jacek Gwizdka; Stephanie Haas; Sanda Harabagiu; Donna Harman; Andreas Henrich; Djoerd Hiemstra; Lee Hollaar; Chun Nan Hsu; Fei Huang; Zan Huang; Mike Huhns; Carlos Hurtado; Keisuke Innoue; Panagiotis Ipeirotis; Bernard Jansen; Wang Jianqiang; Rong Jin; Marko Junkkari; Patrick Juola; Vinay Kakade; Jaap Kamps; In Ho Kang; Damianos Karakos; Vangelis Karkaletsis; Martin Kaszkiel; Siddharth Kaza; Jaana Kekäläinen; Diane Kelly; Benny Kimelfeld; Alek Kolcz; Joseph Konstan; Kui Lam Kwok; Abhimanyu Lad; Alberto Laender; Mounia Lalmas; Leah Larkey; Ray Larson; Nabil Layaida; Zhang Le; Dik Lun Lee; Dongwon Lee; Jochen Leidner; Gina Levow; Hang Li; Xin Li; Chin Yew Lin; Jimmy Lin; Tie Yan Liu; Zehua Liu; David Losada; Jie Lu; Yiming Ma; Inderjeet Mani; Murali Mani; Ioana Manolescu; Catherine Marshall; Mercedes Martinez; Yosi Mass; Paul McNamee; Sean McNee; Brahim Medjahed; Lokman Meho; Donald Metzler; Rada Mihalcea; Ruslan Mitkov; Bamshad Mobasher; Marina Mongiello; Ani Nenkova; Frank Neven; Dorbin Ng; Wilfred Ng,Marchionini; Gary; Abbasi; Ahmed; Agichtein; Eugene; Ahmad; Khurshid; Al-Maskari; Azzah;Amati; Gianni; Yahia; Sihem Amer; Argamon; Shlomo; Ashbrook; Daniel; Atzeni; Paolo;Bacchin; Michela; Back; Godmar; Badia; Antonio; Banczur; Andras; Berendt; Bettina; Bertino;Elisa; Bhagyavati; B.; Bhavnani; Suresh; Bhosale; Devdutta; Bodoff; David; Boldi; Paolo;Bollen; Johan; Bonifati; Angela; Borlund; Pia; Bose; Jit; Bouguettaya; Athman; Brinkmeier;Michael; Brown; Peter; Brusilovsky; Peter; Bruza; Peter; Burges; Christopher; Burke; Robin;Carterette; Ben; Cater; Arthur; Chang; Kuiyu; Chen; Hsin Hsi; Chen; Zheng; Cheney; James;Cheng; Pu Jen; Chiang; Roger; Choi; Byron; Chua; Tat Seng; Clarke; Charlie; Clough; Paul;Consens; Mariano; Cormack; Gordon; Craswell; Nick; Crestani; Fabio; Crouch … In: ACMTransactions on Information Systems; Vol. 25; No. 4; 15; 01.10.2007.,ACM Transactions on Information Systems,2007,*
A Process Algebra Approach to Provenance,James Cheney,The history expresses the most detailed form of provenance information we are interested in.This can be used to evaluate other approaches wrt accuracy and correctness. Key question:Given a provenance tracking system; what questions about the history can be answered withcertainty (given only the final state and provenance information)?,*,2006,*
A Nominal Logical Framework,James Cheney,Page 1. A Nominal Logical Framework Logic and Semantics Club January 20; 2006 JamesCheney University of Edinburgh A Nominal Logical Framework – p.1/28 Page 2. IntroductionA logical framework is a formal system for defining (and reasoning about) other formal systems.Typically; employs a dependent type theory to represent syntax and judgments of a logic orlanguage Idea goes back to at least de Bruijn's AUTOMATH project (Edinburgh) LF; Calculusof Constructions; and variants have proven very expressive and powerful. Fertile area forinteresting type theories (Linear LF; Ordered LF; Concurrent LF; Inductive Constructions) ANominal Logical Framework – p.2/28 Page 3. Do we really need another LF? Existing LF familyvery expressive; but: 1. Names are “second-class”: difficult to encode judgments based onname-inequality 2. Inductive (meta-)reasoning apparently must be …,*,2006,*
αProlog User’s Guide & Language Reference Version 0.3 DRAFT,James Cheney,Names; binding; and scope are perennial problems in many programming tasks; includingimplementing compilers and interpreters as well as symbolic mathematical tools andtheorem proving systems. Few languages provide any assistance for programming withnames; so programmers must reinvent the wheel every time a new system which makes useof names is built. This is often a tedious and error-prone process; also; the resultingprograms tend to be more difficult to read and analyze. Programming language support forkey data structures is crucial to writing clear; optimizable code in traditional domains such asmatrix computations (via arrays); databases (via records); large-scale interactive systems(via objects); and algebraic symbolic computation (via ML-style algebraic datatypes orProlog-style terms): these features have been standard in high-level programming …,*,2003,*
System Description: Prolog; a Fresh Approach to Logic Programming Modulo-Equivalence,James Cheney; Christian Urban,*,UNIF,2003,*
Cornell University Ithaca; NY 14853,James Cheney,ABSTRACT This paper presents a domain-specific language; XParse; that attempts tocombine the power of tools like lex and yacc; which generate efficient parsers fromdeclarative specifications; with the convenience; safety; and usability of textor XML-processing languages such as Perl or XSLT. XParse is a standalone language whichprovides lex-style regular expression matching and yacc-style LALR (1) parsing. Existingparsing tools such as lex and yacc can be difficult to learn; are usually highly language-dependent; and often vary across languages and platforms. Parsers are therefore difficult tocreate and reuse; so are usually developed on a per-application basis rather than a per-language basis. Unlike traditional; language-dependent parser tools; the semantic actions inXParse denote XML fragments rather than uninterpreted source code. This design …,*,2002,*
Cyclone User's Manual; Version 0.1. 3,Dan Grossman; Greg Morrisett; Trevor Jim; Michael Hicks; Yanling Wang; James Cheney,The current version of this manual should be available at http://www. cs. cornell.edu/projects/cyclone/and http://www. research. att. com/projects/cyclone/. The version heredescribes Cyclone Version 0.1. 3; although minor changes may have occurred before therelease.,*,2001,*
CS 686 Project Report Quantum PDL,James Cheney,Abstract this report; I will rst briey overview the mathematical foundations of quantummechanics and quantum computation. Then I will describe quantum logic; a form of logicdeveloped to describe quantum-mechanical situations for which classical propositional logicis inadequate. It was not clear to me how to make use of quantum logic directly inunderstanding quantum computation but there may be some way to tie work in quantumlogic and quantum computation together. In the remainder of the paper; I will show how tomodify the semantics of Probabilistic PDL (PPDL)[5] to model pure quantum computations.Measurements introduce impure probabilistic behavior; and so we show how to embed purequantum PDL (PQPDL) into probabilistic PDL to get generalized quantum PDL (QPDL).Finally; we argue that various instantiations of QPDL are expressive enough to describe …,*,2001,*
Information theoretic problems in digital library research,James Cheney,*,*,2000,*
Reasoning Constructively about Probability and Programming with Chance,James Cheney,Probability and statistics are the deductive and inductive theories; respectively; of chanceand uncertainty. However; they typically do not have a role in traditional logic and theoremproving. This is unfortunate; because chance is an important concept in computer science.The interaction between computer science and uncertainty typically takes three forms. First;algorithms may make random decisions and find solutions to difficult problems quickly withhigh probability. For example; GSAT is a random SAT solver which typically beatsdeterministic solvers such as the Davis-Putnam procedure. AI techniques such as geneticalgorithms and simulated annealing are also randomized. Some randomized algorithmssuggest efficient exact or approximate deterministic algorithms. Randomized algorithms relyon probability theory to reason about the consequences of generating data which is …,*,1999,*
Shape Analysis and Cache Locality for Recursive Data Structures in Java,James Cheney; Kevin Hamlen,There is already a substantial amount of practical research into optimizing programs withstatic; sequential; array-based data structures. Numerical programs in particular tend tomake heavy use of these data structures. However; not all numerical programs make heavyuse of such structures; nor do many other programs we would like to be able to optimize.Another class of data structures which is widely used but currently difficult to optimize is thatof dynamic; recursive; pointer-based data structures (including lists; trees; graphs; etc.) Inthis project we looked at various approaches to optimizing such data structures; includingshape analysis; cache locality optimization; and containeroriented optimization. Shapeanalysis algorithms attempt to statically determine the invariant properties on the structure or“shape” of a data structure. In cache locality optimization; data structures are organized in …,*,1999,*
Learning Programming Language Parsing Rules,James Cheney,Modern programming languages have some natural language properties; such asscoping/precedence ambiguities regarding arithmetic operators (eg+ vs.*) and word(symbol) sense ambiguities (eg unary vs. binary+). Typically these ambiguities are resolvedaccording to well-known conventions so that programs do not need to contain too manyparentheses. These ambiguities are not necessary in programming languages; but they arecommon because people seem to find languages which allow such ambiguities morereadable. Efficient parsers for such languages are difficult to construct by hand. Usually thisproblem is solved by using parser generation tools (such as yacc [9; 7]) which transform acontext-free grammar in some restricted form (such as LR or LALR; see [1]) into an efficient(linear time) parser. However; these tools are also difficult to use. It is not too difficult to …,*,1999,*
Explicit Auditing,Wilmer Ricciotti; James Cheney,Abstract. The Calculus of Audited Units (CAU) is a typed lambda calculus resulting from acomputational interpretation of Artemov's Justification Logic under the Curry-Howardisomorphism; it extends the simply typed lambda calculus by providing audited types;inhabited by expressions carrying a trail of their past computation history. Unlike most otherauditing techniques; CAU allows the inspection of trails at runtime as a first-class operation;with applications in security; debugging; and transparency of scientific computation. Anefficient implementation of CAU is challenging: not only do the sizes of trails grow rapidly;but they also need to be normalized after every beta reduction. In this paper; we study howto reduce terms more efficiently in an untyped variant of CAU by means of explicitsubstitutions and explicit auditing operations.,*,*,*
Additional services for Journal of Functional Programming,UMUT A ACAR; JAMES CHENEY; STEPHANIE WEIRICH,Citation for published version: Acar; UA; Cheney; J & Weirich; S 2012; 'Editorial: Special issuededicated to ICFP 2010' Journal of Functional Programming; vol 22; pp. 379-381. DOI:10.1017/S0956796812000287 … Link: Link to publication record in Edinburgh Research Explorer… Document Version: Publisher's PDF; also known as Version of record … Publisher RightsStatement: Cambridge Journal Open Access … General rights Copyright for the publicationsmade accessible via the Edinburgh Research Explorer is retained by the author(s) and / or othercopyright owners and it is a condition of accessing these publications that users recognise andabide by the legal requirements associated with these rights … Take down policy The Universityof Edinburgh has made every reasonable effort to ensure that Edinburgh Research Explorercontent complies with UK legislation. If you believe that the public display of this file …,*,*,*
ŦProlog; Programming Modulo Ŧ-Equivalence,James Cheney; Christian Urban,Abstract. ŦProlog is a prototype logic programming language with a built-in notion of bindersand unification modulo Ŧ-equivalence. It is based on a mild extension of firstorder Hornformulae: instead of the usual first-order terms and first-order unification; ŦProlog usesnominal terms and nominal unification introduced in [3]. In this paper; we give threeexamples that demonstrate the advantages of ŦProlog and describe our currentimplementation.,Jordi Levy Michael Kohlhase Joachim Niehren,*,*
Schema-based independence analysis for XML updates. http://web. comlab. ox. ac. uk/people/Michael. Benedikt/papers/tr. pdf,Michael Benedikt; James Cheney,Abstract Query-update independence analysis is the problem of determining whether anupdate affects the results of a query. Query-update independence is useful for avoidingrecomputation of materialized views and may have applications to access control andconcurrency control. This paper develops static analysis techniques for queryupdateindependence problems involving core XQuery queries and updates with a snapshotsemantics (based on the W3C XQuery Update Facility proposal). Our approach takesadvantage of schema information; in contrast to previous work on this problem. We formalizeour approach; sketch a proof of correctness; and report on the performance and accuracy ofour implementation. 1.,*,*,*
Comments from the Digital Curation Centre on Long-Lived Digital Data Collections: Enabling Research and Education in the 21st Century; a draft report of the Natio...,Rajendra Bose; Peter Buneman; Peter Burnhill; James Cheney; Floris Geerts; Anastasios Kementsietsidis; Liz Lyon; Mags McGinley; Robin Rice; Chris Rusbridge; Charlotte Waelde; Stratis Viglas,The development of the Internet has caused revolution in the way in which all forms ofscholarship are conducted. The Scientific Method itself is changing as a result of thedependence of all sciences on their accumulations of digital data. The National ScienceBoard report on long-lived digital data collections is a strong confirmation for the need tohave policies; technology and methodologies for caring for–curating–these digitalresources. The Digital Curation Centre (DCC) is an organisation supported by UK researchand university councils; which is dedicated to these issues. The following comments2 on thereport are a summary of discussions among members of the DCC. The DCC welcomes thedraft report. In particular it endorses the view that curation is much more than preservation;: itinvolves all aspects of data acquisition and selection; it is about adding value to and …,*,*,*
Motivation and Vision,James Cheney,Sophisticated systems such as databases and distributed (“grid” or cyberinfrastructure)computing are becoming essential in most scientific disciplines; particularly bioinformatics.As a result; computational artifacts such as databases are now becoming a part of thescientific record; scientific judgments now depend on the correctness; integrity; and securityof such systems. However; as these systems grow more complex; the effort needed to makethem comprehensible; usable; reliable or predictable also increases dramatically. Forexample; while many bioinformatics researchers have expended a great deal of effort onbuilding large curated databases and using them to guide research in molecular biologyand other areas; it is not well-understood how to combine data from different sources; how tocorrect errors in noisy data; how to record the “complete” history of the data; or how to …,*,*,*
found at the ENTCS Macro Home Page. Formalizing adequacy,James Cheney; Rene Vestergaard; Michael Norrish,CiteSeerX - Document Details (Isaac Councill; Lee Giles; PradeepTeregowda): this file with prentcsmacro.sty for your meeting;.,*,*,*
