Cyclone: A Safe Dialect of C.,Trevor Jim; J Gregory Morrisett; Dan Grossman; Michael W Hicks; James Cheney; Yanling Wang,Abstract: Cyclone is a safe dialect of C. It has been designed from the ground up to preventthe buffer overflows; format string attacks; and memory management errors that are commonin C programs; while retaining C's syntax and semantics. This paper examines safetyviolations enabled by C's design; and shows how Cyclone avoids them; without giving upC's hallmark control over low-level details such as data representation and memorymanagement.,USENIX Annual Technical Conference; General Track,2002,786
Provenance in databases: Why; how; and where,James Cheney; Laura Chiticariu; Wang-Chiew Tan,Abstract Different notions of provenance for database queries have been proposed andstudied in the past few years. In this article; we detail three main notions of databaseprovenance; some of their applications; and compare and contrast amongst them.Specifically; we review why; how; and where provenance; describe the relationships amongthese notions of provenance; and describe some of their applications in confidencecomputation; view maintenance and update; debugging; and annotation propagation.,Foundations and Trends in Databases,2009,448
Region-based memory management in Cyclone,Dan Grossman; Greg Morrisett; Trevor Jim; Michael Hicks; Yanling Wang; James Cheney,Abstract Cyclone is a type-safe programming language derived from C. The primary designgoal of Cyclone is to let programmers control data representation and memory managementwithout sacrificing type-safety. In this paper; we focus on the region-based memorymanagement of Cyclone and its static typing discipline. The design incorporates severaladvancements; including support for region subtyping and a coherent integration with stackallocation and a garbage collector. To support separate compilation; Cyclone requiresprogrammers to write some explicit region annotations; but a combination of defaultannotations; local type inference; and a novel treatment of region effects reduces thisburden. As a result; we integrate C idioms in a region-based framework. In our experience;porting legacy C to Cyclone has required altering about 8% of the code; of the changes …,ACM Sigplan Notices,2002,405
Provenance management in curated databases,Peter Buneman; Adriane Chapman; James Cheney,Abstract Curated databases in bioinformatics and other disciplines are the result of a greatdeal of manual annotation; correction and transfer of data from other sources. Provenanceinformation concerning the creation; attribution; or version history of such data is crucial forassessing its integrity and scientific value. General purpose database systems provide littlesupport for tracking provenance; especially when data moves among databases. This paperinvestigates general-purpose techniques for recording provenance for data that is copiedamong databases. We describe an approach in which we track the user's actions whilebrowsing source databases and copying data into a curated database; in order to record theuser's actions in a convenient; queryable form. We present an implementation of thistechnique and use it to evaluate the feasibility of database support for provenance …,Proceedings of the 2006 ACM SIGMOD international conference on Management of data,2006,361
Compressing XML with multiplexed hierarchical PPM models,James Cheney,We established a working Extensible Markup Language (XML) compression benchmarkbased on text compression; and found that bzip2 compresses XML best; albeit more slowlythan gzip. Our experiments verified that T/sub XMILL/speeds up and improves compressionusing gzip and bounded-context PPM by up to 15%; but found that it worsens thecompression for bzip2 and PPM. We describe alternative approaches to XML compressionthat illustrate other tradeoffs between speed and effectiveness. We describe experimentsusing several text compressors and XMILL to compress a variety of XML documents. Usingthese as a benchmark; we describe our two main results: an online binary encoding for XMLcalled Encoded SAX (ESAX) that compresses better and faster than existing methods; andan online; adaptive; XML-conscious encoding based on prediction by partial match (PPM) …,Data Compression Conference; 2001. Proceedings. DCC 2001.,2001,285
Prov-o: The prov ontology,Timothy Lebo; Satya Sahoo; Deborah McGuinness; Khalid Belhajjame; James Cheney; David Corsar; Daniel Garijo; Stian Soiland-Reyes; Stephan Zednik; Jun Zhao,Abstract The PROV Ontology (PROV-O) expresses the PROV Data Model [PROV-DM] usingthe OWL2 Web Ontology Language (OWL2)[OWL2-OVERVIEW]. It provides a set of classes;properties; and restrictions that can be used to represent and interchange provenanceinformation generated in different systems and under different contexts. It can also bespecialized to create new classes and properties to model provenance information fordifferent applications and domains. The PROV Document Overview describes the overallstate of PROV; and should be read before other PROV documents.,W3C recommendation,2013,230
First-class phantom types,James Cheney; Ralf Hinze,Classical phantom types are datatypes in which type constraints are expressed using typevariables that do not appear in the datatype cases themselves. They can be used to embedtyped languages into Haskell or ML. However; while such encodings guarantee that onlywell-formed data can be constructed; they do not permit type-safe deconstruction withoutadditional tagging and run-time checks. We introduce first-class phantom types; which makesuch constraints explicit via type equations. Examples of first-class phantom types includetyped type representations and typed higher-order abstract syntax trees. These types can beused to support typed generic functions; dynamic typing; and staged compilation in higher-order; statically typed languages such as Haskell or Standard ML. In our system; typeconstraints can be equations between type constructors as well as type functions of …,*,2003,221
Prov-dm: The prov data model,Luc Moreau; Paolo Missier; Khalid Belhajjame; Reza B’Far; James Cheney; Sam Coppens; Stephen Cresswell; Yolanda Gil; Paul Groth; Graham Klyne; Timothy Lebo; Jim McCusker; Simon Miles; James Myers; Satya Sahoo; Curt Tilmes,*,Retrieved July,2013,205
Curated databases,Peter Buneman; James Cheney; Wang-Chiew Tan; Stijn Vansummeren,Abstract Curated databases are databases that are populated and updated with a great dealof human effort. Most reference works that one traditionally found on the reference shelves oflibraries--dictionaries; encyclopedias; gazetteers etc.--are now curated databases. Since it isnow easy to publish databases on the web; there has been an explosion in the number ofnew curated databases used in scientific research. The value of curated databases lies inthe organization and the quality of the data they contain. Like the paper reference works theyhave replaced; they usually represent the efforts of a dedicated group of people to produce adefinitive description of some subject area. Curated databases present a number ofchallenges for database research. The topics of annotation; provenance; and citation arecentral; because curated databases are heavily cross-referenced with; and include data …,Proceedings of the twenty-seventh ACM SIGMOD-SIGACT-SIGART symposium on Principles of database systems,2008,142
A lightweight implementation of generics and dynamics,James Cheney; Ralf Hinze,Abstract The recent years have seen a number of proposals for extending statically typedlanguages by dynamics or generics. Most proposals---if not all---require significantextensions to the underlying language. In this paper we show that this need not be the case.We propose a particularly lightweight extension that supports both dynamics and generics.Furthermore; the two features are smoothly integrated: dynamic values; for instance; can bepassed to generic functions. Our proposal makes do with a standard Hindley-Milner typesystem augmented by existential types. Building upon these ideas we have implemented asmall library that is readily usable both with Hugs and with the Glasgow Haskell compiler.,Proceedings of the 2002 ACM SIGPLAN workshop on Haskell,2002,137
On the expressiveness of implicit provenance in query and update languages,Peter Buneman; James Cheney; Stijn Vansummeren,Abstract Information describing the origin of data; generally referred to as provenance; isimportant in scientific and curated databases where it is the basis for the trust one puts intheir contents. Since such databases are constructed using operations of both query andupdate languages; it is of paramount importance to describe the effect of these languageson provenance. In this article we study provenance for query and update languages that areclosely related to SQL; and compare two ways in which they can manipulate provenance sothat elements of the input are rearranged to elements of the output: implicit provenance;where a query or update only provides the rearranged output; and provenance is providedimplicitly by a default provenance semantics; and explicit provenance; where a query orupdate provides both the output and the description of the provenance of each …,Database Theory–ICDT 2007,2007,133
Provenance: a future history,James Cheney; Stephen Chong; Nate Foster; Margo Seltzer; Stijn Vansummeren,Abstract Science; industry; and society are being revolutionized by radical new capabilitiesfor information sharing; distributed computation; and collaboration offered by the World WideWeb. This revolution promises dramatic benefits but also poses serious risks due to the fluidnature of digital information. One important cross-cutting issue is managing and recordingprovenance; or metadata about the origin; context; or history of data. We posit thatprovenance will play a central role in emerging advanced digital infrastructures. In thispaper; we outline the current state of provenance research and practice; identify hard openresearch problems involving provenance semantics; formal modeling; and security; andarticulate a vision for the future of provenance.,Proceedings of the 24th ACM SIGPLAN conference companion on Object oriented programming systems languages and applications,2009,97
alphaProlog: A Logic Programming Language with Names; Binding and-Equivalence,James Cheney; Christian Urban,*,ICLP,2004,85
The W3C PROV family of specifications for modelling provenance metadata,Paolo Missier; Khalid Belhajjame; James Cheney,Abstract Provenance; a form of structured metadata designed to record the origin or sourceof information; can be instrumental in deciding whether information is to be trusted; how itcan be integrated with other diverse information sources; and how to establish attribution ofinformation to authors throughout its history. The PROV set of specifications; produced bythe World Wide Web Consortium (W3C); is designed to promote the publication ofprovenance information on the Web; and offers a basis for interoperability across diverseprovenance management systems. The PROV provenance model is deliberately genericand domain-agnostic; but extension mechanisms are available and can be exploited formodelling specific domains. This tutorial provides an account of these specifications.Starting from intuitive and informal examples that present idiomatic provenance patterns …,Proceedings of the 16th International Conference on Extending Database Technology,2013,80
Provenance as dependency analysis,James Cheney; Amal Ahmed; Umut A Acar,Abstract Provenance is information recording the source; derivation; or history of someinformation. Provenance tracking has been studied in a variety of settings; however;although many design points have been explored; the mathematical or semanticfoundations of data provenance have received comparatively little attention. In this paper;we argue that dependency analysis techniques familiar from program analysis and programslicing provide a formal foundation for forms of provenance that are intended to show how(part of) the output of a query depends on (parts of) its input. We introduce a semanticcharacterization of such dependency provenance; show that this form of provenance is notcomputable; and provide dynamic and static approximation techniques.,International Symposium on Database Programming Languages,2007,74
Requirements for provenance on the web,Paul Groth; Yolanda Gil; James Cheney; Simon Miles,Abstract From where did this tweet originate? Was this quote from the New York Timesmodified? Daily; we rely on data from the Web; but often it is difficult or impossible todetermine where it came from or how it was produced. This lack of provenance is particularlyevident when people and systems deal with Web information or with any environment whereinformation comes from sources of varying quality. Provenance is not captured pervasivelyin information systems. There are major technical; social; and economic impediments thatstand in the way of using provenance effectively. This paper synthesizes requirements forprovenance on the Web for a number of dimensions; focusing on three key aspects ofprovenance: the content of provenance; the management of provenance records; and theuses of provenance information. To illustrate these requirements; we use three …,International Journal of Digital Curation,2012,66
Nominal logic programming,James Cheney; Christian Urban,Abstract Nominal logic is an extension of first-order logic which provides a simple foundationfor formalizing and reasoning about abstract syntax modulo consistent renaming of boundnames (that is; α-equivalence). This article investigates logic programming based onnominal logic. We describe some typical nominal logic programs; and develop the model-theoretic; proof-theoretic; and operational semantics of such programs. Besides being ofinterest for ensuring the correct behavior of implementations; these results provide arigorous foundation for techniques for analysis and reasoning about nominal logicprograms; as we illustrate via examples.,ACM Transactions on Programming Languages and Systems (TOPLAS),2008,66
A practical theory of language-integrated query,James Cheney; Sam Lindley; Philip Wadler,Abstract Language-integrated query is receiving renewed attention; in part because of itssupport through Microsoft's LINQ framework. We present a practical theory of language-integrated query based on quotation and normalisation of quoted terms. Our techniquesupports join queries; abstraction over values and predicates; composition of queries;dynamic generation of queries; and queries with nested intermediate data. Higher-orderfeatures prove useful even for constructing first-order queries. We prove a theoremcharacterising when a host query is guaranteed to generate a single SQL query. We presentexperimental results confirming our technique works; even in situations where Microsoft'sLINQ framework either fails to produce an SQL query or; in one case; produces anavalanche of SQL queries.,ACM SIGPLAN Notices,2013,64
A sequent calculus for nominal logic,Murdoch Gabbay; James Cheney,Nominal logic is a theory of names and binding based on the primitive concepts of freshnessand swapping; with a self-dual N-(or" new")-quantifier; originally presented as a Hilbert-styleaxiom system extending first-order logic. We present a sequent calculus for nominal logiccalled fresh logic; or FL; admitting cut-elimination. We use FL to provide a proof-theoreticfoundation for nominal logic programming and show how to interpret FO/spl lambda//splnabla/; another logic with a self-dual quantifier; within FL.,Logic in Computer Science; 2004. Proceedings of the 19th Annual IEEE Symposium on,2004,57
A provenance model for manually curated data,Peter Buneman; Adriane Chapman; James Cheney; Stijn Vansummeren,Abstract Many curated databases are constructed by scientists integrating various existingdata sources “by hand”; that is; by manually entering or copying data from other sources.Capturing provenance in such an environment is a challenging problem; requiring a goodmodel of the process of curation. Existing models of provenance focus on queries/views indatabases or computations on the Grid; not updates of databases or Web sites. In this paperwe motivate and present a simple model of provenance for manually curated databases anddiscuss ongoing and future work.,International Provenance and Annotation Workshop,2006,52
A formal framework for provenance security,James Cheney,Provenance; or information about the origin; derivation; or history of data; is becoming animportant topic especially for shared scientific or public data on the Web. It clearly hasimplications on security (and vice versa) yet these implications are not well-understood. Agreat deal of work has focused on mechanisms for recording; managing or using some kindof provenance information; but relatively little progress has been made on foundationalmodels that define provenance and relate it to security goals such as availability;confidentiality or privacy. We argue that such foundations are essential to makingmeaningful progress on these problems and should be developed. In this paper; we outlinea formal model of provenance; propose formalizations of security properties for provenancesuch as disclosure and obfuscation; and explore their implications in domains based on …,Computer Security Foundations Symposium (CSF); 2011 IEEE 24th,2011,48
YesWorkflow: a user-oriented; language-independent tool for recovering workflow information from scripts,Timothy McPhillips; Tianhong Song; Tyler Kolisnik; Steve Aulenbach; Khalid Belhajjame; Kyle Bocinsky; Yang Cao; Fernando Chirigati; Saumen Dey; Juliana Freire; Deborah Huntzinger; Christopher Jones; David Koop; Paolo Missier; Mark Schildhauer; Christopher Schwalm; Yaxing Wei; James Cheney; Mark Bieda; Bertram Ludaescher,Abstract: Scientific workflow management systems offer features for composing complexcomputational pipelines from modular building blocks; for executing the resulting automatedworkflows; and for recording the provenance of data products resulting from workflow runs.Despite the advantages such features provide; many automated workflows continue to beimplemented and executed outside of scientific workflow systems due to the convenienceand familiarity of scripting languages (such as Perl; Python; R; and MATLAB); and to thehigh productivity many scientists experience when using these languages. YesWorkflow is aset of software tools that aim to provide such users of scripting languages with many of thebenefits of scientific workflow systems. YesWorkflow requires neither the use of a workflowengine nor the overhead of adapting code to run effectively in such a system. Instead …,arXiv preprint arXiv:1502.02403,2015,45
A graph model of data and workflow provenance,Umut Acar; Peter Buneman; James Cheney; Jan Van Den Bussche; Natalia Kwasnikowska; Stijn Vansummeren,Abstract Provenance has been studied extensively in both database and workflowmanagement systems; so far with little convergence of definitions or models. Provenance indatabases has generally been defined for relational or complex object data; by propagatingfine-grained annotations or algebraic expressions from the input to the output. This kind ofprovenance has been found useful in other areas of computer science: annotationdatabases; probabilistic databases; schema and data integration; etc. In contrast; workflowprovenance aims to capture a complete description of evaluation–or enactment–of aworkflow; and this is crucial to verification in scientific computation. Workflows and theirprovenance are often presented using graphical notation; making them easy to visualize butcomplicating the formal semantics that relates their run-time behavior with their …,*,2010,42
Provenance XG final report,Yolanda Gil; James Cheney; Paul Groth; Olaf Hartig; Simon Miles; Luc Moreau; Paulo Pinheiro Da Silva,KNAW Narcis. Back to search results. Publication ProvenanceXG Final Report (2010). Pagina-navigatie: Main …,Final Incubator Group Report,2010,40
FLUX: functional updates for XML,James Cheney,Abstract XML database query languages have been studied extensively; but XML databaseupdates have received relatively little attention; and pose many challenges to languagedesign. We are developing an XML update language called FLUX; which stands forFunctionaL Updates for XML; drawing upon ideas from functional programming languages.In prior work; we have introduced a core language for FLUX with a clear operationalsemantics and a sound; decidable static type system based on regular expression types.Our initial proposal had several limitations. First; it lacked support for recursive types orupdate procedures. Second; although a high-level source language can easily be translatedto the core language; it is difficult to propagate meaningful type errors from the corelanguage back to the source. Third; certain updates are wellformed yet contain path …,ACM SIGPLAN Notices,2008,40
The complexity of equivariant unification,James Cheney,Abstract Nominal logic is a first-order theory of names and binding based on a primitiveoperation of swapping rather than substitution. Urban; Pitts; and Gabbay have developed anominal unification algorithm that unifies terms up to nominal equality. However; because ofnominal logic's equivariance principle; atomic formulas can be provably equivalent withoutbeing provably equal as terms; so resolution using nominal unification is sound butincomplete. For complete resolution; a more general form of unification called equivariantunification; or “unification up to a permutation” is required. Similarly; for rewrite rulesexpressed in nominal logic; a more general form of matching called equivariant matching isnecessary. In this paper; we study the complexity of the decision problem for equivariantunification and matching. We show that these problems are NP-complete in general …,International Colloquium on Automata; Languages; and Programming,2004,40
Functional programs that explain their work,Roly Perera; Umut A Acar; James Cheney; Paul Blain Levy,Abstract We present techniques that enable higher-order functional computations to"explain" their work by answering questions about how parts of their output were calculated.As explanations; we consider the traditional notion of program slices; which we show can beinadequate; and propose a new notion: trace slices. We present techniques for specifyingflexible and rich slicing criteria based on partial expressions; parts of which have beenreplaced by holes. We characterise program slices in an algorithm-independent fashion andshow that a least slice for a given criterion exists. We then present an algorithm; calledunevaluation; for computing least program slices from computations reified as traces.Observing a limitation of program slices; we develop a notion of trace slice as another formof explanation and present an algorithm for computing them. The unevaluation algorithm …,ACM SIGPLAN Notices,2012,39
Mechanizing the metatheory of LF,Christian Urban; James Cheney; Stefan Berghofer,Abstract LF is a dependent type theory in which many other formal systems can beconveniently embedded. However; correct use of LF relies on nontrivial metatheoreticdevelopments such as proofs of correctness of decision procedures for LF's judgments.Although detailed informal proofs of these properties have been published; they have notbeen formally verified in a theorem prover. We have formalized these properties withinIsabelle/HOL using the Nominal Datatype Package; closely following a recent article byHarper and Pfenning. In the process; we identified and resolved a gap in one of the proofsand a small number of minor lacunae in others. We also formally derive a version of the typechecking algorithm from which Isabelle/HOL can generate executable code. Besides itsintrinsic interest; our formalization provides a foundation for studying the adequacy of LF …,ACM Transactions on Computational Logic (TOCL),2011,37
Program slicing and data provenance.,James Cheney,Abstract Provenance is information that aids understanding and troubleshooting databasequeries by explaining the results in terms of the input. Slicing is a program analysistechnique for debugging and understanding programs that has been studied since the early1980s; in which program results are explained in terms of parts of the program thatcontributed to the results. This paper will briefly review ideas and techniques from programslicing and show how they might be useful for improving our understanding of provenance indatabases.,IEEE Data Eng. Bull.,2007,37
Scrap your nameplate:(functional pearl),James Cheney,Abstract Recent research has shown how boilerplate code; or repetitive code for traversingdatatypes; can be eliminated using generic programming techniques already availablewithin some implementations of Haskell. One particularly intractable kind of boilerplate isnameplate; or code having to do with names; name-binding; and fresh name generation.One reason for the difficulty is that operations on data structures involving names; as usuallyimplemented; are not regular instances of standard map; fold; or zip operations. However; innominal abstract syntax; an alternative treatment of names and binding based on swapping;operations such as α-equivalence; capture-avoiding substitution; and free variable setfunctions are much better-behaved. In this paper; we show how nominal abstract syntaxtechniques similar to those of FreshML can be provided as a Haskell library called …,ACM SIGPLAN Notices,2005,37
