Discovering Multiple Clustering Solutions: Grouping Objects in Different Views of the Data.,Emmanuel Müller; Stephan Günnemann; Ines Färber; Thomas Seidl,Traditional clustering algorithms identify just a single clustering of the data. Today's complexdata; however; allows multiple interpretations leading to several valid groupings hidden indifferent views of the database. Each of these multiple clustering solutions is valuable andinteresting as different perspectives on the same data and several meaningful groupings foreach object are given. Especially for high dimensional data where each object is describedby multiple attributes; alternative clusters in different attribute subsets are of major interest.Inthis tutorial; we describe several real world application scenarios for multiple clusteringsolutions. We abstract from these scenarios and provide the general challenges in thisemerging research area. We describe state-of-the-art paradigms; we highlight specifictechniques; and we give an overview of this topic by providing a taxonomy of the existing …,ICDM,2010,18
Adaptive outlierness for subspace outlier ranking,Emmanuel Müller; Matthias Schiffer; Thomas Seidl,Abstract Outlier mining is an important data analysis task to distinguish exceptional outliersfrom regular objects. However; in recent applications traditional outlier mining approachesmiss outliers as they are hidden in subspace projections. In this work; we propose a noveloutlier ranking based on the degree of deviation in subspaces. Object deviation is measuredonly in a selection of relevant subspaces and is based on adaptive neighborhoods in thesesubspaces. We show that our approach outperforms competing outlier ranking approachesby detecting outliers in arbitrary subspaces.,Proceedings of the 19th ACM international conference on Information and knowledge management,2010,18
HSM: Heterogeneous subspace mining in high dimensional data,Emmanuel Müller; Ira Assent; Thomas Seidl,Abstract Heterogeneous data; ie data with both categorical and continuous values; iscommon in many databases. However; most data mining algorithms assume eithercontinuous or categorical attributes; but not both. In high dimensional data; phenomena dueto the “curse of dimensionality” pose additional challenges. Usually; due to locally varyingrelevance of attributes; patterns do not show across the full set of attributes. In this paper wepropose HSM; which defines a new pattern model for heterogeneous high dimensional data.It allows data mining in arbitrary subsets of the attributes that are relevant for the respectivepatterns. Based on this model we propose an efficient algorithm; which is aware of theheterogeneity of the attributes. We extend an indexing structure for continuous attributessuch that HSM indexing adapts to different attribute types. In our experiments we show …,Scientific and Statistical Database Management,2009,18
Unsupervised interaction-preserving discretization of multivariate data,Hoang-Vu Nguyen; Emmanuel Müller; Jilles Vreeken; Klemens Böhm,Abstract Discretization is the transformation of continuous data into discrete bins. It is animportant and general pre-processing technique; and a critical element of many data miningand data management tasks. The general goal is to obtain data that retains as muchinformation in the continuous original as possible. In general; but in particular for exploratorytasks; a key open question is how to discretize multivariate data such that significantassociations and patterns are preserved. That is exactly the problem we study in this paper.We propose IPD; an information-theoretic method for unsupervised discretization thatfocuses on preserving multivariate interactions. To this end; when discretizing a dimension;we consider the distribution of the data over all other dimensions. In particular; our methodexamines consecutive multivariate regions and combines them if (a) their multivariate …,Data Mining and Knowledge Discovery,2014,16
Local context selection for outlier ranking in graphs with multiple numeric node attributes,Patricia Iglesias Sánchez; Emmanuel Müller; Oretta Irmler; Klemens Böhm,Abstract Outlier ranking aims at the distinction between exceptional outliers and regularobjects by measuring deviation of individual objects. In graphs with multiple numericattributes; not all the attributes are relevant or show dependencies with the graph structure.Considering both graph structure and all given attributes; one cannot measure a cleardeviation of objects. This is because the existence of irrelevant attributes clearly hinders thedetection of outliers. Thus; one has to select local outlier contexts including only thoseattributes showing a high contrast between regular and deviating objects. It is an openchallenge to detect meaningful local contexts for each node in attributed graphs. In this work;we propose a novel local outlier ranking model for graphs with multiple numeric nodeattributes. For each object; our technique determines its subgraph and its statistically …,Proceedings of the 26th International Conference on Scientific and Statistical Database Management,2014,16
ASCLU: Alternative subspace clustering,Stephan Günnemann; Ines Färber; Emmanuel Müller; Thomas Seidl,Abstract Finding groups of similar objects in databases is one of the most important datamining tasks. Recently; traditional clustering approaches have been extended to generatealternative clustering solutions. The basic observation is that for each database objectmultiple meaningful groupings might exist: the data allows to be clustered through differentperspectives. It is thus reasonable to search for deviating clusters compared to a givenclustering result; that the user is not satisfied with. The existing methods focus on full spaceclustering. However; for today's applications; where many attributes per object are recorded;traditional clustering is known to generate no meaningful results. Instead; the analysis ofsubspace projections of the data with subspace or projected clustering techniques is moresuitable. In this paper; we develop the first method that detects alternative subspace …,In MultiClust at KDD,2010,16
Mobile mining and information management in healthnet scenarios,Philipp Kranen; David Kensche; Saim Kim; Nadine Zimmermann; Emmanuel Müller; Christoph Quix; Xiang Li; Thomas Gries; Thomas Seidl; Matthias Jarke; Steffen Leonhardt,Health and mobility of elderly people is gaining importance in aging societies. Newcommunication-based methods to provide health services with personal health care devicesare considered promising elements of first-class medical care services for everybody. Toachieve this vision; several technological issues have to be solved:(i) body sensors tomonitor vital functions have to be developed;(ii) these sensors should be integrated intotextile structures to guarantee ease of use and patient acceptance;(iii) the collected sensordata has to be analyzed to detect emergency situations and to reduce the data volume;(iv)relevant data has to be integrated with other information systems in the work environment ofmedical experts. These challenges are addressed within the HealthNet project at RWTHAachen University. The goal of the project is to develop a framework in which health …,Mobile Data Management; 2008. MDM'08. 9th International Conference on,2008,16
Statistical selection of congruent subspaces for mining attributed graphs,Patricia Iglesias Sánchez; Emmanuel Muller; Fabian Laforet; Fabian Keller; Klemens Bohm,Current mining algorithms for attributed graphs exploit dependencies between attributeinformation and edge structure; referred to as homophily. However; techniques fail if thisassumption does not hold for the full attribute space. In multivariate spaces; some attributeshave high dependency with the graph structure while others do not show any dependency.Hence; it is important to select congruent subspaces (ie; subsets of the node attributes)showing dependencies with the graph structure. In this work; we propose a method for thestatistical selection of such congruent subspaces. More specifically; we define a measurewhich assesses the degree of congruence between a set of attributes and the entire graph.We use it as the core of a statistical test; which congruent subspaces must pass. To illustrateits applicability to common graph mining tasks and in order to evaluate our selection …,Data Mining (ICDM); 2013 IEEE 13th International Conference on,2013,15
4s: Scalable subspace search scheme overcoming traditional apriori processing,Hoang Vu Nguyen; Emmanuel Muller; Klemens Bohm,In many real-world applications; data is collected in multi-dimensional spaces. However; notall dimensions are relevant for data analysis. Instead; interesting knowledge is hidden incorrelated subsets of dimensions (ie; subspaces of the original space). Detecting thesecorrelated subspaces independent of the underlying mining task is an open researchproblem. It is challenging due to the exponential search space. Existing methods have triedto tackle this by utilizing Apriori search schemes. However; they show poor scalability andmiss high quality subspaces. This paper features a scalable subspace search scheme (4S);which overcomes the efficiency problem by departing from the traditional levelwise search.We propose a new generalized notion of correlated subspaces which gives way totransforming the search space to a correlation graph of dimensions. Then we perform a …,Big Data; 2013 IEEE International Conference on,2013,14
Self-organizing energy aware clustering of nodes in sensor networks using relevant attributes,Marwan Hassani; Emmanuel Mller; Pascal Spaus; Adriola Faqolli; Themis Palpanas; Thomas Seidl,ABSTRACT Physical clustering of nodes in sensor networks aims at grouping togethersensor nodes according to some similarity criteria like neighborhood. Out of each group; oneselected node will be the group representative for forwarding the data collected by its group.This considerably reduces the total energy consumption; as only representatives need tocommunicate with distant data sink. In data mining; one is interested in constructing thesephysical clusters according to similar measurements of sensor nodes. Previous data miningapproaches for physical clustering concentrated on the similarity over all dimensions ofmeasurements. We propose ECLUN; an energy aware method for physical clustering ofsensor nodes based on both spatial and measurements similarities. Our approach uses anovel method for constructing physical clusters according to similarities over some …,Proc. of the Int. Wkshp. on Kowledge Discovery from Sensor Data (SensorKDD),2010,14
SOREX: Subspace outlier ranking exploration toolkit,Emmanuel Müller; Matthias Schiffer; Patrick Gerwert; Matthias Hannen; Timm Jansen; Thomas Seidl,Abstract Outlier mining is an important data analysis task to distinguish exceptional outliersfrom regular objects. In recent research novel outlier ranking methods propose to focus onoutliers hidden in subspace projections of the data. However; focusing only on the detectionof outliers these approaches miss to provide reasons why an object should be consideredas an outlier. In this work; we propose a novel toolkit for exploration of subspace outlierrankings. To enable exploration of subspace outliers and to complete knowledge extractionwe provide further descriptive information in addition to the pure detection of outliers. Aswittinesses for the outlierness of an object; we provide information about the relevantprojections describing the reasons for outlier properties. We provided SOREX as opensource framework on our website it is easily extensible and suitable for research and …,Joint European Conference on Machine Learning and Knowledge Discovery in Databases,2010,13
Data analysis challenges in the future energy domain,Frank Eichinger; Daniel Pathmaperuma; Harald Vogt; Emmanuel Müller,T he energy system currently undergoes major changes; primarily triggered by the need fora more sustainable and secure energy supply. The traditional system relying on thecombustion of fossil sources such as oil; gas; and coal on the one side and nucleartechnologies on the other side is not sustainable; for three main reasons:,Computational Intelligent Data Analysis for Sustainable Development,2013,12
Discovering Multiple Clustering Solutions: Grouping Objects in Different Views of the Data.,Emmanuel Müller; Stephan Günnemann; Ines Färber; Thomas Seidl,Page 1. Discovering Multiple Clustering Solutions: Grouping Objects in Different Views of the DataEmmanuel Müller ◦ ; Stephan Günnemann • ; Ines Färber ; Thomas Seidl ◦ Karlsruhe Institute ofTechnology; Germany • Carnegie Mellon University; USA RWTH Aachen University; GermanyTutorial at ICML 2013 download slides: http://dme.rwth-aachen.de/DMCS …,ICDE,2012,12
Efficient cluster detection by ordered neighborhoods,Emin Aksehirli; Bart Goethals; Emmanuel Müller,Abstract Detecting cluster structures seems to be a simple task; ie separating similar fromdissimilar objects. However; given today's complex data;(dis-) similarity measures andtraditional clustering algorithms are not reliable in separating clusters from each other. Forexample; when too many dimensions are considered simultaneously; objects becomeunique and (dis-) similarity does not provide meaningful information to detect clustersanymore. While the (dis-) similarity measures might be meaningful for individual dimensions;algorithms fail to combine this information for cluster detection. In particular; it is the severeissue of a combinatorial search space that results in inefficient algorithms. In this paper wepropose a cluster detection method based on the ordered neighborhoods. By consideringsuch ordered neighborhoods in each dimension individually; we derive properties that …,International Conference on Big Data Analytics and Knowledge Discovery,2015,11
Mining probabilistic representative frequent patterns from uncertain data,Chunyang Liu; Ling Chen; Chengqi Zhang,Abstract Probabilistic frequent pattern mining over uncertain data has received a great dealof attention recently due to the wide applications of uncertain data. Similar to its counterpartin deterministic databases; however; probabilistic frequent pattern mining suffers from thesame problem of generating an exponential number of result patterns. The large number ofdiscovered patterns hinders further evaluation and analysis; and calls for the need to find asmall number of representative patterns to approximate all other patterns. This paperformally defines the problem of probabilistic representative frequent pattern (P-RFP) mining;which aims to find the minimal set of patterns with sufficiently high probability to represent allother patterns. The problem's bottleneck turns out to be checking whether a pattern canprobabilistically represent another; which involves the computation of a joint probability of …,*,2013,11
Flexible fault tolerant subspace clustering for data with missing values,Stephan Gunnemann; Emmanuel Muller; Sebastian Raubach; Thomas Seidl,In today's applications; data analysis tasks are hindered by many attributes per object aswell as by faulty data with missing values. Subspace clustering tackles the challenge ofmany attributes by cluster detection in any subspace projection of the data. However; itposes novel challenges for handling missing values of objects; which are part of multiplesubspace clusters in different projections of the data. In this work; we propose a general faulttolerance definition enhancing subspace clustering models to handle missing values. Weintroduce a flexible notion of fault tolerance that adapts to the individual characteristics ofsubspace clusters and ensures a robust parameterization. Allowing missing values in ourmodel increases the computational complexity of subspace clustering. Thus; we prove novelmonotonicity properties for an efficient computation of fault tolerant subspace clusters …,Data Mining (ICDM); 2011 IEEE 11th International Conference on,2011,11
Identifying User Interests within the Data Space-a Case Study with SkyServer.,Hoang Vu Nguyen; Klemens Böhm; Florian Becker; Bertrand Goldman; Georg Hinkel; Emmanuel Müller,ABSTRACT Many scientific databases nowadays are publicly available for querying andadvanced data analytics. One prominent example is the Sloan Digital Sky Survey (SDSS)—SkyServer; which offers data to astronomers; scientists; and the general public. For suchdata it is important to understand the public focus; and trending research directions on thesubject described by the database; ie; astronomy in the case of SkyServer. With a large userbase; it is worthwhile to identify the areas of the data space that are of interest to users. Inthis paper; we study the problem of extracting and analyzing access areas of user queries;by analyzing the query logs of the database. To our knowledge; both the concept of accessareas and how to extract them have not been studied before. We address this by firstproposing a novel notion of access area; which is independent of any specific database …,EDBT,2015,9
Cartification: A neighborhood preserving transformation for mining high dimensional data,Emin Aksehirli; Bart Goethals; Emmanuel Muller; Jilles Vreeken,The analysis of high dimensional data comes with many intrinsic challenges. In particular;cluster structures become increasingly hard to detect when the data includes dimensionsirrelevant to the individual clusters. With increasing dimensionality; distances between pairsof objects become very similar; and hence; meaningless for knowledge discovery. In thispaper we propose Cartification; a new transformation to circumvent this problem. Wetransform each object into an item set; which represents the neighborhood of the object. Wedo this for multiple views on the data; resulting in multiple neighborhoods per object. Thistransformation enables us to preserve the essential pair wise-similarities of objects overmultiple views; and hence; to improve knowledge discovery in high dimensional data. Ourexperiments show that frequent item set mining on the certified data outperforms …,Data Mining (ICDM); 2013 IEEE 13th International Conference on,2013,9
Outlier detection and ranking based on subspace clustering,Thomas Seidl; Emmanuel Müller; Ira Assent; Uwe Steinhausen,Abstract Detecting outliers is an important task for many applications including frauddetection or consistency validation in real world data. Particularly in the presence ofuncertain data or imprecise data; similar objects regularly deviate in their attribute values.The notion of outliers has thus to be defined carefully. When considering outlier detection asa task which is complementary to clustering; binary decisions whether an object is regardedto be an outlier or not seem to be near at hand. For high-dimensional data; however; objectsmay belong to different clusters in different subspaces. More fine-grained concepts to defineoutliers are therefore demanded. By our new OutRank approach; we address outlierdetection in heterogeneous high dimensional data and propose a novel scoring function thatprovides a consistent model for ranking outliers in the presence of different attribute types …,Dagstuhl Seminar Proceedings,2009,9
Less is more: Non-redundant subspace clustering,Ira Assent; Emmanuel Müller; Stephan Günnemann; Ralph Krieger; Thomas Seidl,ABSTRACT Clustering is an important data mining task for grouping similar objects. In highdimensional data; however; effects attributed to the “curse of dimensionality”; renderclustering in high dimensional data meaningless. Due to this; recent years have seenresearch on subspace clustering which searches for clusters in relevant subspaceprojections of high dimensional data. As the number of possible subspace projections isexponential in the number of dimensions; the number of possible subspace clusters can beoverwhelming. In this position paper; we present our work on identifying non-redundant;relevant subspace clusters which reduce the result set to a manageable size. We discusstechniques for evaluating; visualizing and exploring subspace clusterings; and proposesome directions for future work.,MultiClust: 1st international workshop on discovering; summarizing and using multiple clusterings held in conjunction with KDD 2010,2010,8
Subspace outlier mining in large multimedia databases,Ira Assent; Ralph Krieger; Thomas Seidl,Abstract Increasingly large multimedia databases in life sciences; e-commerce; ormonitoring applications cannot be browsed manually; but require automatic knowledgediscovery in databases (KDD) techniques to detect novel and interesting patterns. One of themajor tasks in KDD; clustering; aims at grouping similar objects into clusters; separatingdissimilar objects. Density-based clustering has been shown to detect arbitrarily shapedclusters even in noisy data bases. In high-dimensional data bases; meaningful clusters canno longer be detected due to the â€ žcurse of dimensionalityâ€ œ. Consequently; subspaceclustering searches for clusters hidden in any subset of the set of dimensions. As the numberof subspaces is exponential in the number of dimensions; traditional approaches use fixedpruning thresholds. This results in dimensionality bias; ie with growing dimensionality …,Dagstuhl Seminar Proceedings,2007,8
Efficient algorithms for a robust modularity-driven clustering of attributed graphs,Patricia Iglesias Sánchez; Emmanuel Müller; Uwe Leo Korn; Klemens Böhm; Andrea Kappes; Tanja Hartmann; Dorothea Wagner,Abstract Clustering methods based on modularity are wellestablished and widely used forgraph data. However; today's applications store additional attribute information for eachnode in the graph. This attribute information may even be contradicting with the graphstructure; which raises a major challenge for the simultaneous mining of both informationsources. For attributed graphs it is essential to be aware of such contradicting effects causedby irrelevant attributes and highly deviating attribute values of outlier nodes. In this work; wefocus on the robustness of graph clustering wrt irrelevant attributes and outliers. We proposea modularity-driven approach for parameter-free clustering of attributed graphs and severalefficient algorithms for its computation. The efficiency is achieved by our incrementalcalculation of attribute information within these modularity-driven algorithms. In our …,*,2015,7
Estimating mutual information on data streams,Fabian Keller; Emmanuel Müller; Klemens Böhm,Abstract Mutual information is a well-established and broadly used concept in informationtheory. It allows to quantify the mutual dependence between two variables--an essential taskin data analysis. For static data; a broad range of techniques addresses the problem ofestimating mutual information. However; the assumption of static data is not applicable fortoday's dynamic data sources such as data streams: In contrast to static approaches; anonline estimator must be able to deal with the evolving; changing; and infinite nature of thestream. Furthermore; some tasks require the estimation to be available online whileprocessing the raw data stream. Our proposed solution M ise (Mutual Information StreamEstimation) allows a user to issue mutual information queries in arbitrary time windows. As akey feature; we introduce a novel sampling scheme; which ensures an equal treatment of …,Proceedings of the 27th International Conference on Scientific and Statistical Database Management,2015,6
MultiClust special issue on discovering; summarizing and using multiple clusterings,Emmanuel Müller; Ira Assent; Stephan Günnemann; Thomas Seidl; Jennifer Dy,Traditionally; clustering has focused on discovering a single grouping of the data. In manyapplications; however; data is collected for multiple analysis tasks. Several features ormeasurements provide complex or high dimensional information. In such data; one typicallyobserves several valid groupings; ie each data object fits in different roles. In contrast totraditional clustering these multiple clusterings describe alternative aspects that characterizethe data in different ways. Traditional single clustering solutions can thus be regarded asspecial cases of multiple clustering solutions; where only a single set of clusters representsone notion of intra-cluster similarity and inter-cluster dissimilarity. The generality of multipleclustering solutions allows capturing multi-faceted information in more than a singlesimilarity notion; while making it more challenging to detect cluster structures.,*,2015,6
OutRules: a framework for outlier descriptions in multiple context spaces,Emmanuel Müller; Fabian Keller; Sebastian Blanc; Klemens Böhm,Abstract Analyzing exceptional objects is an important mining task. It includes theidentification of outliers but also the description of outlier properties in contrast to regularobjects. However; existing detection approaches miss to provide important descriptions thatallow human understanding of outlier reasons. In this work we present OutRules; aframework for outlier descriptions that enable an easy understanding of multiple outlierreasons in different contexts. We introduce outlier rules as a novel outlier description model.A rule illustrates the deviation of an outlier in contrast to its context that is considered to benormal. Our framework highlights the practical use of outlier rules and provides the basis forfuture development of outlier description models.,Joint European Conference on Machine Learning and Knowledge Discovery in Databases,2012,6
