Fast and accurate gene prediction by decision tree classification,Rong She; Jeffrey Shih-Chieh Chu; Ke Wang; Nansheng Chen,Abstract Gene prediction is one of the most challenging tasks in genome analysis; for whichmany tools have been developed and are still evolving. In this paper; we present a novelgene prediction method that is both fast and accurate; by making use of protein homologyand decision tree classification. Specifically; we apply the principled entropy and decisiontree concepts to assist in such gene prediction process. Our goal is to resolve the exact genestructures in terms of finding “coding” regions (exons) and “non-coding” regions (introns).Unlike traditional classification tasks; however; we do not have explicit class labels for suchstructures in the genes. We use protein sequence (the product of gene) as a query to help infinding genes that are homologous to the query protein and deduce class labels based onhomology. Our experiments on the genomes of two nematodes C. elegans and C …,*,2010,1
The Application of" 5S" in Project-based Teaching Approach,Jing WANG; Ping LIU; Li-ying XUE,The article focuses on different issues arising in the current Project-based Teachingapproach in Higher Vocational Colleges. Taking Electromechanical Product AssemblyEngineering Training Course as the research subject; the author investigates themethodology by which" 5S" management approach is applied to Project-based Teaching inthe course. The course design; teaching process and course evaluation are discussed. Theauthor argues that 5S management approach can effectively help students developpersistence and enhance their professional capabilities of self-management and self-disciplining.,Journal of Ningbo Polytechnic,2010,1
On mining rating dependencies in online collaborative rating networks,Hady W Lauw; Ee-Peng Lim; Ke Wang,Abstract The trend of social information processing sees e-commerce and social webapplications increasingly relying on user-generated content; such as rating; to determine thequality of objects and to generate recommendations for users. In a rating system; a set ofreviewers assign to a set of objects different types of scores based on specific evaluationcriteria. In this paper; we seek to determine; for each reviewer and for each object; thedependency between scores on any two given criteria. A reviewer is said to have highdependency between a pair of criteria when his or her rating scores on objects based on thetwo criteria exhibit strong correlation. On the other hand; an object is said to have highdependency between a pair of criteria when the rating scores it receives on the two criteriaexhibit strong correlation. Knowing reviewer dependency and object dependency is …,Pacific-Asia Conference on Knowledge Discovery and Data Mining,2009,1
Preserving Individual Privacy in Serial Data Publishing,Raymond Chi-Wing Wong; Ada Wai-Chee Fu; Jia Liu; Ke Wang; Yabo Xu,Abstract: While previous works on privacy-preserving serial data publishing consider thescenario where sensitive values may persist over multiple data releases; we find that noprevious work has sufficient protection provided for sensitive values that can change overtime; which should be the more common case. In this work we propose to study the privacyguarantee for such transient sensitive values; which we call the global guarantee. Weformally define the problem for achieving this guarantee and derive some theoreticalproperties for this problem. We show that the anonymized group sizes used in the dataanonymization is a key factor in protecting individual privacy in serial publication. Wepropose two strategies for anonymization targeting at minimizing the average group sizeand the maximum group size. Finally; we conduct experiments on a medical dataset to …,arXiv preprint arXiv:0903.0682,2009,1
Isoscaling behavior studied by HIPSE model,Fu Yao; FANG De-Qing; MA Yu-Gang; CAI Xiang-Zhou; GUO Wei; MA Chun-Wang; TIAN Wen-Dong; WANG Hong-Wei; WANG Kun,Abstract The isoscaling behavior in the reaction system of 58; 64 Ni+ 9 Be has been studiedby using the heavy-ion phase-space exploration (HIPSE) model. The extracted isoscalingparameters α and β for both heavy and light fragments for HIPSE model calculations are ingood agreement with recent experimental data. The investigation shows that the parametersin the HIPSE model have some effect on the isoscaling parameter. The isoscalingparameters for hot and cold fragments have been extracted.,Chinese Physics C,2009,1
Mining nested association patterns,Ke Wang; Huiqing Liu,Abstract We introduce the framework of mining association patterns from nested databases.Two means to nest data items; namely; set and sequence; are considered. Theterm\collection" refers to a piece of data obtained by such nestings. A natural binary relationde nes the generalization hierarchy among all collections. A transaction database is a set ofgiven collections; called transactions. The problem of mining nested association patterns isto nd all collections that are generalization of some minimum fraction of transactions; callednested association patterns. We sketch out the working idea of an algorithm for miningnested association patterns.,SIGMOD Workshop on Research Issues on Data Mining and Knowledge Discovery,1997,1
Fuzzy Equi–Join and Its Evaluation,Weining Zhang; Ke Wang,Abstract We propose a new measure of fuzzy equality comparison based on the similarity ofpossibility distributions. we define a fuzzy equi–join based on the new fuzzy equalitycomparison; and allow threshold values to be associated with predicates of the joincondition. A sort–merge join algorithm based on a partial order of intervals is used toevaluate the fuzzy equi-join. In order for the evaluation to be efficient; we identify variousmappings; called FE indicators; that will determine appropriate intervals for fuzzy data withdifferent characteristics. Experiment results from our preliminary simulation of the algorithmshow a significant improvement of efficiency when FE indicators are used with the sort–merge join algorithm.,ISCA International Conference on Intelligent Systems; Boston,1997,1
Investigation of the correlation between high-pressure DTA parameters and burning-rate pressure exponent,Tu Youngzhen Li Baoxuan Wang Chaozhen; Wang Kexiu Jiang Xinhong,This paper described in detail the catalytical effect of two different additive means on themodification of burning-rate and pressure exponent. The correlation between thedecomposition parameters of pressure DTA (higher decomposition temperature; activationenergy atc) and the burning-rate and its pressure exponent was found. A new method ofsearching burning-rate pressure exponent additives was presented.,Journal of Propulsion Technology,1993,1
Personalized Top-N Sequential Recommendation via Convolutional Sequence Embedding,Jiaxi Tang; Ke Wang,ABSTRACT Top-N sequential recommendation models each user as a sequence of itemsinteracted in the past and aims to predict top-N ranked items that a user will likely interact ina “near future”. The order of interaction implies that sequential patterns play an importantrole where more recent items in a sequence have a larger impact on the next item. In thispaper; we propose a Convolutional Sequence Embedding Recommendation Model (Caser)as a solution to address this requirement. The idea is to embed a sequence of recent itemsinto an “image” in the time and latent spaces and learn sequential patterns as local featuresof the image using convolutional lters. This approach provides a uni ed and exible networkstructure for capturing both general preferences and sequential patterns. The experimentson public data sets demonstrated that Caser consistently outperforms state-of-the-art …,*,2018,*
Optimal Sizing and Arrangement of Tidal Current Farm,Yi Dai; Zhouyang Ren; Ke Wang; Wenyuan Li; Zhenwen Li; Wei Yan,This paper proposes a bi-level programming-based optimization method to determine thesizing of tidal current farm (TCF) and the arrangement of tidal current turbines reaching theminimized comprehensive generation cost of tidal power. Not only the characteristics of tidalcurrent velocity and wake effects but also the economic costs and environmental benefitsbrought by TCF integration are all incorporated in the proposed method. The methodincludes a power output model of TCF that can capture the characteristics of tidal currentvelocity and turbine wake effects; and a bi-level optimization model that takes into accountthe penalty costs of greenhouse gas emissions; the operation costs of power system; andthe investment cost of tidal current turbines. The bi-level model is solved using a geneticalgorithm and a quadratic programming technique. The effectiveness and adaptability of …,IEEE Transactions on Sustainable Energy,2018,*
Recovering loss to followup information using denoising autoencoders,Lovedeep Gondara; Ke Wang,Loss to followup is a significant issue in healthcare and has serious consequences for astudy's validity and cost. Methods available at present for recovering loss to followupinformation are restricted by their expressive capabilities and struggle to model highly non-linear relations and complex interactions. In this paper we propose a model based onovercomplete denoising autoencoders to recover loss to followup information. Designed towork with high volume data; results on various simulated and real life datasets show ourmodel is appropriate under varying dataset and loss to followup conditions and outperformsthe state-of-the-art methods by a wide margin (≥ 20% in some scenarios) while preservingthe dataset utility for final analysis.,Big Data (Big Data); 2017 IEEE International Conference on,2017,*
Constructing Top-k Routes with Personalized Submodular Maximization of POI Features,Hongwei Liang; Ke Wang,Abstract: We consider a practical top-k route problem: given a collection of points of interest(POIs) with rated features and traveling costs between POIs; a user wants to find k routesfrom a source to a destination; that maximally match her needs on feature preferences andcan be completed within a travel cost budget. One challenge is dealing with thepersonalized diversity requirement where each user has a different trade-off betweenquantity (the number of POIs with a specified feature) and variety (the coverage of specifiedfeatures). Another challenge is the large scale of the POI network and the great manyalternative routes to search. We model the personalized diversity requirement by the wholeclass of submodular functions; and present an optimal solution to the top-k route problemthrough an index structure for retrieving relevant POIs in both feature and route spaces …,arXiv preprint arXiv:1710.03852,2017,*
Probabilistic Power Flow Analysis of Power Systems Incorporating Tidal Current Generation,Zhouyang Ren; Ke Wang; Wenyuan Li; Liming Jin; Yi Dai,A probabilistic power-flow analysis method for power systems with tidal power sources ispresented in this paper. The regularity of tidal power is modeled using a k-means clusteringtechnique and the randomness of tidal power is modeled by using a nonparametric kerneldensity estimation method. A stochastic sampling method is also developed to generaterandom samples of tidal power time series for Monte Carlo based probabilistic power-flowanalysis. The influence of tidal current generation on power flows is then evaluated andquantified considering both the regularity and randomness of tidal power. The measuredtidal current speed data of two different locations in Florida and Alaska states; USA; and theIEEE 57-bus standard test system are used to verify the correctness and effectiveness of thepresented probabilistic power-flow analysis method.,IEEE Transactions on Sustainable Energy,2017,*
Risk Clearance with Guaranteed Precision,Ryan McBride; Ke Wang; Viswanadh Nekkanti; Wenyuan Li,Abstract In real life applications; we often face the following risk clearance problem: given aset of instances with a known numeric outcome Y (eg; a toxicity level); we want to learn amodel to identify new instances that have a low risk; ie; the probability of the Y valueexceeding a certain maximum MAX is less than some threshold t. This problem guaranteesthat the cleared instances have the minimum precision of 1–t for Y≤ MAX. By clearing suchlow risk instances; we can allocate costly resources to the remaining high risk instances. Inthis work; we formulate this problem as Risk Clearance with a goal of maximizing theclearance of low risk instances. Existing classification models fail to solve Risk Clearanceadequately; so we develop algorithms designed specifically for this problem. We thenvalidate that our approach improves on existing work via experiments on an industrial …,*,2017,*
Revisiting Security Risks of Asymmetric Scalar Product Preserving Encryption and Its Variants,Weipeng Lin; Ke Wang; Zhilin Zhang; Hong Chen,Cloud computing has emerged as a compelling vision for managing data and deliveringquery answering capability over the internet. This new way of computing also poses a realrisk of disclosing confidential information to the cloud. Searchable encryption addresses thisissue by allowing the cloud to compute the answer to a query based on the cipher texts ofdata and queries. Thanks to its inner product preservation property; the asymmetric scalar-product-preserving encryption (ASPE) has been adopted and enhanced in a growingnumber of works toperform a variety of queries and tasks in the cloud computingsetting.However; the security property of ASPE and its enhancedschemes has not been studiedcarefully. In this paper; we show acomplete disclosure of ASPE and several previouslyunknownsecurity risks of its enhanced schemes. Meanwhile; efficientalgorithms are …,Distributed Computing Systems (ICDCS); 2017 IEEE 37th International Conference on,2017,*
Olefin Polymerization Catalyst and a Combined Catalyst Containing the Same,*,The present disclosure provides an olefin polymerization catalyst and a combined catalystcontaining the same. The catalyst comprises a reaction product of a magnesium dialkoxide;a titanium compound; an electron donor compound A and an electron donor compound B;wherein the electron donor compound A is a sulfonyl compound represented by generalformula I; X is a disubstituted or unsubstituted group 14 element atom; a monosubstituted orunsubstituted group 15 element atom or group 16 element atom; and the substituent is amonocyclic; polycyclic or heteroatom-containing cyclic group or an aliphatic chain; R1 andR2 are respectively hydrogen atom; halogen atom; substituted or unsubstituted alkyl;cycloalkyl; aryl; aralkyl; alkylaryl or heteroatom-containing cyclic group. The combinedcatalyst comprises the catalyst and an organoaluminium compound and can comprise an …,*,2016,*
Optical spectroscopy of the Weyl semimetal TaAs,Yaomin Dai; Antoinette Jane Taylor; Dmitry Anatolievitch Yarotski; Rohit Prativadi Prasankumar; Bing Xu; Lingxiao Zhao; Kai Wang; Run Yang; Wei Zhang; Jinyun Liu; Hong Xiao; Genfu Chen; Xianggang Qiu,Author(s): Dai; Yaomin; Taylor; Antoinette Jane; Yarotski; Dmitry Anatolievitch; Prasankumar;Rohit Prativadi; Xu; Bing; Zhao; Lingxiao; Wang; Kai; Yang; Run; Zhang; Wei; Liu; Jinyun;Xiao; Hong; Chen; Genfu; Qiu; Xianggang … Intended for: I am Invited to visit LPEM; ESPCI;Paris; France. I will give a talk about our recently published work in the Lab … Disclaimer: LosAlamos National Laboratory; an affirmative action/equal opportunity employer;is operated bythe Los Alamos National Security; LLC for the National NuclearSecurity Administration of theUS Department of Energy under contract DE-AC52-06NA25396. By approving this article; thepublisher recognizes that the US Government retains nonexclusive; royalty-free license to publishor reproduce the published form of this contribution; or to allow others to do so; for US Governmentpurposes. Los Alamos National Laboratory requests that the publisher identify this article …,*,2016,*
THE POTENTIAL UTILITY OF BRAIN INJURY BIOMARKER IN PRE-CLINICAL DRUG SCREENING BY OPERATION BRAIN TRAUMA THERAPY,S Mondello; D Shear; H Bramlett; C Dixon; K Schmid; W Dietrich; K Wang; R Hayes; O Glushakova; J Povlishock; F Tortella; P Kochanek,*,JOURNAL OF NEUROTRAUMA,2016,*
Abstracts from The 12th Symposium of the International Neurotrauma Society February 1–4; 2016 Cape Town; South Africa,S Yokobori; G Hergenroeder; E Suehiro; M Yamaguch; Y Kuroda; H Kobata; K Kawakita; Y Oda; H Yatsushige; Y Nakamura; T Hirao; O Tasaki; T Miyagi; K Unemoto; J Kaneko; H Yokota; S Gajavelli; M Bullock; W Dietrich; D Okonkwo; D Kim; H Nguyen; N Doan; C Wolfla; G Pollock; N Silva; N Vasconcelos; E Gomes; R Lima; R Silva; P Barradas; J Lopes; E Oliveira; N Sousa; A Salgado; R Dunn; J Sothman; J Stander; M Maleki; A Al-Azri; C Couturier; J Marcoux; A Gamil; K Salih; E Mikkonen; R Raj; R Raj; S Bendel; M Reinikainen; S Hoppu; T Luoto; T Ala-Kokko; S Tetri; R Laitio; T Koivisto; J Rinne; R Kivisaari; J Siironen; M Skrifvars; E Suehiro; Y Fujiyama; K Sugimoto; H Koizumi; M Suzuki; M Hoffer; M Szczupak; A Kiderman; C Pelusso; S Murphy; C Balaban; C Ruven; W Wu; F Corrigan; R Vink; M Günther; F Al Nimer; F Piehl; S Plantman; M Risling; T Mathiesen; A Ahmed; M Spurlock; S Gajavelli; K Rivera; A Mahavadi; B Desousa; M Bullock; J Blixt; M Wanecek; E Gunnarson; J Kwon; K Jang; K Sugimoto; E Suehiro; H Sadahiro; H Yoshino; A Yamane; A Inamura; K Haji; Y Fujiyama; H Koizumi; M Suzuki; L Hill; H Bulstrode; J Nicholl; G Hudson; P Chinnery; V Di Pietro; A Belli; EP Thelin; A Frostell; J Mulder; N Mitsios; P Damberg; S Nikkhou-Aski; M Risling; M Svensson; MC Morganti-Kossmann; BM Bellander; T Glenn; G Brooks; M Horning; P Vespa; D Hovda; D McArthur; S Wolahan; C Real; M Tubi; N Martin; S Dey; D Shukla; Klaus Zweckberger; Jian Wang; Yiang Liu; Michael G Fehlings; A Lilja; K Fugleholm; J Kelsen; M Andresen; A Kiderman; M Hoffer; M Szczupak; C Gallagher; S Murphy; G Meisenholder; J Crawford; K Marshall; T Cooley; A Braverman; C Balaban,Methods: Patients who underwent DC for subdural hematoma (SDH) were divided into 2groups: fenestration (F); n= 33; and no fenestration (NF); n= 11. Fenestration involvesplacement of twist-drill holes 1-2 cm apart throughout the bone flap. Clinical data (age; sex;history of antiplatelet/anticoagulation (AA); and presence of drains) were collected.Postoperative volume (PV) and midline shift (MLS) were evaluated.,Journal of Neurotrauma,2016,*
A genetic evidence of chromosomal fragment from bridge parent existing in substitution lines between two common wheat varieties,ZHAO Pei; WANG Ke; Zhi-shan LIN; Hui-yun LIU; LI Xin; Li-pu DU; Yue-ming YAN; Xing-guo YE,Abstract Locating of important agronomic genes onto chromosome is helpful for efficientdevelopment of new wheat varieties. Wheat chromosome substitution lines between twovarieties have been widely used for locating genes because of their distinctive advantagesin genetic analysis; compared with the aneuploid genetic materials. Apart from thesubstituted chromosome; the other chromosomes between the substitution lines and theirrecipient parent should be identical; which eases the gene locating practice. In this study; aset of chromosome substitution lines with cv. Wichita (WI) as the recipient parent and cv.Cheyenne (CNN) as the donor parent were studied for the composition of high molecularweight glutenin subunits (HMW-GS) as well as a range of agronomic important traits. Resultsrevealed that the substitution lines of WI (CNN5D); WI (CNN6A) and WI (CNN7B) had …,Journal of Integrative Agriculture,2016,*
Modelling cascades over time in microblogs,Wei Xie; Feida Zhu; Siyuan Liu; Ke Wang,One of the most important features of microblogging services such as Twitter is how easy it isto re-share a piece of information across the network through various user connections;forming what we call a" cascade". Business applications such as viral marketing have drivena tremendous amount of research effort predicting whether a certain cascade will go viral.Yet the rarity of viral cascades in real data poses a challenge to all existing predictionmethods. One solution is to simulate cascades that well fit the real viral ones; which requiresour ability to tell how a certain cascade grows over time. In this paper; we build a generaltime-aware cascade model for each particular cascade; in which the chance of one user's re-sharing behaviour over time is modelled as a hazard function of time. Based on two keyobservations on user retweeting behaviour; we design an appropriate hazard function …,Big Data (Big Data); 2015 IEEE International Conference on,2015,*
Studies on dual-frequency countercurrent energy-gathered ultrasonic-assisted extraction technology and antioxidant activity of inulin.,Ke Wang; HaiLe Ma; XiaoFei Ye,Abstract: Helianthus tuberosus L. is a natural herb with excellent health care function.Ultrasound is widely used for auxiliary extraction of natural ingredients. Using dual-frequency countercurrent energy-gathered ultrasonic-assisted extraction technology; thispaper studied the effect of ultrasound on extraction ratio and antioxidant activity of inulinpolysaccharide; influence of each factor sorting order was power density> solid/liquid ratio>time> temperature> pulse/interval ratio. The optimum technology parameter was ultrasounddual-frequency combination of 20 kHz/35 kHz; ultrasound pulse/interval ratio of 4 s/3 s;ultrasound power density of 250 W/L; solid-liquid ratio of 1: 20; extraction temperature of 55C and extraction time of 15 min. Under this condition; the inulin extraction ratio was 56.35%;while under the same condition by hot water extraction method the extraction ratio was …,Journal of Agricultural Science and Technology (Beijing),2015,*
Abstracts from The 32nd Annual National Neurotrauma Symposium June 29–July 2; 2014 San Francisco; California,DA Grant; E Teng; RO Serpa; ML Prins; AV Ulyanova; PF Koch; MR Grovola; JP Harris; DK Cullen; JA Wolf; SC Bressler; H Bharadwaj; I Choi; Y Bogdanova; BG Shinn-Cunningham; JM Morganti; TD Jopson; S Liu; LK Riparip; CK Guandique; N Gupta; S Rosi; CM Macolino; BV Daiutolo; AL Tyburski; MB Elliott; JP Harris; LA Struzyna; PL Murphy; DK Cullen; DW Simon; J Wallisch; MJ Bell; H Bayir; RK Aneja; K Janesko-Feldman; PM Kochanek; RS Clark; GP Liao; RA Hetz; F Jimenez; JT Chang; AN Moore; SC Kosmach; M Day; DA Lee; LL Worth; SI Savitz; P Dash; CS Cox; JM Hinzman; N Andaluz; LA Shutter; DO Okonkwo; C Pahl; AJ Strong; JP Dreier; JA Hartings; MO Blaya; P Tsoulfas; O Furones-Alonso; HM Bramlett; WD Dietrich; K Morioka; T Tazoe; X Ma; CF Guandique; L VanCitters; JR Huie; JC Bresnahan; MS Beattie; S Tanaka; AR Ferguson; T Ogata; EM Swartz; GM Deiter; SD Stocker; GM Holmes; JR Huie; ED Stuck; KH Lee; KA Irvine; JC Bresnahan; MS Beattie; JW Grau; AR Ferguson; SL Okada; N Stivers; DP Stirling; XB Wu; CL Walker; QB Lu; XM Xu; RE von Leden; S Jaiswal; CM Wilson; G Khayrullina; RG Selwyn; KR Byrnes; GW Hawryluk; W Whetstone; R Saigal; A Ferguson; J Talbott; J Bresnahan; J Pan; S Dhall; M Beattie; G Manley; E Daneshi Kohan; ML Delva; CJ Sparrey; M Aceves; MA Hook; JP Dollé; A Jaye; VE Johnson; DH Smith; D Scutella; Y Pan; JL Proctor; G Fiskum; Y Deng-Bryant; LY Leung; R Readnower; W Yang; DA Shear; FC Tortella; WX Wang; NP Visavadiya; JD Pandya; PT Nelson; PG Sullivan; JE Springer; MM Harper; J Herlein; A Hedburg-Buenz; MG Anderson; WR Paljug; EE Abrahamson; MD Ikonomovic; S Ji; W Zhao; Z Zhang; M Saraswati; CL Robertson; RC Koehler; S Kannan; S Liu; C Sarkar,Traumatic brain injury (TBI) is a risk factor for Alzheimer's disease (AD); but the cumulativeeffects of mild repeat TBI (RTBI) in the adolescent brain on AD pathogenesis are unknown.We hypothesized that RTBI would increase secretase concentration acutely in the wild-typeSprague-Dawley rats and accelerate the accumulation of amyloid beta (Ab) chronically inamyloid precursor protein/presenilin 1 transgenic rats (APP/PS1). Postnatal day 35 (P35)male wild-type rats received sham or 4 RTBI at 24 hour intervals (4RTBI24) using a closed-head injury model. Bilateral cortices were analyzed 24 or 48 hours post-injury using westernblots to measure the concentration of beta-site-APP-cleaving-enzyme-1 (BACE1) and PS1;two secretases required for Ab production. The P35 APP/PS1 rats received sham; 4RTBI24or 4 RTBI at 72 hour intervals (4RTBI72) and were perfused at 12 months of age. One …,Journal of Neurotrauma,2014,*
Latent Tunnel Based Information Propagation in Microblog Networks,Chenyi Zhang; Jianling Sun; Ke Wang,Abstract Information propagation in a microblog network aims to identify a set of seed usersfor propagating a target message to as many interested users as possible. This problemdiffers from the traditional influence maximization in two major ways: it has a content-richtarget message for propagation and it treats each link in the network as communication oncertain topics and emphasizes the topic relevance of such communication in propagatingthe target message. In realistic situations; however; the topics associated with a link are notexplicitly expressed but are hidden in the microblogs previously exchanged through the link.In this paper; we present a topic-aware solution to information propagation in a microblognetwork. We first model the latent topic structure of the network using observed microblogmessages published in the network. We then present two methods for estimating the …,*,2014,*
