Visually aided exploration of interesting association rules,Bing Liu; Wynne Hsu; Ke Wang; Shu Chen,Abstract Association rules are a class of important regularities in databases. They are foundto be very useful in practical applications. However; the number of association rulesdiscovered in a database can be huge; thus making manual inspection and analysis of therules difficult. In this paper; we propose a new framework to allow the user to explore thediscovered rules to identify those interesting ones. This framework has two components; aninterestingness analysis component; and a visualization component. The interestingnessanalysis component analyzes and organizes the discovered rules according to variousinterestingness criteria with respect to the user's existing knowledge. The visualizationcomponent enables the user to visually explore those potentially interesting rules. The keystrength of the visualization component is that from a single screen; the user is able to …,Pacific-Asia Conference on Knowledge Discovery and Data Mining,1999,65
GenBlastA: enabling BLAST to identify homologous gene sequences,Rong She; Jeffrey S-C Chu; Ke Wang; Jian Pei; Nansheng Chen,Abstract BLAST is an extensively used local similarity search tool for identifying homologoussequences. When a gene sequence (either protein sequence or nucleotide sequence) isused as a query to search for homologous sequences in a genome; the search results;represented as a list of high-scoring pairs (HSPs); are fragments of candidate genes ratherthan full-length candidate genes. Relevant HSPs (“signals”); which represent candidategenes in the target genome sequences; are buried within a report that contains alsohundreds to thousands of random HSPs (“noises”). Consequently; BLAST results are oftenoverwhelming and confusing even to experienced users. For effective use of BLAST; aprogram is needed for extracting relevant HSPs that represent candidate homologous genesfrom the entire HSP report. To achieve this goal; we have designed a graph-based …,Genome research,2009,60
Publishing sensitive transactions for itemset utility,Yabo Xu; Benjamin CM Fung; Ke Wang; Ada WC Fu; Jian Pei,We consider the problem of publishing sensitive transaction data with privacy preservation.High dimensionality of transaction data poses unique challenges on data privacy and datautility. On one hand; re-identification attacks tend to use a subset of items that infrequentlyoccur in transactions; called moles. On the other hand; data mining applications typicallydepend on subsets of items that frequently occur in transactions; called nuggets. Thus theproblem is how to eliminate all moles while retaining nuggets as much as possible. Achallenge is that moles and nuggets are multi-dimensional with exponential growth and aretangled together by shared items. We present a novel and scalable solution to this problem.The novelty lies in a compact border data structure that eliminates the need of generating allmoles and nuggets.,Data Mining; 2008. ICDM'08. Eighth IEEE International Conference on,2008,59
Mining constrained gradients in large databases,Guozhu Dong; Jiawei Han; JWM Lam; Jian Pei; K Wangm; Wei Zou,Many data analysis tasks can be viewed as search or mining in a multidimensional space(MDS). In such MDSs; dimensions capture potentially important factors for givenapplications; and cells represent combinations of values for the factors. To systematicallyanalyze data in MDS; an interesting notion; called" cubegrade" was recently introduced byImielinski et al.[2002]; which focuses on the notable changes in measures in MDS bycomparing a cell (which we refer to as probe cell) with its gradient cells; namely; itsancestors; descendants; and siblings. We call such queries gradient analysis queries (GQs).Since an MDS can contain billions of cells; it is important to answer GQs efficiently. We focuson developing efficient methods for mining GQs constrained by certain (weakly)antimonotone constraints. Instead of conducting an independent gradient-cell search …,IEEE Transactions on Knowledge and Data Engineering,2004,54
Mining unexpected rules by pushing user dynamics,Ke Wang; Yuelong Jiang; Laks VS Lakshmanan,Abstract Unexpected rules are interesting because they are either previously unknown ordeviate from what prior user knowledge would suggest. In this paper; we study threeimportant issues that have been previously ignored in mining unexpected rules. First; theunexpectedness of a rule depends on how the user prefers to apply the prior knowledge to agiven scenario; in addition to the knowledge itself. Second; the prior knowledge should beconsidered right from the start to focus the search on unexpected rules. Third; theunexpectedness of a rule depends on what other rules the user has seen so far. Thus; onlyrules that remain unexpected given what the user has seen should be consideredinteresting. We develop an approach that addresses all three problems above and evaluateit by means of experiments focusing on finding interesting rules.,Proceedings of the ninth ACM SIGKDD international conference on Knowledge discovery and data mining,2003,54
Mining actionable patterns by role models,Ke Wang; Yuelong Jiang; Alexander Tuzhilin,Data mining promises to discover valid and potentially useful patterns in data. Often;discovered patterns are not useful to the user." Actionability" addresses this problem in that apattern is deemed actionable if the user can act upon it in her favor. We introduce the notionof" action" as a domain-independent way to model the domain knowledge. Given a data setabout actionable features and an utility measure; a pattern is actionable if it summarizes apopulation that can be acted upon towards a more promising population observed with ahigher utility. We present several pruning strategies taking into account the actionabilityrequirement to reduce the search space; and algorithms for mining all actionable patterns aswell as mining the top k actionable patterns. We evaluate the usefulness of patterns and thefocus of search on a real-world application domain.,Data Engineering; 2006. ICDE'06. Proceedings of the 22nd International Conference on,2006,53
Discovering frequent substructures from hierarchical semi-structured data,Gao Cong; Lan Yi; Bing Liu; Ke Wang,Abstract Frequent substructure discovery from a collection of semi-structured objects canserve for storage; browsing; querying; indexing and classification of semi-structureddocuments. This paper examines the problem of discovering frequent substructures from acollection of hierarchical semi-structured objects of the same type. The use of wildcard is animportant aspect of substructure discovery from semi-structured data due to the irregularityand lack of fixed structure of such data. This paper proposes a more general and powerfulwildcard mechanism; which allows us to find more complex and interesting substructuresthan existing techniques. Furthermore; the complexity of structural information of semi-structured data and the usage of wildcard make the existing frequent set mining algorithmsinapplicable for substructure discovery. In this work; we adopt a vertical format for the …,*,2002,52
Can the utility of anonymized data be used for privacy breaches?,Raymond Chi-Wing Wong; Ada Wai-Chee Fu; Ke Wang; Philip S Yu; Jian Pei,Abstract Group based anonymization is the most widely studied approach for privacy-preserving data publishing. Privacy models/definitions using group based anonymizationincludes k-anonymity; l-diversity; and t-closeness; to name a few. The goal of this article is toraise a fundamental issue regarding the privacy exposure of the approaches using groupbased anonymization. This has been overlooked in the past. The group basedanonymization approach by bucketization basically hides each individual record behind agroup to preserve data privacy. If not properly anonymized; patterns can actually be derivedfrom the published data and be used by an adversary to breach individual privacy. Forexample; from the medical records released; if patterns such as that people from certaincountries rarely suffer from some disease can be derived; then the information can be …,ACM Transactions on Knowledge Discovery from Data (TKDD),2011,50
Mining changes of classification by correspondence tracing,Ke Wang; Senqiang Zhou; Chee Ada Fu; Jeffrey Xu Yu,Abstract We study the problem of mining changes of classification characteristics as the datachanges. Available are an old classifier; representing previous knowledge aboutclassification characteristics; and a new data. We want to find the changes of classificationcharacteristics in the new data. An example of such changes is “members with a large familyno longer shop frequently; but they used to”. Finding this kind of changes holds the key forthe organization to adopt to the changed environment and stay ahead of competitors. Thechallenge is that it is difficult to see what has really changed from comparing the old andnew classifiers that could be very large and different. In this paper; we propose a techniqueto identify such changes. The idea is tracing the characteristics; in the old and newclassifiers; that correspond to each other by classifying the same examples. We describe …,*,2003,49
Incremental discovery of sequential patterns,Ke Wang; Jye Tan,Abstract In this paper; incremental discovery of sequential patterns from a large sequencedatabase is studied. A sequential pattern has the form a→ β; where a and β aresubsequences in the database; which says that events a will be followed by events β withsome minimum support and confidence. We consider the scenario that sequential patternshave previously been discovered and materialized and an update is subsequently made tothe database. Rediscovering all patterns by scanning the whole database is not acceptablein a dynamic and large database environment. We propose an incremental discoveryalgorithm that produces the updated patterns by scanning only the affected part of thedatabase and data structures. In addition; the algorithm handles the dynamism of theminimum support and confidence without recomputation; allowing the user to tune these …,1996 ACM SIGMOD Data Mining Workshop: Research Issues on Data Mining and Knowledge Discovery (SIGMOD’96),1996,49
Online anonymity for personalized web services,Yabo Xu; Ke Wang; Guoliang Yang; Ada WC Fu,Abstract To receive personalized web services; the user has to provide personal informationand preferences; in addition to the query itself; to the web service. However; detailedpersonal information could identify the sender of sensitive queries; thus compromise userprivacy. We propose the notion of online anonymity to enable users to issue personalizedqueries to an untrusted web service while with their anonymity preserved. The challenge forproviding online anonymity is dealing with unknown and dynamic web users who can getonline and offline at any time. We define this problem; discuss its implications anddifferences from the problems in the literature; and propose a solution.,Proceedings of the 18th ACM conference on Information and knowledge management,2009,48
Integrating private databases for data analysis,Ke Wang; Benjamin CM Fung; Guozhu Dong,Abstract In today's globally networked society; there is a dual demand on both informationsharing and information protection. A typical scenario is that two parties wish to integratetheir private databases to achieve a common goal beneficial to both; provided that theirprivacy requirements are satisfied. In this paper; we consider the goal of building a classifierover the integrated data while satisfying the k-anonymity privacy requirement. The k-anonymity requirement states that domain values are generalized so that each value ofsome specified attributes identifies at least k records. The generalization process must notleak more specific information other than the final integrated data. We present a practicaland efficient solution to this problem.,International Conference on Intelligence and Security Informatics,2005,46
genBlastG: using BLAST searches to build homologous gene models,Rong She; Jeffrey Shih-Chieh Chu; Bora Uyar; Jun Wang; Ke Wang; Nansheng Chen,Abstract Motivation: BLAST users frequently expect to obtain homologous genes with certainsimilarity to their query genes. But what they get from BLAST searches are often collectionsof local alignments called high-scoring segment pairs (HSPs). On the other hand; mosthomology-based gene finders have been built using computation-intensive algorithms;without taking full advantage of BLAST searches that have been perfected over the lastdecades. Results: Here we report an efficient algorithm; genBlastG that directly uses theHSPs reported by BLAST to define high-quality gene models. Availability: http://genome. sfu.ca/genblast/download. html Contact: chenn@ sfu. ca Supplementary information:Supplementary data are available at Bioinformatics online.,Bioinformatics,2011,43
Introduction to privacy preserving data publishing: concepts and techniques,Benjamin CM Fung; Ke Wang; Ada Wai-Chee Fu; Philip S Yu,Gaining access to high-quality data is a vital necessity in knowledge-based decisionmaking. But data in its raw form often contains sensitive information about individuals.Providing solutions to this problem; the methods and tools of privacy-preserving datapublishing enable the publication of useful information while protecting data privacy.Introduction to Privacy-Preserving Data Publishing: Concepts and Techniques presentsstate-of-the-art information sharing and data integration methods that take into accountprivacy and data mining requirements. The first part of the book discusses the fundamentalsof the field. In the second part; the authors present anonymization methods for preservinginformation utility for specific data mining tasks. The third part examines the privacy issues;privacy models; and anonymization methods for realistic and challenging data publishing …,*,2010,41
On optimal anonymization for l+-diversity,Junqiang Liu; Ke Wang,Publishing person specific data while protecting privacy is an important problem. Existingalgorithms that enforce the privacy principle called l-diversity are heuristic based due to theNP-hardness. Several questions remain open: can we get a significant gain in the data utilityfrom an optimal solution compared to heuristic ones; can we improve the utility by setting adistinct privacy threshold per sensitive value; is it practical to find an optimal solutionefficiently for real world datasets. This paper addresses these questions. Specifically; wepresent a pruning based algorithm for finding an optimal solution to an extended form of the l-diversity problem. The novelty lies in several strong techniques: a novel structure forenumerating all solutions; methods for estimating cost lower bounds; strategies fordynamically arranging the enumeration order and updating lower bounds. This approach …,Data Engineering (ICDE); 2010 IEEE 26th International Conference on,2010,40
Summarizing review scores of “unequal” reviewers,Hady W Lauw; Ee-Peng Lim; Ke Wang,Abstract A frequently encountered problem in decision making is the following reviewproblem: review a large number of objects and select a small number of the best ones. Anexample is selecting conference papers from a large number of submissions. This probleminvolves two sub-problems: assigning reviewers to each object; and summarizing reviewers'scores into an overall score that supposedly reflects the quality of an object. In this paper; weaddress the score summarization sub-problem for the scenario where a small number ofreviewers evaluate each object. Simply averaging the scores may not work as even a singlereviewer could influence the average significantly. We recognize that reviewers are notnecessarily on an equal ground and propose the notion of “leniency” to model this differenceof reviewers. Two insights underpin our approach:(1) the “leniency” of a reviewer …,*,2007,40
MPIS: Maximal-profit item selection with cross-selling considerations,Raymond Chi-Wing Wong; Ada Wai-Chee Fu; Ke Wang,In the literature of data mining; many different algorithms for association rule mining havebeen proposed. However; there is relatively little study on how association rules can aid inmore specific targets. One of the applications for association rules-maximal-profit itemselection with cross-selling effect (MPIS) problem-is investigated. The problem is aboutselecting a subset of items; which can give the maximal profit with the consideration of cross-selling. We prove that a simple version of this problem is NP-hard. We propose a newapproach to the problem with the consideration of the loss rule-a kind of association rule tomodel the cross-selling effect. We show that the problem can be transformed to a quadraticprogramming problem. In case quadratic programming is not applicable; we also propose aheuristic approach. Experiments are conducted to show that both of the proposed …,Data Mining; 2003. ICDM 2003. Third IEEE International Conference on,2003,40
Small domain randomization: same privacy; more utility,Rhonda Chaytor; Ke Wang,Abstract Random perturbation is a promising technique for privacy preserving data mining. Itretains an original sensitive value with a certain probability and replaces it with a randomvalue from the domain with the remaining probability. If the replacing value is chosen from alarge domain; the retention probability must be small to protect privacy. For this reason;previous randomization-based approaches have poor utility. In this paper; we propose analternative way to randomize sensitive values; called small domain randomization. First; wepartition the given table into sub-tables that have smaller domains of sensitive values. Then;we randomize the sensitive values within each sub-table independently. Since each sub-table has a smaller domain; a larger retention probability is permitted. We propose thisapproach as an alternative to classical partition-based approaches to privacy preserving …,Proceedings of the VLDB Endowment,2010,37
Concurrent discretization of multiple attributes,Ke Wang; Bing Liu,Abstract Better decision trees can be learnt by merging continuous values into intervals.Merging of values; however; could introduce inconsistencies to the data; or information loss.When it is desired to maintain a certain consistency; interval mergings in one attribute coulddisable those in another attribute. This interaction raises the issue of determining the orderof mergings. We consider a globally greedy heuristic that selects the “best” merging from allcontinuous attributes at each step. We present an implementation of the heuristic in whichthe best merging is determined in a time independent of the number of possible mergings.Experiments show that intervals produced by the heuristic lead to improved decision trees.,Pacific Rim International Conference on Artificial Intelligence,1998,37
Data partition and parallel evaluation of datalog programs,Weining Zhang; Ke Wang; Siu-Cheung Chau,Parallel bottom-up evaluation provides an alternative for the efficient evaluation of logicprograms. Existing parallel evaluation strategies are neither effective nor efficient indetermining the data to be transmitted among processors. In this paper; we propose redifferent strategy; for general Datalog programs; that is based on the partitioning of datarather than that of rule instantiations. The partition and processing schemes defined in thispaper are more general than those in existing strategies. A parallel evaluation algorithm isgiven based on the semi-naive bottom-up evaluation. A notion of potential usefulness isrecognized as a data transmission criterion to reduce; both effectively and efficiently; theamount of data transmitted. Heuristics and algorithms are proposed for designing thepartition and processing schemes for a given program. Results from an experiment show …,IEEE Transactions on Knowledge and Data Engineering,1995,37
Anonymizing transaction data by integrating suppression and generalization,Junqiang Liu; Ke Wang,Abstract Privacy protection in publishing transaction data is an important problem. A keyfeature of transaction data is the extreme sparsity; which renders any single techniqueineffective in anonymizing such data. Among recent works; some incur high information loss;some result in data hard to interpret; and some suffer from performance drawbacks. Thispaper proposes to integrate generalization and suppression to reduce information loss.However; the integration is non-trivial. We propose novel techniques to address theefficiency and scalability challenges. Extensive experiments on real world databases showthat this approach outperforms the state-of-the-art methods; including global generalization;local generalization; and total suppression. In addition; transaction data anonymized by thisapproach can be analyzed by standard data mining tools; a property that local …,Pacific-Asia Conference on Knowledge Discovery and Data Mining,2010,36
OrthoCluster: a new tool for mining synteny blocks and applications in comparative genomics,Xinghuo Zeng; Matthew J Nesbitt; Jian Pei; Ke Wang; Ismael A Vergara; Nansheng Chen,Abstract By comparing genomes among both closely and distally related species;comparative genomics analysis characterizes structures and functions of different genomesin both conserved and divergent regions. Synteny blocks; which are conserved blocks ofgenes on chromosomes of related species; play important roles in comparative genomicsanalysis. Although a few tools have been designed to identify synteny blocks; most of themcannot handle some challenging application requirements; particularly the strandedness ofgenes; gene inversions; gene duplications; and comparison of more than two genomes. Wedeveloped a data mining tool; Ortho-Cluster; which can handle all those challenges. It ispublicly available at http://genome. sfu. ca/projects/orthocluster. OrthoCluster takes theannotated gene sets of candidate genomes and pairwise orthologous relationships as …,Proceedings of the 11th international conference on Extending database technology: Advances in database technology,2008,36
Bias and controversy: beyond the statistical deviation,Hady W Lauw; Ee-Peng Lim; Ke Wang,Abstract In this paper; we investigate how deviation in evaluation activities may reveal biason the part of reviewers and controversy on the part of evaluated objects. We focus on a'data-centric approach'where the evaluation data is assumed to represent the'ground truth'. Thestandard statistical approaches take evaluation and deviation at face value. We argue thatattention should be paid to the subjectivity of evaluation; judging the evaluation score notjust on'what is being said'(deviation); but also on'who says it'(reviewer) as well as on'whom itis said about'(object). Furthermore; we observe that bias and controversy are mutuallydependent; as there is more bias if there is higher deviation on a less controversial object.To address this mutual dependency; we propose a reinforcement model to identify bias andcontroversy. We test our model on real-life data to verify its applicability.,Proceedings of the 12th ACM SIGKDD international conference on Knowledge discovery and data mining,2006,34
Privacy-preserving frequent pattern mining across private databases,AW-C Fu; RC-W Wong; Ke Wang,Privacy consideration has much significance in the application of data mining. It is veryimportant that the privacy of individual parties is not exposed when data mining techniquesare applied to a large collection of data about the parties. In many scenarios such as datawarehousing or data integration; data from the different parties form a many-to-manyschema. This paper addresses the problem of privacy-preserving frequent pattern mining insuch a schema across two dimension sites. We assume that sites are not trusted and theyare semi-honest. Our method is based on the concept of semi-join and does not involve dataencryption which is used in most previous work. Experiments are conducted to study theefficiency of the proposed models.,Data Mining; Fifth IEEE International Conference on,2005,34
Bias and controversy in evaluation systems,Hady W Lauw; Ee-Peng Lim; Ke Wang,Evaluation is prevalent in real life. With the advent of Web 2.0; online evaluation hasbecome an important feature in many applications that involve information (eg; video; photo;and audio) sharing and social networking (eg; blogging). In these evaluation settings; a setof reviewers assign scores to a set of objects. As part of the evaluation analysis; we want toobtain fair reviews for all the given objects. However; the reality is that reviewers maydeviate in their scores assigned to the same object; due to the potential" bias" of reviewersor" controversy" of objects. The statistical approach of averaging deviations to determinebias and controversy assumes that all reviewers and objects should be given equal weight.In this paper; we look beyond this assumption and propose an approach based on thefollowing observations: 1) evaluation is" subjective;" as reviewers and objects have …,IEEE Transactions on Knowledge and Data Engineering,2008,31
Classification Pruning for Web-request Prediction.,Ian Tian Yi Li; Qiang Yang; Ke Wang,ABSTRACT N-gram and repeating pattern based prediction rules have been used for next-web request prediction. However; there is no rigorous study of how to select the best rule fora given observation. The longer patter may not be the best pattern; because such patters arealso more rare. In this paper; we propose several rule-pruning methods that enable us tobuild efficient; compact and high-quality classifiers for webrequest prediction.,WWW Posters,2001,30
