Constant time maintenance or the triumph of the FD.,Marc H Graham; Ke Wang,In all the contexts in which independence has been studied; it has the following essentialdescription: Some set of 'local'properties is sufficient to guarantee some set of'global'properties. Within weak instance theory; it takes the following form: A database statewithin which each relation satisfies the dependencies local to it has a weak instance; ie; isconsistent. Thii problem does not arise in practice. In practice one does not encounter statesabout which only this local satisfaction property is known. One encounters instead thefollowing problem: Given a state which is known to be consistent and a suggestedmodification to that state; should the modification be allowed; that is; will the modified statebe,Proceedings of the fifth ACM SIGACT-SIGMOD symposium on Principles of database systems,1985,18
Detecting X-outliers in load curve data in power systems,Zhihui Guo; Wenyuan Li; Adriel Lau; Tito Inga-Rojas; Ke Wang,Load curve data records the electric energy consumptions at time intervals and plays animportant role in operation and planning of power systems. Unfortunately; load curvesalways contain abnormal; noisy; unrepresentative; and missing data due to various randomfactors. It is crucial to identify and repair such data. Previous works focused on detecting Y-outliers that are unusual power consumptions (Y-axis) in a small temporal neighborhood.This paper presents a different class of X-outliers that have abnormal power consumptionsaccording to a known periodicity (X-axis). The underlying assumption is that the data setfollows a periodicity and the length (not the pattern) of the periodicity is known. This is thecase for most real load curve data collected at BC Hydro. We discuss possible causes of X-outliers and rationales of identifying and cleaning them. A novel solution to detect and …,IEEE Transactions on Power Systems,2012,17
Divide-and-approximate: A novel constraint push strategy for iceberg cube mining,Ke Wang; Yuelong Jiang; Jeffrey Xu Yu; Guozhu Dong; Jiawei Han,The iceberg cube mining computes all cells v; corresponding to GROUP BY partitions; thatsatisfy a given constraint on aggregated behaviors of the tuples in a GROUP BY partition.The number of cells often is so large that the result cannot be realistically searched withoutpushing the constraint into the search. Previous works have pushed antimonotone andmonotone constraints. However; many useful constraints are neither antimonotone normonotone. We consider a general class of aggregate constraints of the form f (v)/spltheta//spl sigma/; where f is an arithmetic function of SQL-like aggregates and/spl theta/isone of<;/spl les/;/spl ges/>. We propose a novel pushing technique; called divide-and-approximate; to push such constraints. The idea is to recursively divide the search spaceand approximate the given constraint using antimonotone or monotone constraints in …,IEEE Transactions on Knowledge and Data Engineering,2005,17
Electrochemical studies of ternary and quadruple lithium metal nitrides synthesized by ballmilling,Ke Wang; Jun Yang; Jingying Xie; Shichao Zhang,Abstract Quadruple Li 2.6 Co 0.2 Cu 0.2 N and Li 2.6 Ni 0.2 Cu 0.2 N compounds with ahexagonal structure like Li 3 N were synthesized by high-energy ballmilling under N 2atmosphere. The Li 2.6 Co 0.2 Cu 0.2 N sample obtained by using CoCu alloy and Li 3 N asprecursors exhibits high electrochemical activity and reversibility. Its initial specific capacityis 609 mA h/g and 91% of the initial capacity can be retained at the 45th cycle. This resultshows that the Li 2.6 Co 0.2 Cu 0.2 N has better cycling stability than ternary Li 2.6 Co 0.4 Nand Li 2.6 Cu 0.4 N. On the other hand; the Li 2.6 Ni 0.2 Cu 0.2 N has poor electrochemicalreversibility. Only about 66% of initially extracted lithium can be inserted for cycling.,Solid State Ionics,2003,16
Anonymizing temporal data,Ke Wang; Yabo Xu; Raymond Chi-Wing Wong; Ada Wai-Chee Fu,Temporal data are time-critical in that the snapshot at each timestamp must be madeavailable to researchers in a timely fashion. However; due to the limited data; each snapshotlikely has a skewed distribution on sensitive values; which renders classical anonymizationmethods not possible. In this work; we propose the “reposition model” to allow a record to bepublished within a close proximity of original timestamp. We show that reposition over asmall proximity of timestamp is sufficient for reducing the skewness of a snapshot; therefore;minimizing the impact on window queries. We formalize the optimal reposition problem andpresent a linear-time solution. The contribution of this work is that it enables classicalmethods on temporal data.,Data Mining (ICDM); 2010 IEEE 10th International Conference on,2010,15
Web-log cleaning for constructing sequential classifiers,Qiang Yang; Tianyiian Li; Ke Wang,With millions of Web users visiting Web servers each day; the Web log contains valuableinformation about users' browsing behavior. In this work; we construct sequential classifiersfor predicting the users' next visits based on the current actions using association rulemining. The domain feature of Web-log mining entails that we adopt a special kind ofassociation rules we call latest-substring rules; which take into account the temporalinformation as well as the correlation information. Furthermore; when constructing theclassification model; we adopt a pessimistic selection method for choosing amongalternative predictions. To make such prediction models useful; especially for small deviceswith limited memory and bandwidth; we also introduce a model compression method; whichremoves redundant association rules from the model. We empirically show that the …,Applied Artificial Intelligence,2003,15
Constant-time maintainability: A generalization of independence,Ke Wang; Marc H Graham,Abstract The maintenance problem of a database scheme is the following decision problem:Given a consistent database state &rgr; and a new tuple u over some relation scheme of&rgr;; is the modified state &rgr;∪{u} still consistent? A database scheme is said to beconstant-time-maintainable (ctm) if there exists an algorithm that solves its maintenanceproblem by making a fixed number of tuple retrievals. We present a practically usefulalgorithm; called the canonical maintenance algorithm; that solves the maintenance problemof all ctm database schemes within a" not too large" bound. A number of interestingproperties are shown for ctm database schemes; among them that non-ctm databaseschemes are not maintainable in less than a linear time in the state size. A test method isgiven when only cover embedded functional dependencies (fds) appear. When the given …,ACM Transactions on Database Systems (TODS),1992,15
Neighborhood randomization for link privacy in social network analysis,Amin Milani Fard; Ke Wang,Abstract Social network analysis has many important applications but it depends on sharingand publishing the underlying graph. Link privacy requires limiting the ability of an adversaryto infer the presence of a sensitive link between two individuals in the published socialnetwork graph. A standard technique for achieving link privacy is to probabilisticallyrandomize a link over the space for node pairs. A major drawback of such graph-wiserandomization is that it ignores the structural proximity of nodes; thus; alters considerably thestructure of social networks and distorts the accuracy of social network analysis. To addressthis problem; we propose a structure-aware randomization scheme; called neighborhoodrandomization. This scheme models a social network as a directed graph andprobabilistically randomizes the destination of a link within a local neighborhood. By …,World Wide Web,2015,12
Genome-wide variations in a natural isolate of the nematode Caenorhabditis elegans,Ismael A Vergara; Maja Tarailo-Graovac; Christian Frech; Jun Wang; Zhaozhao Qin; Ting Zhang; Rong She; Jeffrey SC Chu; Ke Wang; Nansheng Chen,Increasing genetic and phenotypic differences found among natural isolates of C. eleganshave encouraged researchers to explore the natural variation of this nematode species.Here we report on the identification of genomic differences between the reference strain N2and the Hawaiian strain CB4856; one of the most genetically distant strains from N2. Toidentify both small-and large-scale genomic variations (GVs); we have sequenced theCB4856 genome using both Roche 454 (~ 400 bps single reads) and Illumina GA DNAsequencing methods (101 bps paired-end reads). Compared to previously describedvariants (available in WormBase); our effort uncovered twice as many single nucleotidevariants (SNVs) and increased the number of small InDels almost 20-fold. Moreover; weidentified and validated large insertions; most of which range from 150 bps to 1.2 kb in …,BMC genomics,2014,12
Information propagation in microblog networks,Chenyi Zhang; Jianling Sun; Ke Wang,Abstract Information propagation in a microblog network aims to identify a set of seed usersfor propagating a target message to as many interested users as possible. This problemdiffers from the traditional influence maximization in two major ways: it has a content-richtarget message for propagation and it treats each link in the network as communication oncertain topics and emphasizes the topic relevance of such communication in propagatingthe target message. In realistic situations; however; the topics associated with a link are notexplicitly expressed but are hidden in the microblogs previously exchanged through the link.In this paper; we present a topic-aware solution to information propagation in a microblognetwork. We first model the latent topic structure of the network using observed microblogmessages published in the network. We then present two methods for estimating the …,Proceedings of the 2013 IEEE/ACM international conference on advances in social networks analysis and mining,2013,12
二维光子晶体耦合腔阵列的慢波效应研究,杜晓宇， 郑婉华， 任刚， 王科， 邢名欣， 陈良惠,设计了一种六角晶格二维光子晶体耦合腔阵列; 平面波展开法计算能带表明;处于禁带中的耦合缺陷腔模的色散曲线在光子晶体平面内所有k 矢量方向更加平坦.模拟了横电波沿! K 方向的透射谱. 与光子晶体单缺陷腔相比; 耦合腔阵列结构的缺陷腔模透射率提高三个量级以上; 而群速度降低一个量级; 得到0.007 c 的结果. 该慢波效应在构造微型可调谐光延迟器和低阈值光子晶体激光器等方面具有潜在的应用前景.,*,2008,12
Mining changing regions from access-constrained snapshots: a cluster-embedded decision tree approach,Irene Pekerskaya; Jian Pei; Ke Wang,Abstract Change detection on spatial data is important in many applications; such asenvironmental monitoring. Given a set of snapshots of spatial objects at various temporalinstants; a user may want to derive the changing regions between any two snapshots. Mostof the existing methods have to use at least one of the original data sets to detect changingregions. However; in some important applications; due to data access constraints such asprivacy concerns and limited data online availability; original data may not be available forchange analysis. In this paper; we tackle the problem by proposing a simple yet effectivemodel-based approach. In the model construction phase; data snapshots are summarizedusing the novel cluster-embedded decision trees as concise models. Once the models arebuilt; the original data snapshots will not be accessed anymore. In the change detection …,Journal of Intelligent Information Systems,2006,12
Selecting features by vertical compactness of data,Ke Wang; Suman Sundaresh,Abstract Feature selection is a data preprocessing step for classification and data miningtasks. Traditionally; feature selection is done by selecting fewest features that determine theclass label; ie; by the horizontal compactness of data. In this chapter 1; we propose a newselection criterion that aims at the vertical compactness of data. In particular; we select asubset of features that yields the fewest projected instances while determining the classlabel. Limitations of direct adoption of the standard depth-first search (DFS) and breath-firstsearch (BFS) are analyzed. A hybrid approach that is partially DFS and partially BFS isdescribed. To see the effectiveness of the new criterion on the classification task; wecompare the result induced by C4. 5 before and after the feature selection.,*,1998,12
Privacy-preserving data stream classification,Yabo Xu; Ke Wang; Ada Wai-Chee Fu; Rong She; Jian Pei,In a wide range of applications; multiple data streams need to be examined together in orderto discover trends or patterns existing across several data streams. One common practice isto redirect all data streams into a central place for joint analysis. This “centralized” practice ischallenged by the fact that data streams often are private in that they come from differentowners. In this paper; we focus on the problem of building a classifier in this context andassume that classification evolves as the current window of streams slides forward. Thisproblem faces two major challenges. First; the many-to-many join relationship of streams willblow up the already fast arrival rate of data streams. Second; the privacy requirement impliesthat data exchange among owners should be minimal. These considerations rule out allclassification methods that require producing the join in the current window. We show that …,*,2008,11
Pushing feature selection ahead of join,Rong She; Ke Wang; Yabo Xu; Philip S Yu,Abstract Current approaches for feature selection on multiple data sources need to join alldata in order to evaluate features against the class label; thus are not scalable and involveunnecessary information leakage. In this paper; we present a way of performing featureselection through class propagation; eliminating the need of join before feature selection.We propagate a very compact data structure that provides enough information for selectingfeatures to each data source; thus allowing features to be evaluated locally without lookingat any other information. Our experiments confirmed that our algorithm is highly scalablewhile effectively preserving the data privacy.,*,2005,11
Pushing aggregate constraints by divide-and-approximate,Ke Wang; Yuelong Jiang; Jeffrey Xu Yu; Guozhu Dong; Jiawei Han,Iceberg-cube mining is to compute the GROUP BY partitions; for all GROUP BY dimensionlists; that satisfy a given aggregate constraint. Previous works have pushed anti-monotoneconstraints into iceberg-cube mining. However; many useful constraints are not anti-monotone. We propose a novel strategy for pushing general aggregate constraints; calleddivide-and-approximate. This strategy divides the search space and approximates theconstraint in subspaces by a pushable constraint. As the strategy is recursively applied; theapproximation approaches the given constraint and the pruning tights up. We show that allconstraints defined by SQL aggregates; arithmetic operators and comparison operators canbe pushed by divide-and-approximate. We present an efficient implementation for animportant subclass and evaluate it on both synthetic and real life databases.,Data Engineering; 2003. Proceedings. 19th International Conference on,2003,11
Data partition: a practical parallel evaluation of Datalog programs,Weining Zhang; Ke Wang; Siu-Cheung Chau,The authors analyse previous parallel evaluation strategies based on the partition of ruleinstantiations. They present a parallel evaluation strategy for general Datalog programs thatis based on the partition of data and is more practical. A key issue is to determine a criterionof data transmission that reduces the amount of data transmitted and is tested efficiently. Anotion of potential usefulness is given as such a criterion. The problem of designingappropriate partition schemes and processing schemes is addressed. Heuristics andalgorithms are proposed for making decisions in the design process.,Parallel and Distributed Information Systems; 1991.; Proceedings of the First International Conference on,1991,11
Classification spanning private databases,Ke Wang; Yabo Xu; Rong She; Philip S Yu,*,Proceedings of the National Conference on Artificial Intelligence,2006,10
CubeExplorer: online exploration of data cubes,Jiawei Han; Jianyong Wang; Guozhu Dong; Jian Pei; Ke Wang,Abstract Data cube enables fast online analysis of large data repositories which is attractivein many applications. Although there are several kinds of available cube-based OLAPproducts; users may still encounter challenges on effectiveness and efficiency in theexploration of large data cubes due to the huge computation space as well as the hugeobservation space in a data cube. CubeExplorer is an integrated environment for onlineexploration of data cubes. It integrates our newly developed techniques on iceberg cubecomputation [2]; cube-based feature extraction; and gradient analysis [1]; and makes cubeexploration effective and efficient. In this demo; we will show the features of CubeExplorer;especially its power and flexibility at exploring and mining of large databases.,Proceedings of the 2002 ACM SIGMOD international conference on Management of data,2002,10
Ke li (Cold and Arid Regions Environmental and Engineering Research Institute; Chinese Academy of Sciences; Lanzhou; Gansu 730000); ANALYSIS OF THE SUR...,Hao WANG JIANG,*,PLATEAU METEOROLOGY,2000,10
Anonymizing bag-valued sparse data by semantic similarity-based clustering,Junqiang Liu; Ke Wang,Abstract Web query logs provide a rich wealth of information; but also present seriousprivacy risks. We preserve privacy in publishing vocabularies extracted from a web query logby introducing vocabulary k-anonymity; which prevents the privacy attack of re-identificationthat reveals the real identities of vocabularies. A vocabulary is a bag of query-termsextracted from queries issued by a user at a specified granularity. Such bag-valued data areextremely sparse; which makes it hard to retain enough utility in enforcing k-anonymity. Tothe best of our knowledge; the prior works do not solve such a problem; among which someachieve a different privacy principle; for example; differential privacy; some deal with adifferent type of data; for example; set-valued data or relational data; and some consider adifferent publication scenario; for example; publishing frequent keywords. To retain …,Knowledge and information systems,2013,9
Detecting data inconsistency for multidatabases,Ke Wang; Weining Zhang,Abstract Traditional approaches to database integration require that a common key exist inall participating relations that model equivalent entities in the real-world; therefore;compromising the logical heterogeneity of multidatabases. The recent proposal of usingknowledge to identify equivalent entities without requiring a common key gives rise to theissue of detecting potential inconsistency during entity identi cation. In this paper; criteria ofdata consistency are proposed and incremental tests in the process of updating data andknowledge are considered. The proposed framework and algorithms are tested by anexperiment on three databases extracted from the real-world.,The Ninth International Conference on Parallel and Distributed Computing Systems (PDCS’96),1996,9
Are Features Equally Representative? A Feature-Centric Recommendation.,Chenyi Zhang; Ke Wang; Ee-peng Lim; Qinneng Xu; Jianling Sun; Hongkun Yu,Abstract Typically a user prefers an item (eg; a movie) because she likes certain features ofthe item (eg; director; genre; producer). This observation motivates us to consider afeaturecentric recommendation approach to item recommendation: instead of directlypredicting the rating on items; we predict the rating on the features of items; and use suchratings to derive the rating on an item. This approach offers several advantages over thetraditional item-centric approach: it incorporates more information about why a user choosesan item; it generalizes better due to the denser feature rating data; it explains the predictionof item ratings through the predicted feature ratings. Another contribution is turning aprincipled item-centric solution into a feature-centric solution; instead of inventing a newalgorithm that is feature-centric. This approach maximally leverages previous research …,AAAI,2015,8
Parallel learning to rank for information retrieval,Shuaiqiang Wang; Byron J Gao; Ke Wang; Hady W Lauw,Abstract Learning to rank represents a category of effective ranking methods for informationretrieval. While the primary concern of existing research has been accuracy; learningefficiency is becoming an important issue due to the unprecedented availability of large-scale training data and the need for continuous update of ranking functions. In this paper; weinvestigate parallel learning to rank; targeting simultaneous improvement in accuracy andefficiency.,Proceedings of the 34th international ACM SIGIR conference on Research and development in Information Retrieval,2011,8
A cooperative coevolution framework for parallel learning to rank,Shuaiqiang Wang; Yun Wu; Byron J Gao; Ke Wang; Hady W Lauw; Jun Ma,We propose CCRank; the first parallel framework for learning to rank based on evolutionaryalgorithms (EA); aiming to significantly improve learning efficiency while maintainingaccuracy. CCRank is based on cooperative coevolution (CC); a divide-and-conquerframework that has demonstrated high promise in function optimization for problems withlarge search space and complex structures. Moreover; CC naturally allows parallelization ofsub-solutions to the decomposed sub-problems; which can substantially boost learningefficiency. With CCRank; we investigate parallel CC in the context of learning to rank. Weimplement CCRank with three EA-based learning to rank algorithms for demonstration.Extensive experiments on benchmark datasets in comparison with the state-of-the-artalgorithms show the performance gains of CCRank in efficiency and accuracy.,IEEE Transactions on Knowledge and Data Engineering,2015,7
Feature extraction from micro-blogs for comparison of products and services,Peng Zhao; Xue Li; Ke Wang,Abstract Social networks are a popular place for people to express their opinions aboutproducts and services. One question would be that for two similar products (eg; two differentbrands of mobile phones); can we make them comparable to each other? In this paper; weshow our system namely OpinionAnalyzer; a novel social network analyser designed tocollect opinions from Twitter micro-blogs about two given similar products for an effectivecomparison between them. The system outcome is a structure of features for the givenproducts that people have expressed opinions about. Then the corresponding sentimentanalysis on those features is performed. Our system can be used to understand user'spreference to a certain product and show the reasons why users prefer this product. Theexperiments are evaluated based on accuracy; precision/recall; and F-score. Our …,International Conference on Web Information Systems Engineering,2013,7
Privacy-preserving data publishing: A survey on recent developments,K Wang; R Chen; BC Fung; PS Yu,*,ACM Computing Surveys,2010,7
Fine-grain perturbation for privacy preserving data publishing,Rhonda Chaytor; Ke Wang; Patricia Brantingham,Recent work [12] shows that conventional privacy preserving publishing techniques basedon anonymity-groups are susceptible to corruption attacks. In a corruption attack; if thesensitive information of any anonymity-group member is uncovered; then the remaininggroup members are at risk. In this study; we abandon anonymity-groups and hide sensitiveinformation through perturbation on the sensitive attribute. With each record being perturbedindependently; corruption attacks cannot be effectively carried out. Previous anti-corruptionwork did not minimize information loss. This paper proposes to address this issue byallowing fine-grain privacy specification. We demonstrate the power of our approach throughexperiments on real medical and synthetic datasets.,Data Mining; 2009. ICDM'09. Ninth IEEE International Conference on,2009,7
Room-temperature photonic crystal laser in H3 cavity on InGaAsP/InP slab,Ren Gang; Zheng Wan-Hua; Zhang Ye-Jin; Xing Ming-Xin; Wang Ke; Du Xiao-Yu; Chen Liang-Hui,Abstract We fabricate and investigate two-dimensional photonic crystal H3 microcavities inan InGaAsP slab. The lasing action at room temperature is observed. The lasering thresholdis 7mW under the pulsed pump of 0.75% duty cycle. The Q factor and the lasing modecharacteristics are simulated by three-dimensional finite difference time domain method. Thesimulation result matches well with the experiment.,Chinese Physics Letters,2008,7
