Privacy-Preserving Data Publishing: A Survey of Recent Developments,P. Yu. B. Fung; K. Wang; R. Chen,*,ACM Computing Surveys,2010,1335
Top-down specialization for information and privacy preservation,Benjamin CM Fung; Ke Wang; Philip S Yu,Releasing person-specific data in its most specific state poses a threat to individual privacy.This paper presents a practical and efficient algorithm for determining a generalized versionof data that masks sensitive information and remains useful for modelling classification. Thegeneralization of data is implemented by specializing or detailing the level of information ina top-down manner until a minimum privacy requirement is violated. This top-downspecialization is natural and efficient for handling both categorical and continuous attributes.Our approach exploits the fact that data usually contains redundant structures forclassification. While generalization may eliminate some structures; other structures emergeto help. Our results show that quality of classification can be preserved even for highlyrestrictive privacy requirements. This work has great applicability to both public and …,Data Engineering; 2005. ICDE 2005. Proceedings. 21st International Conference on,2005,626
Hierarchical document clustering using frequent itemsets,Benjamin CM Fung; Ke Wang; Martin Ester,Abstract A major challenge in document clustering is the extremely high dimensionality. Forexample; the vocabulary for a document set can easily be thousands of words. On the otherhand; each document often contains a small fraction of words in the vocabulary. Thesefeatures require special handlings. Another requirement is hierarchical clustering whereclustered documents can be browsed according to the increasing specificity of topics. In thispaper; we propose to use the notion of frequent itemsets; which comes from association rulemining; for document clustering. The intuition of our clustering criterion is that each cluster isidentified by some common words; called frequent itemsets; for the documents in the cluster.Frequent itemsets are also used to produce a hierarchical topic tree for clusters. By focusingon frequent items; the dimensionality of the document set is drastically reduced. We show …,*,2003,604
PSORT-B: Improving protein subcellular localization prediction for Gram-negative bacteria,Jennifer L Gardy; Cory Spencer; Ke Wang; Martin Ester; Gabor E Tusnady; István Simon; Sujun Hua; Katalin deFays; Christophe Lambert; Kenta Nakai; Fiona SL Brinkman,Abstract Automated prediction of bacterial protein subcellular localization is an importanttool for genome annotation and drug discovery. PSORT has been one of the most widelyused computational methods for such bacterial protein analysis; however; it has not beenupdated since it was introduced in 1991. In addition; neither PSORT nor any of the othercomputational methods available make predictions for all five of the localization sitescharacteristic of Gram-negative bacteria. Here we present PSORT-B; an updated version ofPSORT for Gram-negative bacteria; which is available as a web-based application athttp://www. psort. org. PSORT-B examines a given protein sequence for amino acidcomposition; similarity to proteins of known localization; presence of a signal peptide;transmembrane alpha-helices and motifs corresponding to specific localizations. A …,Nucleic acids research,2003,417
(α; k)-anonymity: an enhanced k-anonymity model for privacy preserving data publishing,Raymond Chi-Wing Wong; Jiuyong Li; Ada Wai-Chee Fu; Ke Wang,Abstract Privacy preservation is an important issue in the release of data for miningpurposes. The k-anonymity model has been introduced for protecting individualidentification. Recent studies show that a more sophisticated model is necessary to protectthe association of individuals to sensitive information. In this paper; we propose an (α; k)-anonymity model to protect both identifications and relationships to sensitive information indata. We discuss the properties of (α; k)-anonymity model. We prove that the optimal (α; k)-anonymity problem is NP-hard. We first presentan optimal global-recoding method for the (α;k)-anonymity problem. Next we propose a local-recoding algorithm which is more scalableand result in less data distortion. The effectiveness and efficiency are shown by experiments.We also describe how the model can be extended to more general case.,Proceedings of the 12th ACM SIGKDD international conference on Knowledge discovery and data mining,2006,355
Anonymizing classification data for privacy preservation,Benjamin CM Fung; Ke Wang; S Yu Philip,Classification is a fundamental problem in data analysis. Training a classifier requiresaccessing a large collection of data. Releasing person-specific data; such as customer dataor patient records; may pose a threat to an individual's privacy. Even after removing explicitidentifying information such as Name and SSN; it is still possible to link released recordsback to their identities by matching some combination of nonidentifying attributes such as{Sex; Zip; Birthdate}. A useful approach to combat such linking attacks; called k-anonymization; is anonymizing the linking attributes so that at least k released recordsmatch each value combination of the linking attributes. Previous work attempted to find anoptimal k-anonymization that minimizes some data distortion metric. We argue thatminimizing the distortion to the training data is not relevant to the classification goal that …,IEEE transactions on knowledge and data engineering,2007,339
Bottom-up generalization: A data mining solution to privacy protection,Ke Wang; Philip S Yu; Sourav Chakraborty,The well-known privacy-preserved data mining modifies existing data mining techniques torandomized data. In this paper; we investigate data mining as a technique for masking data;therefore; termed data mining based privacy protection. This approach incorporates partiallythe requirement of a targeted data mining task into the process of masking data so thatessential structure is preserved in the masked data. The idea is simple but novel: we explorethe data generalization concept from data mining as a way to hide detailed information;rather than discover trends and patterns. Once the data is masked; standard data miningtechniques can be applied without modification. Our work demonstrated another positiveuse of data mining technology: not only can it discover useful patterns; but also mask privateinformation. We consider the following privacy problem: a data holder wants to release a …,Data Mining; 2004. ICDM'04. Fourth IEEE International Conference on,2004,325
Multi-dimensional sequential pattern mining,Helen Pinto; Jiawei Han; Jian Pei; Ke Wang; Qiming Chen; Umeshwar Dayal,Abstract Sequential pattern mining; which finds the set of frequent subsequences insequence databases; is an important data-mining task and has broad applications. Usually;sequence patterns are associated with different circumstances; and such circumstancesform a multiple dimensional space. For example; customer purchase sequences areassociated with region; time; customer group; and others. It is interesting and useful to minesequential patterns associated with multi-dimensional information. In this paper; we proposethe theme of multi-dimensional sequential pattern mining; which integrates themultidimensional analysis and sequential data mining. We also thoroughly explore efficientmethods for multi-dimensional sequential pattern mining. We examine feasiblecombinations of efficient sequential pattern mining and multi-dimensional analysis …,Proceedings of the tenth international conference on Information and knowledge management,2001,317
Minimality attack in privacy preserving data publishing,Raymond Chi-Wing Wong; Ada Wai-Chee Fu; Ke Wang; Jian Pei,Abstract Data publishing generates much concern over the protection of individual privacy.Recent studies consider cases where the adversary may possess different kinds ofknowledge about the data. In this paper; we show that knowledge of the mechanism oralgorithm of anonymization for data publication can also lead to extra information that assiststhe adversary and jeopardizes individual privacy. In particular; all known mechanisms try tominimize information loss and such an attempt provides a loophole for attacks. We call suchan attack a minimality attack. In this paper; we introduce a model called m-confidentialitywhich deals with minimality attacks; and propose a feasible solution. Our experiments showthat minimality attacks are practical concerns on real datasets and that our algorithm canprevent such attacks with very little overhead and information loss.,Proceedings of the 33rd international conference on Very large data bases,2007,279
Efficient computation of iceberg cubes with complex measures,Jiawei Han; Jian Pei; Guozhu Dong; Ke Wang,Abstract It is often too expensive to compute and materialize a complete high-dimensionaldata cube. Computing an iceberg cube; which contains only aggregates above certainthresholds; is an effective way to derive nontrivial multi-dimensional aggregations for OLAPand data mining. In this paper; we study efficient methods for computing iceberg cubes withsome popularly used complex measures; such as average; and develop a methodology thatadopts a weaker but anti-monotonic condition for testing and pruning search space. Inparticular; for efficient computation of iceberg cubes with the average measure; we proposea top-k average pruning method and extend two previously studied methods; Apriori andBUC; to Top-k Apriori and Top-k BUC. To further improve the performance; an interestinghypertree structure; called H-tree; is designed and a new iceberg cubing method; called …,ACM SIGMOD Record,2001,278
Mining frequent item sets by opportunistic projection,Junqiang Liu; Yunhe Pan; Ke Wang; Jiawei Han,Abstract In this paper; we present a novel algorithm Opportune Project for mining completeset of frequent item sets by projecting databases to grow a frequent item set tree. Ouralgorithm is fundamentally different from those proposed in the past in that itopportunistically chooses between two different structures; array-based or tree-based; torepresent projected transaction subsets; and heuristically decides to build unfiltered pseudoprojection or to make a filtered copy according to features of the subsets. More importantly;we propose novel methods to build tree-based pseudo projections and array-basedunfiltered projections for projected transaction subsets; which makes our algorithm bothCPU time efficient and memory saving. Basically; the algorithm grows the frequent item settree by depth first search; whereas breadth first search is used to build the upper portion …,Proceedings of the eighth ACM SIGKDD international conference on Knowledge discovery and data mining,2002,270
Privacy-enhancing personalized web search,Yabo Xu; Ke Wang; Benyu Zhang; Zheng Chen,Abstract Personalized web search is a promising way to improve search quality bycustomizing search results for people with individual information goals. However; users areuncomfortable with exposing private preference information to search engines. On the otherhand; privacy is not absolute; and often can be compromised if there is a gain in service orprofitability to the user. Thus; a balance must be struck between search quality and privacyprotection. This paper presents a scalable way for users to automatically build rich userprofiles. These profiles summarize a user. s interests into a hierarchical organizationaccording to specific interests. Two parameters for specifying privacy requirements areproposed to help the user to choose the content and degree of detail of the profileinformation that is exposed to the search engine. Experiments showed that the user …,Proceedings of the 16th international conference on World Wide Web,2007,259
Clustering transactions using large items,Ke Wang; Chu Xu; Bing Liu,Abstract In traditional data clustering; similarity of a cluster of objects is measured bypairwise similarity of objects in that cluster. We argue that such measures are notappropriate for transactions that are sets of items. We propose the notion of large items; ie;items contained in some minimum fraction of transactions in a cluster; to measure thesimilarity of a cluster of transactions. The intuition of our clustering criterion is that thereshould be many large items within a cluster and little overlapping of such items acrossclusters. We discuss the rationale behind our approach and its implication on providing abetter solution to the clustering problem. We present a clustering algorithm based on thenew clustering criterion and evaluate its effectiveness.,Proceedings of the eighth international conference on Information and knowledge management,1999,247
Anonymizing sequential releases,Ke Wang; Benjamin Fung,Abstract An organization makes a new release as new information become available;releases a tailored view for each data request; releases sensitive information and identifyinginformation separately. The availability of related releases sharpens the identification ofindividuals by a global quasi-identifier consisting of attributes from related releases. Since itis not an option to anonymize previously released data; the current release must beanonymized to ensure that a global quasi-identifier is not effective for identification. In thispaper; we study the sequential anonymization problem under this assumption. A keyquestion is how to anonymize the current release so that it cannot be linked to previousreleases yet remains useful for its own release purpose. We introduce the lossy join; anegative property in relational database design; as a way to hide the join relationship …,Proceedings of the 12th ACM SIGKDD international conference on Knowledge discovery and data mining,2006,227
Discovering structural association of semistructured data,Ke Wang; Huiqing Liu,Many semistructured objects are similarly; though not identically structured. We study theproblem of discovering" typical" substructures of a collection of semistructured objects. Thediscovered structures can serve the following purposes: 1) the" table-of-contents" for gaininggeneral information of a source; 2) a road map for browsing and querying informationsources; 3) a basis for clustering documents; 4) partial schemas for providing standarddatabase access methods; and 5) user/customer interests and browsing patterns. Thediscovery task is affected by structural features of semistructured data in a nontrivial way andtraditional data mining frameworks are inapplicable. We define this discovery problem andpropose a solution.,IEEE Transactions on knowledge and data engineering,2000,202
Anonymizing transaction databases for publication,Yabo Xu; Ke Wang; Ada Wai-Chee Fu; Philip S Yu,Abstract This paper considers the problem of publishing" transaction data" for researchpurposes. Each transaction is an arbitrary set of items chosen from a large universe.Detailed transaction data provides an electronic image of one's life. This has twoimplications. One; transaction data are excellent candidates for data mining research. Two;use of transaction data would raise serious concerns over individual privacy. Therefore;before transaction data is released for data mining; it must be made anonymous so that datasubjects cannot be re-identified. The challenge is that transaction data has no structure andcan be extremely high dimensional. Traditional anonymization methods lose too muchinformation on such data. To date; there has been no satisfactory privacy notion and solutionproposed for anonymizing transaction data. This paper proposes one way to address this …,Proceedings of the 14th ACM SIGKDD international conference on Knowledge discovery and data mining,2008,189
Discovering typical structures of documents: a road map approach,Ke Wang; Huiqing Liu,Abstract The structure of a document refers to the role and hierarchy of subdocumentreferences. Many online documents are similarly structured; though not identicallystructured. We study the problem of discovering “typical” structures of a collection of suchdocuments; where the user specifies the minimum frequency of a typical structure. We willconsider structural features of subdocument references such as labeling; nesting; ordering;cyclicity; and wild-card references; like those found on the Web and digital libraries. Typicalstructures can be used to serve the following purposes.(a) The “table-ofcontent” for gainingthe general information of a source.(b) A road map for browsing and querying a source.(c) Abasis for clustering documents.(d) Partial schemas for building structured layers to providestandard database access methods.(e) User/customer's interests and browsing patterns …,Proceedings of the 21st annual international ACM SIGIR conference on Research and development in information retrieval,1998,189
Mining frequent itemsets using support constraints,Ke Wang; Yu He; Jiawei Han,Abstract Interesting patterns often occur at varied levels of support. The classic associationmining based on a uniform minimum support; such as Apriori; either misses interestingpatterns of low support or suffers from the bottleneck of itemset generation. A better solutionis to exploit support constraints; which specify what minimum support is required for whatitemsets; so that only necessary itemsets are generated. In this paper; we present aframework of frequent itemset mining in the presence of support constraints. Our approach isto" push" support constraints into the Apriori itemset generation so that the" best" minimumsupport is used for each itemset at run time to preserve the essence of Apriori.,VLDB,2000,183
Rectree: An efficient collaborative filtering method,Sonny Han Seng Chee; Jiawei Han; Ke Wang,Abstract Many people rely on the recommendations of trusted friends to find restaurants ormovies; which match their tastes. But; what if your friends have not sampled the item ofinterest? Collaborative filtering (CF) seeks to increase the effectiveness of this process byautomating the derivation of a recommendation; often from a clique of advisors that we haveno prior personal relationship with. CF is a promising tool for dealing with the informationoverload that we face in the networked world. Prior works in CF have dealt with improvingthe accuracy of the predictions. However; it is still challenging to scale these methods tolarge databases. In this study; we develop an efficient collaborative filtering method; calledRecTree (which stands for RECommendation Tree) that addresses the scalability problemwith a divide-and-conquer approach. The method first performs an efficient k-means-like …,International Conference on Data Warehousing and Knowledge Discovery,2001,179
Growing decision trees on support-less association rules,Ke Wang; Senqiang Zhou; Yu He,1. INTRODUCTION In association mining; first studied in database [1]; the task is to find allassociation rules that are individually predictive in terms of high confidence. Associationrules; first motivated by market-basket analysis; capture co-occurrence of events; such ascoffee and sugar are often sold together. In classification mining; mainly studied in machinelearning; statistic; pattern recognition; information retrieval (See [5; 14]; for example); the taskis to find a classifier; usually a set of rules; that are collectively qualified in terms ofassociating new cases with classes. The two problems have been largely investigatedindependently; despite their similarity ofdiscovering association of some kind. Interestingquestions arise: what issues must be addressed to turn association rules into a classifier?how does this approach compare to traditional classification methods? In this paper; we …,Proceedings of the sixth ACM SIGKDD international conference on Knowledge discovery and data mining,2000,179
Top down fp-growth for association rule mining,Ke Wang; Liu Tang; Jiawei Han; Junqiang Liu,Abstract In this paper; we propose an efficient algorithm; called TD-FP-Growth (theshorthand for Top-Down FP-Growth); to mine frequent patterns. TD-FP-Growth searches theFP-tree in the top-down order; as opposed to the bottom-up order of previously proposed FP-Growth. The advantage of the top-down search is not generating conditional pattern basesand sub-FP-trees; thus; saving substantial amount of time and space. We extend TD-FP-Growth to mine association rules by applying two new pruning strategies: one is to pushmultiple minimum supports and the other is to push the minimum confidence. Experimentsshow that these algorithms and strategies are highly effective in reducing the search space.,Pacific-Asia Conference on Knowledge Discovery and Data Mining,2002,171
Building hierarchical classifiers using class proximity,Ke Wang; Senqiang Zhou; Shiang Chen Liew,Abstract In this paper; we address the need to automatically classify text documents intotopic hierarchies like those in ACM Digital Library and Yahoo!. The existing local approachconstructs a classifier at each split of the topic hierarchy. However; the local approach doesnot address the closeness of classification in hierarchical classification where the concernoften is how close a classification is; rather than simply correct or wrong. Also; the localapproach puts its bet on classification at higher levels where the classification structure oftendiminishes. To address these issues; we propose the notion of class proximity and cast thehierarchical classification as a flat classification with the class proximity modeling thecloseness of classes. Our approach is global in that it constructs a single classifier based onthe global information about all classes and class proximity. We leverage generalized …,VLDB,1999,169
Handicapping attacker's confidence: an alternative to k-anonymization,Ke Wang; Benjamin CM Fung; S Yu Philip,Abstract We present an approach of limiting the confidence of inferring sensitive propertiesto protect against the threats caused by data mining abilities. The problem has dual goals:preserve the information for a wanted data analysis request and limit the usefulness ofunwanted sensitive inferences that may be derived from the release of data. Sensitiveinferences are specified by a set of “privacy templates". Each template specifies the sensitiveproperty to be protected; the attributes identifying a group of individuals; and a maximumthreshold for the confidence of inferring the sensitive property given the identifying attributes.We show that suppressing the domain values monotonically decreases the maximumconfidence of such sensitive inferences. Hence; we propose a data transformation thatminimally suppresses the domain values in the data to satisfy the set of privacy templates …,Knowledge and Information Systems,2007,138
Mining customer value: From association rules to direct marketing,Ke Wang; Senqiang Zhou; Qiang Yang; Jack Man Shun Yeung,Abstract Direct marketing is a modern business activity with an aim to maximize the profitgenerated from marketing to a selected group of customers. A key to direct marketing is toselect a subset of customers so as to maximize the profit return while minimizing the cost.Achieving this goal is difficult due to the extremely imbalanced data and the inversecorrelation between the probability that a customer responds and the dollar amountgenerated by a response. We present a solution to this problem based on a creative use ofassociation rules. Association rule mining searches for all rules above an interestingnessthreshold; as opposed to some rules in a heuristic-based search. Promising associationrules are then selected based on the observed value of the customers they summarize.Selected association rules are used to build a model for predicting the value of a future …,Data Mining and Knowledge Discovery,2005,133
Scalable sequential pattern mining for biological sequences,Ke Wang; Yabo Xu; Jeffrey Xu Yu,Abstract Biosequences typically have a small alphabet; a long length; and patternscontaining gaps (ie;" don't care") of arbitrary size. Mining frequent patterns in suchsequences faces a different type of explosion than in transaction sequences primarilymotivated in market-basket analysis. In this paper; we study how this explosion affects theclassic sequential pattern mining; and present a scalable two-phase algorithm to deal withthis new explosion. The< i> Segment Phase</i> first searches for short patterns containingno gaps; called< i> segments</i>. This phase is efficient. The< i> Pattern Phase</i>searches for long patterns containing multiple segments separated by variable length gaps.This phase is time consuming. The purpose of two phases is to exploit the informationobtained from the first phase to speed up the pattern growth and matching and to prune …,Proceedings of the thirteenth ACM international conference on Information and knowledge management,2004,127
Schema Discovery for Semistructured Data.,Ke Wang; Huiqing Liu,Abstract To formulate a meaningful query on semistructured data; such as on the Web; thatmatches some of the source's structure; we need first to discover something about how theinformation is represented in the source. This is referred to as schema discovery and wasconsidered for a single object recently. In the case of multiple objects; the task of schemadiscovery is to identify typical structurine: information of those objects as a whole. Wemitivate the schema discovery in this general setting and propose a framework andalgorithm for it. We apply the framework to a real Web database; the Internet MoviesDatabase; to discover typical schema of most voted movies.,KDD,1997,127
