Bayesian approach for near-duplicate image detection,Lucas Bueno; Eduardo Valle; Ricardo da S Torres,Abstract Vote-based algorithms are very popular in tasks based on image local-descriptors;including object matching; panoramic stitching and near-duplicate detection. On this paper;we focus on the latter application; proposing a Bayesian approach; which allows giving aprobabilistic interpretation to the distances between local descriptors in the feature space.That contrasts with traditional schemes; in which the distances are used to establish asimple unweighted vote count. Near-duplicate detection is demanded for a myriad ofapplications: metadata retrieval in cultural institutions; detection of copyright violations;duplicate elimination in storage; etc. The majority of current solutions are based either onvoting algorithms; which are very precise; but expensive; or on the use of visual dictionaries;which are efficient; but less precise. Contrarily to raw-vote based systems; our scheme …,Proceedings of the 2nd ACM International Conference on Multimedia Retrieval,2012,4
Reusing a compound-based infrastructure for searching video stories,NáJurandy Almeida; Ricardo da S Torres; André Santanchè; Neucimar J Leite,The fast evolution of technology has led to a growing demand for multimedia data;increasing the amount of research into efficient systems to manage those materials. A lot ofresearch has being done by the Content-Based Image Retrieval (CBIR) community in thefield of images. Nowadays; they play a key role in digital applications. Thus; contextualintegration of images with different sources is vital. It involves reusing and aggregating alarge amount of information with other media types. In particular; if we consider video data;images can be used to summarize videos into storyboards; providing an easy way tonavigate and to browse large video collections. This has been the goal of a quickly evolvingresearch area known as video summarization. In this paper; we present a novel approach toreuse the CBIR infrastructure for searching video stories; taking advantage of the …,Information Reuse and Integration (IRI); 2011 IEEE International Conference on,2011,4
Intuitive video browsing along hierarchical trees,Jurandy Almeida; Sheila M Pinto-Cáceres; R da S Torres; Neucimar J Leite,Resumo–Recent advances in technology have increased the availability of video data;creating a strong requirement for efficient systems to manage those materials. Makingefficient use of video information requires that data be accessed in a user-friendly way.Ideally; one would like to perform video search using an intuitive tool. Most of existingbrowsers for the interactive search of video sequences; however; have employed a too rigidlayout to arrange the results; restricting users to explore the results using list-or grid-basedlayouts. In this paper; we present a novel approach for the interactive search that displaysthe result set in a flexible manner. The proposed method is based on a hierarchical structurecalled Divisive-Agglomerative Hierarchical Clustering (DAHC). It is able to group togethervideos with similar content and to organize the result set over a well-defined visual …,Technical Report IC-11-06,2011,4
An Infrastructure for Searching and Harvesting Complex Image Objects,Nádia P KOZIEVITCH; Ricardo Da S TORRES; André SANTANCHE; Daniel CG PEDRONETTE; Rodrigo T CALUMBY; Edward A FOX,Abstract In order to reuse; integrate; and unify different resources from a commonperspective; complex objects (COs) have emerged to facilitate aggregation abstraction andto help developers to manage heterogeneous resources; and their components. Inparticular; complex image objects (ICO) play a key role in different domains; due to theirlarge availability and integration with datasets; metadata; and image manipulation software.Applications which manage ICOs still lack support by mechanisms for processing andmanaging data; creating references; making annotations; searching by content; harvesting;and organizing their components. Examples of common services that need support in theseapplications include (i) Content-Based Image Retrieval (CBIR);(ii) the combination of visualwith textual retrieval; and (iii) the harvesting of COs. This paper presents the design and …,Information interaction intelligence,2011,4
Novel approaches for exclusive and continuous fingerprint classification,Javier A Montoya-Zegarra; João P Papa; Neucimar J Leite; Ricardo da Silva Torres; Alexandre X Falcao,Abstract This paper proposes novel exclusive and continuous approaches to guide thesearch and the retrieval in fingerprint image databases. Both approaches are useful toperform a coarse level classification of fingerprint images before fingerprint authenticationtasks. Our approaches are characterized by:(1) texture image descriptors based on pairs ofmulti-resolution decomposition methods that encode effectively global and local fingerprintinformation; with similarity measures used for fingerprint matching purposes; and (2) a novelmulti-class object recognition method based on the Optimum Path Forest classifier.Experiments were carried out on the standard NIST-4 dataset aiming to study thediscriminative and scalability capabilities of our approaches. The high classification ratesallow us demonstrate the feasibility and validity of our approaches for characterizing …,Pacific-Rim Symposium on Image and Video Technology,2009,4
From concepts to implementation and visualization: tools from a team-based approach to IR,Uma Murthy; Ricardo da Silva Torres; Edward A Fox; Logambigai Venkatachalam; Seungwon Yang; Marcos A Gonçalves,Abstract Researchers have been studying and developing teaching materials for informationretrieval (IR); such as [3]. Toolkits also have been built that provide hands-on experience tostudents. For example; IR-Toolbox [4] is an effort to close the gap between the students'understanding of IR concepts and real-life indexing and search systems. Such tools mightbe good for helping students in non-technical areas such as in the Library and InformationScience field to develop their conceptual model of search engines. However; they do notcover emerging topics and skills; such as content-based image retrieval (CBIR) and fusionsearch. Although there is open source software (such as those in http://www. searchtools.com/tools/tools-opensource. html) that can be used to teach basic and advanced IR topics;they require a student to have high-level technical knowledge and to spend a long time to …,Proceedings of the 31st annual international ACM SIGIR conference on Research and development in information retrieval,2008,4
Diversity-based interactive learning meets multimodality,Rodrigo Tripodi Calumby; Marcos André Gonçalves; Ricardo da Silva Torres,Abstract In interactive retrieval tasks; one of the main objectives is to maximize the userinformation gain throughout search sessions. Retrieving many relevant items is quiteimportant; but it does not necessarily completely satisfy the user needs. When only relevantnear-duplicate items are retrieved; the amount of different concepts users are able to extractfrom the target collection is very limited. Therefore; broadening the number of conceptspresent in a result set may improve the overall search experience. Diversifying conceptspresent in the retrieved set is one possibility for increasing the information gain in a singlesearch iteration; maximizing the likelihood of including at least some relevant items for eachpossible intent of ambiguous or underspecified queries. Relevance feedback approachesmay also take advantage of diverse results to improve internal machine learning models …,Neurocomputing,2017,3
Introducing digital cameras to monitor plant phenology in the tropics: applications for conservation,Bruna Alberton; Ricardo da S Torres; Leonardo F Cancian; Bruno D Borges; Jurandy Almeida; Greice C Mariano; Jefersson dos Santos; Leonor Patricia Cerdeira Morellato,Abstract The application of digital cameras to monitor the environment is becoming globaland changing the way of phenological data collection. The technique of repeated digitalphotographs to monitor plant phenology (phenocams) has increased due to its low-costinvestment; reduced size; easy set up installation; and the possibility of handling high-resolution near-remote data. Considering the widespread use of phenocams worldwide; ourmain goals here are:(i) to provide a step-by-step guide for phenocam set up in the tropics;reinforce its appliance as an efficient tool for monitoring tropical phenology and fosternetworking;(ii) to discuss phenocam applications for biological conservation; management;and ecological restoration. We provide the concepts and properties for image analysis whichallow representing the phenological status of the vegetation. The association of a long …,*,2017,3
Rank diffusion for context-based image retrieval,Daniel Carlos Guimarães Pedronette; Ricardo da S Torres,Abstract This paper presents an efficient diffusion-based re-ranking approach. The proposedmethod propagates contextual information defined in terms of top-ranked objects of rankedlists in a diffusion process. That makes the method suitable for large scale real-worldcollections. Experiments were conducted considering public image collections; severaldescriptors; and comparisons with state-of-the-art methods. Experimental resultsdemonstrate that the proposed method provides high effectiveness gains with lowcomputational costs.,Proceedings of the 2016 ACM on International Conference on Multimedia Retrieval,2016,3
A semi-supervised learning algorithm for relevance feedback and collaborative image retrieval,Daniel Carlos Guimarães Pedronette; Rodrigo T Calumby; Ricardo da S Torres,Abstract The interaction of users with search services has been recognized as an importantmechanism for expressing and handling user information needs. One traditional approachfor supporting such interactive search relies on exploiting relevance feedbacks (RF) in thesearching process. For large-scale multimedia collections; however; the user efforts requiredin RF search sessions is considerable. In this paper; we address this issue by proposing anovel semi-supervised approach for implementing RF-based search services. In ourapproach; supervised learning is performed taking advantage of relevance labels providedby users. Later; an unsupervised learning step is performed with the objective of extractinguseful information from the intrinsic dataset structure. Furthermore; our hybrid learningapproach considers feedbacks of different users; in collaborative image retrieval (CIR) …,EURASIP Journal on Image and Video Processing,2015,3
Mid-level image representations for real-time heart view plane classification of echocardiograms,Otávio AB Penatti; Rafael de O Werneck; Waldir R de Almeida; Bernardo V Stein; Daniel V Pazinato; Pedro R Mendes Júnior; Ricardo da S Torres; Anderson Rocha,Abstract In this paper; we explore mid-level image representations for real-time heart viewplane classification of 2D echocardiogram ultrasound images. The proposedrepresentations rely on bags of visual words; successfully used by the computer visioncommunity in visual recognition problems. An important element of the proposedrepresentations is the image sampling with large regions; drastically reducing the executiontime of the image characterization procedure. Throughout an extensive set of experiments;we evaluate the proposed approach against different image descriptors for classifying fourheart view planes. The results show that our approach is effective and efficient for the targetproblem; making it suitable for use in real-time setups. The proposed representations arealso robust to different image transformations; eg; downsampling; noise filtering; and …,Computers in biology and medicine,2015,3
A robust software product line architecture for data collection in android platform,Gustavo M Waku; Edson R Bollis; Cecilia MF Rubira; Ricardo da S Torres,Android is an open platform; developed by Google and Open Mobile Handset Alliancetargeting mobile devices. Its constant evolution and increasing cost reduction made themsuitable for complex applications especially for data collection applications. Data collectionis a domain which evolved to use mobile devices to collect information; targeting differentfields of study including: physical and social sciences; humanities; business; demographicsurveys; agriculture; biology; and geology. Android usually runs on different hardware andsoftware domains with similar functional and non-functional features. The data collectiondomain has a lot of sub-domains; creating an opportunity to explore software variability andquality properties such as reliability; availability; and data integrity using Component-BasedDevelopment (CBD); Fault Tolerance Techniques and Software Product Line (SPL) with …,Components; Architectures and Reuse Software (SBCARS); 2015 IX Brazilian Symposium on,2015,3
Unsupervised effectiveness estimation for image retrieval using reciprocal rank information,Daniel Carlos Guimarães Pedronette; Ricardo da S Torres,In this paper; we present an unsupervised approach for estimating the effectiveness ofimage retrieval results obtained for a given query. The proposed approach does not requireany training procedure and the computational efforts needed are very low; since only the top-k results are analyzed. In addition; we also discuss the use of the unsupervised measures intwo novel rank aggregation methods; which assign weights to ranked lists according to theireffectiveness estimation. An experimental evaluation was conducted considering differentdatasets and various image descriptors. Experimental results demonstrate the capacity ofthe proposed measures in correctly estimating the effectiveness of different queries in anunsupervised manner. The linear correlation between the proposed and widely usedeffectiveness evaluation measures achieves scores up to 0.86 for some descriptors.,Graphics; Patterns and Images (SIBGRAPI); 2015 28th SIBGRAPI Conference on,2015,3
Unsupervised manifold learning by correlation graph and strongly connected components for image retrieval,Daniel Carlos Guimaraes Pedronette; Ricardo da S Torres,This paper presents a novel manifold learning approach that takes into account the intrinsicdataset geometry. The dataset structure is modeled in terms of a Correlation Graph andanalyzed using Strongly Connected Components (SCCs). The proposed manifold learningapproach defines a more effective distance among images; used to improve theeffectiveness of image retrieval systems. Several experiments were conducted for differentimage retrieval tasks involving shape; color; and texture descriptors. The proposedapproach yields better results in terms of effectiveness than various methods recentlyproposed in the literature.,Image Processing (ICIP); 2014 IEEE International Conference on,2014,3
Evaluation of parameters for combining multiple textual sources of evidence for Web image retrieval using genetic programming,Patrícia Correia Saraiva; João MB Cavalcanti; Marcos A Gonçalves; Katia C Lage dos Santos; Edleno S de Moura; Ricardo da S Torres,Abstract Web image retrieval is a research area that is receiving a lot of attention in the lastfew years due to the growing availability of images on the Web. Since content-based imageretrieval is still considered very difficult and expensive in the Web context; most current large-scale Web image search engines use textual descriptions to represent the content of theWeb images. In this paper we present a study about the usage of genetic programming (GP)to address the problem of image retrieval on the World Wide Web by using textual sources ofevidence and textual queries. We investigate several parameter of choices related to theusage of a framework previously proposed by us. The proposed framework uses GP toprovide a good solution to combine multiple textual sources of evidence associated with theWeb images. Experiments performed using a collection with more than 195;000 images …,Journal of the Brazilian Computer Society,2013,3
Image and video representations based on visual dictionaries,Otávio AB Penatti; Eduardo Valle; Ricardo da S Torres,Abstract—The thesis explores three research topics involving the popular approach used forrepresenting visual content: the visual dictionaries. The first topic concerns the generality ofvisual dictionaries: does a dictionary based on one dataset generalize to another dataset?Our findings create the opportunity to greatly alleviate the burden in generating dictionaries.The second topic is related to the importance of the spatial information of visual words in theimage space for distinguishing types of scenes and objects. We propose an efficient andeffective spatial pooling approach which presents promising results for image retrieval. Andthe third topic refers to the semantic information in the visual dictionary model. We claim thata bag-of-prototypes model; where the prototypes are visual words carrying semantics; ispromising for improving image and video representations. Employing this model; we …,*,2012,3
Evaluation and Recommendation of Saltstone Mixer Auger/Paddles Materials of Construction for Improved Wear Resistance,J Mickalonis; R Torres,EXECUTIVE SUMMARY Wear and corrosion testing were conducted to evaluate alternatematerials of construction for the Saltstone mixer auger and paddles. These componentshave been degraded by wear from the slurry processed in the mixer. Material test optionsincluded PVD coatings (TiN; TiCN; and ZrN); weld overlays (Stellite 12 and Ultimet) andhigher hardness steels and carbides (D2 and tungsten carbide). The corrosion testingdemonstrated that the slurry is not detrimental to the current materials of construction or thenew candidates. The ASTM G75 Miller wear test showed that the high hardness materialsand the Stellite 12 weld overlay provide superior wear relative to the Astralloy and CF8Mstainless steel; which are the current materials of construction; as well as the PVD coatingsand Ultimet.,*,2012,3
Geonote: A web service for geographic data annotation in biodiversity information systems,Fabiana B Gil; Nádia P Kozievitch; Ricardo da S Torres,*,Journal of Information and Data Management,2011,3
A Development Process for Web Geographic Information System A Case of Study,María José Escalona; Arturo Torres-zenteno; Javier Gutierrez; Eliane Martins; Ricardo Da S Torres; M Cecilia; C Baranauskas,Abstract This paper introduces a process for developing Web GIS (Geographic InformationSystems) applications. This process integrates the NDT (Navigational DevelopmentTechniques) approach with some of the Organizational Semiotic models. The use of theproposed development process is illustrated for a real application: the construction of theWebMaps system. WebMaps is a Web GIS system whose main goal is to support harvestplanning in Brazil. 1,*,2008,3
Recuperaç ao de Imagem Utilizando Descritores Baseados em Esqueletos,Marcio Alexandre Marar Moreno; Ricardo da Silva Torres,Ao longo dos últimos anos grandes coleç˜oes de ima- gens vêm sendo geradas devido `adiminuiç˜ao dos cus- tos relacionados `a aquisiç˜ao e ao armazenamento de imagens. Nestecenário; verifica-se a necessidade de ca- racterizar e indexar esse grande volume de imagensde modo eficiente e eficaz. Um imagem pode ser analisada a partir de proprieda- des dos pixelscomo cor; forma e textura. Neste sentido; diversos descritores de imagens vêm sendo propostosre- centemente. Este artigo lida com descritores de forma e prop˜oe a sua caracterizaç˜ao apartir do uso de esqueletos. Um es- queleto é formado pelos centros dos cırculos de raio máximoque tocam em pelo menos dois pon- tos do contorno [2]. Nas técnicas propostas; o processode esqueletizaç˜ao é feito através da IFT (Tranfor- mada Imagem-Floresta) [9]. Esta transformadaanalisa uma imagem como um grafo e utiliza um algoritmo que é basicamente a …,*,2008,3
Semi-supervised transfer subspace for domain adaptation,Luís AM Pereira; Ricardo da Silva Torres,Abstract Domain shift is defined as the mismatch between the marginal probabilitydistributions of a source (training set) and a target domain (test set). A successful researchline has been focusing on deriving new source and target feature representations to reducethe domain shift problem. This task can be modeled as a semi-supervised domainadaptation. However; without exploiting at the same time the knowledge available on thelabeled source; labeled target; and unlabeled target data; semi-supervised methods areprone to fail. Here; we present a simple and effective Semi-Supervised Transfer Subspace(SSTS) method for domain adaptation. SSTS establishes pairwise constraints between thesource and labeled target data; besides it exploits the global structure of the unlabeled datato build a domain invariant subspace. After reducing the domain shift by projecting both …,Pattern Recognition,2018,2
Remote Sensing Image Classification Using Genetic-Programming-Based Time Series Similarity Functions,Alexandre E Almeida; Ricardo da S Torres,In several applications; the automatic identification of regions of interest in remote sensingimages is based on the assessment of the similarity of associated time series; ie; two regionsare considered as belonging to the same class if the patterns found in their spectralinformation observed over time are somewhat similar. In this letter; we investigate the use ofa genetic programming (GP) framework to discover an effective combination of time seriessimilarity functions to be used in remote sensing classification tasks. Performed experimentsin a Forest-Savanna classification scenario demonstrated that the GP framework yieldseffective results when compared with the use of traditional widely used similarity functions inisolation.,IEEE Geoscience and Remote Sensing Letters,2017,2
Color and texture applied to a signature-based bag of visual words method for image retrieval,Joyce Miranda Dos Santos; Edleno Silva De Moura; Altigran Soares Da Silva; Ricardo da Silva Torres,Abstract This article addresses the problem of representation; indexing and retrieval ofimages through the signature-based bag of visual words (S-BoVW) paradigm; which mapsfeatures extracted from image blocks into a set of words without the need of clusteringprocesses. Here; we propose the first ever method based on the S-BoVW paradigm thatconsiders information of texture to generate textual signatures of image blocks. We alsopropose a strategy that represents image blocks with words which are generated based onboth color as well as texture information. The textual representation generated by thisstrategy allows the application of traditional text retrieval and ranking techniques to computethe similarity between images. We have performed experiments with distinct similarityfunctions and weighting schemes; comparing the proposed strategy to the well-known …,Multimedia Tools and Applications,2017,2
Towards vegetation species discrimination by using data-driven descriptors,Keiller Nogueira; Jefersson A Dos Santos; Tamires Fornazari; Thiago Sanna Freire Silva; Leonor Patricia Morellato; Ricardo da S Torres,In this paper; we analyse the use of convolutional neural networks (CNNs or ConvNets) todiscriminate vegetation species with few labelled samples. To the best of our knowledge;this is the first work dedicated to the investigation of the use of deep features in such task.The experimental evaluation demonstrate that deep features significantly outperformwellknown feature extraction techniques. The achieved results also show that it is possibleto learn and classify vegetation patterns even with few samples. This makes the use of ourapproach feasible for real-world mapping applications; where it is often difficult to obtainlarge training sets.,Pattern Recogniton in Remote Sensing (PRRS); 2016 9th IAPR Workshop on,2016,2
Modeling plant phenology database: Blending near-surface remote phenology with on-the-ground observations,Greice C Mariano; Leonor Patricia C Morellato; Jurandy Almeida; Bruna Alberton; Maria Gabriela G de Camargo; Ricardo da S Torres,Abstract Phenology research handles multifaceted information that needs to be organizedand made promptly accessed by scientific community. We propose the conceptual designand implementation of a database to store; manage; and manipulate phenological timeseries and associated ecological information and environmental data. The database wasdeveloped in the context of the e-phenology project and integrates ground-basedconventional plant phenology direct observations with near-surface remote phenology usingrepeated images from digital cameras. It also includes site-base information; sensor deriveddata from the study site weather station and plant ecological traits (eg; pollination anddispersal syndrome; flower and fruit color; and leaf exchange strategy) at individual andspecies level. We validated the database design through the implementation of a Web …,Ecological Engineering,2016,2
RECOD@ Placing Task of MediaEval 2016: A Ranking Fusion Approach for Geographic-Location Prediction of Multimedia Objects.,Javier AV Muñoz; Lin Tzy Li; Ícaro C Dourado; Keiller Nogueira; Samuel G Fadel; Otávio Augusto Bizetto Penatti; Jurandy Almeida; Luís AM Pereira; Rodrigo Tripodi Calumby; Jefersson A dos Santos; Ricardo da Silva Torres,ABSTRACT We describe the approach proposed by the RECOD team for the estimation-based sub-task of Placing Task at MediaE-val 2016. Our approach uses geneticprogramming (GP) to combine ranked lists defined in terms of textual and visual descriptorsto automatically assign geographic locations to images and videos.,MediaEval,2016,2
