In-line chemical sensor deployment in a tritium plant,JS Wright; RD Torres; B Peters; DT Hope; LL Tovo,Abstract The Savannah River Tritium Plant (TP) relies on well understood but aging sensortechnology for process gas analysis. Although new sensor technologies have been broughtto various readiness levels; the TP has been reluctant to install technologies that have notbeen tested in tritium service. This gap between sensor development and incorporating newtechnologies into practical applications demonstrates fundamental challenges that existwhen transitioning from status quo to state-of-the-art in an extreme environment such as atritium plant. These challenges stem from three root obstacles: 1) The necessity for acomprehensive assessment of process sensing needs and requirements; 2) The lack of apick-list of process-compatible sensor technologies; and 3) The need to test sensors in atritium-contaminated process environment without risking production. At Savannah River …,Fusion Science and Technology,2015,1
Fisir: a flexible framework for interactive search in image retrieval systems,Sheila M Pinto-Cáceres; Jurandy Almeida; M Cecília C Baranauskas; Ricardo da S Torres,Abstract This paper presents a flexible framework for interactive search in image retrievalsystems. Our approach allows for the visual structure change in order to produce coherentlayouts; which highlight the most relevant results according to user needs. This innovativeframework is flexible in the sense it supports the dynamic creation of several hybrid visualdesigns; based on the combination of different visualization strategies. Results from asubjective evaluation demonstrate that the dynamic hybrid layouts created by the proposedframework provide the end-users with an effective user interface for intuitive browsing andsearching experience.,International Conference on Multimedia Modeling,2015,1
A framework for pattern classifier selection and fusion,Fabio A Faria; Anderson Rocha; Ricardo da S Torres,Abstract. In this work; we propose a framework for classifier selection and fusion. Ourmethod seeks to combine image characterization and learning methods by means of a meta-learning approach responsible for assessing which methods contribute more towards thesolution of a given problem. The framework uses three different strategies of classifierselection that pinpoint the less correlated; yet effective; classifiers through a series ofdiversity measure analysis. The experiments show that the proposed approaches yieldcomparable results to well-known algorithms from the literature on many differentapplications but using less learning and description methods as well as not incurring in thecurse of dimensionality and normalization problems common to some fusion techniques.Furthermore; our approach yields effective classification results using very reduced …,ECML/PKDD 2014,2014,1
e-phenology: monitoring leaf phenology and tracking climate changes in the tropics,Patrícia Morellato; Bruna Alberton; Jurandy Almeida; Jefersson Alex; Greice Mariano; Ricardo Torres,Abstract The e-phenology is a multidisciplinary project combining research in ComputerScience and Phenology. Its goal is to attack theoretical and practical problems involving theuse of new technologies for remote phenological observation aiming to detect localenvironmental changes. It is geared towards three objectives:(a) the use of newtechnologies of environmental monitoring based on remote phenology monitoringsystems;(b) creation of a protocol for a Brazilian long term phenology monitoring programand for the integration across disciplines; advancing our knowledge of seasonal responseswithin tropics to climate change; and (c) provide models; methods and algorithms to supportmanagement; integration and analysis of data of remote phenology systems. The researchteam is composed by computer scientists and biology researchers in Phenology. Our first …,EGU General Assembly Conference Abstracts,2014,1
A fault-tolerant software product line for data collection using mobile devices and cloud infrastructure,Cecılia MF Rubira; Gustavo M Waku; Edson R Bollis; Ricardo S Torres; Flavio Nicastro; Leonor P Morellato,Abstract. The constant evolution of mobile devices and decreasing associated costs madethem suitable for data acquisition. In order to effectively support data acquisition procedures;some challenges related to data integrity and mobile availability; such as battery level; dataloss and data integrity have to be addressed. We propose a modular and configurable fault-tolerant Software Product Line (SPL) through the use of aspects. As a proof of concept; aproduct generated from the SPL aiming to support the acquisition of phenological data onthe field using mobile devices is been developed.,Professoras do Instituto de Computaçao-unicamp,2014,1
Remote sensing image segmentation and representation through multiscale analysis,Jefersson Alex dos Santos; Ricardo da Silva Torres,Every year; new sensor technologies are being implemented to improve the acquisition ofhigh-resolution remote sensing images (RSIs). With the large amount of data provided bythese sensors; novel computational approaches are constantly required to support thedecision-making process based on RSI analysis. A typical problem is the recognition oftarget regions for land-cover mapping. In this context; the main problems are:(1)classification methods are dependent on the segmentation quality; and (2) the selection ofrepresentative samples for training is a costly process. The samples indicated by the userare not always enough to define the best segmentation scale. Furthermore; the indication ofsamples can be expensive; since it often requires to visit studied places in loco. Thesegmentation-dependence problem has been addressed in the literature by using …,Graphics; Patterns and Images Tutorials (SIBGRAPI-T); 2013 26th Conference on,2013,1
Domain-specific image geocoding: a case study on Virginia tech building photos,Lin Tzy Li; Otávio AB Penatti; Edward A Fox; Ricardo da S Torres,Abstract The use of map-based browser services is of great relevance in numerous digitallibraries. The implementation of such services; however; demands the use of geocoded datacollections. This paper investigates the use of image content local representations ingeocoding tasks. Performed experiments demonstrate that some of the evaluateddescriptors yield effective results in the task of geocoding VT building photos. This study isthe first step to geocode multimedia material related to the VT April 16; 2007 school shootingtragedy.,Proceedings of the 13th ACM/IEEE-CS joint conference on Digital libraries,2013,1
Reusing a Compound-Based Infrastructure for Searching and Annotating Video Stories,Nádia P Kozievitch; Jurandy Almeida; Ricardo da S Torres; André Santanchè; Neucimar J Leite; Uma Murthy; Edward A Fox,Abstract-The fast evolution of technology has led to a growing demand for multimedia data;increasing the amount of research into efficient systems to manage those materials.Significant in those efforts is the work being done by the Content-Based Image Retrieval(CBIR) community in processing and retrieving images; along with their further combinationwith annotations. Nowadays; images play a key role in digital applications. Contextualintegration of images with different sources is vital–it involves reusing and aggregating alarge amount of information with other media types. In particular; if we consider video data;annotations can be used to summarize textual descriptions and metadata; while images canbe used to summarize videos into storyboards; providing an easy way to navigate and tobrowse large video collections. This has been the goal of a rapidly evolving research …,International Journal,2012,1
Are visual dictionaries generalizable?,Otavio AB Penatti; Eduardo Valle; Ricardo da S Torres,Abstract: Mid-level features based on visual dictionaries are today a cornerstone of systemsfor classification and retrieval of images. Those state-of-the-art representations dependcrucially on the choice of a codebook (visual dictionary); which is usually derived from thedataset. In general-purpose; dynamic image collections (eg; the Web); one cannot have theentire collection in order to extract a representative dictionary. However; based on thehypothesis that the dictionary reflects only the diversity of low-level appearances and doesnot capture semantics; we argue that a dictionary based on a small subset of the data; oreven on an entirely different dataset; is able to produce a good representation; provided thatthe chosen images span a diverse enough portion of the low-level feature space. Ourexperiments confirm that hypothesis; opening the opportunity to greatly alleviate the …,arXiv preprint arXiv:1205.2663,2012,1
Desenvolvimento de um Modelo Conceitual de um banco de dados para o Projeto e-phenology,Greice C Mariano; Jurandy Almeida; Bruna Alberton; Ricardo da S Torres; Leonor Patricia C Morellato,Abstract. Recently; phenology has gained importance as the more simple and reliableindicator of effects of climate changes on plants and animals. In this context; we highlight thee-phenology; a multidisciplinary project combining research in computer science andphenology; in order to attack theoretical and practical problems involving the use of newtechnologies for remote phenological observation. From the computer science point of view;it is necessary to develop models; tools and techniques concerning the storage; mining;processing; and retrieving of information of phenological changes. In this sense; this paperpresents our achievements regarding the modeling and implementation of a database tomanage information handled in the e-phenology project. Resumo. Recentemente; fenologiatem ganho importância como o indicador mais simples e confiável dos efeitos das …,Anais do XXVIII Congresso da SBC-VI Workshop e-Science,2012,1
Exploiting Contextual Information in Image Retrieval Tasks,Daniel Carlos Guimaraes Pedronette; Ricardo da S Torres,Abstract—In Content-based Image Retrieval (CBIR) systems; accurately ranking images is ofgreat relevance; since users are interested in the returned images placed at the firstpositions; which usually are the most relevant ones. In general; CBIR systems consider onlypairwise image analysis; that is; compute similarity measures considering only pairs ofimages; ignoring the rich information encoded in the relations among several images. Onthe other hand; the user perception usually considers the query specification and responsesin a given context. We propose five re-ranking and rank aggregation algorithms aiming atexploit contextual information for improving the effectiveness of CBIR systems. Re-rankingalgorithms exploit contextual information; encoded in the relationships among collectionimages; while rank aggregation approaches have been used to combine results …,Recod Lab-Institute of Computing University of Campinas (UNICAMP) Campinas; SP-Brazil,2012,1
Recuperaç ao de Vıdeos Comprimidos por Conteudo,Jurandy Almeida; Neucimar J Leite; Ricardo da S Torres,Abstract. Most of existing systems for video retrieval rely on algorithms and methods whichare computationally expensive; limiting their scope of application. Contrary to this trend; themarket has shown a growing demand for mobile and embedded devices. In this context; thisthesis introduces five novel approaches for the analysis; indexing; and retrieval of digitalvideos in limited capacity devices. All these contributions are combined to create acomputationally fast system; which is able to achieve a quality level superior to currentsolutions. Resumo. A maioria dos sistemas existentes para a recuperaçao de vıdeosenvolve algoritmos e métodos computacionalmente custosos; limitando o seu escopo deaplicaçao. Contrário a essa tendência; o mercado tem mostrado uma crescente demandapor dispositivos móveis e embutidos. Nesse contexto; esta tese introduz cinco …,*,2011,1
Coping with geographical relationships in Web searches,Lin Tzy Li; Ricardo da Silva Torres,Abstract This work describes ongoing research which aims to evaluate the limitations ofexisting tools to support geographic information retrieval on the Web. More specifically; weare interested in assessing how well queries involving geographic relationships can bespecified and executed using existing Web tools. Our evaluation considered three differentaspects: the relevance of the results and the time and complexity of the steps necessary toobtain these results. More than thirty Web users performed five tasks; considering fivescenarios. Experiment results demonstrate that existing Web tools are not enough integratedto meet user needs regarding the specification and execution of queries involving spatialrelationships.,*,2010,1
A Geographic Annotation Service for Biodiversity Systems.,Fabiana B Gil; Nádia P Kozievitch; Ricardo da Silva Torres,Abstract. Biodiversity studies are often based on the use of data associated with fieldobservations. These data are usually associated with a geographic location. Most of existingbiodiversity information systems provides support for storing and querying geographic data.Annotation services; in general; are not supported. This paper presents an annotation Webservice to correlate biodiversity data and geographic information. We use superimposedinformation concepts for constructing a Web service for annotating vector geographic data.The Web service specification includes the definition of a generic API for handlingannotations and the definition of a data model for storing them. The solution was validatedthrough the implementation of a prototype for the biodiversity area considering a potentialusage scenario.,GeoInfo,2010,1
A Development Process for Web Geographic Information System,María José Escalona; Arturo Torres-Zenteno; Javier Gutierrez; Eliane Martins; Ricardo da S Torres; M Cecilia C Baranauskas,Abstract: This paper introduces a process for developing Web GIS (Geographic InformationSystems) applications. This process integrates the NDT (Navigational DevelopmentTechniques) approach with some of the Organizational Semiotic models. The use of theproposed development process is illustrated for a real application: the construction of theWebMaps system. WebMaps is a Web GIS system whose main goal is to support harvestplanning in Brazil.,*,2008,1
Descritor de relacionamento espacial baseado em partiç oes,Otávio Augusto Bizetto Penatti; Ricardo da Silva Torres,Abstract. Spatial relationships can be fundamental for image recognition and retrieval; beinguseful for geographic and medical applications; for instance. This paper presents a newspatial relationship descriptor for content-based image retrieval. The new descriptorpresented is based on partitioning the space of analysis into quadrants and on counting thenumber of object points in each partition. Experiments demonstrated that the proposeddescriptor is more effective than other important descriptors recently proposed in theliterature. Resumo. Neste trabalho; propomos um novo descritor de relacionamentoespacial para recuperaçao de imagens por conteúdo. Relacionamentos espaciais podemser fundamentais para o reconhecimento e recuperaç ao de imagens beneficiando aplicaçoes geográficas e médicas; por exemplo. O novo descritor apresentado se baseia no …,XXVI Concurso de Trabalhos de Iniciaçao Cientıfica; XXVII Congresso da Sociedade Brasileira de Computaç ao,2007,1
Multiresolution features for fingerpint image retrieval,Javier A Montoya Zegarra; Neucimar J Leite; Ricardo da S Torres,Abstract This paper presents a real time system to guide the search and the retrieval infingerprint image databases considering both retrieval accuracy and speed. For thatpurposes; we use multiresolution-based feature extraction and indexing methodsconsidering the textural information inherent to fingerprint images. The extracted featurevectors are used to compute the distance between the fingerprint query image to all thefingerprints in the database and the N most similar images are then retrieved. The focus ofthis work is to study the utility of multiresolution transforms on the domain of fingerprintrecognition.,Workshop of Theses and Dissertations; XIX Brazilian Symposium on Computer Graphics and Image Processing,2006,1
RecS-DL: Uma plataforma para Serviços de Recomendaç ao em Bibliotecas Digitais,Daniel Carlos Guimaraes Pedronette; Ricardo da Silva Torres,Resumo. Esta demonstraç ao visa ilustrar o funcionamento de uma plataforma de serviçosde recomendaç ao recentemente criada no Instituto de Computaç ao da Unicamp. Baseadaem Serviços Web e interfaces bem definidas; a ferramenta possibilita que engines derecomendaç ao; baseados em diferentes técnicas; possam ser desenvolvidos; instalados etestados no arcabouço definido. A modelagem de dados realizada e a utilizaçao deServiços Web tornam a plataforma independente de domınio de aplicaçao e portável sob oponto de vista tecnológico.,*,*,1
Graph-based bag-of-words for classification,Fernanda B Silva; Rafael de O Werneck; Siome Goldenstein; Salvatore Tabbone; Ricardo da S Torres,Abstract This paper introduces the Bag of Graphs (BoG); a Bag-of-Words model thatencodes in graphs the local structures of a digital object. We present a formal definition;introducing concepts and rules that make this model flexible and adaptable for differentapplications. We define two BoG-based methods–Bag of Singleton Graphs (BoSG) and Bagof Visual Graphs (BoVG); which create vector representations for graphs and images;respectively. We evaluate the Bag of Singleton Graphs (BoSG) for graph classification onfour datasets of the IAM repository; obtaining significant results in accuracy and executiontime. The method Bag of Visual Graphs (BoVG) is evaluated for image classification onCaltech and ALOI datasets; and for remote sensing image classification on images of MonteSanto and Campinas datasets. This framework opens possibilities for retrieval …,Pattern Recognition,2018,*
Exploiting ConvNet Diversity for Flooding Identification,Keiller Nogueira; Samuel G Fadel; Ícaro C Dourado; Rafael de O Werneck; Javier AV Muñoz; Otávio AB Penatti; Rodrigo T Calumby; Lin Tzy Li; Jefersson A dos Santos; Ricardo da S Torres,Abstract: Flooding is the world's most costly type of natural disaster in terms of botheconomic losses and human causalities. A first and essential procedure towards floodmonitoring is based on identifying the area most vulnerable to flooding; which givesauthorities relevant regions to focus. In this work; we propose several methods to performflooding identification in high-resolution remote sensing images using deep learning.Specifically; some proposed techniques are based upon unique networks; such as dilatedand deconvolutional ones; while other was conceived to exploit diversity of distinct networksin order to extract the maximum performance of each classifier. Evaluation of the proposedalgorithms were conducted in a high-resolution remote sensing dataset. Results show thatthe proposed algorithms outperformed several state-of-the-art baselines; providing …,arXiv preprint arXiv:1711.03564,2017,*
Change Frequency Heatmaps for Temporal Multivariate Phenological Data Analysis,Greice Cristina Mariano; Natalia Costa Soares; Leonor Patricia Cerdeira Morellato; Ricardo Da Silva Torres,The huge amount of multivariate temporal data that has been produced in severalapplications demands the creation of appropriate tools for the analysis and patterncharacterization of change. This paper introduces a novel image-based representation;named Change Frequency Heatmap (CFH); to encode temporal changes of multivariatenumerical data. The method computes histograms of change patterns observed atsuccessive timestamps. We validate the use of CFHs through the creation of a temporalchange characterization tool to support complex plant phenology analysis; concerning thecharacterization of plant life cycle changes of multiple individuals and species over time. Wedemonstrate the potential of CFH to support visual identification of complex temporal changepatterns; especially to decipher interindividual variations in plant phenology.,e-Science (e-Science); 2017 IEEE 13th International Conference on,2017,*
Unsupervised rank diffusion for content-based image retrieval,Daniel Carlos Guimarães Pedronette; Ricardo da S Torres,Abstract Despite the continuous development of features and mid-level representations;effectively and reliably measuring the similarity among images remains a challengingproblem in image retrieval tasks. Once traditional measures consider only pairwise analysis;context-sensitive measures capable of exploiting the intrinsic manifold structure becameindispensable for improving the retrieval performance. In this scenario; diffusion processesand rank-based methods are the most representative approaches. This paper proposes anovel hybrid method; named rank diffusion; which uses a diffusion process based onranking information. The proposed method consists in a diffusion-based re-rankingapproach; which propagates contextual information through a diffusion process defined interms of top-ranked objects; reducing the computational complexity of the proposed …,Neurocomputing,2017,*
A competition on generalized software-based face presentation attack detection in mobile scenarios,Z Boulkenafet; J Komulainen; Z Akhtar; A Benlamoudi; D Samai; SE Bekhouche; A Ouafi; F Dornaika; A Taleb-Ahmed; L Qin; F Peng; LB Zhang; M Long; S Bhilare; V Kanhangad; A Costa-Pazo; E Vazquez-Fernandez; D Perez-Cabo; JJ Moreira-Perez; D Gonzalez-Jimenez; A Mohammadi; S Bhattacharjee; S Marcel; S Volkova; Y Tang; N Abe; L Li; X Feng; Z Xia; X Jiang; S Liu; R Shao; PC Yuen; WR Almeida; F Andalo; R Padilha; G Bertocco; W Dias; J Wainer; R Torres; A Rocha; MA Angeloni; G Folego; A Godoy; A Hadid,In recent years; software-based face presentation attack detection (PAD) methods haveseen a great progress. However; most existing schemes are not able to generalize well inmore realistic conditions. The objective of this competition is to evaluate and compare thegeneralization performances of mobile face PAD techniques under some real-worldvariations; including unseen input sensors; presentation attack instruments (PAI) andillumination conditions; on a larger scale OULU-NPU dataset using its standard evaluationprotocols and metrics. Thirteen teams from academic and industrial institutions across theworld participated in this competition. This time typical liveness detection based onphysiological signs of life was totally discarded. Instead; every submitted system reliespractically on some sort of feature representation extracted from the face and/or …,Biometrics (IJCB); 2017 IEEE International Joint Conference on,2017,*
Semantic segmentation of vegetation images acquired by unmanned aerial vehicles using an ensemble of ConvNets,Keiller Nogueira; Jefersson A dos Santos; Leonardo Cancian; Bruno D Borges; Thiago SF Silva; Leonor Patricia Morellato; Ricardo da S Torres,Vegetation segmentation in high resolution images acquired by unmanned aerial vehicles(UAVs) is a challenging task that requires methods capable of learning high-level featureswhile dealing with fine-grained data. In this paper; we propose a combination of differentmethods of semantic segmentation based on Convolutional Networks (ConvNets) to obtainhighly accurate segmentation of individuals of different vegetation species. The objective isnot only to learn specific and adaptable features depending on the data; but also to learnand combine appropriate classifiers. We conducted a systematic evaluation using a high-resolution UAV-based image dataset related to a campo rupestre vegetation in the BrazilianCerrado biome. Experimental results show that the ensemble technique overcomes allsegmentation strategies.,Geoscience and Remote Sensing Symposium (IGARSS); 2017 IEEE International,2017,*
Fusion of genetic-programming-based indices in hyperspectral image classification tasks,Juan F Hernández Albarracín; Edemir Ferreira; Jefersson A dos Santos; Ricardo da S Torres,This paper introduces a two-step hyper-and multi-spectral image classification approach.The first step relies on the use of a genetic programming (GP) framework to both select andcombine appropriate bands. The second step is concerned with the image classificationitself. We present two strategies for multi-class classification problems based on thecombination of GP-based indices defined in binary classification scenarios. Performedexperiments involving well-known and widely-used datasets demonstrate that the proposedapproach yields comparable or better effectiveness performance when compared to severaltraditional baselines.,Geoscience and Remote Sensing Symposium (IGARSS); 2017 IEEE International,2017,*
Learning to Combine Spectral Indices with Genetic Programming,Juan Felipe Hernández Albarracín; Jefersson Alex dos Santos; Ricardo da S Torres,This paper introduces a Genetic Programming-based method for band selection andcombination; aiming to support remote sensing image classification tasks. Relying onground-truth data; our method selects spectral bands and finds the arithmetic combination ofthose bands (ie; spectral index) that best separates examples of different classes.Experimental results demonstrate that the proposed method is very effective in pixel-wisebinary classification problems.,Graphics; Patterns and Images (SIBGRAPI); 2016 29th SIBGRAPI Conference on,2016,*
