Controlling false discoveries during interactive data exploration,Zheguang Zhao; Lorenzo De Stefani; Emanuel Zgraggen; Carsten Binnig; Eli Upfal; Tim Kraska,Abstract Recent tools for interactive data exploration significantly increase the chance thatusers make false discoveries. They allow users to (visually) examine many hypotheses andmake inference with simple interactions; and thus incur the issue commonly known instatistics as the" multiple hypothesis testing error." In this work; we propose a solution tointegrate the control of multiple hypothesis testing into interactive data exploration systems.A key insight is that existing methods for controlling the false discovery rate (such as FDR)are not directly applicable to interactive data exploration. We therefore discuss a set of newcontrol procedures that are better suited for this task and integrate them in our system;QUDE. Via extensive experiments on both real-world and synthetic data sets wedemonstrate how QUDE can help experts and novice users alike to efficiently control …,Proceedings of the 2017 ACM International Conference on Management of Data,2017,7
RODI: Benchmarking relational-to-ontology mapping generation quality,Christoph Pinkel; Carsten Binnig; Ernesto Jiménez-Ruiz; Evgeny Kharlamov; Wolfgang May; Andriy Nikolov; Ana Sasa Bastinos; Martin G Skjæveland; Alessandro Solimando; Mohsen Taheriyan; Christian Heupel; Ian Horrocks,Abstract Accessing and utilizing enterprise or Web data that is scattered across multiple datasources is an important task for both applications and users. Ontology-based dataintegration; where an ontology mediates between the raw data and its consumers; is apromising approach to facilitate such scenarios. This approach crucially relies on usefulmappings to relate the ontology and the data; the latter being typically stored in relationaldatabases. A number of systems to support the construction of such mappings have recentlybeen developed. A generic and effective benchmark for reliable and comparable evaluationof the practical utility of such systems would make an important contribution to thedevelopment of ontology-based data integration systems and their application in practice.We have proposed such a benchmark; called RODI. In this paper; we present a new …,Semantic Web,2016,7
System and method of performing snapshot isolation in distributed databases,*,A system and method of performing snapshot isolation in distributed databases. Each nodestores local snapshot information that enforces snapshot isolation for that node. The methodincludes partially processing a distributed transaction by a first node; receiving a globalcommit identifier from a coordinator; and continuing to process the distributed transaction; bythe first node and a second node; in accordance with the global commit identifier.,*,2015,7
Die SIKOSA-Methodik,Daniel Weiß; Jörn Kaack; Stefan Kirn; Maike Gilliot; Lutz Lowis; Günter Müller; Andrea Herrmann; Carsten Binnig; Timea Illes; Barbara Paech; Donald Kossmann,Kernpunkte Die SIKOSA-Methodik beschreibt einen durchgängigen Lösungsansatz zurSoftwareentwicklung. Die Methodik überführt funktionale und nicht funktionaleProzessanforderungen in entsprechende testbare Unternehmenssoftware-Anforderungenund erhöht die Validität. Die Methodik wird vor dem Hintergrund eines industriellenBeschaffungsprozesses veranschaulicht.,Wirtschaftsinformatik,2007,6
The end of a myth: distributed transactions can scale,Erfan Zamanian; Carsten Binnig; Tim Harris; Tim Kraska,Abstract The common wisdom is that distributed transactions do not scale. But what ifdistributed transactions could be made scalable using the next generation of networks and aredesign of distributed databases? There would no longer be a need for developers to worryabout co-partitioning schemes to achieve decent performance. Application developmentwould become easier as data placement would no longer determine how scalable anapplication is. Hardware provisioning would be simplified as the system administrator canexpect a linear scale-out when adding more machines rather than some complex sub-linearfunction; which is highly application specific. In this paper; we present the design of ournovel scalable database system NAM-DB and show that distributed transactions with thevery common Snapshot Isolation guarantee can indeed scale using the next generation …,Proceedings of the VLDB Endowment,2017,5
Vistrees: fast indexes for interactive data exploration,Muhammad El-Hindi; Zheguang Zhao; Carsten Binnig; Tim Kraska,Abstract Visualizations are arguably the most important tool to explore; understand andconvey facts about data. As part of interactive data exploration; visualizations might be usedto quickly skim through the data and look for patterns. Unfortunately; database systems arenot designed to efficiently support these workloads. As a result; visualizations often take verylong to produce; creating a significant barrier to interactive data analysis. In this paper; wefocus on the interactive computation of histograms for data exploration. To address thisissue; we present a novel multi-dimensional index structure called VisTree. As a keycontribution; this paper presents several techniques to better align the design of multi-dimensional indexes with the needs of visualization tools for data exploration. Ourexperiments show that the VisTree achieves a speed increase of up to three orders of …,Proceedings of the Workshop on Human-In-the-Loop Data Analytics,2016,5
Generic node including stored script,*,Methods and apparatus; including computer program products; are provided for providingfor processing calculation plans. In one aspect; there is provided a computer-implementedmethod. The method may include generating a calculation plan including a plurality ofnodes; determining whether at least one of the nodes includes a function node; andcompiling the function node into executable code to enable execution of the plurality ofnodes including the function node at the database. Related apparatus; systems; methods;and articles are also described.,*,2015,5
XDB-A novel Database Architecture for Data Analytics as a Service,Carsten Binnig; Abdallah Salama; Erfan Zamanian; Harald Kornmayer; Sven Listing; Alexander C Mueller,Parallel shared-nothing database systems are major platforms for efficiently analyzing largeamounts of structured data. However; in order to offer SQL-like services for data analytics inthe cloud; providers such as Amazon and Google do not use these systems as a basis. Amajor reason for this trend is that existing parallel shared-nothing database systems areexpensive and that they do not fulfill many of the requirements such as elasticity and fault-tolerance needed for providing a service for data analytics in the cloud. In this paper; wepresent an overview of an elastic and fault-tolerant database system called XDB; whichsupports complex analytics. XDB builds on the following novel concepts:(1) a partitioningscheme that supports elasticity with regard to data and queries;(2) a cost-based fault-tolerance scheme that allows to recover from mid-query faults; and (3) adaptive …,Big Data (BigData Congress); 2014 IEEE International Congress on,2014,5
Data warehousing,CARSTEN BINNIG,Page 1. DATA WAREHOUSING INTRODUCTION TO DATA SCIENCE CARSTEN BINNIG BROWNUNIVERSITY Page 2. DATA WAREHOUSES Definition: A data warehouse is a database thatis optimized for analytical workloads which integrates data from independent and heterogeneousdata sources DB1 Data Warehouse Heterogeneous Data Sources Decision Support / Data MiningData Loading + Integration CSV Web Page 3. ENTERPRISE SCENARIO: WHOLEFOODS DBDB DB DB DB DB DB DB DB DB DB Data Warehouse Business Questions: • What are thebestselling products? • Is there difference between states? • … Page 4. OTHER APPLICATIONDOMAINS Restaurant Chains (McDonalds; etc.) Retailers (Nike; …) Insurance Companies Banks …Page 5. HISTORY OF DATABASES Age of Online Transaction Processing - OLTP (> 1970) • Goal:have access to up-to-date business transactions …,*,2002,5
Automatic result verification for the functional testing of a query language,Carsten Binnig; Donald Kossmann; Eric Lo; Angel Saenz-Badillos,Functional testing of a query language is a challenging task in practice. In order to revealerrors in the query processing functionality; it is necessary to verify the actual result of a testquery with the expected correct result. However; automatically computing the expectedquery result of an arbitrary test query is not trivial. One solution is to first generate a set of testdatabase instances and test queries and then to compute the expected result for each testquery over the individual test database instances. The problem of this solution is that manytest queries might return an empty query result; which is not interesting for the functionaltesting of a query language. In this paper; we present a new approach to verify the result of atest query so as to facilitate the functional testing of a query language. Instead of firstgenerating the database instance and then computing the expected result for each test …,Data Engineering; 2008. ICDE 2008. IEEE 24th International Conference on,2008,4
Generating Meaningful Test Databases,Carsten Binnig,Testing is one of the most time-consuming and cost-intensive tasks in software developmentprojects today. A recent report of the NIST [RTI02] estimated the costs for the economy of theUnites States of America caused by software errors in the year 2000 to range from $22.2 to$59.5 billion. Consequently; in the past few years; many techniques and tools have beendeveloped to reduce the high testing costs. Many of these techniques and tools are devotedto automate various testing tasks (eg; test case generation; test case execution; and testresult checking). However; almost no research work has been carried out to automate thetesting of database applications (eg; an E-Shop application) and relational databasemanagement systems (DBMSs). The testing of a database application and of a DBMSrequires different solutions because the application logic of a database application or of a …,*,2008,3
Durchgängige Qualität von Unternehmenssoftware,Andrea Herrmann; B Paech; S Kirn; D Kossmann; G Müller; C Binnig; M Gilliot; T Illes; L Lowis; D Weiß,Kurzfassung: IT-Systeme; die in einem dynamischen Umfeld betrieben werden; müssen sichständig ändernde betriebliche Anforderungen anpassen. Wichtig ist hierbei; dass dieQualität des Systems nicht leidet. Daher wurde eine Methodik entwickelt; mit der klardefiniert wird; welche Qualität des IT-Systems gewünscht wird; wie diese durch das IT-System sichergestellt wird; und wie diese Qualität geprüft wird. Die durch die SIKOSA-Methodik unterstützte durchgängige Nachverfolgbarkeit der Qualitäts-anforderungen ist dieGrundlage für das Änderungsmanagement; denn sie stellt auch bei Änderungen am IT-System sicher; dass die Qualität des Systems erhalten bleibt oder sich sogar verbessert.,Industrie Management,2006,3
Revisiting reuse in main memory database systems,Kayhan Dursun; Carsten Binnig; Ugur Cetintemel; Tim Kraska,Abstract Reusing intermediates in databases to speed-up analytical query processing wasstudied in prior work. Existing solutions require intermediate results of individual operators tobe materialized using materialization operators. However; inserting such materializationoperations into a query plan not only incurs additional execution costs but also ofteneliminates important cache-and register-locality opportunities; resulting in even higherperformance penalties. This paper studies a novel reuse model for intermediates; whichcaches internal physical data structures materialized during query processing (due topipeline breakers) and externalizes them so that they become reusable for upcomingoperations. We focus on hash tables; the most commonly used internal data structure inmain memory databases to perform join and aggregation operations. As queries arrive …,Proceedings of the 2017 ACM International Conference on Management of Data,2017,2
Rethinking Distributed Query Execution on High-Speed Networks.,Abdallah Salama; Carsten Binnig; Tim Kraska; Ansgar Scherp; Tobias Ziegler,Abstract In modern high-speed RDMA-capable networks; the bandwidth to transfer dataacross machines is getting close to the bandwidth of the local memory bus. Recent work hasstarted to investigate how to redesign individual distributed query operators to best leverageRDMA. However; all these novel RDMA-based query operators are still designed for aclassical shared-nothing architecture that relies on a shuffle-based execution model toredistribute the data. In this paper; we revisit query execution for distributed databasesystems on fast networks in a more holistic manner by reconsidering all aspects from theoverall database architecture; over the partitioning scheme to the execution model. Ourexperiments show that in the best case our prototype database system called I-Store; whichis designed for fast networks from scratch; provides 3× speed-up over a shuffle-based …,IEEE Data Eng. Bull.,2017,2
Towards a Benchmark for Interactive Data Exploration.,Philipp Eichmann; Emanuel Zgraggen; Zheguang Zhao; Carsten Binnig; Tim Kraska,Abstract Existing benchmarks for analytical database systems such as TPC-DS and TPC-Hare designed for static reporting scenarios. The main metric of these benchmarks is theperformance of running different SQL queries over a predefined database. In this paper; weargue that such benchmarks are not suitable for evaluating modern interactive dataexploration (IDE) systems; which allow data scientists of varying skill levels to manipulate;analyze; and explore large data sets; as well as to build models and apply machine learningat interactive speeds. While query performance is still important for data exploration; webelieve that a much better metric would reflect the number and complexity of insights usersgain in a given amount of time. This paper discusses challenges of creating such a metricand presents ideas towards a new benchmark that simulates typical user behavior and …,IEEE Data Eng. Bull.,2016,2
Development of a UIML Renderer for Different Target Languages: Experiences and Design Decisions,Carsten Binnig; Andreas Schmidt,Abstract Generic development of user interfaces allows to considerably reduce the timeconsuming manual coding expenditure that may reach up to 50% of the development work.With UIML; the specification of an XML meta language was made available recently; whichclaims to define user interfaces independently of the platform and target language. Thepresent article describes our experience gained from the development of a UIML rendererfor various target languages. Division into target language-dependent and independentgeneration steps as well as various types of final target code generation play an importantrole in minimizing the expenditure of incorporating new target languages.,*,2002,2
A-Tree: A Bounded Approximate Index Structure,Alex Galakatos; Michael Markovitch; Carsten Binnig; Rodrigo Fonseca; Tim Kraska,Abstract: Index structures are one of the most important tools that DBAs leverage in order toimprove the performance of analytics and transactional workloads. However; with theexplosion of data that is constantly being generated in a wide variety of domains includingautonomous vehicles; Internet of Things (IoT) devices; and E-commerce sites; buildingseveral indexes can often become prohibitive and consume valuable system resources. Infact; a recent study has shown that indexes created as part of the TPC-C benchmark canaccount for 55% of the total memory available in a state-of-the-art in-memory DBMS. Thisoverhead consumes valuable and expensive main memory; and limits the amount of spacethat a database has available to store new data or process existing data. In this paper; wepresent a novel approximate index structure called A-Tree. At the core of our index is a …,arXiv preprint arXiv:1801.10207,2018,1
Revisiting reuse for approximate query processing,Alex Galakatos; Andrew Crotty; Emanuel Zgraggen; Carsten Binnig; Tim Kraska,Abstract Visual data exploration tools allow users to quickly gather insights from newdatasets. As dataset sizes continue to increase; though; new techniques will be necessary tomaintain the interactivity guarantees that these tools require. Approximate query processing(AQP) attempts to tackle this problem and allows systems to return query results at" humanspeed." However; existing AQP techniques start to break down when confronted with ad hocqueries that target the tails of the distribution. We therefore present an AQP formulation thatcan provide low-error approximate results at interactive speeds; even for queries over raresubpopulations. In particular; our formulation treats query results as random variables inorder to leverage the ample opportunities for result reuse inherent in interactive dataexploration. As part of our approach; we apply a variety of optimization techniques that …,Proceedings of the VLDB Endowment,2017,1
IncMap: A Journey towards Ontology-based Data Integration,Christoph Pinkel; Carsten Binnig; Ernesto Jimenez-Ruiz; Evgeny Kharlamov; Andriy Nikolov; Andreas Schwarte; Christian Heupel; Tim Kraska,Ontology-based data integration (OBDI) allows users to federate over heterogeneous datasources using a semantic rich conceptual data model. An important challenge in ODBI is thecuration of mappings between the data sources and the global ontology. In the last years;we have built IncMap; a system to semi-automatically create mappings between relationaldata sources and a global ontology. IncMap has since been put into practice; both foracademic and in industrial applications. Based on the experience of the last years; we haveextended the original version of IncMap in several dimensions to enhance the mappingquality:(1) IncMap can detect and leverage semantic-rich patterns in the relational datasources such as inheritance for the mapping creation.(2) IncMap is able to leveragereasoning rules in the ontology to overcome structural differences from the relational data …,*,2017,1
Spotlytics: How to Use Cloud Market Places for Analytics?,Tim Kraska; Elkhan Dadashov; Carsten Binnig,In contrast to fixed-priced cloud computing services; Amazon's Spot market uses a demand-driven pricing model for renting out virtual machine instances. This allows for remarkablesavings when used intelligently. However; a peculiarity of Amazon's Spot market is; thatmachines can suddenly be taken away from the user if the price on the market increases.This can be considered as a distinct form of a machine failure. In this paper; we first analyzeAmazon's current spot market rules and based on the results develop a general marketmodel. This model is valid for Amazon's current Spot service but also many potentialvariations of it; as well as other cloud computing markets. Using the developed marketmodel; we then make recommendations on how to deploy analytical systems with thefollowing three fault-tolerance/recovery strategies: re-execution as used by traditional …,*,2017,1
HILDA 2016 Workshop: A Report.,Arnab Nandi; Alan Fekete; Carsten Binnig,Abstract The first annual workshop “Human-in-the-Loop Data Analytics”(HILDA) was held onJune 26; 2016 in association with ACM SIGMOD in San Francisco. The workshop sparkedsome excellent conversations between speakers and attendees from many disciplinesspanning both industry and academia; and covered a variety of sub-themes related tohuman-in-the-loop data challenges.,IEEE Data Eng. Bull.,2016,1
SOMM: industry oriented ontology management tool,Evgeny Kharlamov; Bernardo Cuenca Grau; Ernesto Jimenez-Ruiz; Steffen Lamparter; Gulnar Mehdi; Martin Ringsquandl; Yavor Nenov; Stephan Grimm; Mikhail Roshchin; Ian Horrocks; Evgeny Kharlamov; Bernardo Cuenca Grau; Ernesto Jimenez-Ruiz; Steffen Lamparter; Gulnar Mehdi; Martin Ringsquandl; Yavor Nenov; Stephan Grimm; Mikhail Roshchin; Ian Horrocks; Yujiao Zhou; Bernardo Cuenca Grau; Yavor Nenov; Mark Kaminski; Ian Horrocks; Yavor Nenov; Robert Piro; Boris Motik; Ian Horrocks; Zhe Wu; Jay Banerjee; Yujiao Zhou; Yavor Nenov; Bernardo Cuenca Grau; Ian Horrocks; Boris Motik; Yavor Nenov; Robert Piro; Ian Horrocks; Yujiao Zhou; Bernardo Cuenca Grau; Yavor Nenov; Ian Horrocks; Boris Motik; Yavor Nenov; Robert Edgar Felix Piro; Ian Horrocks; Boris Motik; Yavor Nenov; Robert Edgar Felix Piro; Ian Horrocks; Yujiao Zhou; Yavor Nenov; Bernardo Cuenca Grau; Ian Horrocks; Yujiao Zhou; Yavor Nenov; Bernardo Cuenca Grau; Ian Horrocks; Mark Kaminski; Yavor Nenov; Bernardo Cuenca Grau; Mark Kaminski; Yavor Nenov; Bernardo Cuenca Grau; Mark Kaminski; Yavor Nenov; Bernardo Cuenca Grau; Boris Motik; Yavor Nenov; Robert Piro; Ian Horrocks; Dan Olteanu; Boris Motik; Yavor Nenov; Robert Piro; Ian Horrocks; Dan Olteanu; Yujiao Zhou; Yavor Nenov; Bernardo Cuenca Grau; Ian Horrocks; Yavor Nenov,Publications; by bibtex; Department of Computer Science; Oxford; Yavor Nenov.,Proc. of International Semantic Web Conference (ISWC); Posters and Demonstrations Track,2015,1
DoomDB: kill the query,Carsten Binnig; Abdallah Salama; Erfan Zamanian,Abstract Typically; fault-tolerance in parallel database systems is handled by restarting aquery completely when a node failure happens. However; when deploying a paralleldatabase on a cluster of commodity machines or on IaaS offerings such as Amazon's SpotInstances; node failures are a common case. This requires a more fine-granular fault-tolerance scheme. Therefore; most recent parallel data management platforms such asHadoop or Shark use a fine-grained fault-tolerance scheme; which materializes allintermediate results in order to be able to recover from mid-query faults. While such a fine-grained fault-tolerance scheme is able to efficiently handle node failures for complex andlong-running queries; it is not optimal for short-running latency-sensitive queries since theadditional costs for materialization often outweigh the costs for actually executing the …,Proceedings of the 2014 ACM SIGMOD International Conference on Management of Data,2014,1
Experience Gained in the Development of a Route Planner for Mobile End Devices.,Andreas Schmidt; Carsten Binnig,EXPERIENCE GAINED IN THE DEVELOPMENT OF A ROUTE PLANNER FOR MOBILE ENDDEVICES Andreas Schmidt; Carsten Binnig Institute for Applied Computer Sciences ForschungszentrumKarlsruhe Postfach 3640 76021 Karlsruhe Germany {schmidt; binnig}@iai.fzk.de ABSTRACTIn the mobile information society; location-based services play an increasingly important role[1]. These services are to be accessed by users with a mobile end device (mobile phone; personaldigital assistant or smart phone) for the use of city maps; route planning; navigation; trafficinformation; etc. Mobile end devices; however; do not have a computing power or storage capacitycomparable to those of a personal computer or laptop. These deficits can be bypassed by employingspecial methods in the development of the respective applications. The present article outlinesthe experience gained in the development of a prototype for route computation in public …,Communications; Internet; and Information Technology,2002,1
DeepVizdom: Deep Interactive Data Exploration,Carsten Binnig; Kristian Kersting; Alejandro Molina; Emanuel Zgraggen,ABSTRACT We make a case for a new generation of interactive data exploration systemsthat seamlessly integrate deep models as first-class citizens into the data exploration stack.Based on three case studies; we argue that this not only enables users to gain much deeperinsights into a broader range of data sets but also helps to improve the performance andquality of existing data exploration systems.,*,2018,*
Appreciation to distributed and parallel databases reviewers,Ailidani Ailijiang; Murat Ali Bayir; Nihat Altiparmak; Douglas Alves Peixoto; Vaibhav Arora; Ira Assent; Manos Athanassoulis; Erman Ayday; Samira Babalou; Mehdi Bahrami; Madhushi Bandara; Fuat Basik; Kaustubh Beedkar; Ladjel Bellatreche; Carsten Binnig; Klemens Böhm; Angela Bonifati; Vanessa Braganholo; Guadalupe Canahuate; Alberto Cano; Lei Cao; Nicholas Car; Fabio Casati; Aniket Chakrabarti; Lijun Chang; Aleksey Charapko; Shimin Chen; Ling Chen; Yu Cheng; Fei Chiang; Byron Choi; Bin Cui; Khuzaima Daudjee; Engin Demir; Murat Demirbas; Anton Dignoes; Bailu Ding; Xiaofeng Ding; Jaeyoung Do; Bin Dong; Hai Dong; Laurent D’orazio; Ahmed Eldawy; Iman Elghandour; Mohammed Eunus Ali; Liyue Fan,For helping us deliver timely decisions to our authors; the Editor-in-Chief and Publisherwould like to thank the following individuals who contributed their reviews between January1; 2017 and December 31; 2017. We applaud all your efforts and dedication to thecommunity,*,2018,*
RODI: Benchmarking relational-to-ontology mapping generation quality,Ian Horrocks Christoph Pinkel; Carsten Binnig; Ernesto Jiménez-Ruiz; Evgeny Kharlamov; Wolfgang May; Andriy Nikolov; Ana Sasa Bastinos; Martin G. Skjæveland; Alessandro Solimando; Mohsen Taheriyan; Christian Heupel,*,Semantic Web Journal,2018,*
Towards Interactive Curation & Automatic Tuning of ML Pipelines,Carsten Binnig; Benedetto Buratti; Yeounoh Chung; Cyrus Cousins; Dylan Ebert; Tim Kraska; Zeyuan Shang; Isabella Tromba; Eli Upfal; Linnan Wang; Robert Zeleznik; Emanuel Zgraggen,*,1st Inaugural Conference on Systems ML (SysML),2018,*
