What you see is not what you get!: Detecting Simpson's Paradoxes during Data Exploration,Yue Guo; Carsten Binnig; Tim Kraska,Abstract Visual data exploration tools; such as Vizdom or Tableau; significantly simplify dataexploration for domain experts and; more importantly; novice users. These tools allow todiscover complex correlations and to test hypotheses and differences between variouspopulations in an entirely visual manner with just a few clicks; unfortunately; often ignoringeven the most basic statistical rules. For example; there are many statistical pitfalls that auser can" tap" into when exploring data sets. As a result of this experience; we started tobuild QUDE [1]; the first system to Quantifying the Uncertainty in Data Exploration; which ispart of Brown's Interactive Data Exploration Stack (called IDES). The goal of QUDE is toautomatically warn and; if possible; protect users from common mistakes during the dataexploration process. In this paper; we focus on a different type of error; the Simpson's …,Proceedings of the 2nd Workshop on Human-In-the-Loop Data Analytics,2017,*
SiliconDB: rethinking DBMSs for modern heterogeneous co-processor environments,Kayhan Dursun; Carsten Binnig; Ugur Cetintemel; Robert Petrocelli,Abstract In the last decade; the work centered around specialized co-processors for DBMSshas largely focused on efficient query processing algorithms for individual operators.However; a major limitation of existing co-processor systems is the PCI bottleneck; whichseverely limits the efficient use of this type of hardware in current systems. In recent years;we have seen the emergence of a new class of co-processor systems that includespecialized accelerators; implemented as ASICs or FPGAs; which co-reside with the CPU onthe same socket. Here we revisit DBMS architectures in this context; and take an initial steptowards the design of a new database system called SiliconDB that targets these newdensely integrated heterogeneous co-processor environments.,Proceedings of the 13th International Workshop on Data Management on New Hardware,2017,*
Safe Visual Data Exploration,Zheguang Zhao; Emanuel Zgraggen; Lorenzo De Stefani; Carsten Binnig; Eli Upfal; Tim Kraska,Abstract Exploring data via visualization has become a popular way to understand complexdata. Features or patterns in visualization can be perceived as relevant insights by users;even though they may actually arise from random noise. Moreover; interactive dataexploration and visualization recommendation tools can examine a large number ofobservations; and therefore result in further increasing chance of spurious insights. Thuswithout proper statistical control; the risk of false discovery renders visual data explorationunsafe and makes users susceptible to questionable inference. To address these problems;we present QUDE; a visual data exploration system that interacts with users to formulatehypotheses based on visualizations and provides interactive control of false discoveries.,Proceedings of the 2017 ACM International Conference on Management of Data,2017,*
Interactive Data Analytics for the Humanities,Iryna Gurevych; Christian M Meyer; Carsten Binnig; Johannes Fürnkranz; Kristian Kersting; Stefan Roth; Edwin Simpson,Abstract. In this vision paper; we argue that current solutions to data analytics are notsuitable for complex tasks from the humanities; as they are agnostic of the user and focusedon static; predefined tasks with large-scale benchmarks. Instead; we believe that the humanmust be put into the loop to address small data scenarios that require expert domainknowledge and fluid; incrementally defined tasks; which are common for many humanitiesuse cases. Besides the main challenges; we discuss existing and urgently requiredsolutions to interactive data acquisition; model development; model interpretation; andsystem support for interactive data analytics. In the envisioned interactive systems; humanusers not only provide annotations to a machine learner; but train a model by using thesystem and demonstrating the task. The learning system will actively query the user for …,*,2017,*
The ETH Zurich systems group and enterprise computing center,Gustavo Alonso; Donald Kossmann; Timothy Roscoe; Nesime Tatbul; Andrew Baumann; Carsten Binnig; Peter Fischer; Oriana Riva; Jens Teubner,Computer science is facing a fundamental paradigm shift. Multicore architectures;application virtualization; and cloud computing each present on their own radical departuresin the way software is built; deployed; and operated. Taken together; these trends frame ascenario that makes sense from many points of view (usability; scalability; flexibility;development cost) but is also radically different from what we know today. It is fair to say thata coherent answer to the challenges raised by the combination of these trends has yet toemerge from either academia or industry. From an academic perspective; these challengesare particularly difficult because they imply a considerable departure from establishedprocedures. To start with; multicore computers; the virtualization of computing platforms; andthe replacement of the one-computer-one-local-copy-ofa-program approach by cloud …,ACM SIGMOD Record,2009,*
The SIKOSA method-Support of the industrial software production by methodically integrated software engineering processes,Daniel Weiss; Jorn Kaack; Stefan Kirn; Maike Gilliot; Lutz Lowis; Gunter Mueller; Andrea Herrmann; Carsten Binnig; Timea Illes; Barbara Paech; Donald Kossman,*,Wirtschaftsinformatik,2007,*
Screen Shot 2017-03-13 at 5.15. 39 PM,Sam Madden; Jane Greenberg; Carsten Binnig; Tim Kraska; Danny Weitzner; Sam Grabus,Summary A part of the NSF Big Data regional innovation hub program; the Northeast hub; isaddressing key data sharing challenges by:• Creating a licensing model for data thatfacilitates sharing data that is not necessarily open or free between different organizations;•Developing a prototype data sharing software platform; ShareDB; which will enforces theterms and restrictions of the developed licenses; and• Developing and integrating relevantmetadata that will accompany the datasets shared under the different licenses; making themeasily searchable and interpretable.,*,*,*
Data Engineering,Abdallah Salama; Carsten Binnig; Tim Kraska; Ansgar Scherp; Tobias Ziegler; Animesh Trivedi Stuedi; Jonas Pfefferle; Radu Stoica; Bernard Metzler; Nikolas Ioannou; Ioannis Koltsidas; Xiaoyi Lu; Dipti Shankar; Dhabaleswar K DK Panda; Chinmay Kulkarni; Aniraj Kesavan; Robert Ricci; Ryan Stutsman,The Technical Committee on Data Engineering held an election last fall for chair of the TC.The voting deadline was December 22 of last year. The candidates were Xiaofang Zhou andErich Neuhold. My thanks both candidates for being willing to run. Being chair of theTechnical Committee is largely invisible; but it is an important responsibility for the successof the data engineering community. The winner; with 69% of the vote is the current chair;Xiaofang Zhou; who has now won his second term. Congratulations to Xiaofang for hiselectoral victory. Xiaofang knows what the job entails; is experienced in doing it; and does itwell. I very much appreciate Xiaofang's efforts and his continued involvement; both at theTCDE and at the Computer Society more widely.,*,*,*
ICDE 2017 Reviewers,Yannis Papakonstantinou; Lei Chen; Reynold Cheng; Wolfgang Gatterbauer; Bingsheng He; Stratos Idreos; Christopher Jermaine; Chen Li; Gerome Miklau; Tamer Özsu; Olga Papaemmanouil; Evimaria Terzi; Eugene Wu; Ashraf Aboulnaga; Alex Alves; Amazon Gabriel Antoniu; INRIA Arvind Arasu; Andrey Balmin; Workday Zhifeng Bao; Sumita Barahmand; Srikanta Bedathur; Carsten Binnig; Spyros Blanas; Marco Brambilla; Stephane Bressan; K Selcuk Candan; Zhao Cao; James Cheng; Fei Chiang; Panos K Chrysanthis; Philippe Cudre-Mauroux,ICDE 2017 Program Committee Chairs Yannis Papakonstantinou; University of California; SanDiego Yanlei Diao; Ecole Polytechnique; France; and University of Massachusetts; Amherst …ICDE 2017 Area Chairs Lei Chen; Hong Kong University of Science and Technology ReynoldCheng; University of Hong Kong Wolfgang Gatterbauer; Carnegie Mellon University BingshengHe; National University of Singapore Stratos Idreos; Harvard University ChristopherJermaine; Rice University Chen Li; University of California Irvine Gerome Miklau; University ofMassachusetts Tamer Özsu; University of Waterloo Olga Papaemmanouil; Brandeis UniversityEvimaria Terzi; Boston University Eugene Wu; Columbia University … ICDE 2017 Program CommitteeAshraf Aboulnaga; Qatar Computing Research Institute Alex Alves; Amazon Gabriel Antoniu;INRIA Arvind Arasu; Microsoft Research Andrey Balmin; Workday Zhifeng Bao; RMIT …,*,*,*
Data Engineering,Aditya Parameswarany; Akash Das Sarma; Vipul Venkataramani; Olga Papaemmanouil; Yanlei Diao; Kyriaki Dimitriadou; Liping Peng; Philipp Eichmann; Emanuel Zgraggen; Zheguang Zhao; Carsten Binnig; Tim Kraska; Michael R Anderson; Dolan Antenucci; Michael Cafarella,Abstract As one of the successful forms of using Wisdom of Crowd; crowdsourcing; has beenwidely used for many human intrinsic tasks; such as image labeling; natural languageunderstanding; market predication and opinion mining. Meanwhile; with advances inpervasive technology; mobile devices; such as mobile phones; tablets; and PDA; havebecome extremely popular. These mobile devices can work as sensors to collect varioustypes of data; such as pictures; videos; audios and texts. Therefore; in crowdsourcing; arequester can unitize power of mobile devices and their location information to ask for datarelated a specific location; subsequently; the mobile users who would like to perform the taskwill travel to the target location and collect the data (videos; audios; or pictures); which isthen sent to the requester. This type of crowdsourcing is called spatial crowdsourcing …,*,*,*
Program Committees,Adam Belloum; Adriana Iamnitchi; Adrien Lèbre; Ajay Deshpande; Albert Levi; Alexandra Carpen-Amarie; Alexandru Costan; Alexandru Iosup; Ali R Butt; Alvaro Navas; Amr Alasaad; Ana-Maria Oprescu; Andre Brinkmann; Andrea Perego; Andres Martinez; Angel Kuri-Morales; Anirban Basu; B Annappa; Anne-Cécile Orgerie; Apostolos Papageorgiou; Athanasios Vasilakos; Ben Liang; Ben Smyth; Bingsheng He; Bo Yang; Bogdan Nicolae; Bruce Hendrickson; Carmelo Ragusa; Carmen Fernández-Gago; Carson K Leung; Carsten Binnig; Chandra Sekaran; Chang Hong Lin; Chen Jin; Chendong Li; Cheng-Kang Chu; Chi-Hung Chi; Ching-Seh Wu; Christophe Cerin; Chuliang Weng; Chunming Hu; Claudio Martella; Craig Lee; Dan Reed; Dana Petcu,Main Conference Adam Belloum; University of Amsterdam Adriana Iamnitchi; University of SouthFlorida Adrien Lèbre; Ecole des Mines Ajay Deshpande; IBM Albert Levi; Sabanci UniversityAlexandra Carpen-Amarie; Vienna University of Technology Alexandru Costan; INRIA AlexandruIosup; Delft University of Technology Ali R. Butt; Virginia Tech Alvaro Navas; Santander BankCentre for Open Middleware Amr Alasaad; The University of British Columbia Ana-MariaOprescu; Vrije University Andre Brinkmann; Johannes Gutenberg-Universität Mainz AndreaPerego; European Commission - Joint Research Centre Andres Martinez; Google AngelKuri-Morales; ITAM Anirban Basu; Tokai University Annappa B; NITK Anne-Cécile Orgerie; Institutde Recherche en Informatique et Systèmes Aléatoires Apostolos Papageorgiou; NEC Lab AthanasiosVasilakos; Kuwait University Ben Liang; University of Toronto Ben Smyth; INRIA Paris …,*,*,*
I-Store: Data Management for Fast Networks,Carsten Binnig; Ugur Cetintemel; Tim Kraska; Stan Zdonik; Erfan Zamanian; Andrew Crotty,Motivation: Existing distributed data management systems typically assume that the networkis a major bottleneck [10]. Consequently; avoiding remote data transfers is an importantdesign aspect of existing systems. In extreme cases; this has lead to system designs; whichexplicitly do not support certain distributed operations (eg; BigTable only supports joins if theinner table contains less than 8 MB of data). A common design principle; however; is tominimize remote data transfer by the two following techniques: First; existing systems try tofind an optimal partitioning scheme to co-partition data in order to avoid remote datatransfers for operations such as joins or to avoid distributed transactions. Second; locality-aware scheduling strategies aim to increase data-locality by shipping computation to thenodes where the data is stored. However; these techniques still result in major limitations …,*,*,*
Generierung Relevanter Testdatenbanken,Carsten Binnig,Abstract: In heutigen Softwareentwicklungsprojekten ist das Testen eine der kostenundzeitintensivsten Tätigkeiten. Wie ein aktueller Bericht des NIST [RTI02] zeigt; verursachtenSoftwarefehler in den USA im Jahr 2000 zwischen 22; 2 und 59; 5 Milliarden Dollar anKosten. Demzufolge wurden in den letzten Jahren verschiedene Methoden und Werkzeugeentwickelt; um diese hohen Kosten zu reduzieren. Viele dieser Werkzeuge dienen dazu dieverschiedenen Testaufgaben (zB das Erzeugen von Testfällen; die Ausführung vonTestfällen und das Uberprüfen der Testergebnisse) zu automatisieren. Jedoch existieren nurwenige Forschungsarbeiten zur Automatisierung der Tests von Datenbankanwendungen(wie zB eines E-Shops) bzw. von relationalen Datenbankmanagementsystemen (DBMS).Die diesem Artikel zugrunde liegende Doktorarbeit diskutiert ein wichtiges Problem aus …,Gesellschaft für Informatik eV (GI) publishes this series in order to make available to a broad public recent findings in informatics (ie computer science and informa-tion systems); to document conferences that are organized in co-operation with GI and to publish the annual GI Award dissertation.,*,*
