Evolution of storage management: Transforming raw data into information,Sandeep Gopisetty; Sandip Agarwala; Eric Butler; Divyesh Jadav; Stefan Jaquet; M Korupolu; Ramani Routray; Prasenjit Sarkar; Aameek Singh; Miriam Sivan-Zimet; C-H Tan; Sandeep Uttamchandani; David Merbach; Sumant Padbidri; Andreas Dieberger; Eben M Haber; Eser Kandogan; Cheryl A Kieliszewski; Dakshi Agrawal; M Devarakonda; K-W Lee; Kostas Magoutis; Dinesh C Verma; Norbert G Vogl,Exponential growth in storage requirements and an increasing number of heterogeneousdevices and application policies are making enterprise storage management a nightmare foradministrators. Back-of-the-envelope calculations; rules of thumb; and manual correlation ofindividual device data are too error prone for the day-to-day administrative tasks of resourceprovisioning; problem determination; performance management; and impact analysis.Storage management tools have evolved over the past several years from standardizing thedata reported by storage subsystems to providing intelligent planners. In this paper; wedescribe that evolution in the context of the IBM TotalStorage® Productivity Center (TPC)—asuite of tools to assist administrators in the day-to-day tasks of monitoring; configuring;provisioning; managing change; analyzing configuration; managing performance; and …,IBM Journal of Research and Development,2008,17
Distributed cognition and joint activity in collaborative problem solving,Paul P Maglio; Eser Kandogan; Eben Haber,Abstract Troubleshooting large software systems is often highly collaborative. Becausethese systems consist of complex infrastructures with many interdependent components;expertise is spread across different people and organizations. Those who administer suchsystems are faced with cognitive and social challenges; including the establishment ofcommon ground and coordination of attention; as they troubleshoot in collaboration withpeers; technical support; and software application developers. We take a distributedcognition approach to interpreting a specific instance of problemsolving in administering aweb-based system; examining the movement of representational state across media in asingle system administrator's environment. We also apply the idea of language use as jointactivity to understand how discourse attributes affect what is accomplished collaboratively …,Proceedings of the Annual Meeting of the Cognitive Science Society,2003,17
From data to insight: work practices of analysts in the enterprise,Eser Kandogan; Aruna Balakrishnan; Eben M Haber; Jeffrey S Pierce,With greater availability of data; businesses are increasingly becoming data-drivenenterprises; establishing standards for data acquisition; processing; infrastructure; anddecision making. Enterprises now have people dedicated to performing analytic work tosupport decision makers. To better understand analytic work; particularly the role ofenterprise business analysts; researchers interviewed 34 analysts at a large corporation.Analytical work occurred in an ecosystem of data; tools; and people; the ecosystem's overallquality and efficiency depended on the amount of coordination and collaboration. Analystswere the bridge between business and IT; closing the semantic gap between datasets; tools;and people. This article provides an overview of the analytic work in the enterprise;describing challenges in data; tools; and practices and identifying opportunities for new …,IEEE computer graphics and applications,2014,16
LabBook: Metadata-driven social collaborative data analysis,Eser Kandogan; Mary Roth; Peter Schwarz; Joshua Hui; Ignacio Terrizzano; Christina Christodoulakis; Renée J Miller,Open data analysis platforms are being adopted to support collaboration in science andbusiness. Studies suggest that analytic work in an enterprise occurs in a complex ecosystemof people; data; and software working in a coordinated manner. These studies also point tofriction between the elements of this ecosystem that reduces user productivity and quality ofwork. LabBook is an open; social; and collaborative data analysis platform designedexplicitly to reduce this friction and accelerate discovery. Its goal is to help users leverageeach other's knowledge and experience to find the data; tools and collaborators they need tointegrate; visualize; and analyze data. The key insight is to collect and use more metadataabout all elements of the analytic ecosystem by means of an architecture and userexperience that reduce the cost of contributing such metadata. We demonstrate how …,Big Data (Big Data); 2015 IEEE International Conference on,2015,14
System and method for disclosing relations between entities in support of information technology system visualization and management,*,A relationship visualization system provides a user interface by which a user may select fromamong entities; elements; and sub-elements as an initial point in a desired relationship fordisplay. The system designates the selected entities; elements; and sub-elementsoriginating endpoints for the desired relationship. The system displays the relationshipbetween entities; elements; and sub-elements to facilitate visualization and management ofthe information technology system. The relationship comprises a data path. The display ofthe relationship comprises a graphical view and a tabular view.,*,2011,14
Policy-based management of an e-commerce business simulation: An experimental study,Eser Kandogan; Christopher S Campbell; Peter Khooshabeh; John Bailey; Paul P Maglio,Autonomic Computing lays out a vision of information technology in which systems managethemselves based on policies. As a result; policies are the new currency of interactionbetween people and computers; creating a new paradigm for interaction with autonomicsystems. In this paradigm; interaction shifts (1) from low-level to high-level monitoring andcontrol and (2) from manually performing actions to delegating tasks to automation. In thispaper; we report an experimental study comparing and contrasting manual interaction topolicy-based interaction to manage a simulated e-commerce website. In this study; weinvestigated issues related to human expertise and policy representation. Our resultssuggest that effective policy-based interaction depends both on the level of detail of thepolicies and on the experience of the system supervisor. Our results show an overall …,Autonomic Computing; 2006. ICAC'06. IEEE International Conference on,2006,13
Collaboration in system administration,Eben M Haber; Eser Kandogan; Paul Maglio,George was in trouble. A seemingly simple deployment was taking all morning; and there seemedno end in sight. His manager kept coming in to check on his progress; as the customer was anxiousto have the deployment done. He was supposed to be leaving for a goodbye lunch for a departingco-worker; adding to the stress. He had called in all kinds of help; including colleagues; an applicationarchitect; technical support; and even one of the system developers. He used e-mail; instantmessaging; face-to-face contacts; his phone; and even his office mate's phone to communicatewith everyone. And George was no novice. He had been working as a Web-hosting administratorfor three years; and he had a bachelor's degree in computer science. But it seemed that all theexpertise being brought to bear was simply not enough. Why was George in trouble? We'll findout … To understand why; and to try to learn how administration can be better …,Queue,2010,12
Security administrators: A breed apart,Eben Haber; Eser Kandogan,ABSTRACT System administrators (sysadmins) are the linchpin of civilization; managing theInformation Technology (IT) infrastructures on which modern life depends. Unfortunately;there has been a lack of research on sysadmin practices and consequently admin tools areoften not designed to support their tasks effectively. Over the past five years; we conducted aseries of field studies investigating the work practices and environments of adminsmanaging several types of systems and infrastructures. We found that sysadmins are notablydifferent from typical computer users in several dimensions. We also observed considerablevariance among sysadmin specialties. Especially interesting are security administrators(secadmins); who act as detectives and intelligence agents to ensure that IT resources areused appropriately; preparing for and responding to attacks by human antagonists. In this …,SOUPS USM,2007,11
Data for all: A systems approach to accelerate the path from data to insight,Eser Kandogan; Mary Roth; Cheryl Kieliszewski; Fatma Özcan; Bob Schloss; Marc-Thomas Schmidt,Zettabytes of data are available to be harvested for competitive business advantage; soundgovernment policies; and new insights in a broad array of applications. Yet; most of this datais inaccessible for users; since current data analysis tools require an army of technicalpeople to find; transform; analyze; and visualize data in order to make it consumable fordecision making. In this paper; we present work in progress to lower the barriers for data-driven decision making by introducing a systems approach to scale the user experience; notonly in the volume and variety of data; but also in the skills required to harvest that data. Wecall for a new approach for data-intensive applications that engages the user as anintelligent partner in a social and intelligent conversation with data by automating; guiding;and recommending data; transformations; visualizations; analytics; and suggesting …,Big Data (BigData Congress); 2013 IEEE International Congress on,2013,10
Method and system for integrating personal information search and interaction on web/desktop applications,*,A system for integrating personal information search and interaction on web and desktopapplications comprises enabling a user-interface (UI) component of an application for theentry of a query the UI component associated with context information. Entry of the querybased on a natural language grammar is parsed to determine at least one natural languageelement. Element types associated with each natural language element are generated. Aquery command from a command list based on the natural language elements; the elementtypes and the context information is interpreted. The query with arguments based on thenatural language elements of the natural language query are executed to determine a result.The transformed result is output through said UI component by replacing said result for saidquery wherein outputting said transformed result comprises automatically adding email …,*,2012,9
Apparatus; system; and method for monitoring computer system components,*,An apparatus; system; and method are disclosed for monitoring computer systemcomponents in large or complex systems. The apparatus includes an identifier module forassociating at least one visual identifier with a computer system component. A functionmodule associates one or more control functions with the visual identifier. A presentationmodule selectively displays the at least one identifier for the computer system componentwithin a present view of a user interface. A monitoring module monitors the computer systemcomponent associated with the at least one identifier and modifies the identifier in responseto a change in operational status for the computer system component.,*,2014,8
Taming information technology: Lessons from studies of system administrators,Eser Kandogan,Information technology is at the center of modern life. It supports most day-to-day activities:talking on the phone; getting money from an ATM; or working in the office. Whether for work;commerce; or fun; we interact with computers; networks; and databases—all sorts ofinformation technology. How does it work? Certainly; technological advances helped createthis world. But what keeps it running? The answer is people. These people—computersystem administrators—are the unsung heroes of the modern age. When we notice them; itis only because something went wrong. Small failures can become big problems; and bigfailures can make news headlines and cost lots of money. But most of the time; things goright; and system administrators are invisible. They work out of sight; down in the data-center; twenty-four hours a day; seven days a week. But how do they keep systems …,*,2012,8
A1: Spreadsheet-based Scripting for Developing Web Tools.,Eben M Haber; Eser Kandogan; Allen Cypher; Paul P Maglio; Rob Barrett,Abstract A1 is a Java-based spreadsheet environment that enables system administrators tobuild small tools that simplify and automate common tasks; integrating real-time data acrossheterogeneous systems. A1 spreadsheets can be saved to a central repository; where theyare published and shared as interactive web portlets. In this paper; we discuss the need foradministrators to create their own tools; how the A1 environment is designed to support thisneed; and how A1's support for web publishing-without requiring special web programming-can enable teams to share; modify; and improve their tools. We also discuss the design andimplementation of A1; and show a number of sample spreadsheets for variousadministration tasks.,LISA,2005,7
Why Don't You Trust Me Anymore? Or the Role of Trust in Troubleshooting Activities of System Administrators,Eser Kandogan; Paul P Maglio,*,Proc. of the Conference on Human Factors in Computing Systems (CHI 2003),2003,7
On the roles of policies in computer systems management,Eser Kandogan; Paul P Maglio; Eben Haber; John Bailey,Abstract Policies are a pervasive and critical aspect of computer system management. Whatmakes an effective policy? How do policies work in practice? To what extent can policyspecification and implementation be formalized and automated? We studied the workpractices of computer system administrators to uncover some of the ways policies are usedin practice; and to inform the design of tools that incorporate policies to support moreeffective system management. We found that polices come in many forms—documented inservice-level agreements and best-practice guidelines; given by management directives;applied by system administrators through formal processes; and built into tools such asconfiguration management applications. We found that although policies sometimes makeexplicit statements and establish formal processes; much is left implicit; by design or …,International Journal of Human-Computer Studies,2011,6
Studying reactive; risky; complex; long-spanning; and collaborative work: The case of it service delivery,Eser Kandogan; Eben M Haber; John H Bailey; Paul P Maglio,Abstract IT service delivery is challenging to study. It is characterized by interacting systemsof technology; people; and organizations. The work is sometimes reactive; sometimescarefully planned; often risky; and always complex and collaborative. In this paper wedescribe how we've learned about IT work; using a variety of methods including naturalisticobservations; contextual interviews; surveys; and diary studies. We provide examples of ourstudy results; showing what we've learned with the different methods. We argue that toeffectively study such systems; a variety of methods may be needed to complement insightsand validate findings. We found that naturalistic observations were extremely time and laborintensive; yet offered us the time and space to observe unplanned events and long-lastingtasks; bringing out the full complexity and risks involved in real work. Contextual …,International Conference on Human-Computer Interaction,2009,6
Distributed Cognition and Joint Activity in Computer System Administration,Paul P Maglio; Eser Kandogan; Eben Haber,Abstract Troubleshooting large computer systems is often highly collaborative. Becausethese systems consist of complex infrastructures with many interdependent components;expertise is spread across people and organizations. Those who administer such systemsare faced with cognitive and social challenges; including the establishment of commonground and coordination of attention; as they troubleshoot in collaboration with peers;technical support; and software application developers. To investigate these aspects ofadministration work; we take a distributed cognition approach to interpreting a specificinstance of problem-solving in administering a Web-based system; examining the movementof representational states across media in a single system administrator's environment. Wealso apply the idea of language use as a joint activity to understand how discourse …,*,2008,6
Security Administration in the Wild: Ethnographic Studies of Security Administrators,Eben M Haber; Eser Kandogan,System administrators are a crucial population of computer users–they keep our computerinfrastructures up and running. Little was known about their work practices and tools;however; spurring us to perform a series ethnographic field studies over the past four years.We made 16 visits across six sites; studying administrators involved in managing systemand network security; web hosting; databases; operating systems; storage; and data centeroperations. Our research methods included naturalist observations of administrators at work(usually recorded on videotape); interviews; surveys; and collection of various artifacts(diaries; manuals; installation instructions; planning documents; etc.). The details of ourfindings with respect to system administration have been published elsewhere; includinggeneral discussions of work practices and tools [1; 2; 6]; a focus on security administrators …,*,2007,6
Elastic windows: design; implementation; and evaluation of multi‐window operations,Eser Kandogan; Ben Shneiderman,Abstract Most windowing systems follow the independent overlapping windows approach;which emerged as an answer to the needs of early computer users. Due to advances incomputers; display technology; and increased information needs; modern users demandmore functionality from window management systems. We propose Elastic Windows withimproved spatial layout and rapid multi-window operations as an alternative to currentwindow management strategies. In this approach; multi-window operations are achieved byissuing operations on window groups hierarchically organized in a space-filling tiled layoutsimilar to TreeMaps. 1 Sophisticated multi-window operations have been developed tohandle fast task-switching and to structure the work environment of users to their rapidlychanging needs. We claim that these multi-window operations and the tiled spatial layout …,Software: Practice and Experience,1998,6
Policity: an experimental evaluation of policy-based administration in a city simulation,Christopher S Campbell; Eser Kandogan; Adam November; Rob Barrett; Paul P Maglio,The administration cost of today's complex IT systems is a major inhibitor of growth for manycompanies in the burgeoning services economy. One proposed solution is policy-basedsystem administration-a type of autonomic computing system that can manage itself withminimum human intervention. To explore the cost-benefit tradeoffs of policy-based systemadministration; we conducted an experiment in which participants managed a simulated city(Policity) using either a policy-based interface or a manual GUI-based interface. Resultsshowed that for novices; performance was 50% higher using the policy interface comparedto using the manual interface; but the interaction workload was significantly higher with thepolicy interface than with the manual interface. Overall; our results suggest that policy-basedsystem administration can provide substantial productivity improvement at the cost of …,Policies for Distributed Systems and Networks; 2005. Sixth IEEE International Workshop on,2005,5
Method for automating variables in end-user programming system,*,A method for automating variables in an end-user programming system is disclosed. Theend-user programming system comprises a script; a shared repository; at least onedatabase; a recorder; an interpreter; and an execution engine. The script comprises at leastone command describing an event comprising a data value. Each user has a uniquelyidentified entry set for the entries distributed in at least one database. The interpreterautomatically creates a variable for a data value in a command by comparing the data valuewith each entry value in the entry set for the user recording the command. The interpreterautomatically instantiates a variable in a command with an entry value by comparing thevariable with each entry name in the entry set for the user executing the command.,*,2012,4
How a freeform spatial interface supports simple problem solving tasks,Eser Kandogan; Juho Kim; Thomas P Moran; Pablo Pedemonte,Abstract We developed DataBoard; a freeform spatial interface; to support users in simpleproblem solving tasks. To develop a deeper understanding of the role of space and thetradeoffs between freeform and structured interaction styles in problem solving tasks; weconducted a controlled user study comparing the DataBoard with a spreadsheet andanalyzed video data in detail. Beyond improvements in task performance and memoryrecall; our observations reveal that freeform interfaces can support users in a variety of ways:representing problems flexibly; developing strategies; executing strategies incrementally;tracking problem state easily; reducing mental computation; and verifying solutionsperceptually. The spreadsheet also had advantages; and we discuss the tradeoffs.,Proceedings of the SIGCHI Conference on Human Factors in Computing Systems,2011,4
Consumer centric online product research,*,Embodiments of the invention relate to providing online product research. Data related to anactivity performed by a consumer at a first electronic commerce website is collected. Thecollected data includes information about a first product; and the information about the firstproduct is stored as product research data. The product research data is associated with theconsumer. It is detected that the consumer is accessing a location in a second electroniccommerce website that includes information about a second product. The product researchdata is searched for data related to the information about the second product. Theinformation about the first product is located in response to searching the product researchdata for data related to the information about the second product; and the consumer ispresented with the information about the first product along with the information about the …,*,2016,3
Method for automating variables in end-user programming system,*,A method for automating variables in an end-user programming system is disclosed. Theend-user programming system comprises a script; a shared repository; at least onedatabase; a recorder; an interpreter; and an execution engine. The script comprises at leastone command describing an event comprising a data value. Each user has a uniquelyidentified entry set for the entries distributed in at least one database. The interpreterautomatically creates a variable for a data value in a command by comparing the data valuewith each entry value in the entry set for the user recording the command. The interpreterautomatically instantiates a variable in a command with an entry value by comparing thevariable with each entry name in the entry set for the user executing the command.,*,2011,3
Apparatus; system; and method for displaying a complementary high-level graphical representation of an enterprise information technology system,*,An apparatus; system; and method are disclosed for displaying a complementary; high-levelgraphical representation of an enterprise information technology system. A primaryvisualization module displays a primary visualization that is a schematic representation ofone or more elements of a selected portion of an enterprise information technology system.A minimap module displays a minimap that is an abstracted; high-level schematicrepresentation of the enterprise information technology system. A navigation moduledemarks a primary visualization representation within the minimap that corresponds to theprimary visualization. In one embodiment; the navigation module modifies the primaryvisualization representation and the corresponding primary visualization in response to auser input directed to the demarked primary visualization representation within the …,*,2008,3
Scalability in system management GUIs: a designer's nightmare,Andreas Dieberger; Eser Kandogan; Cheryl A Kieliszewski,Abstract As Information Technology (IT) advances; traditional concerns over performanceare being overtaken by concerns over manageability and scalability in system managementinterfaces [1]. Designing effective interactions and representations of large complex systemswith intricate relationships among components is a formidable challenge. In this paper wedescribe the design of a topology viewer application for enterprise-scale storage systems. Akey issue in this design effort was to create a graphical topology viewer that would scale tothe complexity of typical storage environments and support administrators effectively invarious activities. Our approach to address these issues was to use semantic zooming andprogressive information disclosure techniques extensively; thus essentially shifting thescalability challenge from purely visual design to mostly interaction design.,CHI'06 Extended Abstracts on Human Factors in Computing Systems,2006,3
