Visualizing multi-dimensional clusters; trends; and outliers using star coordinates,Eser Kandogan,Abstract Interactive visualizations are effective tools in mining scientific; engineering; andbusiness data to support decision-making activities. Star Coordinates is proposed as a newmulti-dimensional visualization technique; which supports various interactions to stimulatevisual thinking in early stages of knowledge discovery process. In Star Coordinates;coordinate axes are arranged on a two-dimensional surface; where each axis shares thesame origin point. Each multi-dimensional data element is represented by a point; whereeach attribute of the data contributes to its location through uniform encoding. Interactionfeatures of Star Coordinates provide users the ability to apply various transformationsdynamically; integrate and separate dimensions; analyze correlations of multipledimensions; view clusters; trends; and outliers in the distribution of data; and query points …,Proceedings of the seventh ACM SIGKDD international conference on Knowledge discovery and data mining,2001,314
Field studies of computer system administrators: analysis of system management tools and practices,Rob Barrett; Eser Kandogan; Paul P Maglio; Eben M Haber; Leila A Takayama; Madhu Prabaker,Abstract Computer system administrators are the unsung heroes of the information age;working behind the scenes to configure; maintain; and troubleshoot the computerinfrastructure that underlies much of modern life. However; little can be found in the literatureabout the practices and problems of these highly specialized computer users. We conducteda series of field studies in large corporate data centers; observing organizations; workpractices; tools; and problem-solving strategies of system administrators. We found systemadministrators operate within large-scale; complex environments that present significanttechnical; social; cognitive; and business challenges. In this paper; we describe systemadministrator tool use in critical; high-cost; labor-intensive work through observational;survey; and interview data. We discuss our findings concerning administrator needs for …,Proceedings of the 2004 ACM conference on Computer supported cooperative work,2004,204
Star coordinates: A multi-dimensional visualization technique with uniform treatment of dimensions,Eser Kandogan,Abstract Visualizing multi-dimensional data has tremendous effects on science; engineering;and business decisionmaking. A new visualization technique called Star Coordinates ispresented to support users in early stages of their visual thinking activities. Star Coordinatesarranges coordinates on a circle sharing the same origin at the center. It uses simply pointsto represent data; treating each dimension uniformly at the cost of coarse representation.Current implementation of Star Coordinates provided valuable insight on several real datasets for cluster discovery and multifactor analysis tasks. The work on Star Coordinates willcontinue on developing advanced transformations that will improve data understanding inmulti-dimensions.,Proceedings of the IEEE Information Visualization Symposium,2000,199
Elastic Windows: evaluation of multi-window operations,Eser Kandogan; Ben Shneiderman,ABSTRACT Most windowing systems follow the independent overlapping windowsapproach; which emerged as an answer to the needs of the 1980s' technology. Due toadvances in computers and display technology; and increased information needs; modemusers demand more functionality from window management systems. We proposed ElasticWindows with improved spatial layout and rapid multi-window operations as an alternativeto current window management strategies for efficient personal role management [12]. In thisapproach; multi-window operations are achieved by issurng operations on window groupshierarchically organized in a space-filling tiled layout.'l% is paper describes the ElasticWindows interface briefly and then presents a study comparing user performance withElastic Windows and traditional window management techniques for 2; 6; and 12 window …,Proceedings of the ACM SIGCHI Conference on Human factors in computing systems,1997,189
Koala: capture; share; automate; personalize business processes on the web,Greg Little; Tessa A Lau; Allen Cypher; James Lin; Eben M Haber; Eser Kandogan,Abstract We present Koala; a system that enables users to capture; share; automate; andpersonalize business processes on the web. Koala is a collaborative programming-by-demonstration system that records; edits; and plays back user interactions as pseudo-natural language scripts that are both human-and machine-interpretable. Unlike previousprogramming by demonstration systems; Koala leverages sloppy programming thatinterprets pseudo-natural language instructions (as opposed to formal syntactic statements)in the context of a given web page's elements and actions. Koala scripts are automaticallystored in the Koalescence wiki; where a community of users can share; run; andcollaboratively develop their" how-to" knowledge. Koala also takes advantage of corporateand personal data stores to automatically generalize and instantiate user-specific data; so …,Proceedings of the SIGCHI conference on Human factors in computing systems,2007,177
Avatar semantic search: a database approach to information retrieval,Eser Kandogan; Rajasekar Krishnamurthy; Sriram Raghavan; Shivakumar Vaithyanathan; Huaiyu Zhu,Abstract We present Avatar Semantic Search; a prototype search engine that exploitsannotations in the context of classical keyword search. The process of annotations isaccomplished offline by using high-precision information extraction techniques to extractfacts; con-cepts; and relationships from text. These facts and concepts are represented andindexed in a structured data store. At runtime; keyword queries are interpreted in the contextof these extracted facts and converted into one or more precise queries over the structuredstore. In this demonstration we describe the overall architecture of the Avatar SemanticSearch engine. We also demonstrate the superiority of the AVATAR approach overtraditional keyword search engines using Enron email data set and a blog corpus.,Proceedings of the 2006 ACM SIGMOD international conference on Management of data,2006,95
Elastic windows: improved spatial layout and rapid multiple window operations,Eser Kandogan; Ben Shneiderman,Abstract Most windowing systems follow the independent overlapping windows approach;which emerged as an answer to the needs of the 80s' application and technology. Advancesin computers; display technology; and the applications demand more functionality fromwindow management systems. Based on these changes and the problems of currentwindowing appraoches; we have updated the requirements for multiwindow systems toguide new methods of window management. We propose elastic windows with improvedspatial layout and rapid multi-window operations. Multi-window operations are achieved byissuing operations on window groups hierachically organized in a space-filling tiled layout.Sophisticated multi-window operations and spatial layout dynamics helps users to handlefast task-switching and to structure thier work environment to their rapidly changing needs …,Proceedings of the workshop on Advanced visual interfaces,1996,81
Usable autonomic computing systems: the administrator's perspective,Rob Barrett; Paul P Maglio; Eser Kandogan; John Bailey,One of the primary motivations behind autonomic computing (AC) is the problem ofadministrating highly complex systems. AC seeks to solve this problem through increasedautomation; relieving system administrators of many burdensome activities. However; theAC strategy of managing complexity through automation runs the risk of makingmanagement harder. We performed field studies of current administrator work practices toinform the design of AC in order to ensure that it simplifies system management. In thispaper; we analyze what system administrators do in terms of three important activities:rehearsal and planning; maintaining situation awareness; and managing multitasking;interruptions and diversions. We provide guidelines for constructing AC environments thatsupport these activities.,Autonomic Computing; 2004. Proceedings. International Conference on,2004,68
Two-key input per character text entry apparatus and method,*,Letters (more generally; language symbols) are entered electronically by selecting; insequential fashion; two keys on a standard phone layout. In preferred embodiments; the twokeys in the sequence are located in the same row. The first key selected is that key on whichthe desired letter is displayed; and the second key is given by the spatial position of thedesired letter within its group of letters on the key. The letters and keys may be color-codedto aid the user when inputting the two-key sequences. Letters may be selected to spell outwords on a screen and then sent electronically to a remote device or recipient.,*,2004,66
Apparatus; system; and method for interaction with multi-attribute system resources as groups,*,An apparatus; system; and method are disclosed for interacting with multi-attribute managedresources as groups. The apparatus; system and method identify in a repository one or moregroups associated with a target attribute. The apparatus system and method furtherdetermine a set of managed resources from the repository wherein each managed resourcein a set comprises the same value for the target attribute. The apparatus system and methodfurther associate each set of managed resources with a group. The apparatus system andmethod may subdivide the groups into sub-groups according to additional attributespossessed by members of each group and may display the groups and sub-groups tosummarize and highlight the managed resources of each group and sub-group.,*,2011,64
Elastic Windows: a hierarchical multi-window World-Wide Web browser,Eser Kandogan; Ben Shneiderman,ABSTRACT The World-Wide Web is becoming an invaluable source for the informationneeds of many users. However; current browsers are still primitive; in that they do notsupport many of the navigation needs of users; as indicated by user studies. They do notprovide an overview and a sense of location in the information structure being browsed. Alsothey do not facilitate organization and filtering of information nor aid users in accessingalready visited pages without high cognitive demands. In this paper; a new browsinginterface is proposed with multiple hierarchical windows and efficient multiple windowoperations. It provides a flexible environment where users can quickly organize; filter; andrestructure the information on the screen as they reformulate their goals. Overviews can givethe user a sense of location in the browsing history as well as provide fast access to a …,*,2003,63
Spreadsheet programming,*,Spreadsheet programming model and language is extended to create objects; with theirassociated state and set of defined behaviors; as first-class spreadsheet cell residents.Desired object behaviors can be invoked by calling methods on the objects through anevent-based imperative programming language that potentially modifies the state of anobject. Expressions can also be defined by calling methods on objects that produce newobjects in combination with operations on objects in other cells. Programming constructs aredefined that allows users to perform a sequence of operations on one or more objects.Operations can also be performed automatically similar to spreadsheet triggeringmechanism. Users can program to trigger operations either manually or automatically basedon changes to objects; or based on conditions defined.,*,2006,56
Security administration tools and practices,Eser Kandogan; Eben M Haber,In this chapter; we provide an overview of the tools and work practices of securityadministration based on our ethnographic field studies at various computing centers. Weprofile two representative security administrators and detail five case studies to illustratesecurity work and the challenges faced by security administrators. Based on these findings;we outline some of the opportunities that lie ahead to improve security administration tools.,Security and Usability: Designing Secure Systems that People Can Use,2005,44
In search of the ‘magic carpet’: Design and experimentation of a bimanual 3d navigation interface,Shumin Zhai; Eser Kandogan; Barton A Smith; Ted Selker,Abstract Hardware and software advances are making real-time 3D graphics part of allmainstream computers. World Wide Web sites encoded in Virtual Reality ModelingLanguage or other formats allow users across the Internet to share virtual 3D 'worlds'. As thesupporting software and hardware become increasingly powerful; the usability of the current3D navigation interfaces becomes the limiting factor to the wide-spread application of 3Dtechnologies. In this paper; we analyze the human factors issues in designing a usablenavigation interface; including interface metaphor; integration and separation of multipledegrees of freedom; mode switching; isotonic versus isometric control; seamless merger ofthe 3D navigation devices with the GUI pointing and scrolling devices; and two-handedinput. We propose a dual joystick navigation interface design based on a real-world …,Journal of Visual Languages & Computing,1999,44
Just-in-time annotation of clusters; outliers; and trends in point-based data visualizations,Eser Kandogan,We introduce the concept of just-in-time descriptive analytics as a novel application ofcomputational and statistical techniques performed at interaction-time to help users easilyunderstand the structure of data as seen in visualizations. Fundamental to just-intimedescriptive analytics is (a) identifying visual features; such as clusters; outliers; and trends;user might observe in visualizations automatically;(b) determining the semantics of suchfeatures by performing statistical analysis as the user is interacting; and (c) enrichingvisualizations with annotations that not only describe semantics of visual features but alsofacilitate interaction to support high-level understanding of data. In this paper; wedemonstrate just-in-time descriptive analytics applied to a point-based multi-dimensionalvisualization technique to identify and describe clusters; outliers; and trends. We argue …,Visual Analytics Science and Technology (VAST); 2012 IEEE Conference on,2012,41
Apparatus and method using color-coded or pattern-coded keys in two-key input per character text entry,*,Letters (more generally; language symbols) are entered electronically by selecting; insequential fashion; two keys on a standard phone layout. The first key in the two-keysequence is that key on which the desired letter is displayed. The keys and the lettersdisplayed on the keys are marked in such a way that the markings suggest the second key inthe two-key sequence. The letters displayed on the keys have respective markings; such asa color; with each letter on a given key having a unique marking. The keys themselves alsohave markings that match the markings of the letters. In preferred embodiments; the two keysin the two-key sequence are located in the same row. Letters may be selected to spell outwords on a screen and then sent electronically to a remote device or recipient.,*,2008,38
A1: end-user programming for web-based system administration,Eser Kandogan; Eben Haber; Rob Barrett; Allen Cypher; Paul Maglio; Haixia Zhao,Abstract System administrators work with many different tools to manage and fix complexhardware and software infrastructure in a rapidly paced work environment. Throughextensive field studies; we observed that they often build and share custom tools for specifictasks that are not supported by vendor tools. Recent trends toward web-based managementconsoles offer many advantages but put an extra burden on system administrators; ascustomization requires web programming; which is beyond the skills of many systemadministrators. To meet their needs; we developed A1; a spreadsheet-based environmentwith a task-specific system-administration language for quickly creating small tools ormigrating existing scripts to run as web portlets. Using A1; system administrators can buildspreadsheets to access remote and heterogeneous systems; gather and integrate status …,Proceedings of the 18th annual ACM symposium on User interface software and technology,2005,38
Task composition method for computer applications,*,Jigsaw connector pieces representing tasks to be performed are displayed on a computerscreen; preferably hierarchically in a tree; to elucidate the relationships between tasks. Toperform a task; a user positions an attachment jigsaw piece next to its correspondingconnector piece. The user is then prompted to input or verify preferences in a propertiespanel. For example; a printer may be installed by interconnecting an attachment piece(corresponding to the printer to be installed) next to the printer connector piece in the tree.The user may be aided in the process of matching connector and attachment pieces throughthe use of matching colors and images on the pieces.,*,2005,35
System and methods for managing complex service delivery through coordination and integration of structured and unstructured activities,*,The invention allows for the integration of structured and unstructured human activities in thecontext of delivering one or more service. The systems and method described improveefficiency and quality of service delivery by increasing overall productivity and by providingbetter accountability for the actual cost of delivery.,*,2013,34
Multidimensional visualization method,*,Multi-dimensional objects or data may be represented in two dimensions; thereby facilitatingunderstanding of the information or data. This reduction in the number of dimensions isaccomplished by constructing unit vectors corresponding to the dimensions; in which theunit vectors share a common plane. Information objects or multi-dimensional data areplotted and represented as small features such as points on a display tied to a processor orcomputer. A user may gain insight into how the information is structured by performingcertain transformations on it; such as scaling one (or more) unit vectors or rotating one ormore unit vectors; followed by replotting the points.,*,2010,29
Activity-based management of IT service delivery,John Bailey; Eser Kandogan; Eben Haber; Paul P Maglio,Abstract Growth; adaptability; innovation; and cost control are leading concerns ofbusinesses; especially with respect to use of information technology (IT). Though standardssuch as the Information Technology Infrastructure Library (ITIL) offer the potential for costsavings through the use of formal processes and best practices; such top-down approachestend to be either highlevel-often far removed from the actual work-or low-level-ofteninflexible given the rapid pace of technology and market change. We conducted field studiesto examine work practices in IT service delivery. Our results suggest that unstructured workactivities comprise a significant and vital portion of the overall work done by people in ITservice delivery. These activities include negotiating work items and schedules; seeking andproviding information and expertise; and using and sharing custom tools and practices …,Proceedings of the 2007 symposium on Computer human interaction for the management of information technology,2007,26
Trust as an underlying factor of system administrator interface choice,Leila Takayama; Eser Kandogan,Abstract System administrators are the unsung heroes of the information age; workingbehind the scenes to configure; maintain; and troubleshoot the computer infrastructure thatunderlies much of modern life. While Graphical User Interfaces (GUIs) are being offered assystem administration tools; they mostly continue to use Command-Line Interfaces (CLIs).Based on an extensive survey of system administrators; we provide insights regarding thispreference; analyze why many of these power users perceive CLIs as more effective thanGUIs; and discuss findings as supported by observations from our parallel field studies. Ouranalysis indicates that cognition-based trust and monitoring play major roles in the interfacepreference for CLIs vs. GUIs. We also propose next steps for further exploration of trust inhuman-computer interfaces.,CHI'06 extended abstracts on Human factors in computing systems,2006,24
Usable autonomic computing systems: The system administrators' perspective,Rob Barrett; Paul P Maglio; Eser Kandogan; John Bailey,Abstract One of the primary motivations behind autonomic computing (AC) is the problem ofadministrating highly complex systems. AC seeks to solve this problem through increasedautomation; relieving system administrators of many burdensome activities. However; theAC strategy of managing complexity through automation runs the risk of makingmanagement harder; if not designed properly. Field studies of current system administratorwork practices were performed to inform the design of AC systems from the systemadministrator's perspective; particularly regarding four important activities: collaboration andcoordination; rehearsal and planning; maintaining situation awareness; and managingmultitasking; interruptions; and diversions. Based on these studies; guidelines for designingusable AC systems that support these activities effectively are provided.,Advanced Engineering Informatics,2005,22
Opinionblocks: Visualizing consumer reviews,Basak Alper; Huahai Yang; Eben Haber; Eser Kandogan,Abstract—Every day; vast numbers of customer reviews are accessed on retail or onlineservices websites. Although valuable information can be gleaned from reviews; thesesources are underutilized both by consumers and businesses due to their unstructurednature; serial presentation; limited search tools; and low ratio of useful information to theoverall amount of data (high noise). OpinionBlocks is an interactive visualization tool to helppeople better understand customer reviews. It is designed to progressively discloseincreasingly detailed textual information from various reviews while continuously providingvisual graphical summaries. The visualization initially exposes text at the keyword level; andthen exposes snippets that the keywords are used in; and finally shows the snippets withinthe context of an entire review. We provide interactive tools to let users navigate across …,IEEE VisWeek 2011 Workshop on Interactive Visual Text Analytics for Decision Making,2011,21
Error messages: What's the problem?,Paul P Maglio; Eser Kandogan,Abstract Computer users spend a lot of time chasing down errors-following the trail of cluesthat starts with an error message and that sometimes leads to a solution and sometimes tofrustration. Problems with error messages are particularly acute for system administrators(sysadmins)-those who configure; install; manage; and maintain the computationalinfrastructure of the modern world-as they spend a lot of effort to keep computers runningamid errors and failures.,Queue,2004,20
Input for three dimensional navigation using two joysticks,*,A two-joystick interface for use with an information processing system having a 3D virtualreality module implements a bulldozer control metaphor permitting movement in threeorthogonal directions—forward-backward; up-down; left-right—and turning about a verticalaxis. The pointing interface includes mode switching permitting use of the joysticks for thecursor positioning and page scrolling functions of the information processing system. Thepointing system includes a frame-of-reference conversion module for transforming thepointing devices software interface to a four-degree-of-freedom three-dimensional interface;an interface with a virtual reality module including a display function. Ergonomicembodiments of the interface include locating the joysticks; eg; two IBM TrackPoints™ alongthe bottom row of keys of a standard keyboard; and; alternatively; placing the joysticks …,*,2001,20
Collaboration in system administration,Eben M Haber; Eser Kandogan; Paul P Maglio,George was in trouble. A seemingly simple deployment was taking all morning; and there seemedno end in sight. His manager kept coming in to check on his progress; as the customer was anxiousto have the deployment done. He was supposed to be leaving for a goodbye lunch for a departingco-worker; adding to the stress. He had called in all kinds of help; including colleagues; an applicationarchitect; technical support; and even one of the system developers. He used email; instantmessaging; face-to-face contacts; his phone; and even his office mate's phone to communicatewith everyone. And George was no novice. He had been working as a Web-hosting administratorfor three years; and he had a bachelor's degree in computer science. But it seemed that all theexpertise being brought to bear was simply not enough. Why was George in trouble? We'll findout … To understand why; and to try to learn how administration can be better …,Communications of the ACM,2011,19
