ACM Proc. of the Workshop on Advanced Visual Interfaces; AVI'96 (Gubbio; Italy; May 27-29; 1996) 29-38.,E Kandogan; B Shneiderman,Most windowing systems follow the independent overlapping windows approach; whichemerged as an answer to the needs of the 80s' applications and technology. Advances incomputers; display technology; and the applications demand more functionality from windowmanagement systems. Based on these changes and the problems of current windowingapproaches; we have updated the requirements for multi-window systems to guide newmethods of window management. We propose elastic windows with improved spatial layoutand rapid multi-window operations. Multi-window operations are achieved by issuingoperations on a hierarchically organized group of windows in a space-filling tiled layout.Sophisticated multi-window operations like Hook; Pump; Minimize; Restore; Move andRelocate have been developed to handle fast task-switching and to structure the work …,*,*,*
Proc. ACM; UIST97; ACM New York (October 1997); 169-177 [Published Version] HCIL-97-08; CS-TR-3789; ISR-TR-97-56,E Kandogan; B Shneiderman,The World Wide Web (WWW) is becoming an invaluable source for the information needs ofmany users. However; current browsers are still primitive; in that they do not support many ofthe navigation needs of users; as indicated by user studies. They do not provide an overviewand a sense of location in the information structure being browsed. Also they do not facilitatethe organization and filtering of information nor aid users in accessing already visited pageswithout much cognitive demands. In this paper; a new browsing interface is proposed withmultiple hierarchical windows and efficient multiple window operations. It provides a flexibleorganization where users can quickly organize; filter; and restructure the information on thescreen as they reformulate their goals. Overviews can give the user a sense of location inthe browsing history as well as provide fast access to a hierachy of pages.,*,*,*
CHI 97 Proceedings; Atlanta GA; 22-27 March 1997; ACM New York; 250-257 [Published Version],E Kandogan; B Shneiderman,Most windowing systems follow the independent overlapping windowsapproach; whichemerged as an answer to the needs of the 1980s' technology. Due to advances incomputers and display technology; and increased information needs; modern uses demandmore functionality from window management systems. We proposed Elastic window withimproved spatial layout and rapid multi-window operations as an alternative to currentwindow management strategies for efficient personal role management [kandogan]. In thisapproach; multi-window operations are achieved by issuing operations on window groupshierarchically organized in a space-filling tiledlayout. Thispaper describes the ElasticWindows interface briefly and thepresents a study comparing user performance with ElasticWindows and traditionalwindow management tewindow situations. Elastic Windows …,*,*,*
Social media study and analysis brings researchers from many fields into a single setting. Even though the tasks of these researchers are varied; data visualization a...,Daniel Archambault; Eser Kandogan; Martin Harrigan,Social media study and analysis brings researchers from many fields into a single setting.Even though the tasks of these researchers are varied; data visualization and analytics playsan important role. For industry and academics alike; visualization of social media data helpswith hypothesis formation and supports the explanation of phenomena. e Social MediaVisualization workshop is a venue for the presentation of research and applications ofvisualization to social media data. Its goal is to bring together researchers and industrypractitioners interested in visual and interactive techniques for social media analysis;particularly in social sciences and humanities as well as in industry. e workshop was heldin conjunction with the International AAAI Conference on Weblogs and Social Media(ICWSM 2012) in Dublin on the 4th of June 2012. e workshop accepted a total of eight …,*,*,*
く> INSTITUTE POR SYSTEMS RESEARCH,E Kandogan; B Shneiderman,Abstract The World-Wide Web (WWW) is becoming an invaluable source for the informationneeds of many users. However; current browsers are still primitive; in that they do notSupport many of the navigation needs of users; as indicated by user studies. They do notprovide an overview and a sense of location in the information structure being browsed. Alsothey do not facilitate the organization and filtering of information nor aid users in accessingalready visited pages without much cognitive demands. In this paper; a new browsinginterface is proposed with multiple hierarchical windows and efficient multiple windowoperations. It provides a flexible organization where users can quickly organize; filter; andrestructure the information on the screen as they reformulate their goals. Overviews can givethe user a sense of location in the browsing history as well as provide fast access to a …,*,*,*
VAST international program committee,Wolfgang Aigner; Natalia Andrienko; Simon Attfield; Enrico Bertini; Alessio Bertone; Rita Borgo; Paolo Buono; Remco Chang; Patricia Crossno; Aritra Dasgupta; Wenwen Dou; Niklas Elmqvist; Alex Endert; Brian Fisher; Kelly Gaither; Michael Gleicher; John Goodall; David Gotz; Diansheng Guo; Pourang Irani; Yun Jang; Jimmy Johansson; Eser Kandogan; David Kasik; Daniel Keim; Jessie Kennedy; Andreas Kerren; Jörn Kohlhammer; Tatiana von Landesberger; Shixia Liu; Ross Maciejewski; Kresimir Matkovic; Laura McNamara; Rosane Minghim; Klaus Mueller; Chris North; William Pike; Margit Pohl; Huaming Qu; William Ribarsky; Jonathan C Roberts; Anthony Robinson; Tobias Schreck; Heidrun Schumann; Chris Shaw; Claudio T Silva; John Stasko; Christian Tominski; Katerina Vrotsou; Chris Weaver; Daniel Weiskopf; Jarke J van Wijk; Stefan Wrobel; Ji Soo Yi; Daniel Archambault; David Auber; Anastasia Bezerianos; Sheelagh Carpendale; Fanny Chevalier; Christopher Collins; Carlos Correa; Stephan Diehl; Marian Dörk; Pierre Dragicevic; Steven Drucker; Tim Dwyer; Jason Dykes; Jean-Daniel Fekete; Sara Johansson Fernstad; Carsten Görg; Frank van Ham; Steve Haroz; Christopher Healey; Nathalie Henry-Riche; Uta Hinrichs; Heike Hofmann; Christophe Hurter; Tobias Isenberg; TJ Jankun-Kelly,Wolfgang Aigner St. Poelten University of Applied Sciences Natalia Andrienko Fraunhofer IAISand City University London Simon Attfield Middlesex University Enrico Bertini New York UniversityAlessio Bertone Dresden University of Technology Rita Borgo Swansea University Paolo BuonoUniversity of Bari Remco Chang Tufts University Patricia Crossno Sandia National LaboratoriesAritra Dasgupta New York University Wenwen Dou University of North Carolina at Charlotte NiklasElmqvist University of Maryland; College Park Alex Endert Georgia Tech Brian Fisher SimonFraser University … Kelly Gaither University of Texas at Austin Michael Gleicher University ofWisconsin John Goodall Oak Ridge National Laboratory David Gotz University of North Carolinaat Chapel Hill Diansheng Guo University of South Carolina Pourang Irani University of ManitobaYun Jang Sejong University Jimmy Johansson Linköping University Eser Kandogan IBM …,*,*,*
VAST International Program Committee,Gennady Andrienko; Simon Attfield; Thomas Baudel; Enrico Bertini; Rita Borgo; Paolo Buono; Patricia Crossno; John Dill; Wenwen Dou; Geoffrey Ellis; Niklas Elmqvist; Alex Endert; Thomas Ertl; Jean-Daniel Fekete; Michael Gleicher; Leanna House; Pourang Irani; Yun Jang; Jimmy Johansson; Eser Kandogan; Daniel Keim; Andreas Kerren; Jorn Kohlhammer; Robert Kosara; Shixia Liu; Zhicheng Liu; Krešimir Matković; Laura McNamara; Silvia Miksch; Klaus Mueller; William Pike; Margit Pohl; Jonathan Roberts; Tobias Schreck; Heidrun Schumann; Claudio Silva; Christian Tominski; Chris Weaver; Mark Whiting; Michelle Zhou; Wolfgang Aigner; Natalia Andrienko; Daniel Archambault; Lyn Bartram; Remco Chang; Carlos Correa; Stephan Diehl; Pierre Dragicevic; Danyel Fisher; Carsten Görg; Nathalie Henry-Riche; Petra Isenberg; Tobias Isenberg; Jessie Kennedy; Stephen Kobourov; Heidi Lam; Tatiana von Landesberger; Bongshin Lee; Alexander Lex; Ross Maciejewski; Michael McGuffin; Guy Mélançon; Torsten Möller; Tamara Munzner; Stephen North; Adam Perer; Harald Piringer; Michael Sedlmair; Jinwook Seo; Aidan Slingsby; Bettina Speckmann; John Stasko; Marc Streit; Justin Talbot; Martin Theus; Frank van Ham; Jarke J van Wijk; Andrew Vande Moere; Matthew Ward; Martin Wattenberg; Jing Yang; Ji Soo Yi,Gennady Andrienko Fraunhofer IAIS Simon Attfield Middlesex University Thomas Baudel IBMILOG Enrico Bertini New York University Polytechnic School of Engineering Rita Borgo SwanseaUniversity Paolo Buono UniversitaÊ degli Studi di Bari Patricia Crossno Sandia National LaboratoriesJohn Dill Simon Fraser University Wenwen Dou University of North Carolina at Charlotte GeoffreyEllis University of Konstanz … Niklas Elmqvist Purdue University Alex Endert Pacific NorthwestNational Laboratory Thomas Ertl University of Stuttgart Jean-Daniel Fekete INRIA Michael GleicherUniversity of Wisconsin Leanna House Virginia Polytechnic Institute and State University PourangIrani University of Manitoba Yun Jang Sejong University Jimmy Johansson Linköping UniversityEser Kandogan IBM Research … Daniel Keim University of Konstanz Andreas Kerren LinnaeusUniversity Jorn Kohlhammer Fraunhofer Institute Robert Kosara Tableau Software …,*,*,*
AVATAR: Beyond Keywords–Collaborative Information Extraction and Search,Eser Kandogan; Rajasekar Krishnamurty; Sriram Raghavan; Shivakumar Vaithyanathan; Huaiyu Zhu,ABSTRACT Existing search tools provide little support for information interaction activitiesbeyond simple keyword-based source retrieval. In order to effectively support the fulllifecycle of information interaction activities; tools need to support users in extracting;retrieving; manipulating; presenting; collaborating; and using information in their day-to-dayactivities. In this paper; we present our efforts in expanding the simple search interactionparadigm beyond source retrieval to collaborative information extraction and argue that weneed to move towards an information interaction language; one that is simple and informal;yet supports users in the full lifecycle of information activities.,ESI 2007,*,*
