Mobile work efficiency: Balancing between benefits; costs and sacrifices,Heli Väätäjä,Abstract Smartphones can be characterized as multipurpose mobile devices; or as pocket-sized mobile computers and multimedia devices. In the fieldwork of mobile journalists innews reporting; the efficiency of work could potentially be enhanced with smartphones.Smartphones equipped with mobile services and applications support various work tasksfrom preparing for the reporting to capturing and submitting or publishing the story or newsmaterial directly from the field. Based on ten studies on mobile news making the authordiscusses smartphones as enablers and characteristics that may constrain the usage anddecrease the perceived work efficiency. The identified benefits of smartphones for mobilejournalists are categorized as 1) temporal; 2) location; 3) convenience; 4) satisfaction; 5)informational; 6) communicational; 7) work process; and 8) monetary benefits. The costs …,International Journal of Mobile Human Computer Interaction (IJMHCI),2012,9
User experience goals as a guiding light in design and development–Early findings,Heli Väätäjä; Paula Savioja; Virpi Roto; Thomas Olsson; Jari Varsaluoma,Abstract. User experience (UX) goals are one means to describe user experiencerequirements and guide the design and evaluation of interactive systems in differentapplication domains. This position paper discusses the results of a pre-workshopquestionnaire for participants of a workshop on UX goals and their utilization. The domainsof the case studies that participants described vary from workplace to consumer applicationsand education. Workshop participants defined a good UX goal as something that (1) helps infocusing the design;(2) is measurable;(3) describes positive emotions; and (4)communicates the desired experience. Furthermore; UX goals were considered useful inkeeping the focus on important issues during design and development; and providinginspiration for design.,INTERACT 2015 Adjunct Proceedings,2015,7
Bottlenecks; usability issues and development needs in creating and delivering news videos with smart phones,Heli Väätäjä; Anssi A Männistö,Abstract We conducted five user studies on using smart phones with multimedia capabilitiesfor creating and delivering news content. We present here findings on bottlenecks; usabilityissues and development needs related to mobile news video capture; editing and uplinkdelivery. The identified bottlenecks for fast and reliable news video publishing are the uplinkdelivery of videos from mobile context due to the network limitations and throughput of themobile system. To enhance the technical quality of the created videos; participants wishedfor high quality lenses; optical zoom; manual adjustments and a possibility to use anexternal microphone for audio recording. In addition; the form factor of the device shouldsupport the capturing by providing a firm grip and enabling moving of the display. For videoediting; more functionalities were wished for; which sets a challenge to designing for …,Proceedings of the 3rd workshop on Mobile video delivery,2010,7
The fuzzy front end of experience design: Eliciting and communicating experience goals,Jari Varsaluoma; Heli Väätäjä; Eija Kaasinen; Hannu Karvonen; Yichen Lu,Abstract When starting an experience design process; designers should first determine theexperience to aim for. In the fuzzy front end of the experience design process; there are oftenseveral alternative sources for gaining insight and inspiration in defining this experience. Inthis paper; we describe our findings from two surveys about experience goal setting andapproaches to communicate about these goals with stakeholders. The results fromresearchers working on 9 different experience design cases suggest that" empathicunderstanding of the users' world" is the most used source of insight and inspiration indefining experience goals. As an end result; we propose the model for Experience GoalElicitation Process to clarify the fuzzy front end of experience design and instructions tosupport designers in defining and evaluating experience goals.,Proceedings of the Annual Meeting of the Australian Special Interest Group for Computer Human Interaction,2015,6
Animal Welfare as a Design Goal in Technology Mediated Human-Animal Interaction,Heli Väätäjä,Abstract Designing technology mediated human-animal interaction with the animal welfareas a design goal calls for understanding of animal welfare issues. This paper discusses thenotion of animal welfare and specifically focuses on domestic dogs (canis familiaris) as anexample case. Strategies for mediating relatedness are discussed and an initial frameworkto support designing tactile interactions for human-animal interaction is presented. Paperbuilds its reasoning upon scientific research on human-animal interaction and welfare; andidentifies issues for future work in this area.,Proceedings of the 2014 Workshops on Advances in Computer Entertainment Conference,2014,6
Factors affecting user experience in mobile systems and services,Heli Väätäjä,Abstract Understanding the factors affecting user experience of mobile systems and servicesis becoming increasingly important as the mobile ecosystem is becoming a reality. The aimof my work is to contribute to the theory building of frameworks on factors affecting userexperience in the mobile context and to the methodology for studying and evaluating userexperience of mobile systems and services.,Proceedings of the 10th international conference on Human computer interaction with mobile devices and services,2008,6
Performance of multiuser detection in TD-CDMA uplink,Heli Väätäjä; Markku Juntti; Pauli Kuosmanen,*,EUPSICO 2000: European signal processing conference,2000,6
User experience of smart phones in mobile journalism: early findings on influence of professional role,Heli Väätäjä,Abstract We used an online questionnaire in the end of a case study to explore whether andhow professional role-the role of a news journalist or a news photographer-affects userexperience of smart phones used for mobile news making. Fifteen participants assessed thepragmatic and hedonic qualities and an overall judgment of appeal of a smart phone basedmobile journalism system. We found that photographers assessed the hedonic qualityidentification more negatively than journalists and a similar trend was found for hedonicquality stimulation. We did not find a statistically significant difference between the usergroups for the perception of pragmatic qualities or overall judgment of appeal.,Proceedings of the 22nd Conference of the Computer-Human Interaction Special Interest Group of Australia on Computer-Human Interaction,2010,5
Human-Computer Interaction-INTERACT 2009,Tom Gross; Jan Gulliksen; Paula Kotzé; Lars Oestreicher; Philippe Palanque; Raquel Oliveira Prates; Marco Winckler,*,Lecture Notes in Computer Science,2009,5
Journalism in virtual reality: opportunities and future research challenges,Esa Sirkkunen; Heli Väätäjä; Turo Uskali; Parisa Pour Rezaei,Abstract This paper presents a state-of-the-art overview of journalism and its opportunitiesand challenges in virtual reality (VR). First; we examine what kind of real-life journalisticexperiments have been made in this field thus far; and then we analyze the researchliterature on journalistic VR. We discuss the emergence of virtual reality and immersivejournalism explored in the latest reports in the fields of Human-Computer Interaction (HCI)and VR design. To analyze VR journalism further; we develop an early draft of an analysismodel based on sample of three VR productions and four VR applications. We conclude bydiscussing the results of the analysis and outline a more advanced and interdisciplinaryresearch approach for studying and designing journalistic VR productions.,Proceedings of the 20th International Academic Mindtrek Conference,2016,4
Opportunities and Needs for Logged Usage Data Analytics of Complex Industrial Systems.,Heli Väätäjä; Tomi Heimonen; Katariina Tiitinen; Jaakko Hakulinen; Markku Turunen; Harri Nieminen; Hannu Paunonen; Jouni Ruotsalainen; Jaakko Oksanen; Iiro Lindborg,Abstract Industrial information systems record and store data about the status and use of thecomplex underlying production systems and processes. These data can be analyzed toimprove existing; and innovate new products; processes; and services. This work focuses ona relatively unexplored area of industrial data analytics–understanding of end-userbehaviors and their implications to the design; implementation; training and servicing ofindustrial systems. We report the initial findings from a requirements gathering workshopconducted with industry participants to identify the expected opportunities and goals withlogged usage data and related needs to support the aims. Our key contributions include acharacterization of the types of data that need to be collected and visualized; how these datacan be used to understand product usage; description of the business purposes the …,ECIS,2016,4
Towards understanding how agile teams predict user experience,Kati Kuusinen; Heli Väätäjä; Tommi Mikkonen; Kaisa Väänänen,Abstract In this chapter; we compare UX assessments of users and agile team members tolearn to what extent developers can predict how users experience (UX) the product thedevelopers are working on; and where user involvement is truly required. We compared UXassessments of agile team members (N= 26) and users (N= 29) of six enterpriseapplications with statistical tests. Moreover; we analyzed the data with principal componentanalysis to reveal the main dimensions of UX for enterprise software. Our results confirmprior research findings that agile team members can put themselves in the users' positionwhen evaluating instrumental aspects of UX of the software they are working on. However; itseems that developers cannot evaluate non-instrumental quality. Therefore; direct userinvolvement from participation to evaluation or other means to support user empathy in …,*,2016,4
Framing the user experience in mobile newsmaking with smartphones,Heli Väätäjä,*,Tampereen teknillinen yliopisto. Julkaisu-Tampere University of Technology. Publication; 1196,2014,4
Exploring augmented reality for user-generated hyperlocal news content,Heli K Väätäjä; Mari J Ahvenainen; Markus S Jaakola; Thomas D Olsson,Abstract To support and enrich crowdsourcing; sharing and consuming of hyperlocal newscontent created by the readers we created four scenarios that utilize augmented reality (AR).We used the scenarios to gain an initial understanding of the feasibility and utility of AR inthis context by interviewing five contributors of hyperlocal news content to explore theirperceptions and further ideas on the scenarios. Findings indicate that AR is an interestingand acceptable solution for the content creators: AR can be applied in hyperlocal news 1) inthe crowdsourcing processes to support crowdworkers' activity and its planning and 2) forsharing and consuming location-based user-generated content. In implementation of ARsolutions; attention needs to be paid to the interestingness of tasks and created content;ensuring the quality of the content as well as how interaction with the AR application and …,CHI'13 Extended Abstracts on Human Factors in Computing Systems,2013,4
Coherence analysis of multichannel time series applying conditioned multivariate autoregressive spectra,H Vaataja; Risto Suoranta; Seppo Rantala,Coherence analysis enables the studying of linear dependencies between multichanneltime series. In the case of a multivariate autoregressive (MAR) spectrum the conventionalcoherence analysis can be applied. However; since we are able to decompose the MARspectrum; there is a possibility to gain more information through coherence analysis basedon conditioned spectra than with conventional methods. The authors formulate thecoherence analysis based on the conditioned MAR spectra (reduced and noise conditionedspectra) by giving related definitions for partial and multiple coherences.,Acoustics; Speech; and Signal Processing; 1994. ICASSP-94.; 1994 IEEE International Conference on,1994,4
Don't cut to the chase: hunting experiences for zoo animals and visitors,Fiona French; Mark Kingston-Jones; David T Schaller; Sarah Ellen Webber; Heli Väätäjä; Mark Campbell,Page 1. Don't Cut to the Chase: Hunting Experiences for Zoo Animals and Visitors Abstract Thisworkshop explores different ways to use technology to facilitate hunting behaviour enrichmentfor zoo-housed animals and parallel gaming experiences for zoo visitors. Author KeywordsEnvironmental enrichment; ACI; games; physical computing. ACM Classification KeywordsH.5.m. Information interfaces and presentation (eg; HCI): Miscellaneous. Introduction Enablingcaptive animals to experience their natural predatory and avoidance behaviours is an interestingchallenge for zoos. Many zoos worldwide are searching for different novel ways to enrich thelives of captive animals to ensure their physical and psychological welfare. Although …,Proceedings of the Third International Conference on Animal-Computer Interaction,2016,3
Software visualization today: Systematic literature review,Anna-Liisa Mattila; Petri Ihantola; Terhi Kilamo; Antti Luoto; Mikko Nurminen; Heli Väätäjä,Abstract Software visualization means visualizing various aspects and artifacts related tosoftware. By this definition a wide range of different software engineering aspects fromprogram comprehension to understanding software process and usage are covered. Thispaper presents the results of systematic literature review spanning six years of softwarevisualization literature. The main result shows that the most studied topics in the past sixyears are related to software structure; behavior and evolution. Software process and usageare addressed only in few studies. In the future studying the adoption of softwarevisualization tools in industry context would be beneficial.,Proceedings of the 20th International Academic Mindtrek Conference,2016,3
The fuzzy front end of experience design,Eija Kaasinen; Heli Väätäjä; Hannu Karvonen; Yichen Lu,Abstract The basic idea behind Experience Design approach is that before ideating thesolution; you define what experience to design for. This is a critical point in a design process;because the experience goal needs to be appropriate for the target context of use; in linewith the brand experience; and meaningful to truly engage users. In the early phases of theexperience design process; in the fuzzy front end; there are several sources that can guideexperience goal setting. One important way is empathic understanding of the users' worldand stepping into the users' shoes; but there are also other sources of insight and inspirationfor setting the experiential goals such as brand promise; technology and societal trends aswell as mere vision of renewal. In this workshop; we aim to collect examples of the fuzzyfront end of the experience design process and analyze how the different sources of …,Proceedings of the 8th Nordic Conference on Human-Computer Interaction: Fun; Fast; Foundational,2014,3
Method and arrangement for calculating correlation,*,A method and arrangement for calculating correlation between a first and second codesequence; which comprise a number of samples and have a finite length is disclosed. Thearrangement comprises an assembly for estimating the delay between the code sequencesand an assembly for setting the codes to a desired phase with respect to each other on thebasis of the delay between the code sequences by rotating the first sequence. To allowcorrelation to be calculated quickly and simply; the arrangement includes an assembly forcomparing the sequences with each other in parallel mode sample by sample and anassembly for adding the results of the sample-specific comparisons together.,*,2003,3
Information Visualization Heuristics in Practical Expert Evaluation,Heli Väätäjä; Jari Varsaluoma; Tomi Heimonen; Katariina Tiitinen; Jaakko Hakulinen; Markku Turunen; Harri Nieminen; Petri Ihantola,Abstract While traditional HCI heuristics can be used to find usability issues also frominformation visualization systems; specialized heuristics tailored for the informationvisualization (InfoViz) domain can be more effective and focus on the special characteristicsof these systems. In this study; we describe the application of ten information visualizationheuristics from prior research and their testing in practical heuristic evaluation. We found thatthe selected heuristics were useful with good coverage in our application case. However;based on our observations; we argue that interaction; veracity; and aesthetics relatedheuristics should be added to the previously used set. The lack of domain knowledge madethe evaluators somewhat uneasy with their capability to carry out the investigation in-depth.We suggest to train domain experts with understanding of the data and application …,Proceedings of the Beyond Time and Errors on Novel Evaluation Methods for Visualization,2016,2
User experience of digital news: two semi-long term field studies,Emilia Pesonen; Satu Jumisko-Pyykkö; Heli Väätäjä,Abstract Reading of digital news on personal devices has dramatically increased. Parallel tonew devices; novel services and content types are created forming new habits andexperiences for readers. Previous research is limited in understanding temporal aspects ofsuch users' experiences (UX). This study aims to understand UX of mobile news reading in areal context of use over one week in two different case studies. UX of digital replicas;browser optimized versions of digital news; and a novel media authentication method fornews reading and ordering were explored with actual news readers (N= 36) in field usingtheir own tablets and personal computers. Data-collection included daily diaries with UXquestionnaires; and retrospective interviews. The results showed that the studied forms ofdigital news and authentication method provided positive UX; and they were appealing …,Proceedings of the 14th International Conference on Mobile and Ubiquitous Multimedia,2015,2
UX Goals 2012 workshop–how to utilize user experience goals in design?,Heli Väätäjä; Thomas Olsson; Paula Savioja; Virpi Roto,This is the proceedings of the workshop UX Goals 2012–“How to Utilize User ExperienceGoals in Design?” held on October 14th; 2012 in Copenhagen; Denmark in conjunction withNordiCHI2012 (http://www. nordichi2012. org/). To design technology that is capable ofenabling; promoting and/or demonstrating specific user experience it is important to setexperiential goals for the design. Such goal setting approach is receiving increasingattention in design and development of interactive systems–not only in relation to everydayconsumer technology but also in work related systems.,*,2012,2
Questionnaires in user experience evaluation,Heli Väätäjä; Virpi Roto,ABSTRACT User experience evaluation is currently discussed widely both in the academiaand industry. In this paper we discuss the use of questionnaires in user experienceevaluation from the point of view of both academic research and practical system andservice development in industry. We describe the current challenges and future needs wehave identified in questionnaire usage; such as the need for agreed metrics for userexperience evaluation; mobile questionnaires; modular questionnaires and creatingquestionnaire toolboxes for researchers and practitioners.,*,2009,2
Collaboration in Open Innovation Communities-Do Users Want It,Maria Antikainen; Heli Väätäjä,*,Proceedings of The XIX ISPIM Conference Open Innovation Creating Products and Services through Collaboration,2008,2
Assisting immersive virtual reality development with user experience design approach,Otto Kauhanen; Heli Väätäjä; Markku Turunen; Tuuli Keskinen; Esa Sirkkunen; Turo Uskali; Vesa Lindqvist; Chelsea Kelling; Jussi Karhu,Abstract In our study we explored how to design a biography of a late Finnish artist as a VRexperience. We conducted a development process assisted by user experience (UX) designmethods; which increased the process efficiency; and resulted in a research prototype.Through previous research and our development process; we identified componentsaffecting the user experience. These components are: Immersion; Presence; Disorientation;Sense of Control; Pleasantness; Exploration and Simulator Sickness. From our user studywith 13 participants; we were able to draw implications that relate to these components.While the set of components could be incomplete or subject to change; shows that furtherresearch is necessary for a more comprehensive knowledge of user experience in the fieldof Virtual reality.,Proceedings of the 21st International Academic Mindtrek Conference,2017,1
Where HCI meets ACI,Ilyena Hirskyj-Douglas; Janet C Read; Oskar Juhlin; Heli Väätäjä; Patricia Pons; Svein-Olaf Hvasshovd,Abstract This one day workshop examines the interactions and the space between HCI(Human Computer Interaction) and ACI (Animal Computer Interaction) focusing on thetransferability of methods and ideas between the two fields. The workshop will begin withshort presentations followed by plenary discussions. The aim is to strengthen connectedthinking whilst highlighting the exchangeable connecting methods from both ACI and HCIand their subfields including Child Computer Interaction (CCI) and Human Robot Interaction(HRI); discussing what these fields learn from each other with their similarities anddifferences mapped. The output of this workshop will be an initial mapping of the ACI andHCI field's interchange of methods and learning transferability as well as an advancedunderstanding of how the two fields are useful to each other.,Proceedings of the 9th Nordic Conference on Human-Computer Interaction,2016,1
Experience design for multiple customer touchpoints,Virpi Roto; Heli Väätäjä; Effie Law; Rachel Powers,Abstract A burgeoning topic in the field of UX is designing users' experiences in differentchannels and touchpoints between an organization and the user. The work so far haslargely focused on responsive transmedia design. However; when UX design meets servicedesign; a deeper and broader perspective of the topic emerges: how users' experiencesevolve along the customer journey through different touchpoints. Multi-touchpointexperience design aims to build a harmonious experience journey through the touchpoints.This one-day workshop has four objectives:(i) to clarify the terminology in this emergingresearch area;(ii) to understand the opportunities and challenges of multi-touchpointexperience design through case studies in different application contexts;(iii) to identifyintriguing research themes; and (iv) to build a community in this area.,Proceedings of the 9th Nordic Conference on Human-Computer Interaction,2016,1
Temporal dimensions of affect in user experience of digital news in the field,Satu Jumisko-Pyykkö; Emilia Pesonen; Heli Väätäjä,Abstract This paper examines temporal dimensions of affective experiences as part of userexperience of digital news reading in field conditions in two case studies. The first studyfocused on user experience of novel browser optimized versions of news for tabletcomputers. The second study examined the experience of digital replicas. The participantswere active readers of newspapers studied. The daily reporting of affect was done over theusage period of one week. The results of both studies showed that there are differencesbetween positive and negative affect; in their dynamism over time and individual differencesthey captured. The amount of negative emotions was very low with small individualdifferences and it reduced over time. In contrast; positive affect indicated slightly positiveuser experience with larger amount of individual differences. Its main dynamism was …,Proceedings of the 20th International Academic Mindtrek Conference,2016,1
Participatory development of user experience design guidelines for a B2B company,Elina Hildén; Heli Väätäjä; Virpi Roto; Kero Uusitalo,Abstract As business success is increasingly dependent on an organization's ability toprovide a pleasant user experiences (UX) for its products; companies need to find ways toharness every employee to think about UX in their daily work. To support this goal; wepresent a participatory development process to create user experience design guidelines fora company developing materials-handling equipment for warehouses. The guidelines weredeveloped to steer the work of all R&D designers and developers towards experience-driven design of the products in business-to-business context. The participatory processincludes six steps: Spreading awareness of UX within the company; providing informationon UX; supporting understanding of UX; co-creation of guidelines; reviewing the outcome;and implementing the guidelines. This paper concentrates on describing the first five …,Proceedings of the 20th International Academic Mindtrek Conference,2016,1
