Rewarding in open innovation communities–how to motivate members,Maria J Antikainen; Heli K Vaataja,In order to attract and enhance users' commitment to participate in online open innovationcommunities; it is important to know what types of motivators are important for the members.Both monetary and non-monetary rewards can be used for motivating participation. In thisstudy we focus on studying the role of rewarding in online open innovation intermediaries.The data was collected by interviews with the community maintainers of three openinnovation intermediaries and by a web survey in the communities maintained by them. Inthe studied communities; the web survey respondents found monetary rewarding important;as well as non-monetary rewarding based on the quality of ideas. According to themaintainers' interviews; combinations of monetary and non-monetary rewarding areimportant. In addition; we analysed the rewarding mechanisms in 12 open innovation …,International Journal of Entrepreneurship and Innovation Management,2010,162
Crowdsourced news reporting: supporting news content creation with mobile phones,Heli Väätäjä; Teija Vainio; Esa Sirkkunen; Kari Salo,Abstract As news organizations are moving towards systematically using the power ofcrowds in news reporting; mobile phones are potential mobile tools for reader reporters. Weconducted two user studies to support the development of future mobile crowdsourcingprocesses and mobile tools for news reporting. In a quasi-experiment on future mobilecrowdsourcing process with location-based assignments; SMS messages were experiencedas an easy and handy means for news assignments. A customized mobile client prototypewas preferred for submission of multimedia content (photo and video); since submission wasexperienced simple to use and reliable especially for videos. Based on our findings andearlier research we discuss implications for the development of mobile crowdsourcingprocesses with mobile news reporting assignments.,Proceedings of the 13th International Conference on Human Computer Interaction with Mobile Devices and Services,2011,50
Developing practical tools for user experience evaluation: a case from mobile news journalism,Heli Väätäjä; Tiina Koponen; Virpi Roto,Abstract We present a questionnaire called Attrak-Work to support the evaluation of userexperience of mobile systems in the context of mobile news journalism. We discusstheoretical background of the questionnaire and describe the development processincluding the field study within which the questionnaire was developed. The presentedquestionnaire assesses user's perception of the pragmatic (usability and task and goalachievement) and hedonic (stimulation and identification) qualities and an overall judgmentof appeal. We used the questionnaire as part of a field study to corroborate and expand thefindings of observations and interviews. We found the Attrak-Work questionnaire a usefultool to be used in this manner especially for the evaluation of the hedonic qualities.,European Conference on Cognitive Ergonomics: Designing beyond the Product---Understanding Activity and User Experience in Ubiquitous Environments,2009,50
Dimensions of context affecting user experience in mobile work,Heli Wigelius; Heli Väätäjä,Abstract Understanding the contextual factors affecting user experience is essential indesigning and evaluating mobile systems for mobile work. The aim of this paper is to explorethese contextual factors through three case studies: of safety observation at constructionsites; passenger transportation with taxis; and mobile news journalism. For each case studywe describe the nature of the mobile work and present our findings on the contextual factorsthat were found to affect the user experience. Based on the results; we present and discussfive dimensions of mobile work context affecting user experience: 1) social; 2) spatial; 3)temporal; 4) infrastructural; and 5) task context. Compared to earlier frameworks of contextfor mobile work; the social context as well as the infrastructural context was emphasized inour findings. The presented framework elaborates the dimensions of context affecting …,IFIP Conference on Human-Computer Interaction,2009,49
Dimensions of Context Affecting User Experience in Mobile Work,H. Wigelius; H. Väätäjä,*,Proceedings of the 12th IFIP TC,*,49
Electroacoustic model for electrostatic ultrasonic transducers with V-grooved backplates,Pentti Mattila; Fabio Tsuzuki; Heli Vaataja; Ken Sasaki,Capacitive ultrasonic transducers are widely used to generate airborne ultrasound. Thispaper presents an equivalent circuit for an electrostatic transducer with a V-groovedbackplate. The comparison between simulation results and measurements on a prototypetransducer shows that the model gives reliable results. This model is useful in manyapplications; for example to simulate sensors in a robot and to design ultrasonic transducersystems.,IEEE transactions on ultrasonics; ferroelectrics; and frequency control,1995,37
Factors affecting the sensitivity of electrostatic ultrasonic transducers,Jarmo Hietanen; P Mattila; Jyrki Stor-Pellinen; Fabio Tsuzuki; Heli Vaataja; Ken Sasaki; M Luukkala,Abstract The sensitivity of an electrostatic transducer determines the range of pulse-echodetection. Maximum sensitivity can be achieved by increasing the bias voltage within certainlimits and by using a light membrane. The tension of the membrane was not found to affectthe transducer's sensitivity. By using a uniformly grooved backplate the acoustic propertiesof the transducer can be optimized. The different sensitivity factors of the electrostaticultrasonic transducer were confirmed with experimental results. High sensitivity can beachieved by using well manufactured backplates with shallow grooves and a small ridgeangle.,Measurement Science and Technology,1993,32
Ethical issues and guidelines when conducting HCI studies with animals,Heli K Väätäjä; Emilia K Pesonen,Abstract The number of studies in the field of Human-Computer Interaction (HCI) withanimals has increased in recent years. When planning and carrying out the studies withanimals; it is important and necessary to take into account the welfare of the animals as wellas deal with the short-and long-term effects of the developed technology and relatedinterventions on animal welfare. This paper addresses the ethical issues; presents the keyconcepts and provides guidelines for carrying out studies with animals based on a literaturereview. The guidelines cover the phases from planning of the studies; to carrying out andreporting the studies.,CHI'13 Extended Abstracts on Human Factors in Computing Systems,2013,31
Seriously fun: exploring how to combine promoting health awareness and engaging gameplay,Katja Suhonen; Heli Väätäjä; Tytti Virtanen; Roope Raisamo,Abstract Combining engaging gameplay and educational aspects promoting healthawareness gives an interesting challenge to game designers. This case study exploresadolescents'(aged 13--16) technology usage; gaming habits and gaming motivations; aswell as the elements affecting the user experience in serious games. Findings emphasizethe importance of social aspects in gaming in form of presence of friends while gaming; or inoffline or online multiplayer gaming. According to the findings games should offerchallenges matching the player's competence and enable improvement; advancement anddeveloping skills. Modifying characters; exploring the game world and physical activity werealso important. The causes and consequences of selections in game and their relation toreal-life were wished to be shown clearly in games. Design implications for designing …,Proceedings of the 12th international conference on Entertainment and media in the ubiquitous era,2008,30
Location-based crowdsourcing of hyperlocal news: dimensions of participation preferences,Heli Väätäjä; Teija Vainio; Esa Sirkkunen,Abstract We studied the mobile users' preferences and concerns of using location-basedassignments (LBA) and geotagging in crowdsourced news making. First; nine readers whohad submitted reader's photos were interviewed about their perceptions of LBA andgeotagging scenarios. Second; a quasi-experiment in field conditions was carried out withnineteen participants. After completing four LBA tasks with a mobile phone; participantswere interviewed on their perceptions and asked to complete a questionnaire on theirpreferences for receiving LBA and usage of geotags. Findings indicate that the perceivedbenefits of LBA and geotagging are greater than the perceived risks. The task type; temporalcontext; preciseness of location query; proximity to the reporting location; parallel tasks;social context and incentives affected the participation preferences. We propose a …,Proceedings of the 17th ACM international conference on Supporting group work,2012,25
Mobile questionnaires for user experience evaluation,Heli Väätäjä; Virpi Roto,Abstract As user experience studies move from laboratories to mobile context; we need toolsfor collecting data in natural settings. Based on the results from a pilot study; we presentearly guidelines for designing mobile questionnaires to be filled in on handheld; palm-sizedmobile devices. We found that special attention needs to be paid to the clarity and simplicityof the structure; layout and questionnaire content; including questions; visual icons; itemsand scales. In addition to the requirements set by the screen size; also data entry method;interaction style and mobile context related issues need to be taken into account whendesigning questionnaires for mobile devices.,CHI'10 Extended Abstracts on Human Factors in Computing Systems,2010,22
Opportunities and challenges of designing the service user experience (SUX) in Web 2.0,Kaisa Väänänen-Vainio-Mattila; Heli Väätäjä; Teija Vainio,Abstract Developed countries are in a transition into service societies. In the past few years;there has been a significant rise in Internet services in people's everyday lives. With the riseof the phenomenon called Web 2.0; users of the services are starting to experience newtypes of dynamically evolving services. New services enable user-created content andsocial awareness; and they are often dynamically composed of various service “mashup”components. Even though there are numerous success stories of such services; coherentdesign principles of user experience of these services are only starting to emerge. Onesignificant aspect that affects the user-centered design of Web 2.0 services is the dynamicnature of service development; with the requirement of fast and continuous iteration of theservices. In this chapter; we first explore the nature of Web 2.0 services from the users' …,*,2009,21
Mobile Journalist Toolkit: a field study on producing news articles with a mobile device,Tero Jokela; Heli Väätäjä; Tiina Koponen,Abstract Today's handheld mobile devices with advanced multimedia capabilities andwireless broadband connectivity have emerged as potential new tools for journalists toproduce news articles. It is envisioned that they could enable faster; more authentic; andmore efficient news production; and many large news producing organizations; includingReuters and BBC; have recently been experimenting with them. In this paper; we present afield study on using mobile devices to produce news articles. During the study; a group of 19MA-level journalism students used the Mobile Journalist Toolkit; a lightweight set of tools formobile journalist work built around the Nokia N82 camera phone; to produce an online newsblog. Our results indicate that while the mobile device cannot completely replace thetraditional tools; for some types of journalist tasks they provide major benefits over the …,Proceedings of the 13th International MindTrek Conference: Everyday Life in the Ubiquitous Era,2009,20
Innovating is fun–motivations to participate in online open innovation communities,Maria Antikainen; Heli Väätäjä,Abstract Online open innovation communities offer customers an environment where theycan participate in companies' product and service development. In aim to attract and tocommit customers to participate in those communities it is important to understand theirmotivations to participate. In this empirical case study we focus on exploring andunderstanding users' motivations to participate in online open innovation communities. Thestudy focuses on three online open innovation communities: CrowdSpirit; FellowForce andOwela. Data was gathered using maintainer interviews and a web survey for members. Theresults show that intellectual challenges and fun are top motivations to participate. Alsointerest towards innovation; possibility to influence and creativity were regarded important.Maintainers stated that being in touch with interesting companies is one of the members' …,Proceedings of the First ISPIM Innovation Symposium Singapore: Managing Innovation in a Connected World; Singapore,2008,20
Briefing news reporting with mobile assignments: perceptions; needs and challenges,Heli Väätäjä; Paul Egglestone,Abstract Mobile handheld devices are an increasing part of everyday fieldwork of newsprofessionals. Mobile assignments delivered to mobile journalists' smartphones are onepotential future development step. We present findings on using mobile assignments fromtwo exploratory user studies in which smartphones were used as news reporting tools.Mobile assignments were perceived as handy for fast reporting situations and simple storiesbut challenging in case of more complex tasks. Structured information content ofassignments; process phase based information and supporting situation and activityawareness would support the work of both editorial staff and mobile journalists. Thelocationing of reporters for sending location-based assignments was found acceptable forcoordinating the work although some privacy concerns were expressed. The findings …,Proceedings of the ACM 2012 conference on Computer Supported Cooperative Work,2012,18
Understanding user experience to support learning for mobile journalist’s work,Heli Väätäjä; Anssi Männistö; Teija Vainio; Tero Jokela,This paper presents a case study of mobile learning related to journalism education. Thegoal of our study was to explore the factors affecting user experience in the case of mobilejournalism; which was set in an educational context. User experience is often defined to be aconsequence of the interaction between a user and a product; system; or service. It isaffected; eg; by the characteristics of the user and the system as well as by contextualfactors. In this paper we concentrate especially on the temporal nature of user experience;namely the relationship of prior experiences and expectations and user experience as wellas the motivational aspects related to user experience. We present a case study; the MappiE24h project; on university-level teaching and learning. The MappiE 24h project was part of aproject work course for graduate students in journalism. The objective of the project was …,The evolution of mobile teaching and learning,2009,18
MoJo in action: The use of mobiles in conflict; community; and cross-platform journalism,John Mills; Paul Egglestone; Omer Rashid; Heli Väätäjä,As citizen journalism and social media continue to influence and shape the global medialandscape; and as smartphone technology becomes increasingly prevalent and affordable;this paper details four international smartphone-centric case studies that utilize a beta-stageeditorial commissioning platform and accompanying smartphone. The study comes asincreasing numbers of news organizations and citizen journalism tools harness the power ofsmartphones to both collect and publish editorial content. This paper examines the potentialfor community; student; and professional reporters to collate and transmit media via atailored publishing platform provide and asks whether this platform can create a seamlesslink between smartphone content production and newsroom-based operations. It outlinesconsiderations for future platform development and potential design methodologies to …,Continuum,2012,17
Early adopters' experiences of using mobile multimedia phones in news journalism,Tiina Koponen; Heli Väätäjä,Abstract Today's mobile multimedia phones with broadband connectivity have brought novelways for journalists to live out their hectic profession. We interviewed six forerunners inFinnish news organizations on mobile phone usage in news production. Here; we presentour results on how and why they use mobile phones in news production and provideimplications for design and development. Our results show that users are delighted to usemobile phones in journalistic work if they can gain personal benefits from it; like moreefficient use of time. Participants were not satisfied with the audio quality of mobile phonesor mobile text editors. However; they considered mobile phones suitable for capturing shortInternet videos. One reason constricting mobile production is editorial processes that are notdesigned for receiving material produced with a mobile phone. This causes extra work …,European Conference on Cognitive Ergonomics: Designing beyond the Product---Understanding Activity and User Experience in Ubiquitous Environments,2009,17
Readers' motivations to participate in hyperlocal news content creation,Heli Väätäjä,Abstract Readers are increasingly participating to news content creation by submitting user-generated content (UGC). We studied the participation motivations of active readers whosend photo content to a hyperlocal news publisher. The first results based on an onlinequestionnaire indicate that fun; the opportunity to get a monetary reward and informingothers of local issues are the strongest motivators. In addition; participation to the newsmaking activity and self-expression are important motivations. Those who intentionallyplanned and searched for topics to report with photos; reported more often the opportunityfor extra income and development as a photographer as participation motivations thanthose; who captured photos when a good topic came about.,Proceedings of the 17th ACM international conference on Supporting group work,2012,16
PDF estimation using order statistic filter bank,Risto Suoranta; K-P Estola; Seppo Rantala; Heli Vaataja,Introduces a new probability density function (pdf) estimation method based on the conceptof order statistic filter banks. The proposed method offers a new kind of possibility forstatistical analysis of signals with real time processing capabilities. Besides the new realtime processing method offers a procedure to control such properties of the pdf estimate asthe variance and the resolution.,Acoustics; Speech; and Signal Processing; 1994. ICASSP-94.; 1994 IEEE International Conference on,1994,15
Best practices for capturing context in user experience studies in the wild,Virpi Roto; Heli Väätäjä; Satu Jumisko-Pyykkö; Kaisa Väänänen-Vainio-Mattila,Abstract In user experience studies; researchers' aim is to understand how the used system;the user's state and the context influence the user experience. Despite existing generalguidance to conduct user studies in real life contexts and a variety of field study methods forinvestigating user experience; specific and comprehensive guidance for capturing dataabout the circumstances that affect user experience is missing. In this paper; we present bestpractices for taking the context characteristics into account in user experience studiesconducted in mobile and ubiquitous contexts. Based on a literature review and insights fromour own field studies; we derived 18 best practices to cope with the real-world context in theplanning; data collection and analysis phases of user experience studies. The presentedbest practices support researchers and practitioners in conducting more reliable UX …,Proceedings of the 15th international academic MindTrek conference: Envisioning future media environments,2011,14
User experience evaluation criteria for mobile news making technology: findings from a case study,Heli Väätäjä,Abstract This research explores the professionals' user experience evaluation criteria fortechnology used in mobile news making. We carried out a case study in which nineteenparticipants used smart phones for reporting news to an online publication. We identified twosets of high-level evaluation criteria; contextual and personal. Contextual high-level criteriafound are error-freeness; support for journalistic quality and speed of publishing. Personal;user-related criteria are users' needs and goals related to enabling and supporting ofprofessional ambition; supporting user's professional goals; as well as fit with andenhancement of the user's professional image. Findings provide empirical evidence onfactors that affect user experience that are relevant for evaluation of mobile technology inmobile news making. In addition; findings provide an initial insight into understanding …,Proceedings of the 22nd Conference of the Computer-Human Interaction Special Interest Group of Australia on Computer-Human Interaction,2010,13
Creating value through user experience: a case study in the metals and engineering industry,Heli Väätäjä; Marko Seppänen; Aija Paananen,This paper explores how three Finnish companies perceive and approach user experience.User experience was perceived both as a management tool within the company and asource of differentiation in the market. The two main challenges were creating a solid valueargumentation for user experience; and showing the link between user experience and themonetary value it can create for the customer. The proposed solution to overcome thechallenges includes four phases: 1) identifying the current position in turning userexperience into a value proposition; 2) understanding the customers' business models; 3)crafting the value proposition by showing long-term tangible and intangible impacts andusing the supplier's internal knowledge of users when selling; 4) communicating the value ofuser experience more effectively by improving the competence and trust of the sales …,International Journal of Technology Marketing,2014,12
A field trial on mobile crowdsourcing of news content factors influencing participation,Heli Väätäjä; Esa Sirkkunen; Mari Ahvenainen,Abstract We conducted a five-week field trial on mobile crowdsourcing of hyperlocal newscontent to 1) understand the readers' experiences and 2) explore factors affecting theirparticipation. In the end of the study the participants were surveyed with an onlinequestionnaire (17/104 respondents) and five participants were interviewed. Althoughrespondents and interviewees were enthusiastic about the trial; the activity in the trial waslow. Results indicate that participant characteristics (age; gender; participation motivationsand hobbyist background in photography) and task characteristics in terms of thesubjectively perceived task significance (possible impact on important issues in theenvironment or on community); task relevance (related to the background and participationmotivation); and task engagingness have an effect on the participation. In addition …,IFIP Conference on Human-Computer Interaction,2013,11
Towards a life cycle framework of mobile service user experience,Kaisa Väänänen-Vainio-Mattila; Heli Väätäjä,ABSTRACT Recently; interactive Internet services–also referred to as Web 2.0 services–areattracting users with their new features based on social networking; user-generated contentand service mash-ups. Compared to physical products; the user experience of Web serviceshas several special challenges; such as the intangible characteristics and dynamicallychanging content of the service; and multiple interaction styles on different service platforms.In this paper; we focus on the service user experience (SUX) life cycle and present atentative framework for the SUX elements across the phases of the service life cycle. Weconclude by discussing how the special characteristics of mobile services should be takeninto account in the SUX life cycle framework.,2nd MIUX Workshop at MobileHCI; Amsterdam; the Netherlands,2008,10
3-D simulation of ultrasonic sensor system in mobile robots,H Vaataja; H Hakala; P Mattila; R Suoranta,A 3-D ultrasonic sensor system simulator is presented as an aid in studying the real sensorsystem of a mobile robot. Software-based simulation and measurements help inunderstanding the physical background of received signals and therefore assists indeveloping new methods for interpreting airborne ultrasonics. The simulator enables thetesting of various signal processing methods. It can also be used to test different ultrasonicsensor structures in a mobile robot; even before an actual realization. This results in efficientoverall system design and testing.,Ultrasonics Symposium; 1992. Proceedings.; IEEE 1992,1992,10
