Multiple Clustering Views via Constrained Projections.,Xuan Hong Dang; Ira Assent; James Bailey,Abstract Clustering; the grouping of data based on mutual similarity; is often used as one ofprincipal tools to analyze and understand data. Unfortunately; most conventional techniquesaim at finding only a single clustering over the data. For many practical applications;especially those being described in high dimensional data; it is common to see that the datacan be grouped into different yet meaningful ways. This gives rise to the recently emergingresearch area of discovering alternative clusterings. In this preliminary work; we propose anovel framework to generate multiple clustering views. The framework relies on aconstrained data projection approach by which we ensure that a novel alternative clusteringbeing found is not only qualitatively strong but also distinctively different from a referenceclustering solution. We demonstrate the potential of the proposed framework using both …,MultiClust@ SDM,2012,2
Public microarray repository semantic annotation with ontologies employing text mining and expression profile correlation,David Ruau; Corinna Kolárik; Heinz-Theodor Mevissen; Emmanuel Müller; Ira Assent; Ralph Krieger; Thomas Seidl; Martin Hofmann-Apitius; Martin Zenke,Results The GSM free text description (downloaded from GEO in November 2007) wasmined using ProMiner [4]; a software for Named Entity Recognition based on dictionaries ofcell; tissue and disease ontologies from OBO [5] plus cell line resources. This resulted in73.5–97.6% class labeling of the GSM objects (Table 1). Next the labeled objects were usedto annotate the unlabeled objects. We computed the correlation matrix for all the objectswhere the raw data were available and followed the nearest neighbor approach [6] toidentify the nearest labeled object within a δ range. The δ value is an input parameterdetermined empirically and limits the propagation of too dissimilar annotations. In this studywe selected a delta value of 0.04 and observed an increase of the annotation percentage upto 4.9%; depending on the platform. The class labeling overall percentage after …,Bmc Bioinformatics,2008,2
AttentionAttractor: efficient video stream similarity query processing in real time,Ira Assent; Ralph Krieger; Thomas Seidl,In a project; customers are attracted by a video streaming application. A video camerarecords people passing by; and a monitor shows an alienated version of the settingaccordingly. The idea is to replace the image on the video screen by a mosaic of similarimages to draw their attention to the location. For successful implementation; severalaspects are of key importance: the images chosen in the mosaic should be similar enoughfor easy recognition; and the result of the alienation should be computed fast enough fordisplay on the screen in real time.,Data Engineering; 2007. ICDE 2007. IEEE 23rd International Conference on,2007,2
Image clustering and retrieval combining fixed/adaptive-binned histograms and various distance functions,Mladen Jovic; Zoran Stejic; T Seidl; Ira Assent,In the context of content-based image retrieval; we compare two types of histograms; fixedand adaptive; both frequently used for modeling the image features. We demonstrate that achoice of a histogram type; combined with the choice of a distance function; can have ahuge impact onto the clustering structure of the dataset. Such a hierarchical clusteringstructure visualization of database objects helps often the user to find similar objects anddiscover unknown patterns. In our experiments we use real data sets with large number ofsemantic categories; and evaluate both the reachability plots and the clustering accuracy; toshow the effects of appropriate choice of fixed and/or adaptive binning in combination withvarious distance functions. Results show that significant clusters; along with theirrepresentatives; can be automatically extracted; which is a basis for visual data mining …,Cybernetics and Intelligent Systems; 2004 IEEE Conference on,2004,2
An Index-Inspired Algorithm for Anytime Classification on Evolving Data Streams,Philipp Kranen; Ira Assent; Thomas Seidl,Abstract Due to the ever growing presence of data streams there has been a considerableamount of research on stream data mining over the past years. Anytime algorithms areparticularly well suited for stream mining; since they flexibly use all available time onstreams of varying data rates; and are also shown to outperform traditional budgetapproaches on constant streams. In this article we present an index-inspired algorithm forBayesian anytime classification on evolving data streams and show its performance onbenchmark data sets.,Datenbank-spektrum,2012,1
Efficient EMD-based Similarity Search in Medical Image Databases,Marc Wichterich; Philipp Kranen; Ira Assent; Thomas Seidl,Abstract The following sections are included: Introduction Related Work Formal Definition ofthe Earth Mover's Distance Multi-Step Query Processing and the EMD DimensionalityReduction for the EMD Dimensionality Reduction Optimal Dimensionality Reduction OptimalCost Reduction Optimal Flow Reduction Flow-based Reduction Query Processing AlgorithmEvaluation on Medical Data Sets Conclusion,*,2010,1
Data Mining For Robust Flight Scheduling,Ira Assent; Ralph Krieger; Petra Welter; Jörg Herbers; Thomas Seidl,In scheduling of airport operations the unreliability of flight arrivals is a serious challenge.Robustness with respect to flight delay is incorporated into recent scheduling techniques. Torefine proactive scheduling; we propose classification of flights into delay categories. Ourmethod is based on archived data at major airports in current flight information systems.Classification in this scenario is hindered by the large number of attributes; that mightocclude the dominant patterns of flight delays. As not all of these attributes are equallyrelevant for different patterns; global dimensionality reduction methods are not appropriate.We therefore present a technique which identifies locally relevant attributes for theclassification into flight delay categories. We give an algorithm that efficiently identifiesrelevant attributes. Our experimental evaluation demonstrates that our technique is …,*,2009,1
Efficient multi-step query processing for EMD-based similarity,Ira Assent; Thomas Seidl,Abstract Similarity search in large multimedia databases requires ef-ficient query processingbased on suitable similarity models. Similarity models consist of a feature extraction step aswell as a distance defined for these features; and they demand an efficient algorithm forretrieving similar objects under this model. In this work; we focus on the Earth MoversDistance (EMD); a recently introduced similarity model which has been successfullyemployed in numerous applications and has been reported as well reflecting humanperceptual similarity. As its computation is complex; the direct application of the EMD tolarge; high-dimensional databases is not feasible. To remedy this and allow users to benefitfrom the high quality of the model even in larger settings; we developed various lowerbounds for the EMD to be used in index-supported multistep query processing algorithms …,Dagstuhl Seminar Proceedings,2006,1
Appreciation to distributed and parallel databases reviewers,Ailidani Ailijiang; Murat Ali Bayir; Nihat Altiparmak; Douglas Alves Peixoto; Vaibhav Arora; Ira Assent; Manos Athanassoulis; Erman Ayday; Samira Babalou; Mehdi Bahrami; Madhushi Bandara; Fuat Basik; Kaustubh Beedkar; Ladjel Bellatreche; Carsten Binnig; Klemens Böhm; Angela Bonifati; Vanessa Braganholo; Guadalupe Canahuate; Alberto Cano; Lei Cao; Nicholas Car; Fabio Casati; Aniket Chakrabarti; Lijun Chang; Aleksey Charapko; Shimin Chen; Ling Chen; Yu Cheng; Fei Chiang; Byron Choi; Bin Cui; Khuzaima Daudjee; Engin Demir; Murat Demirbas; Anton Dignoes; Bailu Ding; Xiaofeng Ding; Jaeyoung Do; Bin Dong; Hai Dong; Laurent D’orazio; Ahmed Eldawy; Iman Elghandour; Mohammed Eunus Ali; Liyue Fan,For helping us deliver timely decisions to our authors; the Editor-in-Chief and Publisherwould like to thank the following individuals who contributed their reviews between January1; 2017 and December 31; 2017. We applaud all your efforts and dedication to thecommunity,*,2018,*
Interactive Exploration of Subspace Clusters for High Dimensional Data,Jesper Kristensen; Son T Mai; Ira Assent; Jon Jacobsen; Bay Vo; Anh Le,Abstract PreDeCon is a fundamental clustering algorithm for finding arbitrarily shapedclusters hidden in high-dimensional feature spaces of data; which is an important researchtopic and has many potential applications. However; it suffers from very high runtime as wellas lack of interactions with users. Our algorithm; called AnyPDC; introduces a novelapproach to cope with these problems by casting PreDeCon into an anytime algorithm. Itquickly produces an approximate result and iteratively refines it toward the result ofPreDeCon at the end. This scheme not only significantly speeds up the algorithm but alsoprovides interactions with users during its execution. Experiments conducted on real largedatasets show that AnyPDC acquires good approximate results very early; leading to anorder of magnitude speedup factor compared to PreDeCon. More interestingly; while …,International Conference on Database and Expert Systems Applications,2017,*
Template Skycube Algorithms for Heterogeneous Parallelism on Multicore and GPU Architectures,Kenneth S Bøgh; Sean Chester; Darius Šidlauskas; Ira Assent,Abstract Multicore CPUs and cheap co-processors such as GPUs create opportunities forvastly accelerating database queries. However; given the differences in their threadingmodels; expected granularities of parallelism; and memory subsystems; effectively utilisingall cores with all co-processors for an intensive query is very difficult. This paper introduces anovel templating methodology to create portable; yet architecture-aware; algorithms. Weapply this methodology on the very compute-intensive task of calculating the* skycube*; amaterialisation of exponentially many skyline query results; which finds applications in dataexploration and multi-criteria decision making. We define three parallel templates; two thatleverage insights from previous skycube research and a third that exploits a novel point-based paradigm to expose more data parallelism. An experimental study shows that …,Proceedings of the 2017 ACM International Conference on Management of Data,2017,*
MultiClust 2013: Multiple Clusterings; Multiview Data; and Multisource Knowledgedriven Clustering:[Workshop Report],Ira Assent; Carlotta Domeniconi; Francesco Gullo; Andrea Tagarelli; Arthur Zimek,Abstract In this workshop report; we give a summary of the Multi-Clust workshop held inChicago in conjunction with KDD 2013. We provide an overview on the history of thisworkshop series and the general topics covered. Furthermore; we provide summaries of theinvited talks and of the contributed papers.,Acm Sigkdd Explorations Newsletter,2016,*
On the Evaluation of Outlier Detection: Measures; Datasets; and an Empirical Study Continued,Guilherme O Campos; Arthur Zimek; Jörg Sander; Ricardo JGB Campello; Barbora Micenková; Erich Schubert; Ira Assent; Michael E Houle,ALOI 50000 images; 27 a r. 50000 1508 27[Kri+ 11];[Sch+ 12] 24000 images; 27648 ar.[dCH12] Glass Class 6 (out.) vs. others (in.) 214 9 7 [KMB12] Ionosphere Class 'b'(out.) vs.class 'g'(in.) 351 126 32[KMB12] KDDCup99 U2R (out.) vs. Normal (in.) 60632 246 38 3[NG10];[NAG10];[Kri+ 11];[Sch+ 12],Lernen; Wissen; Daten; Analysen 2016,2016,*
Maximum Coverage Representative Skyline,Malene Sjørslev Søholm; Sean Chester; Ira Assent,ABSTRACT Skyline queries represent a dataset by the points on its pareto frontier; but canbecome very large. To alleviate this problem; representative skylines select exactly k skylinepoints. However; existing approaches are not scaleinvariant; not stable; or must materialisethe entire skyline. We introduce the maximum coverage representative skyline; whichreturns the k points collectively dominating the largest area of the data space. It satisfies theabove properties and reflects a critical property of the skyline itself.,*,2015,*
2014 Reviewers List,Ahmed Abbasi; Osman Abul; Evrim Acar; Palakorn Achananuparp; Sibel Adali; Nitin Agarwal; Rodrigo Agerri; Ankit Agrawal; Divyakant Agrawal; Manoj Agrawal; Chowdhury Ahmed; Mueen Ahmed; Luca Aiello; Mohammad Akbari; Reza Akbarinia; Oguz Akbilgic; Leman Akoglu; Zaher Al Aghbari; Luai Al-Shalabi; Barron-Cedeno Alberto; Nanopoulos Alexandros; Neda Alipanah; Mohammed Altaf; Toshiyuki Amagasa; Giuseppe Amato; Yuan An; Aris Anagnostopoulos; David Anastasiu; Kai Ang; François Anton; Kemafor Anyanwu; Arvind Arasu; Marcelo Arenas; Nikos Armenatzoglou; Ismailcem Arpinar; Anastasios Arvanitis; Mahdi Asadpour; Ira Assent; Juan Carlos Augusto; G Ausiello; Hakan Aydin,We thank the following reviewers for the time and energy they have given to TKDE … AhmedAbbasi Osman Abul Evrim Acar Palakorn Achananuparp Sibel Adali Nitin Agarwal Rodrigo AgerriAnkit Agrawal Divyakant Agrawal Manoj Agrawal Chowdhury Ahmed Mueen Ahmed Luca AielloMohammad Akbari Reza Akbarinia Oguz Akbilgic Leman Akoglu Zaher Al Aghbari Luai Al-ShalabiBarron-Cede˜no Alberto Nanopoulos Alexandros Neda Alipanah Mohammed Altaf ToshiyukiAmagasa Giuseppe Amato Yuan An Aris Anagnostopoulos David Anastasiu Kai Ang FrançoisAnton Kemafor Anyanwu Arvind Arasu Marcelo Arenas Nikos Armenatzoglou Ismailcem ArpinarAnastasios Arvanitis Mahdi Asadpour Ira Assent Juan Carlos Augusto G. Ausiello Hakan AydinB … Prabhakaran B. Sumeet Bajaj Petko Bakalov Spiridon Bakiras José Balcázar Tim BaldwinForrest Bao … Jie Bao Zhifeng Bao Nathalie Baracaldo Elena Baralis Nicola Barbieri …,IEEE Transactions on Knowledge and Data Engineering,2015,*
Efficient Density-Based Subspace Clustering in High Dimensions,Ira Assent,Abstract Density-based clustering defines clusters as dense areas in feature spaceseparated by sparsely populated areas. It is known to successfully identify clusters ofarbitrary shapes even in noisy data. Today; we face increasingly high-dimensional data; iedata objects described by many attributes. Effects attributed to the “curse of dimensionality”mean that in high-dimensional spaces; traditional clustering methods fail to identifymeaningful clusters. In little more than a decade; the research field of subspace clusteringhas established methods for identifying clusters in subsets of the attributes in such high-dimensional spaces. As the number of possible subsets is exponential in the number ofattributes; efficient algorithms are crucial. This short survey discusses challenges in thisarea; and presents models and algorithms for efficient and scalable density-based …,International Workshop on Clustering High-Dimensional Data,2012,*
Mining and representing recommendations in actively evolving recommender systems,Ira Assent,Recommender systems provide an automatic means of filtering out interesting items; usuallybased on past similarity of user ratings. In previous work; we have suggested a model thatallows users to actively build a recommender network. Users express trust; obtaintransparency; and grow (anonymous) recommender connections. In this work; we proposemining such active systems to generate easily understandable representations of therecommender network. Users may review these representations to provide active feedback.This approach further enhances the quality of recommendations; especially as topics ofinterest change over time. Most notably; it extends the amount of control users have over themodel that the recommender network builds of their interests.,Data Engineering Workshops (ICDEW); 2010 IEEE 26th International Conference on,2010,*
Biomedical Databases and Data Mining,Claudia Plant; Christian Böhm,Medicine; biology; and life sciences are very data intensive disciplines. All kinds of data are producedin tremendous amounts; eg text; semi- structured data; images; time-series; data streams; andoften very high dimensional feature vectors. Modern devices for data acquisition allow to recordmore and more information. High resolution mass spectrometry; for example; allows us to measureand quantify hundreds of metabolites or peptides from one biosample. At the level of raw massspectra even hundreds of thousands of features are measured per sample. A further ap- plicationscenario is patient monitoring: Modern wearable sensors record various parameters of vital functionsand are suitable for long-term patient monitoring … The data explosion in biomedicine challengesthe database community to provide solutions for effective data storage; processing; andexchange. A major additional challenge is to support the so called knowledge discovery …,*,2010,*
Effiziente Ähnlichkeitssuche und Data Mining in großen MultimediadatenbankenEfficient Adaptive Retrieval and Mining in Large Multimedia Databases,Ira Assent,Zusammenfassung Adaptive inhaltsbasierte Ähnlichkeitsmodelle erlauben effektiven Zugriffauf Multimediadatenbanken. Mit zunehmendem Datenvolumen und steigender Anzahl anAttributen in vielen Anwendungen führt ihre hohe Berechnungskomplexität zu schlechtemLaufzeitverhalten. Wir schlagen effiziente Algorithmen und Indexstrukturen für effektiveinhaltsbasierte Zugriffsmethoden vor. Wir stellen Lösungen sowohl fürÄhnlichkeitssuchanfragen als auch für Data Mining Aufgaben vor. Diese Techniken erfüllenunsere ICES Kriterien; und garantieren daher die Richtigkeit der Ergebnisse und gutePerformanz. Experimentelle Untersuchungen auf synthetischen und Realdaten zeigendeutliche Geschwindigkeitsgewinne.,it-Information Technology Methoden und innovative Anwendungen der Informatik und Informationstechnik,2010,*
Advances in Spatial and Temporal Databases: 11th International Symposium; SSTD 2009 Aalborg; Denmark; July 8-10; 2009 Proceedings,Nikos Mamoulis; Thomas Seidl; Kristian Torp; Ira Assent,SSTD 2009 was the 11th in a series of biannual events that discuss new and excitingresearch in spatio-temporal data management and related technologies. PrevioussymposiaweresuccessfullyheldinS…(1989); Zurich (1991); Singapore (1993); Portland (1995); Berlin (1997); Hong Kong (1999);Los An-les (2001); Santorini; Greece (2003); Angra dos Reis; Brazil (2005); and Boston(2007). Before 2001; the series was devoted solely to spatial database mana-ment; andcalled SSD. From 2001; the scope was extended in order to also accommodate temporaldatabase management; in part due to the increasing importance of research that considersspatial and temporal aspects jointly. SSTD2009introducedseveralinnovativeasp…. Therewas a demonstrations track which included ten presentations of systems related to the topicsof interest. In addition to that; the event included a poster session with seven …,*,2009,*
Evaluating Clustering in...,Emmanuel Müller; Stephan Günnemann; Ira Assent; Thomas Seidl,Abstract Clustering high dimensional data is an emerging research field. Subspaceclustering or projected clustering group similar objects in subspaces; ie projections; of thefull space. In the past decade; several clustering paradigms have been developed inparallel; without thorough evaluation and comparison between these paradigms on acommon basis. Conclusive evaluation and comparison is challenged by three major issues.First; there is no ground truth that describes the “true” clusters in real world data. Second; alarge variety of evaluation measures have been used that reflect different aspects of theclustering result. Finally; in typical publications authors have limited their analysis to theirfavored paradigm only; while paying other paradigms little or no attention. In this paper; wetake a systematic approach to evaluate the major paradigms in a common framework. We …,*,2009,*
Efficient Adaptive Retrieval and Mining in Large Multimedia Databases.,Ira Assent,Content-based similarity search requires effective similarity models as well as efficient queryprocessing. Many multimedia features can be represented as histograms; ie vectors ofattributes. For meaningful comparison of histogram features; distance functions providedissimilarity values. The Earth Mover's Distance was introduced in computer vision to modelhuman perceptual similarities. Its computation; however; is too complex for usage ininteractive multimedia database scenarios. In order to enable efficient query processing inlarge databases; we propose an index-supported multistep algorithm. We therefore developnew lower bounding approximation techniques for the Earth Mover's Distance which satisfyhigh quality criteria including completeness (no false dismissals); index-suitability and fastcomputation. We demonstrate the efficiency of our approach in extensive experiments on …,BTW,2009,*
Lecture Notes in Computer Science,N Mamoulis; T Seidl; TB Pedersen; K Torp; I Assent,Skip navigation …,*,2009,*
Advances in Spatial and Temporal Databases,Thomas Seidl; Kristian Torp; Ira Assent,SSTD 2009 was the 11th in a series of biannual events that discuss new and excitingresearch in spatio-temporal data management and related technologies. Previous symposiawere successfully held in Santa Barbara (1989); Zurich (1991); Singapore (1993); Portland(1995); Berlin (1997); Hong Kong (1999); Los Angeles (2001); Santorini; Greece (2003);Angra dos Reis; Brazil (2005); and Boston (2007). Before 2001; the series was devotedsolely to spatial database management; and called SSD. From 2001; the scope wasextended in order to also accommodate temporal database management; in part due to theincreasing importance of research that considers spatial and temporal aspects jointly. SSTD2009 introduced several innovative aspects compared to previous events. There was ademonstrations track which included ten presentations of systems related to the topics of …,*,2009,*
High-Dimensional Indexing for Multimedia Features.,Ira Assent; Stephan Günnemann; Hardy Kremer; Thomas Seidl,Abstract: Efficient content-based similarity search in large multimedia databases requiresefficient query processing algorithms for many practical applications. Especially in high-dimensional spaces; the huge number of features is a challenge to existing indexingstructures. Due to increasing overlap with growing dimensionality; they eventually fail todeliver runtime improvements. In this work; we propose an overlap-free approach toindexing to overcome these problems and allow efficient query processing even on high-dimensional feature vectors. Our method is inspired by separator splits eg in B-trees for one-dimensional data or for sequence data. We transform feature vectors such that overlap-freesplits are ensured. Our algorithm then queries the database with substantially reducednumber of disk accesses; while ensuring correctness and completeness of the result. Our …,BTW,2009,*
Extensible social networking in streamspin,Dingming Wu; Carmen Ruiz; Ira Assent; Kostas Tzoumas,Abstract In the Autumn semester of 2008; students of SW5 are required to work on theproject outlined in this document. The objective of the project is to build an extensible socialnetwork; by leveraging functionality from the streamspin project; developed in AalborgUniversity. The project is divided in two phases. In phase 1 (collaborative phase); thestudents are required to design and analyze a social network architecture and embed it intothe Streamspin platform. In phase 2 (individual phase); the students are required to dividethe project into 5 individual pieces and assign a piece to each group. Each group thenshould individually implement its component. This document is organized as follows:Section 1 gives an overview of the social networking concept; Section 2 provides an outlineof the Streamspin codebase and Section 3 describes the project proposal organization.,*,2008,*
Advanced Data Mining Algorithms,Ira Assent; Thomas Seidl,{"controller"=>"catalog"; "action"=>"show"; "locale"=>"en"; "id"=>"2389390617 …,*,2008,*
Evolutionäre Clustering-Algorithmen: Bionik-Methoden für Knowledge Discovery in Datenbanken,Ira Assent; Ralph Krieger; Thomas Seidl,{"controller"=>"catalog"; "action"=>"show"; "locale"=>"en"; "id"=>"2389335937 …,Rwth Themen,2008,*
Efficient adaptive retrieval and mining in large multimedia databases,Ira Assent; Thomas Seidl,Kurzfassung Multimedia data ranging from images to videos and time series is created innumerous scientific; commercial and home applications. Access to increasingly large datavolumes stored in multimedia databases is a core task to retrieve similar objects or togenerate an overview of the entire content. Examples include retrieval of similar magneticresonance images for diagnostic purposes; or automatic detection of customer segments forsales promotion. Meaningful retrieval and pattern detection require content-based methodsthat describe the relevant characteristics of multimedia objects. As opposed to manualkeyword annotation techniques that are typically infeasible for large data volumes; content-based approaches use similarity models to process multimedia data. Similarity modelsspecify appropriate features and their relationship for effective content based access. As …,*,2008,*
