Evaluating clustering in subspace projections of high dimensional data,Emmanuel Müller; Stephan Günnemann; Ira Assent; Thomas Seidl,Abstract Clustering high dimensional data is an emerging research field. Subspaceclustering or projected clustering group similar objects in subspaces; ie projections; of thefull space. In the past decade; several clustering paradigms have been developed inparallel; without thorough evaluation and comparison between these paradigms on acommon basis. Conclusive evaluation and comparison is challenged by three major issues.First; there is no ground truth that describes the" true" clusters in real world data. Second; alarge variety of evaluation measures have been used that reflect different aspects of theclustering result. Finally; in typical publications authors have limited their analysis to theirfavored paradigm only; while paying other paradigms little or no attention.,Proceedings of the VLDB Endowment,2009,230
The ClusTree: indexing micro-clusters for anytime stream mining,Philipp Kranen; Ira Assent; Corinna Baldauf; Thomas Seidl,Abstract Clustering streaming data requires algorithms that are capable of updatingclustering results for the incoming data. As data is constantly arriving; time for processing islimited. Clustering has to be performed in a single pass over the incoming data and withinthe possibly varying inter-arrival times of the stream. Likewise; memory is limited; making itimpossible to store all data. For clustering; we are faced with the challenge of maintaining acurrent result that can be presented to the user at any given time. In this work; we propose aparameter-free algorithm that automatically adapts to the speed of the data stream. It makesbest use of the time available under the current constraints to provide a clustering of theobjects seen up to that point. Our approach incorporates the age of the objects to reflect thegreater importance of more recent data. For efficient and effective handling; we introduce …,Knowledge and information systems,2011,164
DUSC: Dimensionality unbiased subspace clustering,Ira Assent; Ralph Krieger; Emmanuel Müller; Thomas Seidl,To gain insight into today's large data resources; data mining provides automaticaggregation techniques. Clustering aims at grouping data such that objects within groupsare similar while objects in different groups are dissimilar. In scenarios with many attributesor with noise; clusters are often hidden in subspaces of the data and do not show up in thefull dimensional space. For these applications; subspace clustering methods aim atdetecting clusters in any sub-space. Existing subspace clustering approaches fall prey to aneffect we call dimensionality bias. As dimensionality of subspaces varies; approaches whichdo not take this effect into account fail to separate clusters from noise. We give a formaldefinition of dimensionality bias and analyze consequences for subspace clustering. Adimensionality unbiased subspace clustering (DUSC) definition based on statistical …,Data Mining; 2007. ICDM 2007. Seventh IEEE International Conference on,2007,119
Clicks: An effective algorithm for mining subspace clusters in categorical datasets,Mohammed J Zaki; Markus Peters; Ira Assent; Thomas Seidl,Abstract We present a novel algorithm called C licks; that finds clusters in categoricaldatasets based on a search for k-partite maximal cliques. Unlike previous methods; C licksmines subspace clusters. It uses a selective vertical method to guarantee complete search.C licks outperforms previous approaches by over an order of magnitude and scales betterthan any of the existing method for high-dimensional datasets. These results aredemonstrated in a comprehensive performance study on real and synthetic datasets.,Data & Knowledge Engineering,2007,116
INSCY: Indexing subspace clusters with in-process-removal of redundancy,Ira Assent; Ralph Krieger; Emmanuel Müller; Thomas Seidl,Subspace clustering aims at detecting clusters in any subspace projection of a highdimensional space. As the number of projections is exponential in the number ofdimensions; efficiency is crucial. Moreover; the resulting subspace clusters are often highlyredundant; ie many clusters are detected multiply in several projections. We propose a novelindex for efficient subspace clustering in a novel depth-first processing with in-process-removal of redundant clusters for better pruning. Thorough experiments on real andsynthetic data show that INSCY yields substantial efficiency and quality improvements.,Data Mining; 2008. ICDM'08. Eighth IEEE International Conference on,2008,83
Approximation techniques for indexing the earth mover’s distance in multimedia databases,Ira Assent; Andrea Wenning; Thomas Seidl,Todays abundance of storage coupled with digital technologies in virtually any scientific orcommercial application such as medical and biological imaging or music archives deal withtremendous quantities of images; videos or audio files stored in large multimedia databases.For content-based data mining and retrieval purposes suitable similarity models are crucial.The Earth Mover's Distance was introduced in Computer Vision to better approach humanperceptual similarities. Its computation; however; is too complex for usage in interactivemultimedia database scenarios. In order to enable efficient query processing in largedatabases; we propose an index-supported multistep algorithm. We therefore develop newlower bounding approximation techniques for the Earth Mover's Distance which satisfy highquality criteria including completeness (no false drops); index-suitability and fast …,Data Engineering; 2006. ICDE'06. Proceedings of the 22nd International Conference on,2006,74
The TS-tree: efficient time series search and retrieval,Ira Assent; Ralph Krieger; Farzad Afschari; Thomas Seidl,Abstract Continuous growth in sensor data and other temporal data increases theimportance of retrieval and similarity search in time series data. Efficient time series queryprocessing is crucial for interactive applications. Existing multidimensional indexes like theR-tree provide efficient querying for only relatively few dimensions. Time series are typicallylong which corresponds to extremely high dimensional data in multidimensional indexes.Due to massive overlap of index descriptors; multidimensional indexes degenerate for highdimensions and access the entire data by random I/O. Consequently; the efficiency benefitsof indexing are lost. In this paper; we propose the TS-tree (time series tree); an indexstructure for efficient time series retrieval and similarity search. Exploiting inherent propertiesof time series quantization and dimensionality reduction; the TS-tree indexes high …,Proceedings of the 11th international conference on Extending database technology: Advances in database technology,2008,73
Relevant subspace clustering: Mining the most interesting non-redundant concepts in high dimensional data,Emmanuel Müller; Ira Assent; Stephan Günnemann; Ralph Krieger; Thomas Seidl,Subspace clustering aims at detecting clusters in any subspace projection of a highdimensional space. As the number of possible subspace projections is exponential in thenumber of dimensions; the result is often tremendously large. Recent approaches fail toreduce results to relevant subspace clusters. Their results are typically highly redundant; iemany clusters are detected multiple times in several projections. In this work; we propose anovel model for relevant subspace clustering (RESCU). We present a global optimizationwhich detects the most interesting non-redundant subspace clusters. We prove thatcomputation of this model is NP-hard. For RESCU; we propose an approximative solutionthat shows high accuracy with respect to our relevance model. Thorough experiments onsynthetic and real world data show that RESCU successfully reduces the result to …,Data Mining; 2009. ICDM'09. Ninth IEEE International Conference on,2009,69
Outsourced similarity search on metric data assets,Man Lung Yiu; Ira Assent; Christian S Jensen; Panos Kalnis,This paper considers a cloud computing setting in which similarity querying of metric data isoutsourced to a service provider. The data is to be revealed only to trusted users; not to theservice provider or anyone else. Users query the server for the most similar data objects to aquery example. Outsourcing offers the data owner scalability and a low-initial investment.The need for privacy may be due to the data being sensitive (eg; in medicine); valuable (eg;in astronomy); or otherwise confidential. Given this setting; the paper presents techniquesthat transform the data prior to supplying it to the service provider for similarity queries on thetransformed data. Our techniques provide interesting trade-offs between query cost andaccuracy. They are then further extended to offer an intuitive privacy guarantee. Empiricalstudies with real data demonstrate that the techniques are capable of offering privacy …,IEEE Transactions on Knowledge and Data Engineering,2012,64
Efficient emd-based similarity search in multimedia databases via flexible dimensionality reduction,Marc Wichterich; Ira Assent; Philipp Kranen; Thomas Seidl,Abstract The Earth Mover's Distance (EMD) was developed in computer vision as a flexiblesimilarity model that utilizes similarities in feature space to define a high quality similaritymeasure in feature representation space. It has been successfully adopted in a multitude ofapplications with low to medium dimensionality. However; multimedia applicationscommonly exhibit high-dimensional feature representations for which the computationalcomplexity of the EMD hinders its adoption. An efficient query processing approach thatmitigates and overcomes this effect is crucial. We propose novel dimensionality reductiontechniques for the EMD in a filter-and-refine architecture for efficient lossless retrieval.Thorough experimental evaluation on real world data sets demonstrates a substantialreduction of the number of expensive high-dimensional EMD computations and thus …,Proceedings of the 2008 ACM SIGMOD international conference on Management of data,2008,60
Self-adaptive anytime stream clustering,Philipp Kranen; Ira Assent; Corinna Baldauf; Thomas Seidl,Clustering streaming data requires algorithms which are capable of updating clusteringresults for the incoming data. As data is constantly arriving; time for processing is limited.Clustering has to be performed in a single pass over the incoming data and within thepossibly varying inter-arrival times of the stream. Likewise; memory is limited; making itimpossible to store all data. For clustering; we are faced with the challenge of maintaining acurrent result that can be presented to the user at any given time. In this work; we propose aparameter free algorithm that automatically adapts to the speed of the data stream. It makesbest use of the time available under the current constraints to provide a clustering of theobjects seen up to that point. Our approach incorporates the age of the objects to reflect thegreater importance of more recent data. Moreover; we are capable of detecting concept …,Data Mining; 2009. ICDM'09. Ninth IEEE International Conference on,2009,59
On the evaluation of unsupervised outlier detection: measures; datasets; and an empirical study,Guilherme O Campos; Arthur Zimek; Jörg Sander; Ricardo JGB Campello; Barbora Micenková; Erich Schubert; Ira Assent; Michael E Houle,Abstract The evaluation of unsupervised outlier detection algorithms is a constant challengein data mining research. Little is known regarding the strengths and weaknesses of differentstandard outlier detection models; and the impact of parameter choices for these algorithms.The scarcity of appropriate benchmark datasets with ground truth annotation is a significantimpediment to the evaluation of outlier methods. Even when labeled datasets are available;their suitability for the outlier detection task is typically unknown. Furthermore; the biases ofcommonly-used evaluation measures are not fully understood. It is thus difficult to ascertainthe extent to which newly-proposed outlier detection methods improve over establishedmethods. In this paper; we perform an extensive experimental study on the performance of arepresentative set of standard k nearest neighborhood-based methods for unsupervised …,Data Mining and Knowledge Discovery,2016,55
VISA: visual subspace clustering analysis,Ira Assent; Ralph Krieger; Emmanuel Müller; Thomas Seidl,Abstract To gain insight into today's large data resources; data mining extracts interestingpatterns. To generate knowledge from patterns and benefit from human cognitive abilities;meaningful visualization of patterns are crucial. Clustering is a data mining technique thataims at grouping data to patterns based on mutual (dis) similarity. For high dimensionaldata; subspace clustering searches patterns in any subspace of the attributes as patternsare typically obscured by many irrelevant attributes in the full space. For visual analysis ofsubspace clusters; their comparability has to be ensured. Existing subspace clusteringapproaches; however; lack interactive visualization and show bias with respect to thedimensionality of subspaces. In this work; dimensionality unbiased subspace clustering anda novel distance function for subspace clusters are proposed. We suggest two …,ACM SIGKDD Explorations Newsletter,2007,55
Anyout: Anytime outlier detection on streaming data,Ira Assent; Philipp Kranen; Corinna Baldauf; Thomas Seidl,Abstract With the increase of sensor and monitoring applications; data mining on streamingdata is receiving increasing research attention. As data is continuously generated; miningalgorithms need to be able to analyze the data in a one-pass fashion. In many applicationsthe rate at which the data objects arrive varies greatly. This has led to anytime miningalgorithms for classification or clustering. They successfully mine data until the a prioriunknown point of interruption by the next data in the stream. In this work we investigateanytime outlier detection. Anytime outlier detection denotes the problem of determiningwithin any period of time whether an object in a data stream is anomalous. The more time isavailable; the more reliable the decision should be. We introduce AnyOut; an algorithmcapable of solving anytime outlier detection; and investigate different approaches to build …,International Conference on Database Systems for Advanced Applications,2012,53
Outlier ranking via subspace analysis in multiple views of the data,Emmanuel Muller; Ira Assent; Patricia Iglesias; Yvonne Mulle; Klemens Bohm,Outlier mining is an important task for finding anomalous objects. In practice; however; thereis not always a clear distinction between outliers and regular objects as objects havedifferent roles wrt different attribute sets. An object may deviate in one subspace; ie a subsetof attributes. And the same object might appear perfectly regular in other subspaces. Onecan think of subspaces as multiple views on one database. Traditional methods consideronly one view (the full attribute space). Thus; they miss complex outliers that are hidden inmultiple subspaces. In this work; we propose Outrank; a novel outlier ranking concept.Outrank exploits subspace analysis to determine the degree of outlierness. It considersdifferent subsets of the attributes as individual outlier properties. It compares clusteredregions in arbitrary subspaces and derives an outlierness score for each object. Its …,Data Mining (ICDM); 2012 IEEE 12th International Conference on,2012,51
Anticipatory DTW for efficient similarity search in time series databases,Ira Assent; Marc Wichterich; Ralph Krieger; Hardy Kremer; Thomas Seidl,Abstract Time series arise in many different applications in the form of sensor data; stocksdata; videos; and other time-related information. Analysis of this data typically requiressearching for similar time series in a database. Dynamic Time Warping (DTW) is a widelyused high-quality distance measure for time series. As DTW is computationally expensive;efficient algorithms for fast computation are crucial. In this paper; we propose a novel filter-and-refine DTW algorithm called Anticipatory DTW. Existing algorithms aim at efficientlyfinding similar time series by filtering the database and computing the DTW in the refinementstep. Unlike these algorithms; our approach exploits previously unused information from thefilter step during the refinement; allowing for faster rejection of false candidates. Wecharacterize a class of applicable filters for our approach; which comprises state-of-the-art …,Proceedings of the VLDB Endowment,2009,49
OutRank: ranking outliers in high dimensional data,Emmanuel Muller; Ira Assent; Uwe Steinhausen; Thomas Seidl,Outlier detection is an important data mining task for consistency checks; fraud detection;etc. Binary decision making on whether or not an object is an outlier is not appropriate inmany applications and moreover hard to parametrize. Thus; recently; methods for outlierranking have been proposed. Determining the degree of deviation; they do not requiresetting a decision boundary between outliers and the remaining data. High dimensional andheterogeneous (continuous and categorical attributes) data; however; pose a problem formost outlier ranking algorithms. In this work; we propose our OutRank approach for rankingoutliers in heterogeneous high dimensional data. We introduce a consistent model fordifferent attribute types. Our novel scoring functions transform the analyzed structure of thedata to a meaningful ranking. Promising results in preliminary experiments show the …,Data Engineering Workshop; 2008. ICDEW 2008. IEEE 24th International Conference on,2008,49
Indexing density models for incremental learning and anytime classification on data streams,Thomas Seidl; Ira Assent; Philipp Kranen; Ralph Krieger; Jennifer Herrmann,Abstract Classification of streaming data faces three basic challenges: it has to deal withhuge amounts of data; the varying time between two stream data items must be used bestpossible (anytime classification) and additional training data must be incrementally learned(anytime learning) for applying the classifier consistently to fast data streams. In this work;we propose a novel index-based technique that can handle all three of the abovechallenges using the established Bayes classifier on effective kernel density estimators. Ournovel Bayes tree automatically generates (adapted efficiently to the individual object to beclassified) a hierarchy of mixture densities that represent kernel density estimators atsuccessively coarser levels. Our probability density queries together with novel classificationimprovement strategies provide the necessary information for very effective classification …,Proceedings of the 12th international conference on extending database technology: advances in database technology,2009,42
Explaining outliers by subspace separability,Barbora Micenková; Xuan-Hong Dang; Ira Assent; Raymond T Ng,Outliers are extraordinary objects in a data collection. Depending on the domain; they mayrepresent errors; fraudulent activities or rare events that are subject of our interest. Existingapproaches focus on detection of outliers or degrees of outlierness (ranking); but do notprovide a possible explanation of how these objects deviate from the rest of the data. Suchexplanations would help user to interpret or validate the detected outliers. The problemaddressed in this paper is as follows: given an outlier detected by an existing algorithm; wepropose a method that determines possible explanations for the outlier. These explanationsare expressed in the form of subspaces in which the given outlier shows separability fromthe inliers. In this manner; our proposed method complements existing outlier detectionalgorithms by providing additional information about the outliers. Our method is designed …,Data Mining (ICDM); 2013 IEEE 13th International Conference on,2013,40
External evaluation measures for subspace clustering,Stephan Günnemann; Ines Färber; Emmanuel Müller; Ira Assent; Thomas Seidl,Abstract Knowledge discovery in databases requires not only development of novel miningtechniques but also fair and comparable quality assessment based on objective evaluationmeasures. Especially in young research areas where no common measures are available;researchers are unable to provide a fair evaluation. Typically; publications glorify the highquality of one approach only justified by an arbitrary evaluation measure. However; suchconclusions can only be drawn if the evaluation measures themselves are fully understood.In this paper; we provide the basis for systematic evaluation in the emerging research areaof subspace clustering. We formalize general quality criteria for subspace clusteringmeasures not yet addressed in the literature. We compare the existing external evaluationmethods based on these criteria and pinpoint limitations. We propose a novel external …,Proceedings of the 20th ACM international conference on Information and knowledge management,2011,40
Discriminative features for identifying and interpreting outliers,Xuan Hong Dang; Ira Assent; Raymond T Ng; Arthur Zimek; Erich Schubert,We consider the problem of outlier detection and interpretation. While most existing studiesfocus on the first problem; we simultaneously address the equally important challenge ofoutlier interpretation. We propose an algorithm that uncovers outliers in subspaces ofreduced dimensionality in which they are well discriminated from regular objects while at thesame time retaining the natural local structure of the original data to ensure the quality ofoutlier explanation. Our algorithm takes a mathematically appealing approach from thespectral graph embedding theory and we show that it achieves the globally optimal solutionfor the objective of subspace learning. By using a number of real-world datasets; wedemonstrate its appealing performance not only wrt the outlier detection rate but also wrt thediscriminative human-interpretable features. This is the first approach to exploit …,Data Engineering (ICDE); 2014 IEEE 30th International Conference on,2014,38
Efficient similarity search using the Earth Mover's Distance for large multimedia databases,Ira Assent; Marc Wichterich; Tobias Meisen; Thomas Seidl,Multimedia similarity search in large databases requires efficient query processing. TheEarth Mover's Distance; introduced in computer vision; is successfully used as a similaritymodel in a number of small-scale applications. Its computational complexity hindered itsadoption in large multimedia databases. We enable directly indexing the Earth Mover'sDistance in structures such as the R-tree and the VA-file by providing the accurateMinDist'function to any bounding rectangle in the index. We exploit the computational structure of thenew MinDist to derive a new lower bound for the EMD MinDist which is assembled fromquantized partial solutions yielding very fast query processing times. We provecompleteness of our approach in a multistep scheme. Extensive experiments on real worlddata demonstrate the high efficiency.,Data Engineering; 2008. ICDE 2008. IEEE 24th International Conference on,2008,37
DensEst: Density estimation for data mining in high dimensional spaces,Emmanuel Müller; Ira Assent; Ralph Krieger; Stephan Günnemann; Thomas Seidl,Abstract Subspace clustering and frequent itemset mining via “step-by-step” algorithms thatsearch the subspace/pattern lattice in a top-down or bottom-up fashion do not scale to largehigh dimensional data bases. Recent “jump” algorithms directly choose candidate subspaceregions or patterns. Their scalability and quality depend heavily on the rating of thesecandidates as mislead jumps incur poor results and costly candidate refinements. Existingtechniques rely on simple statistics with low estimation quality or on inefficient data basescans. In this work; we propose DensEst; an efficient density estimator with significantlyimproved accuracy. It efficiently provides rough estimates of object counts in selectivesubspace regions. Furthermore; by incorporating correlations between dimensions DensEstachieves not only efficient but also highly accurate estimations. We show how this density …,*,2009,35
