Lecture Notes in Computer Science (including subseries Lecture Notes in Artificial Intelligence and Lecture Notes in Bioinformatics): Preface,Masayuki Abe; Kazumaro Aoki; Giuseppe Ateniese; Roberto Avanzi; Zuzana Beerliová; Olivier Billet; Alex Biryukov; Ian Blake; Colin Boyd; Eric Brier; Aniello Castiglione; Juyoung Cha; Aldar Chan; Liqun Chen; Kookrae Cho; Scott Contini; Paolo D'Arco; Jintai Ding; Christophe Doche; Orr Dunkelman; Matthias Fitzi; Pierre Alain Fouque; Jacques JA Fournier; Kouichi Fujisaki; Eiichiro Fujisaki; Jun Furukawa; David Galindo; Shai Halevi; Helena Handschuh; Chris Heneghan; Thomas Holenstein; Fumitaka Hoshino; Yong Ho Hwang; Toshiyuki Isshiki; Ellen Jochemsz; Antoine Joux; Ari Juels; Charanjit Jutla; Aggelos Kiayias; Hiroaki Kikuchi; Tetsutarou Kobayashi; Tadayoshi Kohno; Hugo Krawczyk; Sandeep Kumar; Tanja Lange; Jung Wook Lee; Barbara Masucci; Alexander May; Miodrag Mihaljevic; Kazuhiko Minematsu; Fabian Monrose; Paul Montague; Steve Myers; David Naccache; Antonio Nicolosi; Satoshi Obana; Satomi Okazaki; Katsuyuki Okeya; Francis Olivier; Roger Oyono; Dan Page; Jung Hyung Park; Kun Peng; Krzysztof Pietrzak; Dominik Raub; Yasuyuki Sakai; Kouichi Sakurai; Werner Schindler; Jae Woo Seo; Jong Hoon Shin; Igor Shparlinski; Ron Steinfeld; Mike Szydlo; Yael Tauman Kalai; Isamu Teranishi; Toshio Tokita; Michael Tunstall; Frederik Vercauteren; Karine Villegas; Shabsi Walfish; Huaxiong Wang; Xiaofeng Wang; Bogdan Warinschi; Benne De Weger; Christopher Wolf; Alex Yampolskiy; Yeon Hyeong Yang; Yiqun Lisa Yin; Jeong Yoon; David Pointcheval,Abe; M; Aoki; K; Ateniese; G; Avanzi; R; Beerliová; Z; Billet; O; Biryukov; A; Blake; I; Boyd; C;Brier; E; Castiglione; A; Cha; J; Chan; A; Chen; L; Cho; K; Contini; S; D'Arco; P; Ding; J;Doche; C; Dunkelman; O; Fitzi; M; Fouque; PA; Fournier; JJA; Fujisaki; K; Fujisaki; E;Furukawa; J; Galindo; D; Halevi; S; Handschuh; H; Heneghan; C; Holenstein; T; Hoshino; F;Hwang; YH; Isshiki; T; Jochemsz; E; Joux; A; Juels; A; Jutla; C; Kiayias; A; Kikuchi; H;Kobayashi; T; Kohno; T; Krawczyk; H; Kumar; S; Lange; T; Lee; JW; Masucci; B; May; A;Mihaljevic; M; Minematsu … Abe M; Aoki K; Ateniese G; Avanzi R; Beerliová Z; Billet O etal. Lecture Notes in Computer Science (including subseries Lecture Notes in Artificial Intelligenceand Lecture Notes in Bioinformatics): Preface. Lecture Notes in Computer Science (includingsubseries Lecture Notes in Artificial Intelligence and Lecture Notes in Bioinformatics) …,Lecture Notes in Computer Science (including subseries Lecture Notes in Artificial Intelligence and Lecture Notes in Bioinformatics),2006,33
EDSC: efficient density-based subspace clustering,Ira Assent; Ralph Krieger; Emmanuel Müller; Thomas Seidl,Abstract Subspace clustering mines clusters hidden in subspaces of high-dimensional datasets. Density-based approaches have been shown to successfully mine clusters of arbitraryshape even in the presence of noise in full space clustering. Exhaustive search of all density-based subspace clusters; however; results in infeasible runtimes for large high-dimensionaldata sets. This is due to the exponential number of possible subspace projections in additionto the high computational cost of density-based clustering. In this paper; we proposelossless efficient detection of density-based subspace clusters. In our EDSC (efficientdensity-based subspace clustering) algorithm we reduce the high computational cost ofdensity-based subspace clustering by a complete multistep filter-and-refine algorithm. Ourfirst hypercube filter step avoids exhaustive search of all regions in all subspaces by …,Proceedings of the 17th ACM conference on Information and knowledge management,2008,31
Morpheus: interactive exploration of subspace clustering,Emmanuel Müller; Ira Assent; Ralph Krieger; Timm Jansen; Thomas Seidl,Abstract Data mining techniques extract interesting patterns out of large data resources.Meaningful visualization and interactive exploration of patterns are crucial for knowledgediscovery. Visualization techniques exist for traditional clustering in low dimensional spaces.In high dimensional data; clusters typically only exist in subspace projections. This subspaceclustering; however; lacks interactive visualization tools. Challenges arise from typicallylarge result sets in different subspace projections that hinder comparability; visualization andunderstandability. In this work; we describe Morpheus; a tool that supports the knowledgediscovery process through visualization and interactive exploration of subspace clusterings.Users may browse an overview of the entire subspace clustering; analyze subspace clustercharacteristics in-depth and zoom into object groupings. Bracketing of different parameter …,Proceedings of the 14th ACM SIGKDD international conference on Knowledge discovery and data mining,2008,29
An unbiased distance-based outlier detection approach for high-dimensional data,Hoang Vu Nguyen; Vivekanand Gopalkrishnan; Ira Assent,Abstract Traditional outlier detection techniques usually fail to work efficiently on high-dimensional data due to the curse of dimensionality. This work proposes a novel method forsubspace outlier detection; that specifically deals with multidimensional spaces wherefeature relevance is a local rather than a global property. Different from existing approaches;it is not grid-based and dimensionality unbiased. Thus; its performance is impervious to gridresolution as well as the curse of dimensionality. In addition; our approach ranks the outliers;allowing users to select the number of desired outliers; thus mitigating the issue of high falsealarm rate. Extensive empirical studies on real datasets show that our approach efficientlyand effectively detects outliers; even in high-dimensional spaces.,International Conference on Database Systems for Advanced Applications,2011,24
From stars to galaxies: skyline queries on aggregate data,Matteo Magnani; Ira Assent,Abstract The skyline operator extracts relevant records from multidimensional databasesaccording to multiple criteria. This operator has received a lot of attention because of itsability to identify the best records in a database without requiring to specify complexparameters like the relative importance of each criterion. However; it has only been definedwith respect to single records; while one fundamental functionality of database querylanguages is aggregation; enabling operations over sets of records. In this paper weintroduce aggregate skylines; where the skyline works as a filtering predicate on sets ofrecords. This operator can be used to express queries in the form: return the best groupsdepending on the features of their elements; and thus provides a powerful combination ofgrouping and skyline functionality. We define a semantics for aggregate skylines based …,Proceedings of the 16th International Conference on Extending Database Technology,2013,23
Scalable density-based subspace clustering,Emmanuel Müller; Ira Assent; Stephan Günnemann; Thomas Seidl,Abstract For knowledge discovery in high dimensional databases; subspace clusteringdetects clusters in arbitrary subspace projections. Scalability is a crucial issue; as thenumber of possible projections is exponential in the number of dimensions. We propose ascalable density-based subspace clustering method that steers mining to few selectedsubspace clusters. Our novel steering technique reduces subspace processing byidentifying and clustering promising subspaces and their combinations directly. Thereby; itnarrows down the search space while maintaining accuracy. Thorough experiments on realand synthetic databases show that steering is efficient and scalable; with high quality results.For future work; our steering paradigm for density-based subspace clustering opensresearch potential for speeding up other subspace clustering approaches as well.,Proceedings of the 20th ACM international conference on Information and knowledge management,2011,23
OpenSubspace: An open source framework for evaluation and exploration of subspace clustering algorithms in weka,Emmanuel Müller; Ira Assent; Stephan Günnemann; Thomas Seidl,Abstract: Subspace clustering and projected clustering are recent research areas forclustering in high dimensional spaces. As the field is rather young; there is a lack ofcomparative studies on the advantages and disadvantages of the different algorithms. Partof the underlying problem is the lack of available open source implementations that could beused by researchers to understand; compare; and extend subspace and projected clusteringalgorithms. In this paper; we discuss the requirements for open source evaluation software.We propose OpenSubspace; an open source framework that meets these requirements.OpenSubspace integrates state-of-the-art performance measures and visualizationtechniques to foster research in subspace and projected clustering.,Open Source in Data Mining Workshop (OSDM 2009) in conjunction with 13th Pacific-Asia Conference on Knowledge Discovery and Data Mining (PAKDD 2009),2009,23
Scalable parallelization of skyline computation for multi-core processors,Sean Chester; Darius Šidlauskas; Ira Assent; Kenneth S Bøgh,The skyline is an important query operator for multi-criteria decision making. It reduces adataset to only those points that offer optimal trade-offs of dimensions. In general; it is veryexpensive to compute. Recently; multicore CPU algorithms have been proposed toaccelerate the computation of the skyline. However; they do not sufficiently minimizedominance tests and so are not competitive with state-of-the-art sequential algorithms. In thispaper; we introduce a novel multicore skyline algorithm; Hybrid; which processes points inblocks. It maintains a shared; global skyline among all threads; which is used to minimizedominance tests while maintaining high throughput. The algorithm uses an efficiently-updatable data structure over the shared; global skyline; based on point-based partitioning.Also; we release a large benchmark of optimized skyline algorithms; with which we …,Data Engineering (ICDE); 2015 IEEE 31st International Conference on,2015,22
Clustering high dimensional data,Ira Assent,Abstract High-dimensional data; ie; data described by a large number of attributes; posespecific challenges to clustering. The so-called 'curse of dimensionality'; coined originally todescribe the general increase in complexity of various computational problems asdimensionality increases; is known to render traditional clustering algorithms ineffective. Thecurse of dimensionality; among other effects; means that with increasing number ofdimensions; a loss of meaningful differentiation between similar and dissimilar objects isobserved. As high-dimensional objects appear almost alike; new approaches for clusteringare required. Consequently; recent research has focused on developing techniques andclustering algorithms specifically for high-dimensional data. Still; open research issuesremain. Clustering is a data mining task devoted to the automatic grouping of data based …,Wiley Interdisciplinary Reviews: Data Mining and Knowledge Discovery,2012,22
Local outlier detection with interpretation,Xuan Hong Dang; Barbora Micenková; Ira Assent; Raymond T Ng,Abstract Outlier detection aims at searching for a small set of objects that are inconsistent orconsiderably deviating from other objects in a dataset. Existing research focuses on outlieridentification while omitting the equally important problem of outlier interpretation. Thispaper presents a novel method named LODI to address both problems at the same time. InLODI; we develop an approach that explores the quadratic entropy to adaptively select a setof neighboring instances; and a learning method to seek an optimal subspace in which anoutlier is maximally separated from its neighbors. We show that this learning task can besolved via the matrix eigen-decomposition and its solution contains essential information toreveal features that are most important to interpret the exceptional properties of outliers. Wedemonstrate the appealing performance of LODI via a number of synthetic and real world …,Joint European Conference on Machine Learning and Knowledge Discovery in Databases,2013,20
Clustering multidimensional sequences in spatial and temporal databases,Ira Assent; Ralph Krieger; Boris Glavic; Thomas Seidl,Abstract Many environmental; scientific; technical or medical database applications requireeffective and efficient mining of time series; sequences or trajectories of measurementstaken at different time points and positions forming large temporal or spatial databases.Particularly the analysis of concurrent and multidimensional sequences poses newchallenges in finding clusters of arbitrary length and varying number of attributes. Wepresent a novel algorithm capable of finding parallel clusters in different subspaces anddemonstrate our results for temporal and spatial applications. Our analysis of structuralquality parameters in rivers is successfully used by hydrologists to develop measures forriver quality improvements.,Knowledge and Information Systems,2008,20
Efficient GPU-based skyline computation,Kenneth S Bøgh; Ira Assent; Matteo Magnani,Abstract The skyline operator for multi-criteria search returns the most interesting points of adata set with respect to any monotone preference function. Existing work has almostexclusively focused on efficiently computing skylines on one or more CPUs; ignoring thehigh parallelism possible in GPUs. In this paper we investigate the challenges for efficientskyline algorithms that exploit the computational power of the GPU. We present a novelstrategy for managing data transfer and memory for skylines using CPU and GPU. Our newsorting based data-parallel skyline algorithm is introduced and its properties are discussed.We demonstrate in a thorough experimental evaluation that this algorithm is faster than state-of-the-art sequential sorting based skyline algorithms and that it shows superior scalability.,Proceedings of the Ninth International Workshop on Data Management on New Hardware,2013,19
Work-efficient parallel skyline computation for the GPU,Kenneth S Bøgh; Sean Chester; Ira Assent,Abstract The skyline operator returns records in a dataset that provide optimal trade-offs ofmultiple dimensions. State-of-the-art skyline computation involves complex tree traversals;data-ordering; and conditional branching to minimize the number of point-to-pointcomparisons. Meanwhile; GPGPU computing offers the potential for parallelizing skylinecomputation across thousands of cores. However; attempts to port skyline algorithms to theGPU have prioritized throughput and failed to outperform sequential algorithms. In thispaper; we introduce a new skyline algorithm; designed for the GPU; that uses a global; staticpartitioning scheme. With the partitioning; we can permit controlled branching to exploittransitive relationships and avoid most point-to-point comparisons. The result is a non-traditional GPU algorithm; SkyAlign; that prioritizes work-efficiency and respectable …,Proceedings of the VLDB Endowment,2015,18
HSM: Heterogeneous subspace mining in high dimensional data,Emmanuel Müller; Ira Assent; Thomas Seidl,Abstract Heterogeneous data; ie data with both categorical and continuous values; iscommon in many databases. However; most data mining algorithms assume eithercontinuous or categorical attributes; but not both. In high dimensional data; phenomena dueto the “curse of dimensionality” pose additional challenges. Usually; due to locally varyingrelevance of attributes; patterns do not show across the full set of attributes. In this paper wepropose HSM; which defines a new pattern model for heterogeneous high dimensional data.It allows data mining in arbitrary subsets of the attributes that are relevant for the respectivepatterns. Based on this model we propose an efficient algorithm; which is aware of theheterogeneity of the attributes. We extend an indexing structure for continuous attributessuch that HSM indexing adapts to different attribute types. In our experiments we show …,International Conference on Scientific and Statistical Database Management,2009,18
Learning Outlier Ensembles: The Best of Both Worlds—Supervised and Unsupervised,Barbora Micenková; Brian McWilliams; Ira Assent,ABSTRACT Years of research in unsupervised outlier detection have produced numerousalgorithms to score data according to their exceptionality. However; the nature of outliersheavily depends on the application context and different algorithms are sensitive to outliersof different nature. This makes it very difficult to assess suitability of a particular algorithmwithout a priori knowledge. On the other hand; in many applications; some examples ofoutliers exist or can be obtained in addition to the vast amount of unlabeled data.Unfortunately; this extra knowledge cannot be simply incorporated into the existingunsupervised algorithms. In this paper; we show how to use powerful machine learningapproaches to combine labeled examples together with arbitrary unsupervised outlierscoring algorithms. We aim to get the best out of the two worlds—supervised and …,Proceedings of the ACM SIGKDD 2014 Workshop on Outlier Detection and Description under Data Diversity (ODD2). New York; NY; USA,2014,13
Taking the big picture: representative skylines based on significance and diversity,Matteo Magnani; Ira Assent; Michael L Mortensen,Abstract The skyline is a popular operator to extract records from a database when a recordscoring function is not available. However; the result of a skyline query can be very large.The problem addressed in this paper is the automatic selection of a small number (k)(k) ofrepresentative skyline records. Existing approaches have only focused on partial aspects ofthis problem. Some try to identify sets of diverse records giving an overall approximation ofthe skyline. These techniques; however; are sensitive to the scaling of attributes or to theinsertion of non-skyline records into the database. Others exploit some knowledge of therecord scoring function to identify the most significant record; but not sets of recordsrepresentative of the whole skyline. In this paper; we introduce a novel approach taking boththe significance of all the records and their diversity into account; adapting to available …,The VLDB journal,2014,12
Content-based multimedia retrieval in the presence of unknown user preferences,Christian Beecks; Ira Assent; Thomas Seidl,Abstract Content-based multimedia retrieval requires an appropriate similarity model whichreflects user preferences. When these preferences are unknown or when the structure of thedata collection is unclear; retrieving the most preferable objects the user has in mind ischallenging; as the notion of similarity varies from data to data; from task to task; andultimately from user to user. Based on a specific query object and unknown userpreferences; retrieving the most similar objects according to some default similarity modeldoes not necessarily include the most preferable ones. In this work; we address the problemof content-based multimedia retrieval in the presence of unknown user preferences. Ouridea consists in performing content-based retrieval by considering all possibilities in a familyof similarity models simultaneously. To this end; we propose a novel content-based …,International Conference on Multimedia Modeling,2011,12
Mining probabilistic representative frequent patterns from uncertain data,Chunyang Liu; Ling Chen; Chengqi Zhang,Abstract Probabilistic frequent pattern mining over uncertain data has received a great dealof attention recently due to the wide applications of uncertain data. Similar to its counterpartin deterministic databases; however; probabilistic frequent pattern mining suffers from thesame problem of generating an exponential number of result patterns. The large number ofdiscovered patterns hinders further evaluation and analysis; and calls for the need to find asmall number of representative patterns to approximate all other patterns. This paperformally defines the problem of probabilistic representative frequent pattern (P-RFP) mining;which aims to find the minimal set of patterns with sufficiently high probability to represent allother patterns. The problem's bottleneck turns out to be checking whether a pattern canprobabilistically represent another; which involves the computation of a joint probability of …,*,2013,11
Outlier detection with space transformation and spectral analysis,Xuan Hong Dang; Barbora Micenková; Ira Assent; Raymond T Ng,Abstract Detecting a small number of outliers from a set of data observations is alwayschallenging. In this paper; we present an approach that exploits space transformation anduses spectral analysis in the newly transformed space for outlier detection. Unlike mostexisting techniques in the literature which rely on notions of distances or densities; thisapproach introduces a novel concept based on local quadratic entropy for evaluating thesimilarity of a data object with its neighbors. This information theoretic quantity is used toregularize the closeness amongst data instances and subsequently benefits the process ofmapping data into a usually lower dimensional space. Outliers are then identified by spectralanalysis of the eigenspace spanned by the set of leading eigenvectors derived from themapping procedure. The proposed technique is purely data-driven and imposes no …,*,2013,11
Robust adaptable video copy detection,Ira Assent; Hardy Kremer,Abstract Video copy detection should be capable of identifying video copies subject toalterations eg in video contrast or frame rates. We propose a video copy detection schemethat allows for adaptable detection of videos that are altered temporally (eg frame ratechange) and/or visually (eg change in contrast). Our query processing combines filteringand indexing structures for efficient multistep computation of video copies under this model.We show that our model successfully identifies altered video copies and does so morereliably than existing models.,International Symposium on Spatial and Temporal Databases,2009,11
AnyDBC: an efficient anytime density-based clustering algorithm for very large complex datasets,Son T Mai; Ira Assent; Martin Storgaard,Abstract The density-based clustering algorithm DBSCAN is a state-of-the-art data clusteringtechnique with numerous applications in many fields. However; its O (n 2) time complexitystill remains a severe weakness. In this paper; we propose a novel anytime approach tocope with this problem by reducing both the range query and the label propagation time ofDBSCAN. Our algorithm; called AnyDBC; compresses the data into smaller density-connected subsets called primitive clusters and labels objects based on connectedcomponents of these primitive clusters for reducing the label propagation time. Moreover;instead of passively performing the range query for all objects like existing techniques;AnyDBC iteratively and actively learns the current cluster structure of the data and selects afew most promising objects for refining clusters at each iteration. Thus; in the end; it …,Proceedings of the 22nd ACM SIGKDD international conference on knowledge discovery and data mining,2016,10
Outlier detection and ranking based on subspace clustering,Thomas Seidl; Emmanuel Müller; Ira Assent; Uwe Steinhausen,Abstract Detecting outliers is an important task for many applications including frauddetection or consistency validation in real world data. Particularly in the presence ofuncertain data or imprecise data; similar objects regularly deviate in their attribute values.The notion of outliers has thus to be defined carefully. When considering outlier detection asa task which is complementary to clustering; binary decisions whether an object is regardedto be an outlier or not seem to be near at hand. For high-dimensional data; however; objectsmay belong to different clusters in different subspaces. More fine-grained concepts to defineoutliers are therefore demanded. By our new OutRank approach; we address outlierdetection in heterogeneous high dimensional data and propose a novel scoring function thatprovides a consistent model for ranking outliers in the presence of different attribute types …,Dagstuhl Seminar Proceedings,2009,9
Adaptable Distance Functions for Similarity-based Multimedia Retrieval.,Ira Assent; Marc Wichterich; Thomas Seidl,Abstract Today's abundance of storage coupled with digital technologies in virtually allscientific or commercial applications such as medical and biological imaging or musicarchives deal with tremendous quantities of images; videos or audio files stored in largemultimedia databases. For content-based data mining and multimedia retrieval purposes;suitable similarity models are crucial. Adaptable distance functions are particularly well-suited to match the human perception of similarity. Quadratic Forms (QF) were introduced tocapture the notion of inter-feature similarity which sets them apart from the more traditionalfeature-by-feature measures from eg the Euclidean or Manhattan dissimilarity functions. TheEarth Mover's Distance (EMD) was adopted in Computer Vision to better approach humanperceptual similarities by allowing feature transformation under a number of restrictions …,Datenbank-Spektrum,2006,9
