Consistent query answers in inconsistent databases,Marcelo Arenas; Leopoldo Bertossi; Jan Chomicki,Abstract In this paper we consider the problem of the logical characterization of the notion ofconsistent answer in a relational database that may violate given integrity constraints. Thisnotion is captured in terms of the possible repaired versions of the database. A rnethod forcomputing consistent answers is given and its soundness and completeness (for someclasses of constraints and queries) proved. The method is based on an iterative procedurewhose termination for several classes of constraints is proved as well.,Proceedings of the eighteenth ACM SIGMOD-SIGACT-SIGART symposium on Principles of database systems,1999,824
Semantics and complexity of SPARQL,Jorge Pérez; Marcelo Arenas; Claudio Gutierrez,Abstract SPARQL is the standard language for querying RDF data. In this article; we addresssystematically the formal study of the database aspects of SPARQL; concentrating in itsgraph pattern matching facility. We provide a compositional semantics for the core part ofSPARQL; and study the complexity of the evaluation of several fragments of the language.Among other complexity results; we show that the evaluation of general SPARQL patterns isPSPACE-complete. We identify a large class of SPARQL patterns; defined by imposing asimple and natural syntactic restriction; where the query evaluation problem can be solvedmore efficiently. This restriction gives rise to the class of well-designed patterns. We showthat the evaluation problem is coNP-complete for well-designed patterns. Moreover; weprovide several rewriting rules for well-designed patterns whose application may have a …,ACM Transactions on Database Systems (TODS),2009,651
A normal form for XML documents,Marcelo Arenas; Leonid Libkin,Abstract This article takes a first step towards the design and normalization theory for XMLdocuments. We show that; like relational databases; XML documents may contain redundantinformation; and may be prone to update anomalies. Furthermore; such problems arecaused by certain functional dependencies among paths in the document. Our goal is to finda way of converting an arbitrary DTD into a well-designed one; that avoids these problems.We first introduce the concept of a functional dependency for XML; and define its semanticsvia a relational representation of XML. We then define an XML normal form; XNF; that avoidsupdate anomalies and redundancies. We study its properties; and show that XNFgeneralizes BCNF; we also discuss the relationship between XNF and normal forms fornested relations. Finally; we present a lossless algorithm for converting any DTD into one …,ACM Transactions on Database Systems (TODS),2004,560
Semantics and Complexity of SPARQL,Jorge Pérez; Marcelo Arenas; Claudio Gutierrez,Abstract SPARQL is the W3C candidate recommendation query language for RDF. In thispaper we address systematically the formal study of SPARQL; concentrating in its graphpattern facility. We consider for this study simple RDF graphs without special semantics forliterals and a simplified version of filters which encompasses all the main issues. We providea compositional semantics; prove there are normal forms; prove complexity bounds; amongothers that the evaluation of SPARQL patterns is PSPACE-complete; compare our semanticsto an alternative operational semantics; give simple and natural conditions when bothsemantics coincide and discuss optimization procedures.,International semantic web conference,2006,558
Mapping data in peer-to-peer systems: Semantics and algorithmic issues,Anastasios Kementsietsidis; Marcelo Arenas; Renée J Miller,Abstract We consider the problem of mapping data in peer-to-peer data-sharing systems.Such systems often rely on the use of mapping tables listing pairs of corresponding values tosearch for data residing in different peers. In this paper; we address semantic andalgorithmic issues related to the use of mapping tables. We begin by arguing why mappingtables are appropriate for data mapping in a peer-to-peer environment. We discussalternative semantics for these tables and we present a language that allows the user tospecify mapping tables under different semantics. Then; we show that by treating mappingtables as constraints (called mapping constraints) on the exchange of information betweenpeers it is possible to reason about them. We motivate why reasoning capabilities areneeded to manage mapping tables and show the importance of inferring new mapping …,Proceedings of the 2003 ACM SIGMOD international conference on Management of data,2003,323
XML data exchange: consistency and query answering,Marcelo Arenas; Leonid Libkin,Abstract Data exchange is the problem of finding an instance of a target schema; given aninstance of a source schema and a specification of the relationship between the source andthe target. Theoretical foundations of data exchange have recently been investigated forrelational data. In this article; we start looking into the basic properties of XML dataexchange; that is; restructuring of XML documents that conform to a source DTD under atarget DTD; and answering queries written over the target schema. We define XML dataexchange settings in which source-to-target dependencies refer to the hierarchical structureof the data. Combining DTDs and dependencies makes some XML data exchange settingsinconsistent. We investigate the consistency problem and determine its exact complexity.,Journal of the ACM (JACM),2008,254
The hyperion project: from data integration to data coordination,Marcelo Arenas; Vasiliki Kantere; Anastasios Kementsietsidis; Iluju Kiringa; Renée J Miller; John Mylopoulos,Abstract We present an architecture and a set of challenges for peer database managementsystems. These systems team up to build a network of nodes (peers) that coordinate at runtime most of the typical DBMS tasks such as the querying; updating; and sharing of data.Such a network works in a way similar to conventional multidatabases. Conventionalmultidatabase systems are founded on key concepts such as those of a global schema;central administrative authority; data integration; global access to multiple databases;permanent participation of databases; etc. Instead; our proposal assumes total absence ofany central authority or control; no global schema; transient participation of peer databases;and constantly evolving coordination rules among databases. In this work; we describe thestatus of the Hyperion project; present our current solutions; and outline remaining …,ACM SIGMOD Record,2003,227
Answer sets for consistent query answering in inconsistent databases,Marcelo Arenas; Leopoldo Bertossi; Jan Chomicki,Abstract: A relational database is inconsistent if it does not satisfy a given set of integrityconstraints. Nevertheless; it is likely that most of the data in it is consistent with theconstraints. In this paper we apply logic programming based on answer sets to the problemof retrieving consistent information from a possibly inconsistent database. Since consistentinformation persists from the original database to every of its minimal repairs; the approachis based on a specification of database repairs using disjunctive logic programs withexceptions; whose answer set semantics can be represented and computed by systems thatimplement stable model semantics. These programs allow us to declare persistence bydefaults and repairing changes by exceptions. We concentrate mainly on logic programs forbinary integrity constraints; among which we find most of the integrity constraints found in …,arXiv preprint cs/0207094,2002,195
An information-theoretic approach to normal forms for relational and XML data,Marcelo Arenas; Leonid Libkin,Abstract Normalization as a way of producing good relational database designs is a well-understood topic. However; the same problem of distinguishing well-designed databasesfrom poorly designed ones arises in other data models; in particular; XML. While; in therelational world; the criteria for being well designed are usually very intuitive and clear tostate; they become more obscure when one moves to more complex data models. Our goalis to provide a set of tools for testing when a condition on a database design; specified by anormal form; corresponds to a good design. We use techniques of information theory; anddefine a measure of information content of elements in a database with respect to a set ofconstraints. We first test this measure in the relational context; providing information-theoretic justification for familiar normal forms such as BCNF; 4NF; PJ/NF; 5NFR; DK/NF …,Journal of the ACM (JACM),2005,158
nSPARQL: A navigational language for RDF,Jorge Pérez; Marcelo Arenas; Claudio Gutierrez,Abstract Navigational features have been largely recognized as fundamental for graphdatabase query languages. This fact has motivated several authors to propose RDF querylanguages with navigational capabilities. In this paper; we propose the query languagenSPARQL that uses nested regular expressions to navigate RDF data. We study some of thefundamental properties of nSPARQL and nested regular expressions concerningexpressiveness and complexity of evaluation. Regarding expressiveness; we show thatnSPARQL is expressive enough to answer queries considering the semantics of the RDFSvocabulary by directly traversing the input graph. We also show that nesting is necessary innSPARQL to obtain this last result; and we study the expressiveness of the combination ofnested regular expressions and SPARQL operators. Regarding complexity of evaluation …,Web Semantics: Science; Services and Agents on the World Wide Web,2010,139
Scalar aggregation in inconsistent databases,Marcelo Arenas; Leopoldo Bertossi; Jan Chomicki; Xin He; Vijay Raghavan; Jeremy Spinrad,Abstract We consider here scalar aggregation queries in databases that may violate a givenset of functional dependencies. We define consistent answers to such queries to be greatest-lowest/least-upper bounds on the value of the scalar function across all (minimal) repairs ofthe database. We show how to compute such answers. We provide a completecharacterization of the computational complexity of this problem. We also show howtractability can be improved in several special cases (one involves a novel application ofBoyce–Codd Normal Form) and present a practical hybrid query evaluation method.,Theoretical Computer Science,2003,132
A direct mapping of relational data to RDF. W3C Recommendation 27 September 2012,Marcelo Arenas; Alexandre Bertails; Eric Prud’hommeaux; Juan Sequeda,Search all the public and authenticated articles in CiteULike. Include unauthenticated resultstoo (may include "spam") Enter a search phrase. You can also specify a CiteULike article id(123456);. a DOI (doi:10.1234/12345678). or a PubMed ID (pmid:12345678). Click Help foradvanced usage. CiteULike; Group: Mostrare; Search; Register; Log in …,*,2012,112
Querying semantic web data with SPARQL,Marcelo Arenas; Jorge Pérez,Abstract The Semantic Web is the initiative of the W3C to make information on the Webreadable not only by humans but also by machines. RDF is the data model for SemanticWeb data; and SPARQL is the standard query language for this data model. In the last tenyears; we have witnessed a constant growth in the amount of RDF data available on theWeb; which have motivated the theoretical study of some fundamental aspects of SPARQLand the development of efficient mechanisms for implementing this query language. Someof the distinctive features of RDF have made the study and implementation of SPARQLchallenging. First; as opposed to usual database applications; the semantics of RDF is openworld; making RDF databases inherently incomplete. Thus; one usually obtains partialanswers when querying RDF with SPARQL; and the possibility of adding optional …,Proceedings of the thirtieth ACM SIGMOD-SIGACT-SIGART symposium on Principles of database systems,2011,102
Counting beyond a Yottabyte; or how SPARQL 1.1 property paths will prevent adoption of the standard,Marcelo Arenas; Sebastián Conca; Jorge Pérez,Abstract SPARQL-the standard query language for querying RDF-provides only limitednavigational functionalities; although these features are of fundamental importance for graphdata formats such as RDF. This has led the W3C to include the property path feature in theupcoming version of the standard; SPARQL 1.1. We tested several implementations ofSPARQL 1.1 handling property path queries; and we observed that their evaluation methodsfor this class of queries have a poor performance even in some very simple scenarios. Toformally explain this fact; we conduct a theoretical study of the computational complexity ofproperty paths evaluation. Our results imply that the poor performance of the testedimplementations is not a problem of these particular systems; but of the specification itself. Infact; we show that any implementation that adheres to the SPARQL 1.1 specification (as …,Proceedings of the 21st international conference on World Wide Web,2012,97
Relational and XML data exchange,Marcelo Arenas; Pablo Barcelo; Leonid Libkin; Filip Murlak,Abstract Data exchange is the problem of finding an instance of a target schema; given aninstance of a source schema and a specification of the relationship between the source andthe target. Such a target instance should correctly represent information from the sourceinstance under the constraints imposed by the target schema; and it should allow one toevaluate queries on the target instance in a way that is semantically consistent with thesource data. Data exchange is an old problem that re-emerged as an active research topicrecently; due to the increased need for exchange of data in various formats; often in e-business applications. In this lecture; we give an overview of the basic concepts of dataexchange in both relational and XML contexts. We give examples of data exchangeproblems; and we introduce the main tasks that need to addressed. We then discuss …,Synthesis Lectures on Data Management,2010,95
Efficient incremental validation of XML documents,Denilson Barbosa; Alberto O Mendelzon; Leonid Libkin; Laurent Mignet; Marcelo Arenas,We discuss incremental validation of XML documents with respect to DTDs and XMLschema definitions. We consider insertions and deletions of subtrees; as opposed to leafnodes only; and we also consider the validation of ID and IDREF attributes. For arbitraryschemas; we give a worst-case n log n time and linear space algorithm; and show that itoften is far superior to revalidation from scratch. We present two classes of schemas; whichcapture most real-life DTDs; and show that they admit a logarithmic time incrementalvalidation algorithm that; in many cases; requires only constant auxiliary space. We thendiscuss an implementation of these algorithms that is independent of; and can becustomized for different storage mechanisms for XML. Finally; we present extensiveexperimental results showing that our approach is highly efficient and scalable.,Data Engineering; 2004. Proceedings. 20th International Conference on,2004,95
Specifying and querying database repairs using logic programs with exceptions,Marcelo Arenas; Leopoldo Bertossi; Jan Chomicki,Abstract Databases may be inconsistent with respect to a given set of integrity constraints.Nevertheless; most of the data may be consistent. In this paper we show how to specifyconsistent data and how to query a relational database in such a way that only consistentdata is retrieved. The specification and queries are based on disjunctive extended logicprograms with positive and negative exceptions that generalize those previously introducedby Kowalski and Sadri.,*,2001,95
On verifying consistency of XML specifications,Marcelo Arenas; Wenfei Fan; Leonid Libkin,Abstract XML specifications often consist of a type definition (typically; a DTD) and a set ofintegrity constraints. It has been shown previously that such specifications can beinconsistent; and thus it is often desirable to check consistency at compile-time. It is knownthat for general keys and foreign keys; and DTDs; the consistency problem is undecidable;however; it becomes NP-complete when all keys are one-attribute (unary); and tractable; ifno foreign keys are used. In this paper; we consider a variety of constraints for XML data;and study the complexity of the consistency problem. Our main conclusion is that in thepresence of foreign keys; compile-time verification of consistency is usually infeasible. Welook at two types of constraints: absolute (that hold in the entire document); and relative (thatonly hold in a part of the document). For absolute constraints; we extend earlier …,Proceedings of the twenty-first ACM SIGMOD-SIGACT-SIGART symposium on Principles of database systems,2002,94
On directly mapping relational databases to RDF and OWL,Juan F Sequeda; Marcelo Arenas; Daniel P Miranker,Abstract Mapping relational databases to RDF is a fundamental problem for thedevelopment of the Semantic Web. We present a solution; inspired by draft methods definedby the W3C where relational databases are directly mapped to RDF and OWL. Given arelational database schema and its integrity constraints; this direct mapping produces anOWL ontology; which; provides the basis for generating RDF instances. The semantics ofthis mapping is defined using Datalog. Two fundamental properties are informationpreservation and query preservation. We prove that our mapping satisfies both conditions;even for relational databases that contain null values. We also consider two desirableproperties: monotonicity and semantics preservation. We prove that our mapping ismonotone and also prove that no monotone mapping; including ours; is semantic …,Proceedings of the 21st international conference on World Wide Web,2012,86
Locally consistent transformations and query answering in data exchange,Marcelo Arenas; Pablo Barceló; Ronald Fagin; Leonid Libkin,Abstract Data exchange is the problem of taking data structured under a source schema andcreating an instance of a target schema. Given a source instance; there may be manysolutions-target instances that satisfy the constraints of the data exchange problem. Previouswork has identified two classes of desirable solutions: canonical universal solutions; andtheir cores. Query answering in data exchange amounts to rewriting a query over the targetschema to another query that; over a materialized target instance; gives the result that issemantically consistent with the source. A basic question is then whether there exists atransformation sending a source instance into a solution over which target queries can beanswered. We show that the answer is negative for many data exchange transformationsthat have structural properties similar to canonical universal solutions and cores. Namely …,Proceedings of the twenty-third ACM SIGMOD-SIGACT-SIGART symposium on Principles of database systems,2004,82
The recovery of a schema mapping: bringing exchanged data back,Marcelo Arenas; Jorge Pérez; Cristian Riveros,Abstract A schema mapping is a specification that describes how data from a source schemais to be mapped to a target schema. Once the data has been transferred from the source tothe target; a natural question is whether one can undo the process and recover the initialdata; or at least part of it. In fact; it would be desirable to find a reverse schema mapping fromtarget to source that specifies how to bring the exchanged data back. In this article; weintroduce the notion of a recovery of a schema mapping: it is a reverse mapping; M′ for amapping M; that recovers sound data with respect to M. We further introduce an orderrelation on recoveries. This allows us to choose mappings that recover the maximumamount of sound information. We call such mappings maximum recoveries. We studymaximum recoveries in detail; providing a necessary and sufficient condition for their …,ACM Transactions on Database Systems (TODS),2009,81
First-order and temporal logics for nested words,Rajeev Alur; Marcelo Arenas; Pablo Barcelo; Kousha Etessami; Neil Immerman; Leonid Libkin,Nested words are a structured model of execution paths in procedural programs; reflectingtheir call and return nesting structure. Finite nested words also capture the structure of parsetrees and other tree-structured data; such as XML. We provide new temporal logics for finiteand infinite nested words; which are natural extensions of LTL; and prove that these logicsare first-order expressively-complete. One of them is based on adding a" within" modality;evaluating a formula on a subword; to a logic CaRet previously studied in the context ofverifying properties of recursive state machines. The other logic is based on the notion of asummary path that combines the linear and nesting structures. For that logic; both model-checking and satisfiability are shown to be EXPTIME-complete. Finally; we prove that first-order logic over nested words has the three-variable property; and we present a temporal …,Logic in Computer Science; 2007. LICS 2007. 22nd Annual IEEE Symposium on,2007,80
Semantics and optimization of the SPARQL 1.1 federation extension,Carlos Buil-Aranda; Marcelo Arenas; Oscar Corcho,Abstract The W3C SPARQL working group is defining the new SPARQL 1.1 query language.The current working draft of SPARQL 1.1 focuses mainly on the description of the language.In this paper; we provide a formalization of the syntax and semantics of the SPARQL 1.1federation extension; an important fragment of the language that has not yet received muchattention. Besides; we propose optimization techniques for this fragment; provide animplementation of the fragment including these techniques; and carry out a series ofexperiments that show that our optimization procedures significantly speed up the queryevaluation process.,Extended Semantic Web Conference,2011,76
On blank nodes,Alejandro Mallea; Marcelo Arenas; Aidan Hogan; Axel Polleres,Abstract Blank nodes are defined in RDF as 'existential variables' in the same way that hasbeen used before in mathematical logic. However; evidence suggests that actual usage ofRDF does not follow this definition. In this paper we thoroughly cover the issue of blanknodes; from incomplete information in database theory; over different treatments of blanknodes across the W3C stack of RDF-related standards; to empirical analysis of RDF datapublicly available on the Web. We then summarize alternative approaches to the problem;weighing up advantages and disadvantages; also discussing proposals for Skolemization.,International Semantic Web Conference,2011,75
What’s hard about xml schema constraints?,Marcelo Arenas; Wenfei Fan; Leonid Libkin,Abstract Data description for XML usually comes in the form of a type specification (eg; aDTD) together with integrity constraints. XML Schema allows one to mix DTD features withsemantic information; such as keys and foreign keys. It was shown recently [[2];[7]] that theinteraction of DTDs with constraints may be rather nontrivial. In particular; testing if a generalspecification is consistent is undecidable; but for the most common case of single-attributeconstraints it is NP-complete; and linear time if no foreign keys are present. However; XMLSchema design did not adopt the form of constraints prevalent in the database literature; andslightly changed the semantics of keys; foreign keys; and unique constraints. In this paperwe demonstrate the very costly effect of this slight change on the feasibility of consistencychecking. In particular; all the known hardness results extend to the XML Schema case …,International Conference on Database and Expert Systems Applications,2002,74
nSPARQL: A navigational language for RDF,Jorge Pérez; Marcelo Arenas; Claudio Gutierrez,Abstract Navigational features have been largely recognized as fundamental for graphdatabase query languages. This fact has motivated several authors to propose RDF querylanguages with navigational capabilities. In particular; we have argued in a previous paperthat nested regular expressions are appropriate to navigate RDF data; and we haveproposed the nSPARQL query language for RDF; that uses nested regular expressions asbuilding blocks. In this paper; we study some of the fundamental properties of nSPARQLconcerning expressiveness and complexity of evaluation. Regarding expressiveness; weshow that nSPARQL is expressive enough to answer queries considering the semantics ofthe RDFS vocabulary by directly traversing the input graph. We also show that nesting isnecessary to obtain this last result; and we study the expressiveness of the combination of …,International Semantic Web Conference,2008,72
Data sharing through query translation in autonomous sources,Anastasios Kementsietsidis; Marcelo Arenas,Abstract We consider the problem of data sharing between autonomous data sources in anenvironment where constraints cannot be placed on the shared contents of sources. Oursolutions rely on the use of mapping tables which define how data from different sources areassociated. In this setting; the answer to a local query; that is; a query posed against theschema of a single source; is augmented by retrieving related data from associated sources.This retrieval of data is achieved by translating; through mapping tables; the local query intoa set of queries that are executed against the associated sources. We consider both soundtranslations (which only retrieve correct answers) and complete translations (which retrieveall correct answers; and no incorrect answers) and we present algorithms to compute suchtranslations. Our solutions are implemented and tested experimentally and we describe …,Proceedings of the Thirtieth international conference on Very large data bases-Volume 30,2004,70
