The Semantic Web-ISWC 2015,Marcelo Arenas; Jeff Heflin; Paul Groth; Krishnaprasad Thirunarayan; Mathieu d'Aquin; Markus Strohmaier; Oscar Corcho; Steffen Staab; Kavitha Srinivas; Elena Simperl; Michel Dumontier,Since its inception in the last decade; the Semantic Web has experienced a steady andcontinuous development toward its original vision; both in terms of research and oftechnology development and applications. Many of the research results presented in theinitial conferences have now matured and been taken up in commercial settings; giving riseto new research problems that are now being explored. Large-scale initiatives; such assome of the most popular datasets in the linked open data cloud; are now considered ascommodities and are part of many services that are being used on a daily basis; not onlyinside our research community but also in other research areas. The International SemanticWeb Conference (ISWC) has continued to be the premier venue for presenting innovativesystems; applications; and research results related to the Semantic Web. In this edition …,*,2015,1
Towards General Representability in Knowledge Exchange.,Marcelo Arenas; Jorge Pérez; Emanuel Sallinger,In data exchange; one is typically given a source database instance and a mappingbetween a source schema and a target schema. The goal then is to materialize a targetdatabase instance that corresponds to the source instance and the mapping. In this settingsource data is explicitly given; that is; every fact that is true in it is explicitly mentioned in thesource database instance. Knowledge bases typically consist of some explicit knowledge–like in database instances–and some implicit knowledge; usually given in the form of rulesthat specify how to derive knowledge not explicitly stored. In [5]; Arenas et al. introduced thesetting of knowledge exchange; where one is given a source knowledge base and amapping between a source schema and a target schema; and the goal is to materialize atarget knowledge base; that is; both explicit and implicit knowledge. While the question of …,AMW,2013,1
Computing Solutions in OWL 2 QL Knowledge Exchange.,Marcelo Arenas; Elena Botoeva; Diego Calvanese; Vladislav Ryzhikov,*,Description Logics,2013,1
SPARQL Formalization,Marcelo Arenas; Claudio Gutierrez; Jorge Pérez,Page 1. SPARQL Formalization Marcelo Arenas; Claudio Gutierrez; Jorge Pérez Departmentof Computer Science Pontificia Universidad Católica de Chile Universidad de Chile Center forWeb Research http://www.cwr.cl M. Arenas; C. Gutierrez; J. Pérez – SPARQL Formalization 1 /34 Page 2. SPARQL: A simple RDF query language SELECT ?Name ?Email WHERE { ?X :name?Name ?X :email ?Email } ► The semantics of simple SPARQL queries is easy to understand;at least intuitively. M. Arenas; C. Gutierrez; J. Pérez – SPARQL Formalization 2 / 34 Page 3.SPARQL: A simple RDF query language SELECT ?Name ?Email WHERE { ?X :name ?Name?X :email ?Email } ► The semantics of simple SPARQL queries is easy to understand; at leastintuitively. “Give me the name and email of the resources in the datasource” M. Arenas; C.Gutierrez; J. Pérez – SPARQL Formalization 2 / 34 Page 4 …,Intẻnational Semantic Web Conference Tutorial,2007,1
Environmental Information System for analysis and forecast of air pollution (Application to Santiago de Chile),Marcelo Arenas; Leopoldo Bertossi; Loreto Bravo; Laura Gallardo; Achim Sydow,ABSTRACT In Santiago de Chile and other cities in Chile; air pollution is a dramaticproblem. An Environmental Information System (EIS) based on air quality models isextremely valuable in order to support users in governmental administrations and industrywith forecasting and operative decision-making as well as short to long-term regionalplanning. Using a model-based EIS for air pollution it is possible (i) to study complexsource/receptor relationships;(ii) to optimize air pollution abatement strategies either locallyor in a larger region; and (iii) to forecast the air quality for urban and industrial regions. Thepaper presents issues of a joint project of Universidad Catolica de Chile and GMD FIRSTwhich objectives are the exchange of know how in the fields of EIS design and the use of airquality models; the installation of a model-based EIS for air pollution for Santiago de …,Proceedings of the International Conference “Environmental Modeling and Simulation”(ICEMS'00); San Diego (USA),2000,1
Representation of Temporal Knowledge in the Situation Calculus,Marcelo Arenas; Leopoldo Bertossi; Javier Pinto,Abstract In this article we deal with the problem of using temporal knowledge in thespecification of the dynamics of a database. Temporal knowledge is formalized withformulas that refer to the evolution of the database. In the article we analyze severalproblems involving temporal knowledge:(1) Specification of complex temporal preconditionsfor database transactions.(2) Specification and maintenance of integrity constraints.(3)Posing and answering temporal queries about the real or hypothetical evolution of thedatabase. Our research is based on two logical languages that have been developed inparallel: The Situation Calculus; a logical language developed to represent knowledgeabout action and change [8]. The Situation Calculus has been used as a medium for thespecification of database updates [14]; and our work is a further development of this …,*,1998,1
A Direct Mapping of Relational Data to RDF. Working Draft. W3C (2012),M Arenas,*,*,*,1
G-CORE: A Core for Future Graph Query Languages,Renzo Angles; Marcelo Arenas; George HL Fletcher; Claudio Gutierrez; Tobias Lindaaker; Marcus Paradies; Stefan Plantikow; Juan Sequeda; Oskar van Rest; Hannes Voigt,Abstract: We report on a community effort between industry and academia to shape thefuture of graph query languages. We argue that existing graph database managementsystems should consider supporting a query language with two key characteristics. First; itshould be composable; meaning; that graphs are the input and the output of queries.Second; the graph query language should treat paths as first-class citizens. Our result is G-CORE; a powerful graph query language design that fulfills these goals; and strikes a carefulbalance between path query expressivity and evaluation complexity. Subjects: Databases(cs. DB) Cite as: arXiv: 1712.01550 [cs. DB](or arXiv: 1712.01550 v1 [cs. DB] for this version)Submission history From: Hannes Voigt [view email][v1] Tue; 5 Dec 2017 09: 59: 47 GMT(329kb; D),arXiv preprint arXiv:1712.01550,2017,*
A note on computing certain answers to queries over incomplete databases,Marcelo Arenas; Elena Botoeva; E Kostylev; Vladislav Ryzhikov,The ability to handle incomplete information is fundamental in many areas; including dataintegration; data exchange; inconsistent databases; and the Semantic Web. In such areas; itis often impossible to describe the domain of interest in a full; comprehensive way; so theaim of an incomplete database is to concisely represent a (potentially infinite) number ofcompletions. Incomplete information is usually represented by allowing placeholders forunknown values; which are called “nulls”. An incomplete database I with such nulls thenrepresents a set of databases with complete information; called representations of I; each ofwhich is obtained by replacing nulls by actual values. One of the most important problemsassociated to databases is query answering. Since an incomplete database I can haveseveral representations; the aim in this context is to find the “certain answers” to a query Q …,*,2017,*
Determining the schema of a graph dataset,*,A schema for a dataset is identified by identifying a dataset comprising data andrelationships between data pairs. An original schema is identified for the dataset. Thisoriginal schema comprises an organizational structure. An initial fit between the dataset andthe original schema is determined. The initial fit quantifying a conformity of the data in thedataset to the organizational structure of the original schema. A plurality of additionalschemas are identified. Each additional schema is a distinct organizational schema. Thedataset is partitioned into a plurality of subsets. Each subset comprises a modified fitquantifying a modified conformity of subset data in each subset to one of the original schemaand the additional schemas. The modified fit is greater than the original fit.,*,2017,*
Foreword: Special Issue on Database Theory,Marcelo Arenas,This Theory of Computing Systems special issue contains six invited; extended journalarticles of papers presented at the International Conference on Database Theory (ICDT2015); which was held jointly with the International Conference on Extending DatabaseTechnology (EDBT 2015) on March 23–27; 2015 in Brussels; Belgium. ICDT is one of themajor conferences for database theory. The ICDT conference started in 1986 and was abiennial conference until 2009; when it became an annual conference and is jointly heldwith EDBT. The submissions for the special issue underwent thorough journal reviewing andrevision process; in accordance with the usual standards of Theory of Computing Systems.The papers in this special issue are (in no particular order):• Answering Conjunctive Querieswith Inequalities; Paraschos Koutris; Tova Milo;,Theory of Computing Systems,2017,*
Designing a Query Language for RDF,Marcelo Arenas; Martin Ugarte,Resumen When querying an Resource Description Framework (RDF) graph; a prominentfeature is the possibility of extending the answer to a query with optional information.However; the definition of this feature in SPARQL—the standard RDF query language—hasraised some important issues. Most notably; the use of this feature increases the complexityof the evaluation problem; and its closed-world semantics is in conflict with the underlyingopen-world semantics of RDF. Many approaches for fixing such problems have beenproposed; the most prominent being the introduction of the semantic notion of weaklymonotone SPARQL query. Weakly monotone SPARQL queries have shaped the class ofqueries that conform to the open-world semantics of RDF. Unfortunately; finding an effectiveway of restricting SPARQL to the fragment of weakly monotone queries has proven to be …,ACM transactions on database systems,2017,*
Dagstuhl Reports; Vol. 6; Issue 4 ISSN 2192-5283,Thorsten Quandt; German Shegalov; Helle Sjøvaag; Gottfried Vossen; Ingrid Hotz; Evren Özarslan; Thomas Schultz; Marcelo Arenas; Richard Hull; Wim Martens; Tova Milo; Thomas Schwentick; Evrim Acar; Animashree Anandkumar; Lenore Mullin; Sebnem Rusitschka; Volker Tresp; Elena Cabrio; Graeme Hirst; Serena Villata; Adam Wyner; Paris Avgeriou; Philippe Kruchten; Ipek Ozkaya; Carolyn Seaman; Leo G Kroon; Anita Schöbel; Dorothea Wagner; Amel Bennaceur; Dimitra Giannakopoulou; Reiner Hähnle; Karl Meinke,Analysis; Interpretation and Benefit of User-Generated Data: Computer Science Meets CommunicationStudies (Dagstuhl Seminar 16141) Thorsten Quandt; German Shegalov; Helle Sjøvaag; andGottfried Vossen … Multidisciplinary Approaches to Multivalued Data: Modeling;Visualization; Analysis (Dagstuhl Seminar 16142) Ingrid Hotz; Evren Özarslan; and ThomasSchultz ............................... 16 … Foundations of Data Management (Dagstuhl Perspectives Workshop16151) Marcelo Arenas; Richard Hull; Wim Martens; Tova Milo; and Thomas Schwentick …Tensor Computing for Internet of Things (Dagstuhl Perspectives Workshop 16152) EvrimAcar; Animashree Anandkumar; Lenore Mullin; Sebnem Rusitschka; and Volker Tresp ............................................................................ 57 … Natural Language Argumentation: Mining;Processing; and Reasoning over Textual Arguments (Dagstuhl Seminar 16161) Elena …,*,2016,*
Incomplete Causal Laws in the Situation Calculus Using Free Fluents.,Marcelo Arenas; Jorge A Baier; Juan S Navarro; Sebastian Sardina,Abstract We propose a simple relaxation of Reiter's basic action theories; based on fluentswithout successor state axioms; that accommodates incompleteness beyond the initialdatabase. We prove that fundamental results about basic action theories can be fullyrecovered and that the generalized framework allows for natural specifications of variousforms of incomplete causal laws. We illustrate this by showing how the evolution ofincomplete databases; guarded action theories; and non-deterministic actions can beconveniently specified.,IJCAI,2016,*
2016 ACM PODS Alberto O. Mendelzon Test-of-Time Award,Marcelo Arenas; Peter Buneman; Jan Van den Bussche,Mendelzon was an international leader in database theory; whose pioneering andfundamental work has inspired and influenced both database theoreticians andpractitioners; and continues to be applied in a variety of advanced settings. He served thedatabase community in many ways; in particular; he served as the General Chair of thePODS conference; and was instrumental in bringing together the PODS and SIGMODconferences. He also was an outstanding educator; who guided the research of numerousdoctoral students and postdoctoral fellows. The Award is to be awarded each year to apaper or a small number of papers published in the PODS proceedings ten years prior; thathad the most impact (in terms of research; methodology; or transfer of practice) over theintervening decade. The decision was approved by SIGMOD and ACM. The funds for the …,Proceedings of the 35th ACM SIGMOD-SIGACT-SIGAI Symposium on Principles of Database Systems,2016,*
Faceted search over RDF− based knowledge graphs,Bernardo Cuenca Grau; Evgeny Kharlamov; Dmitriy Zheleznyakov,Abstract Knowledge graphs such as Yago and Freebase have become a powerful asset forenhancing search; and are being intensively used in both academia and industry. Manyexisting knowledge graphs are either available as Linked Open Data; or they can beexported as RDF datasets enhanced with background knowledge in the form of an OWL 2ontology. Faceted search is the de facto approach for exploratory search in many onlineapplications; and has been recently proposed as a suitable paradigm for querying RDFrepositories. In this paper; we provide rigorous theoretical underpinnings for faceted searchin the context of RDF-based knowledge graphs enhanced with OWL 2 ontologies. Weidentify well-defined fragments of SPARQL that can be naturally captured using facetedsearch as a query paradigm; and establish the computational complexity of answering …,Journal of Web Semantics,2016,*
Proceedings of the Workshops of the EDBT/ICDT 2015 Joint Conference (EDBT/ICDT); Brussels; Belgium; March 27th; 2015,Peter M Fischer; Gustavo Alonso; Marcelo Arenas; Floris Geerts,Publication. Title; Proceedings of the Workshops of the EDBT/ICDT 2015 JointConference (EDBT/ICDT); Brussels; Belgium; March 27th; 2015 …,*,2015,*
EDBT/ICDT 2015 Joint Conference,Peter M Fischer; Gustavo Alonso; Marcelo Arenas; Floris Geerts,The International Conference on Extending Database Technology (EDBT) and theInternational Conference on Database Theory (ICDT) are two prestigious venues for theexchange of the latest research results in data management and the theoretical foundationsof database systems. While having the same overarching goal of presenting cutting-edgeresults; ideas; techniques; and theoretical advances in databases; the workshops of theEDBT/ICDT joint conference are separately tasked by focusing on emerging topics thatcomplement the areas covered by the main technical program. This year; our programincludes workshops focusing on seven exciting topics:,*,2015,*
18th International Conference on Database Theory,Marcelo Arenas; Martín Ugarte,The 18th International Conference on Database Theory (ICDT 2015) was held in Brussels;Belgium; March 23–27; 2015. Originally biennial; the ICDT conference has been heldannually and jointly with EDBT (“Extending Database Technology”) since 2009. Theproceedings of ICDT 2015 include a paper by Graham Cormode (University of Warwick)based on the keynote address by him; a paper by Rasmus Pagh (IT University ofCopenhagen) based on the keynote address by him; an overview of an invited lecture byNicole Schweikardt (Humboldt University of Berlin); a laudation concerning the ICDT 2015Test of Time Award; and 22 research papers that were selected by the Program Committeefrom 50 submissions.,*,2015,*
; Table of Contents; Preface; ICDT 2015 Test of Time Award; Organization; External Reviewers; List of Authors,Marcelo Arenas; Martín Ugarte,ACM Classification 1998 H.2: Database Management; H.2.1 Normal forms; H.2.2 Schema andsubschema; H.2.3 Query languages; H.2.4 Query processing; H.2.4 Relational databases;H.2.4 Distributed databases; H.2.5 Heterogeneous Databases; H.3.5 Online InformationServices; H.1: Miscellaneous – Privacy; H.4.1 Office Automation: Workflow management; B.4.4Performance Analysis and Design Aids: Formal models; Verification; F.1.3 Complexity measuresand classes; F.4.1 Computational Logic; Model Theory; G.2.2 Graph Theory – Hypergraphs …Published online and open access by Schloss Dagstuhl – Leibniz-Zentrum für InformatikGmbH; Dagstuhl Publishing; Saarbrücken/Wadern; Germany. Online available at http://www.dagstuhl.de/dagpub/978-3-939897-79-8 … Bibliographic information published by the Deutsche NationalbibliothekThe Deutsche Nationalbibliothek lists this publication in the Deutsche …,LIPIcs-Leibniz International Proceedings in Informatics,2015,*
LIPIcs; Volume 31; ICDT'15; Complete Volume,Marcelo Arenas; Martín Ugarte,The 18th International Conference on Database Theory (ICDT 2015) was held in Brussels;Belgium; March 23–27; 2015. Originally biennial; the ICDT conference has been heldannually and jointly with EDBT (“Extending Database Technology”) since 2009. Theproceedings of ICDT 2015 include a paper by Graham Cormode (University of Warwick)based on the keynote address by him; a paper by Rasmus Pagh (IT University ofCopenhagen) based on the keynote address by him; an overview of an invited lecture byNicole Schweikardt (Humboldt University of Berlin); a laudation concerning the ICDT 2015Test of Time Award; and 22 research papers that were selected by the Program Committeefrom 50 submissions.,LIPIcs-Leibniz International Proceedings in Informatics,2015,*
2014 Reviewers List,Ahmed Abbasi; Osman Abul; Evrim Acar; Palakorn Achananuparp; Sibel Adali; Nitin Agarwal; Rodrigo Agerri; Ankit Agrawal; Divyakant Agrawal; Manoj Agrawal; Chowdhury Ahmed; Mueen Ahmed; Luca Aiello; Mohammad Akbari; Reza Akbarinia; Oguz Akbilgic; Leman Akoglu; Zaher Al Aghbari; Luai Al-Shalabi; Barron-Cedeno Alberto; Nanopoulos Alexandros; Neda Alipanah; Mohammed Altaf; Toshiyuki Amagasa; Giuseppe Amato; Yuan An; Aris Anagnostopoulos; David Anastasiu; Kai Ang; François Anton; Kemafor Anyanwu; Arvind Arasu; Marcelo Arenas; Nikos Armenatzoglou; Ismailcem Arpinar; Anastasios Arvanitis; Mahdi Asadpour; Ira Assent; Juan Carlos Augusto; G Ausiello; Hakan Aydin,We thank the following reviewers for the time and energy they have given to TKDE … AhmedAbbasi Osman Abul Evrim Acar Palakorn Achananuparp Sibel Adali Nitin Agarwal Rodrigo AgerriAnkit Agrawal Divyakant Agrawal Manoj Agrawal Chowdhury Ahmed Mueen Ahmed Luca AielloMohammad Akbari Reza Akbarinia Oguz Akbilgic Leman Akoglu Zaher Al Aghbari Luai Al-ShalabiBarron-Cede˜no Alberto Nanopoulos Alexandros Neda Alipanah Mohammed Altaf ToshiyukiAmagasa Giuseppe Amato Yuan An Aris Anagnostopoulos David Anastasiu Kai Ang FrançoisAnton Kemafor Anyanwu Arvind Arasu Marcelo Arenas Nikos Armenatzoglou Ismailcem ArpinarAnastasios Arvanitis Mahdi Asadpour Ira Assent Juan Carlos Augusto G. Ausiello Hakan AydinB … Prabhakaran B. Sumeet Bajaj Petko Bakalov Spiridon Bakiras José Balcázar Tim BaldwinForrest Bao … Jie Bao Zhifeng Bao Nathalie Baracaldo Elena Baralis Nicola Barbieri …,IEEE Transactions on Knowledge and Data Engineering,2015,*
Building a query language for the web of data: efficiency in an open world,C Ugarte; I Martín,Al consultar bases de datos incompletas es importante tener la posibilidad de extender losresultados cuando hay información adicional disponible. Esta funcionalidad ha sidoampliamente adoptada para consultar la Web Semántica; dado que la información en laWeb es inherentemente incompleta. Desafortunadamente; la implementación de estafuncionalidad en SPARQL; el lenguaje recomendado por el World Wide Web Consotrium(W3C) para consultar datos en la Semantic Web; trae consigo algunos efectos negativos.Dos de los más importantes son un incremento en la complejidad de evaluar consultas; y unconflicto entre SPARQL y el supuesto de mundo abierto. Diferentes caminos han sidotomados para arreglar estos problemas; de los cuales el más adoptado ha sido restringirSPARQL a patrones bien-diseñados. Sin embargo; aun sigue abierto el problema de …,*,2015,*
Towards a Positive Query Language for RDF,Marcelo Arenas; Martın Ugarte,When querying incomplete databases; the possibility of optionally obtaining information-when available-is a distinctive feature. In particular; this feature is present in SPARQL; thelanguage recommended by the W3C for querying Semantic Web data. Unfortunately; itsimplementation has been shown to have adverse consequences. Two of the most notableare an increase in evaluation complexity and the possibility of creating negative queries(queries for which there can be a loss of answers when adding new data to a dataset). Manyapproaches for settling these issues have been presented; being that of restricting SPARQLto well-designed graph patterns [2] the most widely adopted. Welldesigned graph patternsare indeed positive and their evaluation complexity is lower; but they are not capable ofexpressing disjunction. Moreover; it is hard to prove properties concerning expressibility …,8th Alberto Mendelzon International Workshop on Foundations of Data Management (AMW 2014),2014,*
SemFacet: Semantic Faceted Search over Yago,Bernardo Cuenca Grau; Ernesto Jimenez-Ruiz; Evgeny Kharlamov; Sarunas Marciuska; Dmitriy Zheleznyakov,Skip to main content. University of Oxford Department of Computer Science. Contact UsSearch. Search for. Search. Toggle Main Menu. Home; Admissions; Research (current);News & Events; About Us; Alumni; Our Students; Innovation. Home; Research; InformationSystems; SemFacet: Semantic Faceted Search over Yago. SemFacet: Semantic FacetedSearch over Yago. Bernardo Cuenca Grau‚ Evgeny Kharlamov‚ Sarunas Marciuska‚ DmitriyZheleznyakov‚ Marcelo Arenas and Ernesto Jimenez−Ruiz. Book Title. WWW Demo. Note.http://www.cs.ox.ac.uk/isg/tools/SemFacet/. Pages. 123−126. Year. 2014. Links. BibTeX;Download (pdf); Link. See Also. Bernardo Cuenca Grau; Ernesto Jimenez-Ruiz; EvgenyKharlamov; Sarunas Marciuska; Dmitriy Zheleznyakov …,*,2014,*
The Chilean Database Group,Marcelo Arenas; Pablo Barceló; Loreto Bravo; Claudio Gutiérrez; Jorge Pérez; Juan Reutter; M Andrea Rodriguez,*,Journal of Information and Data Management,2013,*
