Model-driven engineering of service orchestrations,Marco Brambilla; Matteo Dosmi; Piero Fraternali,This paper presents a methodology for the Model Driven Engineering of complex; multi-actorbusiness processes; mixing tasks executed by humans and by machines. The idea is toenrich business description languages with a few extra details on task assignment;semantics; and typed dataflows; so as to enable a two-step generative approach: first theProcess Model is automatically transformed into an Application Model; which seamlesslyexpress both human-and machine-executable tasks; secondly; the Application Model is fedto a state-of-the-practice Web/Web Service development tool capable of producing the code.The resulting method and generative framework unify Web Service orchestration and WebUser Interface design into a coherent Model-Driven Engineering process.,Services-I; 2009 World Conference on,2009,11
Model-driven development based on omg’s IFML with webratio web and mobile platform,Roberto Acerbis; Aldo Bongio; Marco Brambilla; Stefano Butti,Abstract The need for quick development of mobile applications; combined with the chronicshortage of IT personnel with skills in Web and mobile app development advocate for newapproaches and tools. In this context; we propose a comprehensive tool suite calledWebRatio Platform for model-driven development of web and mobile applications. The toolsupports developers in the specification of the domain model and of the user interactionmodel for applications according to two extended versions of the OMG standard languagecalled IFML (Interaction Flow Modeling Language). The extensions feature primitivestailored to web application development and to mobile systems. The tool features model-checking and full code generation that produces ready-to-publish Web and cross-platformmobile applications.,International Conference on Web Engineering,2015,10
Building semantic web portals with WebML,Marco Brambilla; Federico M Facca,Abstract Current conceptual models and methodologies for Web applications concentrate oncontent; navigation; and service modeling. Although some of them are meant to addresssemantic web applications too; they do not fully exploit the whole potential deriving frominteraction with ontological data sources and and from Semantic annotations. This paperproposes an extension to Web application conceptual models toward Semantic Web. Wedevise an extension of the WebML modeling framework that fulfills most of the designrequirements emerging for the new area of Semantic Web. We generalize the developmentprocess to cover Semantic Web and we devise a set of new primitives for ontology importingand querying. Finally; an implementation prototype of the proposed concepts is proposedwithin the commercial tool WebRatio.,International Conference on Web Engineering,2007,10
Search Computing: Managing complex search queries,Stefano Ceri; Adnan Abid; Mamoun Abu Helou; Davide Barbieri; Alessandro Bozzon; Daniele Braga; Marco Brambilla; Alessandro Campi; Francesco Corcoglioniti; Emanuele Della Valle; Davide Eynard; Piero Fraternali; Michael Grossniklaus; Davide Martinenghi; Stefania Ronchi; Marco Tagliasacchi; Salvatore Vadacca,Search computing focuses on building answers to complex search queries (for example;"Where can I attend an interesting conference in my field near a sunny beach?") byinteracting with a constellation of cooperating search services; and using result ranking andjoining as the dominant factors for service composition. The service computing paradigmhas so far been neutral to the specific features of search applications and services. Toaddress this weakness; search computing advocates a new approach in which search; join;and ranking are the central aspects for service composition.,IEEE Internet Computing,2010,9
Comparison: mediation on WebML/WebRatio and jABC/jETI,Marco Brambilla; Stefano Ceri; Emanuele Della Valle; Federico M Facca; Christian Kubczak; Tiziana Margaria; Bernhard Steffen; Christian Winkler,In this chapter we compare two solutions to the mediation scenario of the SWS challengethat are based on the use of WebML [1] and of the jABC [2; 3] as modeling and executionplatforms. In particular; first we give a general overview of the differences among the toapproaches; and then we compare in the details the two solutions for the SWS challenge.We use selected parts from the mediation scenarios to keep the comparison simple butexpressive. Looking on the advanced scenarios would be more complex but wouldobviously lead to the same results.,*,2009,9
Extending WebML towards semantic web,Federico Michele Facca; Marco Brambilla,Abstract Available methodologies for developing Sematic Web applications do not fullyexploit the whole potential deriving from interaction with ontological data sources. Here weintroduce an extension of the WebML modeling framework to fulfill most of the designrequirements emerging for the new area of Semantic Web. We generalize the developmentprocess to support Semantic Web applications and we introduce a set of new primitives forontology importing and querying.,Proceedings of the 16th international conference on World Wide Web,2007,9
Towards semantic interoperability (in-depth comparison of two approaches to solving semantic web service challenge mediation tasks),Maciej Zaremba; Tomas Vitvar; Matthew Moran,Abstract: This paper overviews and compares the DERI and DEI-Cefriel approaches to theSWS-Challenge workshop mediation scenario in terms of the utilized underlyingtechnologies and delivered solutions. In the mediation scenario one partner usesRosettaNet to define its B2B protocol while the other one operates on a proprietary solution.Goal of the workshop participants was to show how could these partners be semanticallyintegrated.,*,2007,9
On the quest for changing knowledge,Marco Brambilla; Stefano Ceri; Florian Daniel; Emanuele Della Valle,Abstract For centuries; science (in German" Wissenschaft") has aimed to create (" schaffen")new knowledge (" Wissen") from the observation of physical phenomena; their modeling andempirical validation. With this vision paper; we propose to do so by observing not thephysical; but the virtual world; namely the Web with its ever growing stream of datamaterialized in the form of social network chattering; content produced on demand bycrowds of people; messages exchanged among interlinked devices in the Internet of Things;and similar. The knowledge we may find there can be dispersed; informal; contradicting andephemeral today; while already tomorrow it may be commonly accepted. The challenge iscapturing knowledge that is new; has not been formalized yet (eg; in existing knowledgebases); and is buried inside a big; moving target (the stream of online data). The purpose …,Proceedings of the Workshop on Data-Driven Innovation on the Web,2016,8
Intergroup Threat and Outgroup Attitudes,Marco Brambilla; David A Butz,Abstract Two studies examined the impact of macrolevel symbolic threat on intergroupattitudes. In Study 1 (N= 71); participants exposed to a macrosymbolic threat (vs.nonsymbolic threat and neutral topic) reported less support toward social policiesconcerning gay men; an outgroup whose stereotypes implies a threat to values; but nottoward welfare recipients; a social group whose stereotypes do not imply a threat to values.Study 2 (N= 78) showed that; whereas macrolevel symbolic threat led to less favorableattitudes toward gay men; macroeconomic threat led to less favorable attitudes towardAsians; an outgroup whose stereotypes imply an economic threat. These findings arediscussed in terms of their implications for understanding the role of a general climate ofthreat in shaping intergroup attitudes.,Social Psychology,2013,8
A remark on “Decomposition of bivariate inequality indices by attributes” by Abul Naga and Geoffard; Economics Letters 90 (2006); pp. 362–367,Marco Giovanni Brambilla; Eugenio Peluso,Abstract We correct the generalized version of the decomposition of multivariate inequalityindices by attributes proposed by Abul Naga and Geoffard VAbul Naga; RH and Geoffard;PY; 2006. Decomposition of bivariate inequality indices by attributes. Economic Letters 90;pp. 362− 367. V,Economics Letters,2010,8
Engineering search computing applications: vision and challenges,Marco Brambilla; Stefano Ceri,Abstract Search computing is a novel discipline whose goal is to answer complex; multi-domain queries. Such queries typically require combining in their results domain knowledgeextracted from multiple Web resources; therefore; conventional crawling and indexingtechniques; which look at individual Web pages; are not adequate for them. In this paper; wesketch the main characteristics of search computing and we highlight how various classicalcomputer science disciplines-including software engineering; Web engineering; service-oriented architectures; data management; and human-computing interaction-are challengedby the search computing approach.,Proceedings of the the 7th joint meeting of the European software engineering conference and the ACM SIGSOFT symposium on The foundations of software engineering,2009,8
Modeling ontology-driven personalization of web contents,Marco Brambilla; Christina Tziviskou,Personalization of contents accessed on the web can be improved by proper exploitation ofuser preferences and navigation behavior. Such profile information may be provided bymetadata and should be managed through state-of-the-art web engineering methodologiesand notations. In our proposal; we exploit existing solutions in the field of knowledgerepresentation and web applications conceptual specification; and we provide:(i) a set ofontologies for representing both user profile and preferences; together with a good metadatadesign for describing them;(ii) a set of techniques for registering preferences explicitlydeclared by the user; as well as user navigation behavior automatically recorded; and (iii)some basic methods for delivering personalized content to the user based on metadatamanagement. We base our method on the well known web modeling language called …,Web Engineering; 2008. ICWE'08. Eighth International Conference on,2008,8
MVC-Webflow: an AJAX tool for online modeling of MVC-2 web applications,Marco Brambilla; Alessandro Origgi,Modern Web applications are characterized by a high level of complexity and deal with hugeamounts of data. When the application grows in complexity; manual code development isnot suitable; because it lacks in efficiency; reuse; reliability; maintainability; and group workfacilities. On the other hand; several Web engineering approaches are too far away from theaverage developer and designer way of working to be widely adopted. In this demonstrationpaper we propose a light-weight design notation (with its companion editing tool) that leadsto the development of MVC applications. We present an on-line visual editing tool calledMVC-Webflow for the specification of simple conceptual models for MVC applications andwe provide partial automatic code generation; that can be performed on the flight directly onthe deployed application. The advantages of the approach are the closeness to the well …,Web Engineering; 2008. ICWE'08. Eighth International Conference on,2008,8
Fundamentals of exception handling within workflow-based Web applications,Marco Brambilla; Christina Tziviskou,Abstract As the Web becomes a platform for implementing B2B applications; the need arisesof extending Web conceptual modeling from data-centric applications to data-and process-centric applications. New primitives must be put in place to implement workflows describingbusiness processes. In this context; new problems about process safety arise; due to theloose control on Web clients. Indeed; user behavior can generate dangerous incoherenciesfor the execution of processes. This paper presents a proposal of workflow-enablingprimitives for Web applications; and a high level approach to the management of exceptionsthat occurs during execution of processes. We present a classification of exceptions that canoccur inside workflow-based Web applications; and recovery policies to retrieve coherentstatus and data after an exception. An implementation experience is briefly presented too.,Journal of Web Engineering,2005,8
Hypertext Semantics for Web Applications.,Marco Brambilla; Sara Comai; Piero Fraternali,Abstract. Web applications integrate dynamic pages for publishing data; functions for contentmanagement; and generic business services. To support the model-driven design andautomatic generation of Web applications; an extended notion of hypertext is required;whose semantics is scarcely investigated. In this paper; we analyse and classify thesemantic problems encountered in the computation of Web pages; characterised by multipleinterrelated pieces of content; inter-page and intra-page navigation; and content updateoperations. The identified semantic framework may help in better understanding the existingWeb conceptual models; and in reasoning at a higher level about the implementationproblems daily faced by Web developers.,SEBD,2002,8
Web information retrieval. Data-centric systems and applications,Stefano Ceri; Alessandro Bozzon; Marco Brambilla; ED Valle; Piero Fraternali; Silvia Quarteroni,web information retrieval data centric systems and applications stefano ceri alessandrobozzon marco brambilla emanuele della valle piero fraternali silvia data centric systems andapplications series editors we describe how data is published on the web in a way webinformation retrieval Web Information Retrieval (Data-Centric Systems and Applications):With the proliferation of huge amounts of heterogeneous data on the Web the importance ofinformation retrieval IR has grown considerably over the last few years Big players in thecomputer industry such as Google Microsoft and Yahoo are the primary contributors oftechnology for fast access to Web based information and searching capabilities are nowintegrated into most information systems ranging from business management software andcustomer relationshi From the reviews ldquo The book covers not only a wide range but …,*,2013,7
The information retrieval process,Stefano Ceri; Alessandro Bozzon; Marco Brambilla; Emanuele Della Valle; Piero Fraternali; Silvia Quarteroni,Abstract What does an information retrieval system look like from a bird's eye perspective?How can a set of documents be processed by a system to make sense out of their contentand find answers to user queries? In this chapter; we will start answering these questions byproviding an overview of the information retrieval process. As the search for text is the mostwidespread information retrieval application; we devote particular emphasis to textualretrieval. The fundamental phases of document processing are illustrated along with theprinciples and data structures supporting indexing.,*,2013,7
A characterization of the layout definition problem for web search results,Alessandro Bozzon; Marco Brambilla; Sara Comai,Abstract In the last years the user information seeking process on the Web has shifted fromdocument search to object search. Hence; the answers provided by Web search enginescannot consist any more in a mere list of pages. In this paper we consider queries returningmono-; ambiguous; or multi-domain results; where the domain represents a specific field ofinterests such as City; People; Movies; etc. and we characterize the problem for thedefinition of the layout of such results. In particular; we describe a conceptual definition ofthe Web search result layout problem; by identifying: the parameters involved in the layoutdesign; the tuning dimensions available for optimizing the result layout; and the possiblestrategies that can be adopted for producing such layouts. Finally; we provide an outlook onthe possible future research directions on this topic.,OTM Confederated International Conferences" On the Move to Meaningful Internet Systems",2010,7
An online platform for semantic validation of UML models,Marco Brambilla; Christina Tziviskou,Abstract The Web is becoming the development platform for applications; thus makingdesktop IDE and CASE tools obsolete. We propose a first example of online support toapplication designers; consisting in a tool for online validation of UML models based onsemantic formalization and reasoning. We base our work on a formalization of the UMLmodels and we exploit Web engineering methods and techniques; applied to Semantic Webtechnologies; for providing a set of components and patterns that allow management andverification of UML diagrams.,International Conference on Web Engineering,2009,7
Progettazione di dati e applicazioni per il Web,Stefano Ceri; Piero Fraternali; Aldo Bongio; Marco Brambilla; Sara Comai; Maristella Matera,Segnalazioni con codici 20501/20503/20504: Alcuni dati obbligatori per il sito CINECA nonsono presenti o invalidi; oppure il sito CINECA non è riuscito ad individuare una rivista con idati forniti; è necessario controllare la correttezza dell'ISSN e/o EISSN dove applicabili e iltitolo della rivista.Segnalazioni con codici 20201/20202: La pubblicazione non è statatrasferita SOLO per i docenti segnalati nel messaggio a causa di problemi nell'anagraficaCINECA e/o di Ateneo (pe i codici fiscali non sono gli stessi) oppure perché si tratta didocenti che; pur essendo abilitati all'inserimento nel sistema di Ateneo; non hanno facoltà disincronizzare le proprie pubblicazioni in CINECA. Tutti gli altri eventuali coautori senzasegnalazione troveranno la pubblicazione correttamente nel proprio spazio personaleCINECA.,*,2003,7
Extending search to crowds: A model-driven approach,Alessandro Bozzon; Marco Brambilla; Stefano Ceri; Andrea Mauri,Abstract In many settings; the human opinion provided by an expert or knowledgeable usercan be more useful than factual information retrieved by a search engine. Search systemsdo not capture the subjective opinions and recommendations of friends; or fresh; online-provided information that require contextual or domain-specific expertise. Search resultsobtained from conventional search engines can be complemented by crowdsearch; anonline interaction with crowds; selected among friends; experts; or people who are presentlyat a given location; an interplay between conventional and search-based queries can occur;so that the two search methods can support each other. In this paper; we use a model-drivenapproach for specifying and implementing a crowdsearch application; in particular we definetwo models: the “Query Task Model”; representing the meta-model of the query that is …,*,2012,6
A Model-Driven Approach for Crowdsourcing Search.,Alessandro Bozzon; Marco Brambilla; Andrea Mauri,ABSTRACT Even though search systems are very efficient in retrieving world-wideinformation; they can not capture some peculiar aspects and features of user needs; such assubjective opinions and recommendations; or information that require local or domainspecific expertise. In this kind of scenario; the human opinion provided by an expert orknowledgeable user can be more useful than any factual information retrieved by a searchengine. In this paper we propose a model-driven approach for the specification of crowd-search tasks; ie activities where real people–in real time–take part to the generalized searchprocess that involve search engines. In particular we define two models: the “Query TaskModel”; representing the metamodel of the query that is submitted to the crowd and theassociated answers; and the “User Interaction Model”; which shows how the user can …,CrowdSearch,2012,6
The anatomy of a multi-domain search infrastructure,Stefano Ceri; Alessandro Bozzon; Marco Brambilla,Abstract Current search engines do not support queries that require a complex combinationof information. Problems such as “Which theatre offers an at least-three-stars action movie inLondon close to a good Italian restaurant” can only be solved by asking multiple queries;possibly to different search engines; and then manually combining results; therebyperforming “data integration in the brain.” While searching the Web is the preferred methodfor accessing information in everyday's practice; users expect that search systems will soonbe capable of mastering complex queries. However; combining information requires adrastic change of perspective: a new generation of search computing systems is needed;capable of going beyond the capabilities of current search engines. In this paper we showhow search computing should open to modular composition; as many other kinds of …,International Conference on Web Engineering,2011,6
Business process modeling and quick prototyping with WebRatio BPM,Marco Brambilla; Stefano Butti; Piero Fraternali,Abstract. We describe a software tool called WebRatio BPM that helps close the gapbetween the modeling of business processes and the design and implementation of thesoftware applications that support their enactment. The main idea is to enhance the degreeof automation in the conversion of business process models into application models; definedas abstract; platform-independent representations of the application structure and behavior.Application models are themselves amenable to the semiautomatic transformation intoapplication code; resulting in extremely rapid prototyping and shorter time-to-market. Thanksto the proposed chain of model transformations it is also possible to fine tune the finalapplication in several ways; eg; by integrating the visual identity of the organization orconnecting the business process to legacy applications via Web Services.,BPM 2010 Demonstration Track,2010,6
Extending conceptual schemas with business process information,Marco Brambilla; Jordi Cabot; Sara Comai,The specification of business processes is becoming a more and more critical aspect fororganizations. Such processes are specified as workflow models expressing the logicalprecedence among the different business activities (ie; the units of work). Typically; workflowmodels are managed through specific subsystems; called workflow management systems; toensure a consistent behavior of the applications with respect to the organization businessprocess. However; for small organizations and/or simple business processes; the complexityand capabilities of these dedicated workflow engines may be overwhelming. In this paper;we therefore; advocate for a different and lightweight approach; consisting in the integrationof the business process specification within the system conceptual schema. We show how aworkflow-extended conceptual schema can be automatically obtained; which serves both …,Advances in Software Engineering,2010,6
A tool for model-driven design of rich internet applications based on AJAX,Marco Brambilla; Piero Fraternali; Emanuele Molteni,ABSTRACT This chapter describes how the design tool WebRatio (and its companionconceptual model WebML) have been extended to support the new requirements imposedby rich Internet applications (RIAs); that are recognized to be one of the main innovationsthat lead to the Web 2.0 revolution. Complex interactions such as drag and drop; dynamicresizing of visual components; graphical editing of objects; and partial page refresh areaddressed by the RIA extensions of WebRatio. The chapter discusses what kinds ofmodelling primitives are required for specifying such patterns and how these primitives canbe integrated in a CASE tool. Finally; a real industrial case is presented in which the novelRIA features are successfully applied.,Handbook of Research on Web,2009,6
PHAROS: an audiovisual search platform,Alessandro Bozzon; Marco Brambilla; Piero Fraternali; Francesco Nucci; Stefan Debald; Eric Moore; Wolfgang Neidl; Michel Plu; Patrick Aichroth; Olli Pihlajamaa; Cyril Laurier; Serge Zagorac; Gerhard Backfried; Daniel Weinland; Vincenzo Croce,PHAROS 1 [1] is an Integrated Project aimed at building a platform for advanced audiovisualsearch applications. The Consortium comprises 12 partners from 9 European countries. 2PHAROS unbundles the functionalities of an audiovisual search engine into an open service-based ecosystem; where content can be submitted to customized analysis pipelines; third-party annotation components can be plugged-in; and content based search engines can beregistered. PHAROS enables a variety of application scenarios; from content acquisition andenrichment; to annotation fusion; to multi-modal queries. Figure 1 shows the architecture ofPHAROS; which supports two main process: Content Caption and Refinement (CCR)executes flow of operators on the captured content and produces XML metadata(subsequently indexed by a core XML search engine) and derived artifacts (used for …,Proceedings of the 32nd international ACM SIGIR conference on Research and development in information retrieval,2009,6
Service discovery with SWE-ET and DIANE-a comparative evaluation by means of solutions to a common scenario,Andrea Turati; Maciej Zaremba; D Cerizza; E Della Valle; M Brambilla; S Ceri; FM Facca; C Tziviskou,Abstract: Semantic service discovery and matchmaking has received increased attentionwithin the last years. Various approaches have been proposed but agreed upon criteria orcommon use and test cases to objectively evaluate such approaches are widely lacking. Inthis paper we present an in-depth comparison of the solutions to the discovery problemsdefined by the SWS-Challenge 2006. By means of this common and independentlydeveloped scenario we can develop a much better understanding for the appliedtechnologies in general; but also and in particular for the trade-offs involved in the differentapproaches. 1,In 9th International Conference on Enterprise Information Systems (ICEIS2007,2007,6
