Assessing Online Media Content Trustworthiness; Relevance and Influence: an Introductory Survey.,Eleonora Ciceri; Roman Fedorov; Eric Umuhoza; Marco Brambilla; Piero Fraternali,Abstract. The increasing popularity of social media articles and microblogging systems ischanging the way online information is produced: users are both content publishers andcontent consumers. Since information is produced and shared by common users; whousually have a limited domain knowledge; and due to an exponential growth of the availableinformation; assessing online content trustworthiness is vital. Several works in the state ofthe art approach this issue and propose different models to estimate online contenttrustworthiness; content relevance and user influence. In this paper we investigate the mostrelevant research works in this domain; highlighting their common characteristics andpeculiarities in terms of content source type; trust-related content features; trust evaluationmethods and performance assessment techniques.,KDWeb,2015,*
Personal; Social and Event Organization Through Web and Mobile Apps: The Fluxedo Case,Max Bancora; Marco Brambilla; Davide Ripamonti; Andrea Vaccarella,Abstract This paper presents Fluxedo; a platform that combines social network data; webinterfaces; a mobile app; and information from events and venues; for allowing people todesign their experience; plan their activities and engage with friends or colleagues incommon tasks. The application is built through a set of Web engineering practices thatinclude: model-driven development; REST service design and invocation; interaction withpublic Web APIs (eg; of social networks) and business process management (BPM).,International Conference on Web Engineering,2015,*
Modeling and execution of software user interfaces,Marco Brambilla,Summary form only given. Software front-end development is a costly and inefficientprocess; where manual coding is the predominant development approach; reuse of designartifacts is low; and cross-platform portability remains difficult; despite some trends towardsHTML-based templating. In this sense; the availability of a platform-independent modelinglanguage for describing the user interaction can bring several benefits to the developmentprocess of user interfaces. This speech focuses on the modeling of software UIs throughgraphical domain-specific languages and in particular shows the new standard adopted byOMG called IFML (Interaction Flow Modeling Language) at work. The speech illustrates thebasic concepts of IFML; presents the design best practices and integration with othermodelling languages; and discusses some large-scale industrial experiences (also …,Model-Driven Engineering and Software Development (MODELSWARD); 2015 3rd International Conference on,2015,*
How to exploit social media data to evaluate performing arts: an empirical application at La Scala Opera House,Deborah Agostino; Beatrice Cassottana; Michela Arnaboldi; Marco Brambilla; Riccardo Volonterio,Performing arts play a crucial role within a city; contributing to enhance cultural developmentand city growth (Strom; 1999; Evans; 2005; Eizenberg and Cohen; 2015; Jung et al.; 2015).It is recognized that performing arts; and cultural activities in general; render urban areasmore attractive; facilitating the physical; social and economic wellbeing of a certain area(Griffiths; 1995; Strom; 1999; Withford; 2009). In this context; the evaluation of performingarts has long been considered a priority in order to understand if and quantify how artscontribute to urban regeneration and city growth (Pugh and Wood; 2004; Evans; 2005;Wood; 2005; Andersson and Lundberg; 2013). This evaluation is relevant for the performingarts organizations to better understand their viability and competitiveness (Rentschler andPotter; 1996); as well as for policy makers who need to gain insights to better support …,XXVI RSA AiIG 2015,2015,*
CloudMDE 2014,Richard Paige; Jordi Cabot; Marco Brambilla; Louis Rose; James H Hill,The second workshop on Model-Driven Engineering (MDE) for and in the Cloud was heldon 30 September 2014 at UP Valencia; Spain co-located with the ACM/IEEE 17thInternational Conference on Model-Driven Engineering Languages and Systems. Model-Driven Engineering (MDE) elevates models to first class artefacts of the softwaredevelopment process. MDE principles; practices and tools are also becoming more widelyused in industrial scenarios. Many of these scenarios are traditional IT development andemphasis on novel or evolving deployment platforms has yet to be seen. Cloud computing isa computational model in which applications; data; and IT resources are provided asservices to users over the Internet. Cloud computing exploits distributed computers toprovide on-demand resources and services over a network (usually the Internet) with the …,*,2014,*
Enriching Live Event Participation with Social Network Content Analysis and Visualization,Marco Brambilla; Daniele Dell’Aglio; Emanuele Della Valle; Andrea Mauri; Riccardo Volonterio,Abstract During live events like conferences or exhibitions; people nowadays share theiropinions; multimedia contents; suggestions; related materials; and reports through socialnetworking platforms; such as Twitter. However; live events also feature inherent complexity;in the sense that they comprise multiple parallel sessions or happenings (eg; in aconference you have several sessions in different rooms). The focus of this research is toimprove the experience of (local or remote) attendees; by exploiting the contents shared onthe social networks. The framework gathers in real time the tweets related to the event;analyses them and links them to the specific sub-events they refer to. Attendees have anholistic view on what is happening and where; so as to get help when deciding what sub-event to attend. To achieve its goal; the application consumes data from different data …,European Semantic Web Conference,2014,*
ACM SIGMOD Record Volume 43 Issue 1,Ioana Manolescu; Denilson Barbosa; Pablo Barceló; Vanessa Braganholo; Marco Brambilla; Chee Yong Chan; Rada Chirkova; Anish Das Sarma; Glenn Paulley; Alkis Simitsis; Nesime Tatbul; Marianne Winslett,Google; Inc. (search). SIGN IN SIGN UP. ACM SIGMOD Record. Volume 43 Issue 1; March 2014table of contents. Editors: Ioana Manolescu; INRIA Saclay. Denilson Barbosa; University of Alberta.Pablo Barceló; Universidad de Chile. Vanessa Braganholo; Universidade Federal Fluminense.,*,2014,*
Augmented Participation to Live Events through Social Network Content Enrichment.,Marco Brambilla; Daniele Dell'Aglio; Emanuele Della Valle; Andrea Mauri; Riccardo Volonterio,Abstract. During live events like conferences or exhibitions; people nowadays share theiropinions; mutimedia contents; suggestions; related materials; and reports through socialnetworking platforms; such as Twitter. However; live events also feature inherent complexity;in the sense that they comprise multiple parallel sessions or happenings (eg; in aconference you have several sessions in different rooms). The focus of this research is toimprove the experience of (local or remote) attendees; by exploiting the contents shared onthe social networks. The framework gathers in realtime the tweets related to the event;analyses them and links them to the specific sub-events they refer to. Attendees have anholistic view on what is happening and where; so as to get help when deciding what sub-event to attend. To achieve its goal; the application consumes data from different data …,AIMashup@ ESWC,2014,*
Justice perception and attitudes towards immigrants,Lucia Lopez-Rodriguez; Guillermo B Willis; Marco Brambilla; Rosa Rodriguez-Bailon,*,REVISTA DE PSICOLOGIA SOCIAL,2013,*
Introduction to the JSS special issue of Web 2.0 engineering: New practices and emerging Challenges,Marco Brambilla; Cinzia Cappiello; Irene Garrigós Fernández; José Norberto Mazón López; Santiago Meliá,The number and complexity of Web applications and the amount of information they offerhas been continuously growing in the context of the Web 2.0. Importantly; Web 2.0applications need Web engineering design methods to provide mechanisms to accelerateand improve their development and maintenance. To this aim methods or tools based onrecent techniques of model-driven engineering discipline (eg; MDA [OMG 2003]; ADM[Newcomb 2005]; Architecture-Centric MDA; Aspect-Oriented Development; etc.) should beprovided for developing such applications (such as social computing; Rich InternetApplications; Service-Oriented Architecture; etc.). Moreover; some new issues need to beaddressed; due to the increased level of sophistication of the modern Web applications;commonly referred to as Web 2.0 applications. These applications foster the user …,*,2013,*
Link Analysis,Stefano Ceri; Alessandro Bozzon; Marco Brambilla; Emanuele Della Valle; Piero Fraternali; Silvia Quarteroni,Abstract Ranking is perhaps the most important feature of a search engine; as it allows theuser to efficiently order the huge amount of pages matching a query according to theirrelevance to the user's information need. With respect to traditional textual search engines;Web information retrieval systems build ranking by combining at least two evidences ofrelevance: the degree of matching of a page—the content score—and the degree ofimportance of a page—the popularity score. While the content score can be calculated usingone of the information retrieval models described in Chap. 3; the popularity score can becalculated from an analysis of the indexed pages' hyperlink structure using one or more linkanalysis models. In this chapter we introduce the two most famous link analysis models;PageRank and HITS.,*,2013,*
Search Process and Interfaces,Stefano Ceri; Alessandro Bozzon; Marco Brambilla; Emanuele Della Valle; Piero Fraternali; Silvia Quarteroni,Abstract Traditional information retrieval is based on a simple paradigm: driven by aninformation need; users seek information by composing a query; using a search system; thesystem; in turn; associates relevant documents to the query and returns them to the users.However; search is more a means than an end; and the needs behind an informationseeking process are typically diverse and articulated. Thus; interaction with search systemstypically involves several steps of refinement and exploration. Visual interfaces are designedto effectively support this iterative process; help users to understand and express theirinformation needs; and collect the results when the process ends. This chapter providesinsight into the main theoretical models used to describe the information seeking process;and offers an overview of the user interface components used by modern search engines.,*,2013,*
Recommendation and Diversification for the Web,Stefano Ceri; Alessandro Bozzon; Marco Brambilla; Emanuele Della Valle; Piero Fraternali; Silvia Quarteroni,Abstract Web search effectiveness is hampered by several factors; including the existence ofseveral similar resources; ambiguous queries posed by users; and the varied profiles andobjectives of users who submit the same query. This chapter focuses on recommendationand diversification techniques as possible solutions to these issues. Recommendationsystems aim at predicting the level of preferences of users towards some items; with thepurpose of suggesting ones they may like; among a set of elements they haven't consideredyet. Diversification is a technique that aims at removing redundancy in search results; withthe purpose of reducing the information overload and providing more satisfying and diverseinformation items to the user. Both techniques; although typically “hidden behind thecurtains” to the end user; result in dramatically enhancing user satisfaction with the …,*,2013,*
Search Engines,Stefano Ceri; Alessandro Bozzon; Marco Brambilla; Emanuele Della Valle; Piero Fraternali; Silvia Quarteroni,Abstract In this chapter we discuss the challenges in the design and deployment of searchengines; systems that respond to keyword-based queries by extracting results which includepointers to Web pages. The main aspect of search engines is their ability to scale andmanage billions of indexed pages dispersed on the Web. We provide an architectural viewof the main elements of search engines; and we focus on their main components; namelythe crawling and indexing subsystems.,*,2013,*
Advertising in Search,Stefano Ceri; Alessandro Bozzon; Marco Brambilla; Emanuele Della Valle; Piero Fraternali; Silvia Quarteroni,Abstract The business model of search engines mainly relies on advertising for economicsustainability. This chapter provides the foundational concepts of online advertising andsearch advertising by describing the main advertising strategies that can be adopted (brandadvertising and direct marketing); providing the basic terminology of the field; anddiscussing the economic models (pay per impression; pay per click; pay per conversion) andthe auction mechanisms that are implemented in advertising.,*,2013,*
Information Retrieval Models,Stefano Ceri; Alessandro Bozzon; Marco Brambilla; Emanuele Della Valle; Piero Fraternali; Silvia Quarteroni,Abstract This chapter introduces three classic information retrieval models: Boolean; vectorspace; and probabilistic. These models provide the foundations of query evaluation; theprocess that retrieves the relevant documents from a document collection upon a user'squery. The three models represent documents and compute their relevance to the user'squery in very different ways. We illustrate each of them separately and then compare theirfeatures.,*,2013,*
Exploratory search upon semantically described web data sources,Marco Brambilla,Abstract Exploratory search applications upon structured Web content is becoming one ofthe main information seeking paradigms for users. This is mainly due to the move towardsmobile and pervasive Web access and to the more and more tight intertwining betweeneveryday life and information seeking. Structured data is typically distributed on the Web andaccessible through a service-oriented paradigm. This paper proposes a vision on:(1) asemantically-enabled service registration framework for describing in a Web data services ina convenient way; and (2) a design method for applications that exploit such model using adesign pattern--based method.,Proceedings of the 2nd International Workshop on Semantic Search over the Web,2012,*
Welcome to the fourth international workshop on search-driven development: Users; Infrastructures; Tools; and Evaluation (SUITE 2012),Suresh Thummalapenta; Oliver Hummel; Marcel Bruch; Eduardo Santana De Almeida; Sushil Bajracharya; Andrew Begel; Marco Brambilla; Bill Frakes; Rosalva Gallardo; Mark Grechanik; Emily Hill; Reid Holmes; Sung Kim; Adrian Kuhn; Hidehiko Masuhara; Denys Poshyvanyk; Jonathan Sillito; Tom Zimmermann,The fourth international workshop on Search-driven Development-Users; Infrastructure;Tools; and Evaluation (SUITE 2010) focuses on exploring the notion of search as afundamental activity during software development; and all aspects that are related withintegrating search into software development workflows. Two primary observationsencouraged us to start this workshop series. First; results from existing research show thatdevelopers spend majority of their time in searching for code. Furthermore; developers haveto struggle with a myriad of additional information needs such as those that are related withdesign or requirements documents or even with the communication between the variousstakeholders in a development project. Second; recently there has been considerable effortfrom both academia and industry in building specialized search tools for software …,2012 4th International Workshop on Search-Driven Development: Users; Infrastructure; Tools; and Evaluation; SUITE 2012-Proceedings,2012,*
Web Engineering: 12th International Conference; ICWE 2012; Berlin; Germany; July 23-27; 2012; Proceedings,Marco Brambilla; Takehiro Tokuda; Robert Tolksdorf,This book constitutes the refereed proceedings of the 12th International Conference on WebEngineering; ICWE 2012; held in Berlin; Germany; in July 2012. The 20 revised full papersand 15 short papers were carefully reviewed and selected from 98 submissions. The papersare organized in topical sections on social networks and collaboration; tagging;personalization and personal systems; search; Web modeling; AJAX and user interfaces;Web services; Web crawling; and Web and linked data management. The book alsoincludes 6 poster papers; 12 demos and 5 tutorials.,*,2012,*
Development of Mobile Search Applications Over Structured Web Data Through Domain-in Specific Modeling,Marco Brambilla,*,*,2012,*
Extracting information from google fusion tables,Marco Brambilla; Stefano Ceri; Nicola Cinefra; Anish Das Sarma; Fabio Forghieri; Silvia Quarteroni,Abstract With Fusion Tables; Google has made available a huge repository that allows usersto share; visualize and manage structured data. Since 2009; thousands of tables have beenshared online; encompassing data from virtually any domain and entered by all kinds ofusers; from professional to non-experts. While Fusion Tables are a potentially precioussource of freely available structured information for all sorts of applications; complexquerying and composing them is not supported natively; as it requires understanding boththe structure and content of tables' data; which are heterogeneous and produced" bottom-up". In this paper; we discuss ongoing and future work concerning the integration of FusionTables in the aim of efficiently integrating; visualizing; and querying them.,*,2012,*
Mobile multi-domain search over structured web data,Atakan Aral; Ilker Zafer Akin; Marco Brambilla,Abstract So far; web search applications have been primarily designed for access throughpersonal computers; because this represented by far the most widespread usage scenario.However; the wider and wider adoption of web-enabled smartphones; tablets andembedded devices are opening completely new scenarios for applying search technologiesin everyday life of people. In this paper we propose an approach and a concrete architecturefor optimizing exploratory search tasks on mobile devices. Our claim is that new searchparadigms may let users conduct the search on small devices without being hampered bythe limitations of the devices themselves. Even better; appropriate solutions may also exploitthe advantages of such devices for further improving the overall search experience.,*,2012,*
An Incentive–Compatible Revenue–Sharing Mechanism for the Economic Sustainability of Multi–domain Search Based on Advertising,Marco Brambilla; Sofia Ceppi; Nicola Gatti; Enrico H Gerding,Abstract Multi–domain search engines decompose complex queries addressing severalissues at a time into sub–queries; and forwards them to one or more domain–specificcontent providers; typically implemented as Web services. This enables complex searches(eg; vacation planning; composed of a hotel; flight; and car search); and allows users toreceive aggregated and high quality results from a variety of sources. We focus on thedesign of a revenue sharing mechanism for multi–domain search; considering the generalsetting in which different actors (content providers; advertising providers; hybrid content+advertising providers; and content integrators) are involved in the search results generation.The design of such a mechanism is paramount for the economic sustainability of multi–domain search. Our revenue sharing mechanism extends the existing sponsored search …,*,2012,*
Query splitting techniques and search service recommendation for multi-domain natural language queries,Alessandro Bozzon; Marco Brambilla,Abstract Current general purpose search engines are not able to address multi-domainqueries; ie; queries that span over several domains of interest. In this paper we address thegeneral problem of natural language multi-domain search queries; seen as the first step ofthe information exploration process. We propose an approach that splits the queries intodomain-specific subqueries; and suggests a vertical search engine API to be invoked. Theuser may be asked for the missing details needed to invoke the API and a first resultset canbe retrieved (and then explored).,Proceedings of the 5th International Workshop on Web APIs and Service Mashups,2011,*
Model-based dynamic and adaptive visualization for multi-domain search results,Alessandro Bozzon; Marco Brambilla; Luca Cioria; Piero Fraternali; Maristella Matera,Abstract Search systems are becoming increasingly sophisticated in their capacity ofbuilding result sets that are not mere lists of documents but articulated combinations ofconcepts retrieved from different domains. This paper investigates the models for the resultsets and the visualization spaces; and model-to-model transformations to dynamicallysuggest optimized visualizations for multi-domain search results.,International Conference on Web Engineering,2011,*
Build your complex search: social; behavioral; and micro-economic perspective on modern Web search,Marco Brambilla; Stefano Ceri; Alessandro Bozzon,ABSTRACT So far; Web search has been a playground for few giants. However; whiletraditional search engines are superb in their ability of extracting the Web pages that mostclosely match with user's keywords; they fail in going beyond such simple paradigm. On theother side; an increasing number of data sets is becoming available on the Web as (semi)structured data instead of userconsumable pages. Web search has huge potentials forimprovement thanks to the high quality of these data sources; but this can be achieved onlyby designing new search applications that federate those sources. To tackle the long tail ofuser requirements and tastes; the need arises for new ways of thinking and designingsearch applications: application providers (and perhaps even end users) will need to buildtheir own; customized search experiences; by combining search services available on the …,*,2011,*
Proceedings of the First International Workshop on Searching and Integrating New Web Data Sources,M Brambilla; F Casati; S Ceri,Searching for data upon new; open; linked Web data sources has the potential of reshapingthe scenario of current Web applications; going beyond the capabilities of conventionalsearch engines in solving search problems; but also presents new technical challenges.Solving data integration problems requires new solutions; including the use of universalURIs; efficient indexing; partial or approximate value matching; rank aggregation;continuous or push-based search; exploratory methods and context-aware paradigms;collaborative and social search and information retrieval. The goal of this workshop is togather researchers and practitioners in the diverse fields related to data integration andsearch applications on the web at the purpose of discussing innovative strategies forcombining search facilities with integration aspects for Web data sources. The workshop …,*,2011,*
ECLIPSE IT 2011,Francesca Arcelli; Leonardo Mariani; Domenico Squillace,ECLIPSE IT 2011 The 6th Workshop of the Italian Eclipse Community Proceedings of the WorkshopFrancesca Arcelli Leonardo Mariani and Domenico Squillace September 22th and September23th; 2011 University of Milano Bicocca; Italy http://2011. Eclipse-IT. org … Edited by Prof. FrancescaArcelli Università di Milano Bicocca; Italy Copyright© 2011 by the Italian Eclipse Community.All Right Reserved. ISBN: 9788890438820 … Committees Workshop Chair Francesca ArcelliUniversity of Milano Bicocca; Italy Workshop Co-Chair Paolo Maresca University of Napoli FedericoII; Italy Mauro Coccoli University of Genova; Italy Technical track Chair Francesca Arcelli Universityof Milano Bicocca; Italy Student track Chair Leonardo Mariani University of Milano Bicocca; ItalyIndustry track Chair Domenico Squillace IBM; Italy Organizing Committee Francesca Arcelli Universityof Milano Bicocca; Italy Leonardo Mariani University of Milano Bicocca; Italy Oliviero …,*,2011,*
Search Computing: Addressing Complex Search on the Web,Stefano Ceri; Marco Brambilla,Abstract Web search is considered a playground for a few giants—such as Google; Yahoo!and Bing—that relegate the other players to market niches. However; Web search is far fromsatisfying all information needs; because many search queries are complex; requireinformation integration; and go beyond what can be offered by a single Web page; on thesequeries; generalized search engines do not perform well enough. This paper addresses anew paradigm for search-driven data integration; called Search Computing; based oncombining data extraction from distinct sources and data integration by means of specializedintegration engines. The Search Computing project has the ambitious goal of lowering thetechnological barrier required for building complex search applications; thereby enablingthe development of many new applications which will cover relevant search needs.,*,2011,*
